headlines,text,date,author,read_more,image_url,inshorts_url,original_source,day
"My govt will complete its tenure, we'll even win next poll: Shinde","Maharashtra CM Eknath Shinde on Saturday said that his government will complete its tenure, adding, ""We'll even win next election."" While speaking at a press conference, he said that it is only the natural alliance of the BJP and Shiv Sena that can take Maharashtra ahead. Earlier today, BJP chief JP Nadda held a meeting with Shinde on cabinet expansion.",2022-07-09,Dharini Mudgal,https://www.timesnownews.com/india/my-government-will-complete-its-tenure-we-will-even-win-next-election-maharashtra-cm-eknath-shinde-article-92767651/amp?utm_campaign=fullarticle&utm_medium=referral&utm_source=inshorts,https://static.inshorts.com/inshorts/images/v1/variants/jpg/m/2022/07_jul/9_sat/img_1657368194194_569.jpg?,https://inshorts.com/en/news/my-govt-will-complete-its-tenure-well-even-win-next-poll-shinde-1657370866316,Times Now,Saturday
We're moving towards gaining 100% results on issues of national consensus: Shah,"Union Home Minister Amit Shah said that we are moving towards achieving 100% results on issues that require building a national consensus. ""He said although the role of the (zonal) council is advisory, he is happy that in his three years of experience, over 75% of issues in the (zonal) council have been resolved by consensus,"" an official statement said.",2022-07-10,Sakshi Sharma,https://www.hindustantimes.com/india-news/india-heading-towards-gaining-100-consensus-on-issues-amit-shah-101657392746451-amp.html?utm_campaign=fullarticle&utm_medium=referral&utm_source=inshorts,https://static.inshorts.com/inshorts/images/v1/variants/jpg/m/2022/07_jul/10_sun/img_1657421455681_107.jpg?,https://inshorts.com/en/news/were-moving-towards-gaining-100-results-on-issues-of-national-consensus-shah-1657424044893,Hindustan Times,Sunday
Tsunami of unemployment has hit the nation under BJP's rule: Rahul,"Congress leader Rahul Gandhi on Saturday took to Twitter and alleged, ""Under the BJP's rule, the prices of domestic LPG cylinders went up by 157%, fuel prices broke all records and the 'Gabbar Tax loot' and a 'tsunami of unemployment' hit the country."" ""[Public] is telling PM Narendra Modi...these obstacles created by you have exhausted us, now stop,"" Gandhi added.",2022-07-09,Dharini Mudgal,https://www.timesnownews.com/india/tsunami-of-unemployment-rahul-gandhi-slams-pm-modi-over-lack-of-jobs-rising-fuel-prices-article-92766588/amp?utm_campaign=fullarticle&utm_medium=referral&utm_source=inshorts,https://static.inshorts.com/inshorts/images/v1/variants/jpg/m/2022/07_jul/9_sat/img_1657366368813_516.jpg?,https://inshorts.com/en/news/tsunami-of-unemployment-has-hit-the-nation-under-bjps-rule-rahul-1657369260925,Times Now,Saturday
Andhra CM Reddy's mother quits YSR Cong Party to support daughter in T'gana,"YS Vijayamma, mother of Andhra Pradesh CM YS Jagan Mohan Reddy, on Friday resigned as the honorary president of the ruling YSR Congress Party. Vijayamma said she will now support her daughter YS Sharmila, who is heading the YSR Telangana Party in the neighbouring state. ""My daughter is fighting alone. If I don’t support her, it'll be injustice,"" Vijayamma added.",2022-07-08,Shreyasi Banerjee,https://www.hindustantimes.com/india-news/y-s-jagan-mohan-reddy-s-mother-quits-ysrcp-to-stand-by-her-daughter-101657272679127-amp.html?utm_campaign=fullarticle&utm_medium=referral&utm_source=inshorts,https://static.inshorts.com/inshorts/images/v1/variants/jpg/m/2022/07_jul/8_fri/img_1657282840282_830.jpg?,https://inshorts.com/en/news/andhra-cm-reddys-mother-quits-ysr-cong-party-to-support-daughter-in-tgana-1657283451751,Hindustan Times,Friday
He was a friend of India: Sitharaman on demise of Japan's ex-PM Abe,"Finance Minister Nirmala Sitharaman has expressed grief over the demise of former PM of Japan Shinzo Abe. In a tweet on Friday, Sitharaman said, ""Express my profound grief on the tragic demise of...Shinzo Abe. He was a friend of India and we held him in great regard."" Abe died after being shot while delivering a speech in Japan's Nara city.",2022-07-08,Dharini Mudgal,https://twitter.com/nsitharaman/status/1545339709525635077?utm_campaign=fullarticle&utm_medium=referral&utm_source=inshorts,https://static.inshorts.com/inshorts/images/v1/variants/jpg/m/2022/07_jul/8_fri/img_1657279781577_488.jpg?,https://inshorts.com/en/news/he-was-a-friend-of-india-sitharaman-on-demise-of-japans-expm-abe-1657282356379,Twitter,Friday
ED raids 18 places linked to J'khand CM Soren's close aide over tender scam,"The Enforcement Directorate (ED) on Friday conducted raids at 18 locations in Jharkhand as part of a money-laundering investigation against MLA Pankaj Mishra, a close aide of Chief Minister Hemant Soren, officials said. The raids were conducted in connection with an alleged scam carried out while availing marketplace tender in Sahibganj's Barharwa in 2020.",2022-07-08,Shreyasi Banerjee,https://www.thequint.com/amp/story/news/india/jharkhand-ed-raids-18-places-linked-to-cm-hemant-sorens-mla-rep?utm_campaign=fullarticle&utm_medium=referral&utm_source=inshorts,https://static.inshorts.com/inshorts/images/v1/variants/jpg/m/2022/07_jul/8_fri/img_1657276048776_745.jpg?,https://inshorts.com/en/news/ed-raids-18-places-linked-to-jkhand-cm-sorens-close-aide-over-tender-scam-1657277613465,The Quint,Friday
ED summons Delhi minister Satyendar Jain's wife in money laundering case,The Enforcement Directorate on Friday issued summons to Delhi Health Minister Satyendar Jain's wife Poonam Jain to appear before it at its headquarters for questioning on July 14 in connection with a money laundering case. This comes months after the ED arrested Satyendar Jain on May 30 in connection with alleged hawala transactions related to a Kolkata-based company.,2022-07-08,Shreyasi Banerjee,https://www.freepressjournal.in/amp/india/ed-issues-summons-to-arrested-delhi-minister-satyendar-jains-wife-poonam-in-money-laundering-case?utm_campaign=fullarticle&utm_medium=referral&utm_source=inshorts,https://static.inshorts.com/inshorts/images/v1/variants/jpg/m/2022/07_jul/8_fri/img_1657287254336_126.jpg?,https://inshorts.com/en/news/ed-summons-delhi-minister-satyendar-jains-wife-in-money-laundering-case-1657288483919,Free Press Journal,Friday
"Stalin congratulates PT Usha, Ilaiyaraaja on Rajya Sabha nomination","Tamil Nadu Chief Minister MK Stalin has extended greetings to athlete PT Usha and music icon Ilaiyaraaja on their Rajya Sabha nomination. ""Congratulations to PT Usha on being nominated to the Council of States,"" Stalin tweeted. Stalin also congratulated the music maestro for his upcoming stint in the Rajya Sabha. Ilaiyaraaja thanked Stalin for the wishes.",2022-07-07,Anisha Joneja,http://www.ptinews.com/news/13510565_Stalin-lauds-Ilaiyaraaja--P-T-Usha.html?utm_campaign=fullarticle&utm_medium=referral&utm_source=inshorts,https://static.inshorts.com/inshorts/images/v1/variants/jpg/m/2022/07_jul/7_thu/img_1657212609013_949.jpg?,https://inshorts.com/en/news/stalin-congratulates-pt-usha-ilaiyaraaja-on-rajya-sabha-nomination-1657216430189,Press Trust of India,Thursday
Extend support to NDA's Prez candidate Murmu: Shiv Sena MP to Uddhav,"Shiv Sena MP Rajendra Gavit has urged party chief Uddhav Thackeray to support Droupadi Murmu's candidature in the Presidential election. Gavit, who belongs to a tribal community, is the second Sena MP to suggest that the party back NDA's Presidential candidate. It would be an honour if a tribal person became the President, Gavit said in a letter to Thackeray.",2022-07-08,Shailesh,https://repository.inshorts.com/articles/en/PTI/e29a66a1-ed28-4220-a14b-9af37dfcd1f4?utm_campaign=fullarticle&utm_medium=referral&utm_source=inshorts,https://static.inshorts.com/inshorts/images/v1/variants/jpg/m/2022/07_jul/8_fri/img_1657300881969_659.jpg?,https://inshorts.com/en/news/extend-support-to-ndas-prez-candidate-murmu-shiv-sena-mp-to-uddhav-1657302219690,PTI,Friday
TMC delegation meets Governor over Dilip Ghosh's remarks against Mamata,"An eight-member delegation of TMC, including party's leader Kunal Ghosh, met Governor Jagdeep Dhankhar on Thursday, seeking action against BJP leader Dilip Ghosh for his alleged derogatory comments against West Bengal CM Mamata Banerjee. Governor Dhankhar has assured the TMC delegation that he will look into the matter. Ghosh had allegedly made some remarks about Banerjee's family during an event.",2022-07-07,Dharini Mudgal,https://www.hindustantimes.com/cities/kolkata-news/tmc-delegation-to-meet-bengal-guv-amid-row-over-dilip-ghosh-s-remarks-on-mamata-101657184626493-amp.html?utm_campaign=fullarticle&utm_medium=referral&utm_source=inshorts,https://static.inshorts.com/inshorts/images/v1/variants/jpg/m/2022/07_jul/7_thu/img_1657205521281_229.jpg?,https://inshorts.com/en/news/tmc-delegation-meets-governor-over-dilip-ghoshs-remarks-against-mamata-1657207687397,Hindustan Times,Thursday
Cong has misused Gandhi's name; brought country to a sorry state: CM Bommai,"Karnataka CM Basavaraj Bommai has accused Congress of misusing Mahatma Gandhi's name and bringing the country to a sorry state. ""Congress is in the position of a convict. They bowed to lobbies...They do not have the moral right to preach to others,"" CM Bommai said. ""There are more such scams which Congress has buried. They would be exposed,"" he added.",2022-07-08,Mohammad Anab,https://www.hindustantimes.com/cities/bengaluru-news/congress-brought-the-country-to-a-sorry-state-cm-bommai-101657263266895-amp.html?utm_campaign=fullarticle&utm_medium=referral&utm_source=inshorts,https://static.inshorts.com/inshorts/images/v1/variants/jpg/m/2022/07_jul/8_fri/img_1657270136847_649.jpg?,https://inshorts.com/en/news/cong-has-misused-gandhis-name-brought-country-to-a-sorry-state-cm-bommai-1657274192378,Hindustan Times,Friday
Deeply saddened by demise of former Japan PM Shinzo Abe: Rahul,"Congress leader Rahul Gandhi on Friday expressed condolences and said that he's ""deeply saddened"" by the demise of former Japan PM Shinzo Abe. ""[Abe's] role in strengthening...strategic relationship between India and Japan was commendable,"" he added. He further said that Abe has left behind a ""lasting legacy in...Indo-Pacific"". Abe died after being shot while delivering a speech in Nara city.",2022-07-08,Medhaa Gupta,https://twitter.com/RahulGandhi/status/1545336104974368769?ref_src=twsrc%5Egoogle%7Ctwcamp%5Eserp%7Ctwgr%5Etweet&utm_campaign=fullarticle&utm_medium=referral&utm_source=inshorts,https://static.inshorts.com/inshorts/images/v1/variants/jpg/m/2022/07_jul/8_fri/img_1657276041456_882.jpg?,https://inshorts.com/en/news/deeply-saddened-by-demise-of-former-japan-pm-shinzo-abe-rahul-1657277182443,Twitter,Friday
Cong has been constantly attacking constitutional institutions: Rijiju,"Union Minister Kiren Rijiju criticised Congress and said the party has been constantly attacking constitutional institutions from the beginning. ""Don't forget that people of India are not servants of anyone,"" Rijiju tweeted. Rijiju's comment comes a day after Congress' Abhishek Singhvi accused the BJP of promoting personal attacks on Supreme Court judges.",2022-07-07,Apoorva Shankar,https://www.timesnownews.com/india/congress-has-been-constantly-attacking-constitutional-institutions-from-beginning-kiren-rijiju-article-92729792/amp?utm_campaign=fullarticle&utm_medium=referral&utm_source=inshorts,https://static.inshorts.com/inshorts/images/v1/variants/jpg/m/2022/07_jul/7_thu/img_1657209667626_869.jpg?,https://inshorts.com/en/news/cong-has-been-constantly-attacking-constitutional-institutions-rijiju-1657213197379,Times Now,Thursday
Dare TMC to arrest me: BJP's Dilip Ghosh on remarks on WB CM,"West Bengal BJP leader Dilip Ghosh dared the TMC government to arrest him for his comments on Chief Minister Mamata Banerjee. ""TMC is falling on the feet of the governor so that I can be arrested. They are shameless!"" Ghosh tweeted. Ghosh's comment comes after a TMC delegation met Governor Jagdeep Dhankhar and sought action against him.",2022-07-08,Apoorva Shankar,https://www.timesnownews.com/india/i-dare-tmc-to-arrest-me-bjps-dilip-ghosh-after-trinamool-delegation-meets-governor-over-comments-on-mamata-banerjee-article-92737301/amp?utm_campaign=fullarticle&utm_medium=referral&utm_source=inshorts,https://static.inshorts.com/inshorts/images/v1/variants/jpg/m/2022/07_jul/8_fri/img_1657281426715_66.jpg?,https://inshorts.com/en/news/dare-tmc-to-arrest-me-bjps-dilip-ghosh-on-remarks-on-wb-cm-1657292756780,Times Now,Friday
BJP bags 102 of 130 panchayat seats unopposed in Arunachal Pradesh,"The Bharatiya Janata Party (BJP) has won 102 out of 130 seats unopposed in the gram panchayat elections in Arunachal Pradesh. Other 14 seats were bagged by Congress, National People's Party (NPP) and independent candidates. Chief Minister Pema Khandu thanked all BJP supporters on Twitter and said, ""Congratulations and thanks to all karyakartas, supporters and sympathisers.""",2022-07-08,Swati Dubey,https://theprint.in/india/bjp-bags-102-out-of-130-panchayat-seats-unopposed-in-arunachal-pradesh/1030006/?amp=&utm_campaign=fullarticle&utm_medium=referral&utm_source=inshorts,https://static.inshorts.com/inshorts/images/v1/variants/jpg/m/2022/07_jul/8_fri/img_1657264697795_801.jpg?,https://inshorts.com/en/news/bjp-bags-102-of-130-panchayat-seats-unopposed-in-arunachal-pradesh-1657270026435,The Print,Friday
Sachin Pilot meets family of tailor killed in Udaipur; shares pics,"Congress leader Sachin Pilot on Friday met the family members of tailor Kanhaiya Lal, who was beheaded in Udaipur for allegedly supporting suspended BJP spokesperson Nupur Sharma. He also shared pictures of the meeting. Calling the incident a ""barbaric massacre"", he added that the ""pain and anguish"" that Kanhaiya's family is going through can't be expressed in words.",2022-07-09,Medhaa Gupta,None,https://static.inshorts.com/inshorts/images/v1/variants/jpg/m/2022/07_jul/9_sat/img_1657343354491_476.jpg?,https://inshorts.com/en/news/sachin-pilot-meets-family-of-tailor-killed-in-udaipur-shares-pics-1657343788010,Inshorts,Saturday
BJP wants to finish Shiv Sena: Sanjay Raut,"Shiv Sena's Member of Parliament (MP) Sanjay Raut on Friday accused the BJP of trying to destroy Shiv Sena. ""BJP doesn't want to engineer a split in the Shiv Sena, but it wants to finish the party,"" he said. ""Till the time Shiv Sena exists, they cannot realise their dream of breaking Maharashtra into three pieces,"" he added.",2022-07-09,Swati Dubey,https://theprint.in/india/not-just-cause-split-bjp-wants-to-destroy-shiv-sena-claims-raut/1030832/?amp=&utm_campaign=fullarticle&utm_medium=referral&utm_source=inshorts,https://static.inshorts.com/inshorts/images/v1/variants/jpg/m/2022/07_jul/9_sat/img_1657352612948_53.jpg?,https://inshorts.com/en/news/bjp-wants-to-finish-shiv-sena-sanjay-raut-1657356412503,The Print,Saturday
"32 Sena corporators from Navi Mumbai meet Shinde, extend support","As many as 32 Shiv Sena corporators from Navi Mumbai met with Maharashtra CM Eknath Shinde on Thursday and extended their support to him. This comes after 66 of the party's corporators from Thane joined Shinde's camp. ""[Shinde] never declined anybody's phone call. Even if an ordinary party worker calls him up, he receives...call,"" the Navi Mumbai corporators said.",2022-07-08,Medhaa Gupta,https://www.timesnownews.com/india/fresh-jolt-to-uddhav-thackeray-as-32-navi-mumbai-corporators-back-cm-eknath-shinde-led-faction-of-shiv-sena-article-92732803/amp?utm_campaign=fullarticle&utm_medium=referral&utm_source=inshorts,https://static.inshorts.com/inshorts/images/v1/variants/jpg/m/2022/07_jul/8_fri/img_1657252280273_643.jpg?,https://inshorts.com/en/news/32-sena-corporators-from-navi-mumbai-meet-shinde-extend-support-1657253418333,Times Now,Friday
"Ex-Sena MLA, 8 policemen booked for assaulting Dalit man in Pune","Former Shiv Sena MLA Mahadev Babar and eight police personnel have been booked for allegedly assaulting a Dalit man during a bandh last year in Pune. Babar and some others had reportedly forced the complainant to shut his sister's fish stall and thrashed him. Later, when the complainant went to Kondhwa police station, the accused police officers apparently beat him.",2022-07-08,Medhaa Gupta,None,https://static.inshorts.com/inshorts/images/v1/variants/jpg/m/2022/07_jul/8_fri/img_1657255446329_470.jpg?,https://inshorts.com/en/news/exsena-mla-8-policemen-booked-for-assaulting-dalit-man-in-pune-1657258103511,Inshorts,Friday
Saddened to know about demise of former Japan PM Shinzo Abe: Kejriwal,"Delhi Chief Minister Arvind Kejriwal expressed condolences and said he is saddened to know about the demise of former Japan PM Shinzo Abe. ""The world has lost a great leader. May the departed soul rest in peace,"" Kejriwal tweeted. Shinzo Abe was shot while delivering a speech in the city of Nara.",2022-07-08,Apoorva Shankar,http://www.ptinews.com/news/13512388_Kejriwal-condoles-death-of-former-Japan-PM-Shinzo-Abe.html?utm_campaign=fullarticle&utm_medium=referral&utm_source=inshorts,https://static.inshorts.com/inshorts/images/v1/variants/jpg/m/2022/07_jul/8_fri/img_1657283602721_661.jpg?,https://inshorts.com/en/news/saddened-to-know-about-demise-of-former-japan-pm-shinzo-abe-kejriwal-1657285263808,Press Trust of India,Friday
No one can take away Sena's 'bow & arrow' symbol: Uddhav Thackeray,"Maharashtra's former CM and Shiv Sena chief Uddhav Thackeray on Friday said the 'bow and arrow' symbol will always remain with the party. ""There's a discussion going on about the party's symbol. As per the law, no one can take away 'bow and arrow' from Shiv Sena,"" he added. Thackeray further demanded that mid-term elections should be held in Maharashtra.",2022-07-08,Dharini Mudgal,https://twitter.com/ANI/status/1545333990122729472?utm_campaign=fullarticle&utm_medium=referral&utm_source=inshorts,https://static.inshorts.com/inshorts/images/v1/variants/jpg/m/2022/07_jul/8_fri/img_1657281627788_514.jpg?,https://inshorts.com/en/news/no-one-can-take-away-senas-bow-arrow-symbol-uddhav-thackeray-1657284005635,Twitter,Friday
Centre creating 'economic blockade' for West Bengal: CM Mamata Banerjee,"West Bengal CM Mamata Banerjee on Thursday claimed that the central government is creating an ""economic blockade"" for the state by not releasing funds for MGNREGA and other schemes. ""UGC grants have also been stopped and is causing trouble to PhD students doing research,"" Mamata added. She was speaking at a programme held to distribute students' credit cards in Kolkata.",2022-07-08,Shiwangi,https://www.freepressjournal.in/amp/india/mamata-banerjee-slams-centre-for-economic-blockade-in-west-bengal?utm_campaign=fullarticle&utm_medium=referral&utm_source=inshorts,https://static.inshorts.com/inshorts/images/v1/variants/jpg/m/2022/07_jul/8_fri/img_1657252547606_636.jpg?,https://inshorts.com/en/news/centre-creating-economic-blockade-for-west-bengal-cm-mamata-banerjee-1657255343144,Free Press Journal,Friday
Extreme unemployment: Chidambaram on applications received under Agnipath,"Senior Congress leader P Chidambaram on Thursday said that ""extreme unemployment situation"" in the country was the reason behind the Indian Air Force (IAF) receiving 7.5 lakh applications under Agnipath scheme. ""Wrong conclusion: the Agniveer scheme is popular among...youth,"" he tweeted, adding that the correct conclusion would be the unemployment, which is driving desperate youth to take any job.",2022-07-08,Shiwangi,https://theprint.in/india/unemployment-situation-extreme-chidambaram-on-iaf-receiving-7-5-lakh-applications-under-agnipath/1029755/?amp=&utm_campaign=fullarticle&utm_medium=referral&utm_source=inshorts,https://static.inshorts.com/inshorts/images/v1/variants/jpg/m/2022/07_jul/8_fri/img_1657255221172_68.jpg?,https://inshorts.com/en/news/extreme-unemployment-chidambaram-on-applications-received-under-agnipath-1657258129451,The Print,Friday
BJP shouldn't teach Bengalis how to worship Goddess Kali: Moitra,"TMC MP Mahua Moitra reacted to BJP criticising her remarks on Goddess Kali, saying that they ""shouldn't teach Bengalis how to worship"" the goddess. BJP should stop imposing its ""version of Hinduism...based on established norms of North India"" on other parts of India, she added. Earlier, Moitra said that to her, ""Goddess Kali is a meat-eating and alcohol-accepting goddess.""",2022-07-08,Medhaa Gupta,https://theprint.in/india/bjp-not-custodian-of-hindu-deities-shouldnt-teach-bengalis-how-to-worship-goddess-kali-mahua-moitra/1030277/?amp=&utm_campaign=fullarticle&utm_medium=referral&utm_source=inshorts,https://static.inshorts.com/inshorts/images/v1/variants/jpg/m/2022/07_jul/8_fri/img_1657269084473_24.jpg?,https://inshorts.com/en/news/bjp-shouldnt-teach-bengalis-how-to-worship-goddess-kali-moitra-1657271703599,The Print,Friday
Govt has fulfilled 95% of promises made before 2019 polls: Andhra CM,"YSR Congress President and Andhra Pradesh CM YS Jagan Mohan Reddy on Friday said that his government has fulfilled 95% of the promises made ahead of the 2019 elections. Speaking at the YSRCP's plenary in Amaravati, Jagan Reddy claimed that his government has shown how an administration can be run in a transparent and a corruption-free manner.",2022-07-08,Apoorva Shankar,https://www.latestly.com/agency-news/india-news-we-showed-what-clean-governance-is-says-ap-cm-jagan-3925712.html/amp?utm_campaign=fullarticle&utm_medium=referral&utm_source=inshorts,https://static.inshorts.com/inshorts/images/v1/variants/jpg/m/2022/07_jul/8_fri/img_1657293496683_878.jpg?,https://inshorts.com/en/news/govt-has-fulfilled-95-of-promises-made-before-2019-polls-andhra-cm-1657300035872,LatestLY,Friday
"After being acquitted of murder, BJP leader holds roadshow in UP; booked","A BJP leader and his supporters were booked for allegedly holding a roadshow from Etah district jail to Aligarh in Uttar Pradesh without administration's permission. The roadshow was taken out on Thursday, a day after the BJP leader was acquitted of murdering a man during 2020 CAA-NRC protest. ""There were around 30 to 35 vehicles in...procession,"" a police officer said.",2022-07-09,Medhaa Gupta,None,https://static.inshorts.com/inshorts/images/v1/variants/jpg/m/2022/07_jul/9_sat/img_1657343294374_34.jpg?,https://inshorts.com/en/news/after-being-acquitted-of-murder-bjp-leader-holds-roadshow-in-up-booked-1657348199529,Inshorts,Saturday
My political & social tenure is not yet over: Naqvi after resignation,"Senior BJP leader Mukhtar Abbas Naqvi, who resigned as Union Minority Affairs Minister recently, said his political journey is not yet over. ""I understand that my tenure in Rajya Sabha has been completed, but my political and social tenure has not yet been completed,"" he said. ""I will continue to work with dedication and concern for society,"" Naqvi added.",2022-07-08,Swati Dubey,https://www.siasat.com/my-political-and-social-tenure-not-yet-over-says-naqvi-after-resignation-2365274/?utm_campaign=fullarticle&utm_medium=referral&utm_source=inshorts,https://static.inshorts.com/inshorts/images/v1/variants/jpg/m/2022/07_jul/8_fri/img_1657253827092_348.jpg?,https://inshorts.com/en/news/my-political-social-tenure-is-not-yet-over-naqvi-after-resignation-1657257865245,The Siasat Daily,Friday
Pained to learn about assassination of Japan's ex-PM Shinzo Abe: Shah,"Union Home Minister Amit Shah on Friday expressed grief over the assassination of former PM of Japan, Shinzo Abe. Taking to Twitter, Shah said, ""Pained to learn about the assassination of...India's valued friend, Shinzo Abe. His efforts in strengthening...India-Japan relationship will always be held fondly in our memories."" ""My deepest condolences to his family...and...people of Japan,"" he added.",2022-07-08,Dharini Mudgal,https://twitter.com/AmitShah/status/1545365347196276738?utm_campaign=fullarticle&utm_medium=referral&utm_source=inshorts,https://static.inshorts.com/inshorts/images/v1/variants/jpg/m/2022/07_jul/8_fri/img_1657283347832_306.jpg?,https://inshorts.com/en/news/pained-to-learn-about-assassination-of-japans-expm-shinzo-abe-shah-1657289588045,Twitter,Friday
Waiting for divorce from Akhilesh Yadav-led SP: SBSP chief,"Suheldev Bharatiya Samaj Party chief Om Prakash Rajbhar on Friday said he will not initiate any steps to break SBSP's alliance with the Samajwadi Party and that he is waiting for ""talaq"" (divorce) from Akhilesh Yadav-led SP. Rajbhar added that he is ""still with the SP, but will not remain together forcefully if Akhilesh Yadav doesn't want it"".",2022-07-08,Shailesh,https://repository.inshorts.com/articles/en/PTI/077364e6-3772-4ee7-a6fd-13e10d04aebe?utm_campaign=fullarticle&utm_medium=referral&utm_source=inshorts,https://static.inshorts.com/inshorts/images/v1/variants/jpg/m/2022/07_jul/8_fri/img_1657280900476_338.jpg?,https://inshorts.com/en/news/waiting-for-divorce-from-akhilesh-yadavled-sp-sbsp-chief-1657283793867,PTI,Friday
Lalu Prasad Yadav's health is improving: Daughter Misa Bharti,"RJD leader Misa Bharti tweeted that the health of her father Lalu Prasad Yadav is improving. She also shared some photos of the RJD chief from hospital and wrote, ""Lalu Ji's condition is much better...because of his morale and your prayers. Please don't pay attention to rumours."" Lalu was hospitalised with severe injuries and airlifted to Delhi's AIIMS on Wednesday.",2022-07-08,Swati Dubey,https://twitter.com/MisaBharti/status/1545254148811079680?s=20&t=FOYpFsxExZxo3j9jWwsjIg&utm_campaign=fullarticle&utm_medium=referral&utm_source=inshorts,https://static.inshorts.com/inshorts/images/v1/variants/jpg/m/2022/07_jul/8_fri/img_1657273594280_931.jpg?,https://inshorts.com/en/news/lalu-prasad-yadavs-health-is-improving-daughter-misa-bharti-1657278145540,Twitter,Friday
