headlines,text,date,author,read_more,image_url,inshorts_url,original_source,day
21 TMC MLAs are in direct touch with me: Bengal BJP's Mithun Chakraborty,"West Bengal BJP leader Mithun Chakraborty on Wednesday claimed that 21 TMC MLAs are in direct touch with him in the state. ""Do you want to hear breaking news? At this moment, 38 TMC MLAs have very good relations with us,"" he said in Kolkata. ""Rest, you make the calculations,"" Mithun added.",2022-07-27,Deepika Bhatt,https://twitter.com/ANI/status/1552243736632889344?ref_src=twsrc%5Egoogle%7Ctwcamp%5Eserp%7Ctwgr%5Etweet&utm_campaign=fullarticle&utm_medium=referral&utm_source=inshorts,https://static.inshorts.com/inshorts/images/v1/variants/jpg/m/2022/07_jul/27_wed/img_1658921105754_860.jpg?,https://inshorts.com/en/news/21-tmc-mlas-are-in-direct-touch-with-me-bengal-bjps-mithun-chakraborty-1658922914507,ANI,Wednesday
Central govt wants to crush journalism: PDP chief Mehbooba Mufti,"PDP chief Mehbooba Mufti on Wednesday claimed that the BJP-led central government wants to crush journalism. ""It's no secret that GOI wants to crush the...backbone and fourth pillar of our democracy because of its intolerance to...truth,"" Mufti tweeted. Her remarks came after authorities stopped Kashmiri journalist, Aakash Hassan, from travelling to Sri Lanka to cover the ongoing crisis there.",2022-07-27,Shiwangi,https://theprint.in/india/centre-wants-to-crush-journalism-pdp-chief-mehbooba-mufti/1057185/?amp=&utm_campaign=fullarticle&utm_medium=referral&utm_source=inshorts,https://static.inshorts.com/inshorts/images/v1/variants/jpg/m/2022/07_jul/27_wed/img_1658919449451_76.jpg?,https://inshorts.com/en/news/central-govt-wants-to-crush-journalism-pdp-chief-mehbooba-mufti-1658922141101,The Print,Wednesday
Congress trying to mislead probe agencies through protests: Thakur,"Union Minister Anurag Thakur on Wednesday criticised the Congress and accused the party of ""misleading and pressuring"" central probe agencies through street protests. Thakur said that cases of rape and murder are increasing in states. ""The situation is worrisome in Rajasthan, but the CM is spending time here,"" he said. Congress has never shied away from attacking democracy, Thakur added.",2022-07-27,Nakul Ahuja,https://theprint.in/india/congress-trying-to-mislead-probe-agencies-through-protests-i-b-minister-anurag-thakur/1057249/?amp=&utm_campaign=fullarticle&utm_medium=referral&utm_source=inshorts,https://static.inshorts.com/inshorts/images/v1/variants/jpg/m/2022/07_jul/27_wed/img_1658917857723_811.jpg?,https://inshorts.com/en/news/congress-trying-to-mislead-probe-agencies-through-protests-thakur-1658919499794,The Print,Wednesday
Sonia Gandhi leaves ED office after 3 hours of questioning,"Congress interim President Sonia Gandhi’s ED questioning in connection with the National Herald case concluded for the day on Wednesday. She left the ED office in Delhi after three hours of questioning. There has been no fresh summons issued to her as of now, PTI stated. She was called for the third round of questioning in the case today.",2022-07-27,Sakshi Sharma,https://www.hindustantimes.com/india-news/sonia-gandhi-s-questioning-by-ed-in-national-herald-case-concludes-for-today-101658912088347-amp.html?utm_campaign=fullarticle&utm_medium=referral&utm_source=inshorts,https://static.inshorts.com/inshorts/images/v1/variants/jpg/m/2022/07_jul/27_wed/img_1658918473516_555.jpg?,https://inshorts.com/en/news/sonia-gandhi-leaves-ed-office-after-3-hours-of-questioning-1658920185206,Hindustan Times,Wednesday
Not easy to break Bengal with central agencies: Mamata amid SSC probe,"Amid the ongoing probe into the SSC scam, West Bengal CM Mamata Banerjee on Wednesday criticised the Centre and said it ""wasn't easy to break Bengal"" with the help of central agencies. ""They (BJP) have no work, their job is to take over the state governments through 3-4 agencies,"" Mamata said. ""They've taken Maharashtra...but Bengal has defeated them,"" she added.",2022-07-27,Apoorva Shankar,https://aninews.in/news/national/general-news/not-easy-to-break-bengal-with-central-agencies-wb-cm-mamata20220727165152/?utm_campaign=fullarticle&utm_medium=referral&utm_source=inshorts,https://static.inshorts.com/inshorts/images/v1/variants/jpg/m/2022/07_jul/27_wed/img_1658924755159_918.jpg?,https://inshorts.com/en/news/not-easy-to-break-bengal-with-central-agencies-mamata-amid-ssc-probe-1658935605656,ANI News,Wednesday
Former Assam minister Ardhendu Dey dies aged 84,"Former Assam minister Ardhendu Kumar Dey died at a hospital on Wednesday following a brief illness, his family said. The 84-year-old former Congress minister was undergoing treatment at Gauhati Medical College and Hospital, they added. His mortal remains were taken to his residence at Hojai, where the last rites were performed. Dey was first elected as Hojai MLA in 1991.",2022-07-27,Nidhi Sinha,https://theprint.in/india/former-assam-minister-ardhendu-dey-dies-at-84/1057684/?amp=&utm_campaign=fullarticle&utm_medium=referral&utm_source=inshorts,https://static.inshorts.com/inshorts/images/v1/variants/jpg/m/2022/07_jul/27_wed/img_1658943345638_735.jpg?,https://inshorts.com/en/news/former-assam-minister-ardhendu-dey-dies-aged-84-1658944022059,The Print,Wednesday
"ED has created terror, being used to topple govts: Gehlot","The ED has created ""terror"" in country, Rajasthan CM and Congress leader Ashok Gehlot said on Wednesday. ""ED is being used to topple governments,"" Gehlot added. ""First they summoned Rahul Gandhi. He was interrogated for several hours in five days. Sonia Gandhi has been summoned for the third time today. We've no idea how long it would last,"" he stated.",2022-07-27,Sakshi Sharma,https://twitter.com/ANI/status/1552161213676912640?s=20&t=gprefQDv8NjP9jc-FtL3dA&utm_campaign=fullarticle&utm_medium=referral&utm_source=inshorts,https://static.inshorts.com/inshorts/images/v1/variants/jpg/m/2022/07_jul/27_wed/img_1658902781736_321.jpg?,https://inshorts.com/en/news/ed-has-created-terror-being-used-to-topple-govts-gehlot-1658907763436,ANI,Wednesday
BJP protests near AAP office over Delhi excise policy irregularities,"Bharatiya Janata Party (BJP) workers protested over irregularities in Delhi government's excise policy implementation outside the Aam Aadmi Party's (AAP) office. BJP MP Parvesh Sahib Singh Verma led the protests, and he alleged that AAP government made Delhi into an ""intoxicated capital"". However, the police didn't allow the protestors' planned march to the AAP office at Deen Dayal Upadhyay Marg.",2022-07-27,Anisha Joneja,https://theprint.in/india/bjp-protests-near-aap-office-over-irregularities-in-new-excise-policy/1057277/?amp=&utm_campaign=fullarticle&utm_medium=referral&utm_source=inshorts,https://static.inshorts.com/inshorts/images/v1/variants/jpg/m/2022/07_jul/27_wed/img_1658925062237_63.jpg?,https://inshorts.com/en/news/bjp-protests-near-aap-office-over-delhi-excise-policy-irregularities-1658930099872,The Print,Wednesday
He's mentally ill: TMC MP on Mithun's '38 MLAs in touch with BJP' claim,"TMC MP Santanu Sen on Wednesday said BJP leader Mithun Chakraborty has ""some mental problem"" after the latter claimed that 38 TMC MLAs ""have very good relations"" with BJP. ""[Chakraborty] was admitted for some physical ailment for a long period of time...As a doctor, I feel he must be having some mental problem...That's why he's saying [these things],"" Sen said.",2022-07-27,Ashley Paul,https://www.hindustantimes.com/videos/news/mentally-ill-tmc-rips-mithun-chakraborty-for-38-mlas-in-touch-claim-101658936558578-amp.html?utm_campaign=fullarticle&utm_medium=referral&utm_source=inshorts,https://static.inshorts.com/inshorts/images/v1/variants/jpg/m/2022/07_jul/27_wed/img_1658940504158_148.jpg?,https://inshorts.com/en/news/hes-mentally-ill-tmc-mp-on-mithuns-38-mlas-in-touch-with-bjp-claim-1658941279193,Hindustan Times,Wednesday
Dhankhar said he will not spare Partha Chatterjee: TMC leader,"Trinamool Congress leader Kunal Ghosh has recalled a recent incident when former Bengal Governor Jagdeep Dhankhar told him that ""he will not spare (Partha) Chatterjee"" for an attack on his wife. The comments came as West Bengal Commerce Minister Partha Chatterjee was arrested three days ago in an alleged teachers’ recruitment scam. Jagdeep Dhankhar is the NDA's vice-presidential candidate.",2022-07-27,Indraneel Sen,https://www.financialexpress.com/india-news/jagdeep-dhankhar-said-he-wont-spare-partha-chatterjee-tmcs-kunal-ghosh/2608268/lite/?utm_campaign=fullarticle&utm_medium=referral&utm_source=inshorts,https://static.inshorts.com/inshorts/images/v1/variants/jpg/m/2022/07_jul/27_wed/img_1658925507593_538.jpg?,https://inshorts.com/en/news/dhankhar-said-he-will-not-spare-partha-chatterjee-tmc-leader-1658929616831,Financial Express,Wednesday
"MVA experiment wasn't wrong, Sena will have its CM again: Uddhav","Shiv Sena chief and former Maharashtra CM Uddhav Thackeray, in an interview with 'Saamana', said the Maha Vikas Aghadi (MVA) alliance experiment wasn't wrong and people had welcomed it. ""The Shiv Sena will have a chief minister again. I will work to expand the party base and cadre,"" Thackeray said. ""If...present rulers fear the Opposition, it's their inefficiency,"" he added.",2022-07-27,Shiwangi,https://www.freepressjournal.in/amp/mumbai/mva-experiment-wasnt-wrong-shiv-sena-will-have-its-cm-again-uddhav-thackeray?utm_campaign=fullarticle&utm_medium=referral&utm_source=inshorts,https://static.inshorts.com/inshorts/images/v1/variants/jpg/m/2022/07_jul/27_wed/img_1658908044329_474.jpg?,https://inshorts.com/en/news/mva-experiment-wasnt-wrong-sena-will-have-its-cm-again-uddhav-1658912025095,Free Press Journal,Wednesday
Cong protesters stop Gujarat-bound train in Mumbai as ED probes Sonia,A group of 10-15 Youth Congress workers stopped a Gujarat-bound train on Mumbai's Borivali station on Wednesday morning to protest against the questioning of Congress chief Sonia Gandhi by the Enforcement Directorate (ED). A video showed protesters raising slogans against PM Narendra Modi. Police officials said some of the protesters were detained and the train departed for its onward journey.,2022-07-27,Nidhi Sinha,https://www.freepressjournal.in/amp/mumbai/mumbai-youth-congress-workers-detained-after-rail-roko-protest-against-ed-questioning-of-sonia-gandhi?utm_campaign=fullarticle&utm_medium=referral&utm_source=inshorts,https://static.inshorts.com/inshorts/images/v1/variants/jpg/m/2022/07_jul/27_wed/img_1658912831246_471.jpg?,https://inshorts.com/en/news/cong-protesters-stop-gujaratbound-train-in-mumbai-as-ed-probes-sonia-1658917072645,Free Press Journal,Wednesday
"Was ready to leave MVA, join hands with BJP to convince rebels: Uddhav","Shiv Sena chief Uddhav Thackeray said that as part of his final attempts to convince rebel MLAs, he was ready to leave the MVA alliance. Thackeray said he would've joined hands with BJP after getting clarifications on three points, including ""misuse"" of central agencies against Shiv Sainiks. ""[Rebels] had no courage to tell me the reasons [for leaving],"" Thackeray added.",2022-07-27,Ashley Paul,https://theprint.in/politics/was-ready-to-leave-mva-join-hands-with-bjp-in-last-attempt-to-convince-rebels-says-uddhav/1057149/?amp=&utm_campaign=fullarticle&utm_medium=referral&utm_source=inshorts,https://static.inshorts.com/inshorts/images/v1/variants/jpg/m/2022/07_jul/27_wed/img_1658915949879_377.jpg?,https://inshorts.com/en/news/was-ready-to-leave-mva-join-hands-with-bjp-to-convince-rebels-uddhav-1658918933614,The Print,Wednesday
"Those guilty must be punished, but media trials unacceptable: Mamata","Days after TMC leader Partha Chatterjee was arrested by the ED in connection with a school recruitment scam, West Bengal CM Mamata Banerjee on Wednesday criticised the media for launching a ""malicious campaign"" against TMC. ""If anyone has committed any mistake, and it is proven legally, he or she must be punished,"" she said.",2022-07-27,Nakul Ahuja,None,https://static.inshorts.com/inshorts/images/v1/variants/jpg/m/2022/07_jul/27_wed/img_1658932448772_479.jpg?,https://inshorts.com/en/news/those-guilty-must-be-punished-but-media-trials-unacceptable-mamata-1658935712323,Inshorts,Wednesday
Politically motivated: Robert Vadra on ED summons to Congress leaders,"Following ED summons sent to Congress leaders Rahul Gandhi and now Sonia Gandhi, Priyanka Gandhi Vadra’s husband Robert Vadra said the move is ""politically motivated"". ""Now when there is GST, inflation, price hike...they have called Mrs Gandhi,"" he added. ""The government is diverting people’s attention to cover-up the statement given by Nupur Sharma that created communal disharmony,"" he stated.",2022-07-27,Sakshi Sharma,https://theprint.in/politics/ed-summons-to-congress-leaders-to-cover-up-nupur-sharma-case-inflation-robert-vadra/1056580/?amp=&utm_campaign=fullarticle&utm_medium=referral&utm_source=inshorts,https://static.inshorts.com/inshorts/images/v1/variants/jpg/m/2022/07_jul/27_wed/img_1658896911065_367.jpg?,https://inshorts.com/en/news/politically-motivated-robert-vadra-on-ed-summons-to-congress-leaders-1658902384825,The Print,Wednesday
Pray to God for your long and healthy life: Shinde wishes Uddhav on birthday,"Maharashtra CM Eknath Shinde on Wednesday wished former CM Uddhav Thackeray on his birthday and prayed for his good health. Taking to Twitter, Shinde wrote, ""Happy Birthday to Hon'ble Shri Uddhavji Thackeray, former Chief Minister of Maharashtra. I pray to Mata Jagdamba for your long and healthy life."" Recently, Uddhav compared the rebel MLAs to rotten leaves.",2022-07-27,Subhangi Singh,https://www.hindustantimes.com/india-news/eknath-shinde-s-wish-on-uddhav-thackeray-s-birthday-pray-to-jagadamba-for-101658896542528-amp.html?utm_campaign=fullarticle&utm_medium=referral&utm_source=inshorts,https://static.inshorts.com/inshorts/images/v1/variants/jpg/m/2022/07_jul/27_wed/img_1658899252467_757.jpg?,https://inshorts.com/en/news/pray-to-god-for-your-long-and-healthy-life-shinde-wishes-uddhav-on-birthday-1658903884498,Hindustan Times,Wednesday
Congress govt in Raj under control of mafias: BJP leader Tarun Chugh,"BJP leader Tarun Chugh on Tuesday criticised the Ashok Gehlot-led government in Rajasthan, saying the law and order situation has ""completely derailed in the state"". ""The Congress government is under...control of mafias like mining mafia, cheating mafia...on whose behest the government is running,"" Chugh said. The development of the state has come to a complete standstill, he further claimed.",2022-07-27,Shiwangi,https://theprint.in/india/law-and-order-situation-has-completely-derailed-under-cong-rule-in-rajasthan-bjp-leader/1056707/?amp=&utm_campaign=fullarticle&utm_medium=referral&utm_source=inshorts,https://static.inshorts.com/inshorts/images/v1/variants/jpg/m/2022/07_jul/27_wed/img_1658900288492_874.jpg?,https://inshorts.com/en/news/congress-govt-in-raj-under-control-of-mafias-bjp-leader-tarun-chugh-1658905176567,The Print,Wednesday
Congress CMs camping in Delhi instead of managing their states: Anurag Thakur,"Union Minister Anurag Thakur criticised Congress for protesting in Delhi against ED questioning Sonia Gandhi in money laundering case and asked, Why is Congress scared if they haven't done any corruption? ""Incidents of rape, murder are being reported from Congress-ruled states, but their CMs are camping in Delhi instead of maintaining law and order in their respective states,"" he said.",2022-07-27,Subhangi Singh,https://twitter.com/ANI/status/1552171115531083776?utm_campaign=fullarticle&utm_medium=referral&utm_source=inshorts,https://static.inshorts.com/inshorts/images/v1/variants/jpg/m/2022/07_jul/27_wed/img_1658903085269_474.jpg?,https://inshorts.com/en/news/congress-cms-camping-in-delhi-instead-of-managing-their-states-anurag-thakur-1658905270584,ANI News,Wednesday
"If MPs belong at police lines, why is new Parliament being constructed?: Cong MP","Congress MP Deepender Singh Hooda on Wednesday said that when MPs raise important issues in Parliament, they are suspended. ""During protests, our members are detained and taken to police lines. If MPs belong at police lines, then why is a new Parliament being constructed here?"" Hooda asked. This comes as Congress interim President Sonia Gandhi appeared before the ED today.",2022-07-27,Sakshi Sharma,https://twitter.com/ANI/status/1552191464024985601?s=20&t=3gWTycF-j3DNhSGpbOMcmg&utm_campaign=fullarticle&utm_medium=referral&utm_source=inshorts,https://static.inshorts.com/inshorts/images/v1/variants/jpg/m/2022/07_jul/27_wed/img_1658913159287_276.jpg?,https://inshorts.com/en/news/if-mps-belong-at-police-lines-why-is-new-parliament-being-constructed-cong-mp-1658919375286,ANI,Wednesday
Will resign if govt doesn't take action: BJP MLA on party worker's murder,"After a BJP Yuva Morcha worker, Praveen Nettaru, was hacked to death by two assailants in Karnataka's Dakshina Kannada district, BJP MLA MP Renukacharya said he'll resign if action is not taken against the attackers. ""What's the use of being in power if we cannot protect...Hindu workers?"" Renukacharya tweeted, adding that there was no use for just ""Om Shanthi"" posts.",2022-07-27,Apoorva Shankar,https://www.freepressjournal.in/amp/india/karnataka-bjp-youth-leaders-murder-will-resign-if-govt-does-not-take-action-says-mla-mp-renukacharya?utm_campaign=fullarticle&utm_medium=referral&utm_source=inshorts,https://static.inshorts.com/inshorts/images/v1/variants/jpg/m/2022/07_jul/27_wed/img_1658939836384_968.jpg?,https://inshorts.com/en/news/will-resign-if-govt-doesnt-take-action-bjp-mla-on-party-workers-murder-1658942997048,Free Press Journal,Wednesday
"Had govt spent 4 hrs on debates, 5 days wouldn't have been wasted: Kharge","Leader of Opposition in Rajya Sabha, Mallikarjun Kharge, said that if the central government had spent four hours on discussions, five days of Parliament's Monsoon session wouldn't have gone to waste. ""Our demand is a discussion under rule 267, suspending business...they could have taken up a discussion under some other rule...It's clear they don't want a discussion,"" he added.",2022-07-27,Subhangi Singh,None,https://static.inshorts.com/inshorts/images/v1/variants/jpg/m/2022/07_jul/27_wed/img_1658897286412_660.jpg?,https://inshorts.com/en/news/had-govt-spent-4-hrs-on-debates-5-days-wouldnt-have-been-wasted-kharge-1658903390964,Inshorts,Wednesday
He inspires me to be better each day: Aaditya's Insta post on father's birthday,"Former Maharashtra Minister Aaditya Thackeray wished his father Uddhav Thackeray on his birthday and shared a picture of the father-son duo. Taking to Instagram, Aaditya wrote, ""Wishing my father and my leader a very happy birthday. He inspires me each day to be better at everything I do, more so, in an honest and kind way.""",2022-07-27,Subhangi Singh,https://www.hindustantimes.com/india-news/aaditya-thackeray-leans-on-father-in-his-new-instagram-post-on-uddhav-s-birthday-101658907114902-amp.html?utm_campaign=fullarticle&utm_medium=referral&utm_source=inshorts,https://static.inshorts.com/inshorts/images/v1/variants/jpg/m/2022/07_jul/27_wed/img_1658910593404_354.jpg?,https://inshorts.com/en/news/he-inspires-me-to-be-better-each-day-aadityas-insta-post-on-fathers-birthday-1658914824499,Hindustan Times,Wednesday
"Congress protesting to protect a family, not country: Nadda","The Congress party is protesting to protect a family, not the country, BJP President JP Nadda said on Wednesday. ""Congress protests are not 'Satyagrah' but an attempt to hide the truth…Gandhis required to answer the investigation agencies...they think they are above the law,"" he added. ""Congress party's attempt to keep one family above the law will not work,"" he stated.",2022-07-27,Sakshi Sharma,https://twitter.com/ANI/status/1552173352995164161?s=20&t=brTAc2keGbaRge7BqhfiHw&utm_campaign=fullarticle&utm_medium=referral&utm_source=inshorts,https://static.inshorts.com/inshorts/images/v1/variants/jpg/m/2022/07_jul/27_wed/img_1658907283869_896.jpg?,https://inshorts.com/en/news/congress-protesting-to-protect-a-family-not-country-nadda-1658912071788,ANI,Wednesday
Ideological opponents shouldn't be treated as personal opponents: Cong leader,"Ideological opponents in a democracy should not be treated as personal opponents, Congress leader Anand Sharma said on Wednesday. His statement comes as Congress interim President Sonia Gandhi appeared before ED for questioning in connection with the National Herald case today. ""Weaponisation of laws and their use to target has been going on,"" Sharma added.",2022-07-27,Sakshi Sharma,https://news.abplive.com/news/india/ideological-opponents-should-not-be-treated-as-personal-oopponents-congress-targets-centre-as-sonia-gandhi-appears-before-ed-1544706/amp?utm_campaign=fullarticle&utm_medium=referral&utm_source=inshorts,https://static.inshorts.com/inshorts/images/v1/variants/jpg/m/2022/07_jul/27_wed/img_1658908567911_583.jpg?,https://inshorts.com/en/news/ideological-opponents-shouldnt-be-treated-as-personal-opponents-cong-leader-1658919279338,ABP,Wednesday
Only a spineless govt hides behind police: Cong after protesting MPs detained,"Amid protests by Congress against ED’s questioning of party chief Sonia Gandhi, several Congress MPs were detained by the Delhi Police from Vijay Chowk on Wednesday. ""Only a spineless and coward government hides behind the police force,"" Congress tweeted. ""This is how our MPs and leaders are treated under the draconian [PM] Modi rule,"" Congress added.",2022-07-27,Sakshi Sharma,https://twitter.com/INCIndia/status/1552204643672829952?s=20&t=nCJl6V6iyCmFk66Zrkphfg&utm_campaign=fullarticle&utm_medium=referral&utm_source=inshorts,https://static.inshorts.com/inshorts/images/v1/variants/jpg/m/2022/07_jul/27_wed/img_1658914294863_400.jpg?,https://inshorts.com/en/news/only-a-spineless-govt-hides-behind-police-cong-after-protesting-mps-detained-1658919572094,Twitter,Wednesday
BJP workers glue PM Modi's photos on Chess Olympiad posters in TN,"BJP workers glued PM Narendra Modi's photos on hoardings advertising the 44th Chess Olympiad in Chennai. While sharing a video, BJP functionary AP Reddy wrote, ""Let me remind [Tamil Nadu CM] MK Stalin that PM Modi is the nation's sole representative."" This comes amid protests by BJP leaders over absence of PM Modi's name and image in the Olympiad's advertisements.",2022-07-27,Ashley Paul,https://www.thenewsminute.com/article/pm-modi-s-photos-glued-chess-olympiad-posters-chennai-bjp-leader-166257?amp=&utm_campaign=fullarticle&utm_medium=referral&utm_source=inshorts,https://static.inshorts.com/inshorts/images/v1/variants/jpg/m/2022/07_jul/27_wed/img_1658917968999_5.jpg?,https://inshorts.com/en/news/bjp-workers-glue-pm-modis-photos-on-chess-olympiad-posters-in-tn-1658919623887,The News Minute,Wednesday
"More cash recovered from Arpita's premises, ED brings counting machines","The Enforcement Directorate conducted fresh raids on four premises linked to West Bengal minister Partha Chatterjee's aide, Arpita Mukherjee, in an alleged teacher recruitment scam case on Wednesday. Cash counting machines were brought at her residence after the ED recovered a huge amount of cash from the premises, ANI reported. Earlier, the ED recovered ₹21.9 crore cash from Mukherjee's flat.",2022-07-27,Nidhi Sinha,https://www.thequint.com/amp/story/news/politics/ssc-scam-ed-recovers-more-banknotes-from-house-of-partha-chatterjees-aide?utm_campaign=fullarticle&utm_medium=referral&utm_source=inshorts,https://static.inshorts.com/inshorts/images/v1/variants/jpg/m/2022/07_jul/27_wed/img_1658939647109_609.jpg?,https://inshorts.com/en/news/more-cash-recovered-from-arpitas-premises-ed-brings-counting-machines-1658940976505,The Quint,Wednesday
Decision to suspend 19 Opp'n MPs from RS taken with heavy heart: Goyal,"BJP on Tuesday said that the decision to suspend 19 opposition MPs from the Rajya Sabha was taken with a ""heavy heart"", as they repeatedly ignored the Chair's appeals to let the House function. Leader of the House in the RS, Piyush Goyal, said that India has tackled inflation and price rise better than many countries.",2022-07-26,Nakul Ahuja,https://theprint.in/india/decision-to-suspend-19-opposition-mps-from-rs-taken-with-heavy-heart-piyush-goyal/1055806/?amp=&utm_campaign=fullarticle&utm_medium=referral&utm_source=inshorts,https://static.inshorts.com/inshorts/images/v1/variants/jpg/m/2022/07_jul/26_tue/img_1658839261395_791.jpg?,https://inshorts.com/en/news/decision-to-suspend-19-oppn-mps-from-rs-taken-with-heavy-heart-goyal-1658842496328,The Print,Tuesday
You paid for it right: Khushbu Sundar to troll saying she got plastic surgery,"Actress-turned-politician Khushbu Sundar recently posted a picture of herself on social media after losing weight. A troll commented on her post, ""Looking good but why from plastic surgery and other skin corrections?"" Khushbu replied to the troll's comment, writing, ""And you paid for it right my dear? What sadistic pleasures [do] people like you get...at someone's expense? Shame on you.""",2022-07-26,Kriti Kambiri,https://www.news18.com/amp/news/movies/khushbu-sundars-befitting-reply-to-troll-receives-applause-5627497.html?utm_campaign=fullarticle&utm_medium=referral&utm_source=inshorts,https://static.inshorts.com/inshorts/images/v1/variants/jpg/m/2022/07_jul/26_tue/img_1658835580088_899.jpg?,https://inshorts.com/en/news/you-paid-for-it-right-khushbu-sundar-to-troll-saying-she-got-plastic-surgery-1658838470315,News18,Tuesday
