headlines,text,date,author,read_more,image_url,inshorts_url,original_source,day
"Channi's statement was misconstrued: Priyanka on his UP, Bihar remark","Congress' Priyanka Gandhi Vadra on Thursday defended Punjab CM Charanjit Channi amid a controversy over his remark that 'bhaiyas' from UP and Bihar shouldn't be allowed in Punjab. Saying that Channi's statement was misconstrued, she said, ""All that...Channi said was that Punjab should be run by Punjabis...I don't think anyone from UP is interested in coming to Punjab and ruling.""",2022-02-17,Shalini Ojha,https://www.timesnownews.com/amp/india/article/punjab-election-2022-channi-s-up-bihar-ke-bhaiya-comment-misconstrued-says-priyanka-gandhi/859692?utm_campaign=fullarticle&utm_medium=referral&utm_source=inshorts,https://static.inshorts.com/inshorts/images/v1/variants/jpg/m/2022/02_feb/17_thu/img_1645096890830_691.jpg?,https://inshorts.com/en/news/channis-statement-was-misconstrued-priyanka-on-his-up-bihar-remark-1645099187188,timesnownews.com,Thursday
Still blaming 1st PM Nehru: Manmohan Singh on PM Modi-led govt,"Former PM Dr Manmohan Singh on Thursday criticised PM Narendra Modi-led government, saying BJP has been ruling for over seven years but blames first PM Jawaharlal Nehru for India's problems. He said an attempt was made to defame Punjab CM Charanjit Channi and Punjab's people ""in name of PM's security"". ""As an...Indian hailing from Punjab...these things...hurt me,"" he added.",2022-02-17,Shalini Ojha,https://repository.inshorts.com/articles/en/PTI/d2067226-bd0f-4149-9819-1315a40f36fb?utm_campaign=fullarticle&utm_medium=referral&utm_source=inshorts,https://static.inshorts.com/inshorts/images/v1/variants/jpg/m/2022/02_feb/17_thu/img_1645094089579_338.jpg?,https://inshorts.com/en/news/still-blaming-1st-pm-nehru-manmohan-singh-on-pm-modiled-govt-1645099272233,PTI,Thursday
Foreign relations don't improve by hugging or by going to eat biryani: Manmohan Singh,"Former PM Manmohan Singh has said that the government has proved to be a complete failure on the foreign policy front. He said, ""Chinese soldiers have been sitting on our holy soil for the last one year...Old friends are constantly leaving us."" He added, ""Relationships don't improve by forcibly hugging politicians or by going to eat biryani without invitation.""",2022-02-17,Apaar Sharma,https://www.youtube.com/watch?utm_campaign=fullarticle&v=78rgepEzKzA&utm_medium=referral&utm_source=inshorts,https://static.inshorts.com/inshorts/images/v1/variants/jpg/m/2022/02_feb/17_thu/img_1645091423003_506.jpg?,https://inshorts.com/en/news/foreign-relations-dont-improve-by-hugging-or-by-going-to-eat-biryani-manmohan-singh-1645092752412,YouTube,Thursday
Name combines greatest cricketers: Tharoor on India's youngest mayor marrying Sachin Dev,"Congratulating India's youngest mayor Arya Rajendran on her plans to marry Kerala's youngest MLA Sachin Dev, Congress MP Shashi Tharoor said, ""Anyone whose name combines two of India's greatest cricketers must be a good catch, I told her!"" Tharoor also shared a picture with Rajendran and tweeted, ""Blessings & best wishes to the young couple.""",2022-02-17,Arshiya Chopra,https://www.freepressjournal.in/amp/viral/good-catch-shashi-tharoors-cricket-inspired-wedding-wish-for-thiruvananthapuram-mayor-on-twitter-check?utm_campaign=fullarticle&utm_medium=referral&utm_source=inshorts,https://static.inshorts.com/inshorts/images/v1/variants/jpg/m/2022/02_feb/17_thu/img_1645105879209_298.jpg?,https://inshorts.com/en/news/name-combines-greatest-cricketers-tharoor-on-indias-youngest-mayor-marrying-sachin-dev-1645107263790,Free Press Journal,Thursday
I meant people like Kejriwal who cause disruptions: Channi on 'UP bhaiya' remark,"Punjab CM Charanjit Singh Channi on Thursday reacted to the controversy over his 'UP, Bihar ke bhaiya' remark and said, ""I only meant people like...[Delhi CM] Arvind Kejriwal who come from outside and cause disruptions."" He added, ""Punjab is as much of the people of Uttar Pradesh, Bihar...who come here and work as much as it is ours.""",2022-02-17,Deepika Bhatt,https://twitter.com/ANI/status/1494265517997424640?utm_campaign=fullarticle&utm_medium=referral&utm_source=inshorts,https://static.inshorts.com/inshorts/images/v1/variants/jpg/m/2022/02_feb/17_thu/img_1645096985054_388.jpg?,https://inshorts.com/en/news/i-meant-people-like-kejriwal-who-cause-disruptions-channi-on-up-bhaiya-remark-1645098147579,Twitter,Thursday
Not tenant but shareholder: Manish Tewari on rumoured exit from Cong,"Former Union Minister Manish Tewari addressed rumours that he is quitting Congress, saying that he's not a tenant but a shareholder in the party. ""If anyone wants to push me out, that's a different thing. But as far as I am concerned, I have given 40 years...to this party,"" he said. Earlier, former Law Minister Ashwani Kumar left Congress.",2022-02-17,Shalini Ojha,https://www.financialexpress.com/india-news/manish-tewaris-cryptic-tweet-puts-congress-in-a-fix-says-if-someone-wants-to-push-me-out/2436528/lite/?utm_campaign=fullarticle&utm_medium=referral&utm_source=inshorts,https://static.inshorts.com/inshorts/images/v1/variants/jpg/m/2022/02_feb/17_thu/img_1645107521170_531.jpg?,https://inshorts.com/en/news/not-tenant-but-shareholder-manish-tewari-on-rumoured-exit-from-cong-1645108920915,The Financial Express,Thursday
'Maalik' was clapping: PM criticises Priyanka over Channi's 'bhaiya' remark,"PM Narendra Modi criticised Congress leader Priyanka Gandhi and Punjab CM Charanjit Singh Channi over his 'UP, Bihar ke bhaiya' remark and said, ""Family from Delhi is his 'maalik' (boss), that 'maalik' was standing next to him and clapping."" He added that the country has seen what Channi said. He alleged, ""Congress always pits people of a region against others.""",2022-02-17,Deepika Bhatt,https://www.timesnownews.com/amp/india/article/congress-cms-statement-received-claps-from-member-of-family-in-delhi-pm-modi-on-charanjit-channis-up-bihar-bhaiyas-remark/859634?utm_campaign=fullarticle&utm_medium=referral&utm_source=inshorts,https://static.inshorts.com/inshorts/images/v1/variants/jpg/m/2022/02_feb/17_thu/img_1645098738997_858.jpg?,https://inshorts.com/en/news/maalik-was-clapping-pm-criticises-priyanka-over-channis-bhaiya-remark-1645101040568,Times Now,Thursday
"PM wishes KCR on birthday, 1st interaction after T'gana CM didn't meet him","Prime Minister Narendra Modi on Thursday called Telangana Chief Minister KCR to extend birthday greetings to him. This marked the first interaction between the two leaders after KCR didn't meet or welcome PM Modi in Hyderabad on February 5, when the latter arrived for the inauguration of Saint Ramanujacharya's statue. KCR had cited health reasons for skipping the meeting.",2022-02-17,Shalini Ojha,https://theprint.in/india/president-kovind-pm-modi-call-up-telangana-cm-kcr-to-convey-birthday-greetings/835095/?amp=&utm_campaign=fullarticle&utm_medium=referral&utm_source=inshorts,https://static.inshorts.com/inshorts/images/v1/variants/jpg/m/2022/02_feb/17_thu/img_1645090859592_517.jpg?,https://inshorts.com/en/news/pm-wishes-kcr-on-birthday-1st-interaction-after-tgana-cm-didnt-meet-him-1645093726774,ThePrint,Thursday
K'taka Cong MLAs to protest overnight at Assembly over minister's remark,"Congress MLAs in Karnataka will protest overnight in the Assembly against minister KS Eshwarappa for saying that a saffron flag could be hoisted at Red Fort instead of the tricolour. Former CM and BJP leader BS Yediyurappa said they asked Opposition leaders to withdraw the protest, but they didn't agree. ""We will speak to them tomorrow again,"" he added.",2022-02-17,Shalini Ojha,https://www.thenewsminute.com/article/cong-mlas-protest-overnight-k-taka-assembly-over-eshwarappa-s-saffron-flag-remark-161104?amp=&utm_campaign=fullarticle&utm_medium=referral&utm_source=inshorts,https://static.inshorts.com/inshorts/images/v1/variants/jpg/m/2022/02_feb/17_thu/img_1645117423155_532.jpg?,https://inshorts.com/en/news/ktaka-cong-mlas-to-protest-overnight-at-assembly-over-ministers-remark-1645119953654,The News Minute,Thursday
No farmer will have to pay electricity bill in UP if BJP wins: Shah,"While addressing a public meeting in Uttar Pradesh's Firozabad, Union Home Minister Amit Shah said that no farmer will have to pay electricity bills for the next five years if BJP is given another chance. He also commented on Samajwadi Party chief Akhilesh Yadav and said that his motto is to collect taxes and go on foreign vacations.",2022-02-17,Nakul Ahuja,https://aninews.in/news/national/politics/uttar-pradesh-election-no-farmer-needs-to-pay-electricity-bill-if-bjp-given-another-opportunity-says-amit-shah20220217155441/?utm_campaign=fullarticle&utm_medium=referral&utm_source=inshorts,https://static.inshorts.com/inshorts/images/v1/variants/jpg/m/2022/02_feb/17_thu/img_1645106452536_609.jpg?,https://inshorts.com/en/news/no-farmer-will-have-to-pay-electricity-bill-in-up-if-bjp-wins-shah-1645116761188,ANI News,Thursday
Amarinder removed as Punjab CM for not giving free power to poor: Rahul,"Congress' Rahul Gandhi said on Thursday that the party removed Captain Amarinder Singh as Punjab CM because the latter allegedly refused to provide free electricity to poor people. ""He [Amarinder Singh] said [he has] a contract with...power supplying companies,"" Rahul said. Earlier, Priyanka Gandhi Vadra had said that Singh's government in Punjab was being controlled by BJP from Delhi.",2022-02-17,Disha Jana,https://www.timesnownews.com/amp/india/article/punjab-election-2022-amarinder-removed-as-cm-because-he-refused-to-provide-free-power-to-the-poor-says-rahul-gandhi/859745?utm_campaign=fullarticle&utm_medium=referral&utm_source=inshorts,https://static.inshorts.com/inshorts/images/v1/variants/jpg/m/2022/02_feb/17_thu/img_1645112323481_635.jpg?,https://inshorts.com/en/news/amarinder-removed-as-punjab-cm-for-not-giving-free-power-to-poor-rahul-1645113095814,Times Now,Thursday
"Opp'n agenda like that of Pakistan, to break Punjab: PM Modi","Prime Minister Narendra Modi on Thursday said the Opposition parties' agenda, like Pakistan's, is ""of breaking Punjab"". ""[Opposition] ready to join hands with the separatists for power,"" said PM Modi. He added, ""Double engine government in Punjab means fastest development of the state in this decade...new opportunities for employment, self-employment for the youth of Punjab.""",2022-02-17,Ashley Paul,https://aninews.in/news/national/politics/oppositions-agenda-is-same-as-pakistan-to-break-punjab-pm-modi20220217145438/?utm_campaign=fullarticle&utm_medium=referral&utm_source=inshorts,https://static.inshorts.com/inshorts/images/v1/variants/jpg/m/2022/02_feb/17_thu/img_1645096973510_19.jpg?,https://inshorts.com/en/news/oppn-agenda-like-that-of-pakistan-to-break-punjab-pm-modi-1645098860516,ANI News,Thursday
Cong's infighting made Channi a Commander without an army: Rajnath,"Union Minister and BJP leader Rajnath Singh on Thursday said Punjab CM Charanjit Channi is like a Commander without an army while referring to ""infighting within the Congress party"". ""Congress wants to gain power by dividing the society,"" Rajnath said while adding, ""There is a wind of change in Punjab. People will not tolerate loot-tantra in the name of lok-tantra.""",2022-02-17,Ashley Paul,https://aninews.in/news/national/politics/punjab-polls-channi-is-like-a-commander-without-an-army-says-rajnath-singh20220217153543/?utm_campaign=fullarticle&utm_medium=referral&utm_source=inshorts,https://static.inshorts.com/inshorts/images/v1/variants/jpg/m/2022/02_feb/17_thu/img_1645101244120_257.jpg?,https://inshorts.com/en/news/congs-infighting-made-channi-a-commander-without-an-army-rajnath-1645106317487,ANI,Thursday
PM came to Pathankot but couldn't meet protesting farmers: Priyanka,"Congress leader Priyanka Gandhi Vadra on Thursday said Prime Minister Narendra Modi ""came to Pathankot yesterday for polls but he couldn't travel 5-6 kilometres from his residence to meet farmers"" protesting near Delhi's borders. ""Instead, son of his minister mowed down six farmers with his vehicle,"" Gandhi added while referring to the Lakhimpur Kheri incident.",2022-02-17,Ashley Paul,https://twitter.com/ANI/status/1494235208077705216?s=19&t=jdu-P-Pas-ImLsHd4e16EA&utm_campaign=fullarticle&utm_medium=referral&utm_source=inshorts,https://static.inshorts.com/inshorts/images/v1/variants/jpg/m/2022/02_feb/17_thu/img_1645090311957_655.jpg?,https://inshorts.com/en/news/pm-came-to-pathankot-but-couldnt-meet-protesting-farmers-priyanka-1645093486603,Twitter,Thursday
BJP transformed Manipur from blockades to development: BJP chief,"Speaking ahead of the Manipur Assembly elections, BJP National President JP Nadda on Thursday said that the party has transformed the state from blockades to the path of development. He further said, ""The agricultural budget in Manipur has been increased two times in five years under the Biren Singh government. We will take Manipur to newer heights.""",2022-02-17,Nakul Ahuja,https://aninews.in/news/national/general-news/bjp-has-transformed-manipur-from-blockades-to-development-says-jp-nadda20220217200002/?utm_campaign=fullarticle&utm_medium=referral&utm_source=inshorts,https://static.inshorts.com/inshorts/images/v1/variants/jpg/m/2022/02_feb/17_thu/img_1645113678836_881.jpg?,https://inshorts.com/en/news/bjp-transformed-manipur-from-blockades-to-development-bjp-chief-1645117043529,ANI News,Thursday
Cong should apologise: Bihar minister on Punjab CM's 'bhaiye' remark,"Criticising Punjab CM Charanjit Singh Channi, Bihar minister Sanjay Kumar Jha said, ""It is abhorring to see the way...Channi has denigrated and mocked the hardworking people of Bihar and UP."" ""We strongly condemn this and ask apology from...Congress,'' he added. Addressing a rally, Channi had said that he will not let ""Uttar Pradesh, Bihar, Delhi de bhaiye"" enter poll-bound Punjab.",2022-02-17,Subhangi Singh,https://www.hindustantimes.com/cities/patna-news/bihar-leaders-condemn-punjab-chief-minister-charanjit-singh-channi-s-bhaiye-comment-101645071622505-amp.html?utm_campaign=fullarticle&utm_medium=referral&utm_source=inshorts,https://static.inshorts.com/inshorts/images/v1/variants/jpg/m/2022/02_feb/17_thu/img_1645085723095_768.jpg?,https://inshorts.com/en/news/cong-should-apologise-bihar-minister-on-punjab-cms-bhaiye-remark-1645094945251,Hindustan Times,Thursday
"SP would be engaged in goonism, dacoity if voted to power: CM Yogi","Uttar Pradesh Chief Minister Yogi Adityanath on Thursday said Samajwadi Party ""can never think of public welfare"" and they ""would be engaged in goonism, dacoity and goonda tax"" if voted to power. ""These Tamanchawadis (people carrying guns) who regard themselves as Samajwadis have a Parivarwadi (family-oriented) thinking,"" CM Adityanath said at a public rally in Jhansi.",2022-02-17,Ashley Paul,https://twitter.com/ANINewsUP/status/1494239829445337089?s=19&t=ZuPG-QEyvFkzKBjTy3FJlQ&utm_campaign=fullarticle&utm_medium=referral&utm_source=inshorts,https://static.inshorts.com/inshorts/images/v1/variants/jpg/m/2022/02_feb/17_thu/img_1645091778340_293.jpg?,https://inshorts.com/en/news/sp-would-be-engaged-in-goonism-dacoity-if-voted-to-power-cm-yogi-1645095147515,Twitter,Thursday
Why should people in UP elect Cong: Malviya on Channi's 'bhaiya' remark,"BJP leader Amit Malviya on Thursday reacted to Punjab CM Charanjit Singh Channi's ""don't let UP, Bihar ke bhaiya enter Punjab"" comment calling it an ""objectionable"" remark. ""On what basis does Congress think that people in UP should support and vote for them?” Malviya said. Channi had made the remark during Congress' roadshow in poll-bound Punjab's Rupnagar.",2022-02-17,Disha Jana,https://theprint.in/india/why-should-people-in-up-vote-for-congress-asks-amit-malviya-on-channis-remarks/835228/?amp=&utm_campaign=fullarticle&utm_medium=referral&utm_source=inshorts,https://static.inshorts.com/inshorts/images/v1/variants/jpg/m/2022/02_feb/17_thu/img_1645102149740_206.jpg?,https://inshorts.com/en/news/why-should-people-in-up-elect-cong-malviya-on-channis-bhaiya-remark-1645103342219,ThePrint,Thursday
"Sant Ravidas born in UP, Guru Gobind in Bihar: PM on Punjab CM’s remark","Two days after Punjab CM Charanjit Singh Channi's 'UP-Bihar de bhaiye' remark sparked a controversy, PM Narendra Modi invoked Sant Ravidas and Guru Gobind Singh to criticise it. He said Sant Ravidas was born in UP's Varanasi and Guru Gobind Singh in Bihar's Patna Sahib. ""Will you turn away Sant Ravidas and insult Guru Gobind Singh too?"" asked Modi.",2022-02-17,Saurabh Sinha,https://twitter.com/ANI/status/1494222183601930242?utm_campaign=fullarticle&utm_medium=referral&utm_source=inshorts,https://static.inshorts.com/inshorts/images/v1/variants/jpg/m/2022/02_feb/17_thu/img_1645093086747_103.jpg?,https://inshorts.com/en/news/sant-ravidas-born-in-up-guru-gobind-in-bihar-pm-on-punjab-cms-remark-1645097278422,ANI Twitter,Thursday
Insurance cover of up to ₹5 lakh for fishermen: BJP in poll-bound Manipur,"BJP chief JP Nadda and Manipur CM N Biren Singh on Thursday released the party's manifesto for the upcoming state Assembly elections. In the manifesto, BJP promised that free of cost accidental insurance of up to ₹5,00,000 will be provided to all fishermen in Manipur. Besides, it promised to increase the monthly pension of senior citizens from ₹200 to ₹1,000.",2022-02-17,Dharini Mudgal,https://aninews.in/news/national/general-news/bjp-manifesto-for-manipur-elections-promises-free-scooty-laptop-aiims-two-lpg-cylinders20220217163219/?utm_campaign=fullarticle&utm_medium=referral&utm_source=inshorts,https://static.inshorts.com/inshorts/images/v1/variants/jpg/m/2022/02_feb/17_thu/img_1645100238093_386.jpg?,https://inshorts.com/en/news/insurance-cover-of-up-to-₹5-lakh-for-fishermen-bjp-in-pollbound-manipur-1645104022417,ANI News,Thursday
Propaganda against honest Kejriwal: Chadha on 'Khalistan PM' remark,"Aam Aadmi Party's (AAP) Raghav Chadha said on Thursday that former party leader Kumar Vishwas' allegations against party chief Arvind Kejriwal are ""propaganda"". ""People of Punjab know that...dishonest forces...want to conspire to stop an honest...Kejriwal,"" he said. Vishwas alleged that Kejriwal had told him that he will either become CM (of Punjab) or first PM of independent nation (Khalistan).",2022-02-17,Disha Jana,https://twitter.com/ANI/status/1494248864450514949?utm_campaign=fullarticle&utm_medium=referral&utm_source=inshorts,https://static.inshorts.com/inshorts/images/v1/variants/jpg/m/2022/02_feb/17_thu/img_1645103409287_212.jpg?,https://inshorts.com/en/news/propaganda-against-honest-kejriwal-chadha-on-khalistan-pm-remark-1645104565917,Twitter,Thursday
Congress violated flag code in Assembly: Karnataka CM Bommai,"Accusing Congress of violating flag code in Karnataka Assembly, CM Basavaraj Bommai said that the party failed to act as a responsible Opposition. Bommai said this after Congress MLAs protested in Assembly holding national flag, demanding the resignation of state Minister KS Eshwarappa. Congress was protesting against  Eshwarappa's ''saffron flag may become the national flag in future'' remark.",2022-02-17,Subhangi Singh,https://www.freepressjournal.in/amp/india/congress-violated-flag-code-in-assembly-says-karnataka-cm-basavaraj-bommai?utm_campaign=fullarticle&utm_medium=referral&utm_source=inshorts,https://static.inshorts.com/inshorts/images/v1/variants/jpg/m/2022/02_feb/17_thu/img_1645088792177_919.jpg?,https://inshorts.com/en/news/congress-violated-flag-code-in-assembly-karnataka-cm-bommai-1645092281131,Free Press Journal,Thursday
BJP responsible for hijab controversy in K'taka: Asaduddin Owaisi,"All India Majlis-e-Ittehadul Muslimeen (AIMIM) chief Asaduddin Owaisi on Thursday said the BJP is responsible for the hijab controversy in Karnataka. ""The BJP has its government in Karnataka. They have raised this issue,"" he added. ""Give them (women) the rights which have been given to every citizen in the constitution,"" Owaisi said.",2022-02-17,Deepika Bhatt,https://news.abplive.com/elections/exclusive-bjp-created-the-issue-aimim-chief-owaisi-on-hijab-row-ahead-of-assembly-polls-2022-1513612/amp?utm_campaign=fullarticle&utm_medium=referral&utm_source=inshorts,https://static.inshorts.com/inshorts/images/v1/variants/jpg/m/2022/02_feb/17_thu/img_1645093726210_273.jpg?,https://inshorts.com/en/news/bjp-responsible-for-hijab-controversy-in-ktaka-asaduddin-owaisi-1645097934204,ABP,Thursday
"No PM, CM from Gandhi family since Rajiv: Kharge on 'parivarwad'","Congress leader Mallikarjun Kharge said on Thursday that there is no 'parivarwad' (dynasty politics) in Congress as no member of the Gandhi family has been a Prime Minister or Chief Minister since Rajiv Gandhi. ""Congress has always fought elections on ideology,” Kharge said. ""BJP supports dynasty politics and then levels allegations against us,” he added.",2022-02-17,Disha Jana,https://aninews.in/news/national/politics/no-parivarwad-in-congress-no-pm-cm-from-gandhi-family-since-rajiv-gandhi-kharge20220217185248/?utm_campaign=fullarticle&utm_medium=referral&utm_source=inshorts,https://static.inshorts.com/inshorts/images/v1/variants/jpg/m/2022/02_feb/17_thu/img_1645116340147_977.jpg?,https://inshorts.com/en/news/no-pm-cm-from-gandhi-family-since-rajiv-kharge-on-parivarwad-1645118040985,ANI News,Thursday
Didn't expect from you: FM as Manmohan criticises govt's economic policy,"Union Finance Minister Nirmala Sitharaman on Thursday reacted to former PM Manmohan Singh's comments about the government's handling of the economy. ""I have great regards for you (Singh). I did not expect this from you,"" Sitharaman said. She added that Singh was more remembered for having brought India to ""fragile five"" and rampant inflation during his tenure.",2022-02-17,Deepika Bhatt,http://www.ptinews.com/news/13136755_Did-not-expect-this-from-Manmohan-Singh--Sitharaman.html?utm_campaign=fullarticle&utm_medium=referral&utm_source=inshorts,https://static.inshorts.com/inshorts/images/v1/variants/jpg/m/2022/02_feb/17_thu/img_1645114167277_953.jpg?,https://inshorts.com/en/news/didnt-expect-from-you-fm-as-manmohan-criticises-govts-economic-policy-1645116192206,PTI,Thursday
PM should apologise on Shiv Jayanti for insulting Maha: Patole,"Maharashtra Congress president Nana Patole on Thursday sought PM Narendra Modi's apology on Shiv Jayanti for ""insulting"" the state with his remarks on the 2020 migrant crisis. He added that Congress will initiate a new phase of agitation, through which Congress workers will send letters to the PM, asking him to apologise and ""seek forgiveness from the public"".",2022-02-17,Nakul Ahuja,http://www.ptinews.com/news/13137017_Apologise-on-Shiv-Jayanti-for-Maha-remarks--Patole-to-PM.html?utm_campaign=fullarticle&utm_medium=referral&utm_source=inshorts,https://static.inshorts.com/inshorts/images/v1/variants/jpg/m/2022/02_feb/17_thu/img_1645117459921_270.jpg?,https://inshorts.com/en/news/pm-should-apologise-on-shiv-jayanti-for-insulting-maha-patole-1645119776336,Press Trust of India,Thursday
"China sitting at our border, efforts being made to suppress it: Manmohan Singh","Former PM and Congress leader Manmohan Singh said China is sitting at our border and efforts are being made to suppress it. ""They (BJP-led government) have no understanding of economic policy...This government has also failed on foreign policy. China is sitting at our border and efforts are being made to suppress it,"" Singh added.",2022-02-17,Sakshi Sharma,https://www.hindustantimes.com/india-news/china-still-sitting-at-our-borders-bjp-led-govt-failed-manmohan-singh-101645084791102-amp.html?utm_campaign=fullarticle&utm_medium=referral&utm_source=inshorts,https://static.inshorts.com/inshorts/images/v1/variants/jpg/m/2022/02_feb/17_thu/img_1645089251868_728.jpg?,https://inshorts.com/en/news/china-sitting-at-our-border-efforts-being-made-to-suppress-it-manmohan-singh-1645092579303,Hindustan Times,Thursday
"Woman shares pic of Swara in short dress, questions her for advocating hijab; she replies","Actress Swara Bhasker took to Twitter to respond after Keya Ghosh, Vice President of BJP Mahila Morcha in West Bengal, shared a picture of Swara in a short dress. ""That's Swara...my friends, who is advocating for hijab,"" Keya wrote. Swara replied, ""I advocate women's right to choose their clothing...you know 'choice'...Leave it. You slut-shame others and fail in that too.""",2022-02-16,Anmol Sharma,https://twitter.com/ReallySwara/status/1493887828958138368?utm_campaign=fullarticle&utm_medium=referral&utm_source=inshorts,https://static.inshorts.com/inshorts/images/v1/variants/jpg/m/2022/02_feb/16_wed/img_1645010375153_869.jpg?,https://inshorts.com/en/news/woman-shares-pic-of-swara-in-short-dress-questions-her-for-advocating-hijab-she-replies-1645010813745,Twitter,Wednesday
Ban on religious attire only in colleges having uniforms: K'taka CM,"Karnataka CM Basavaraj S Bommai said on Wednesday in the state Assembly that the ban on wearing religious attire is not applicable in all colleges. ""HC has said only colleges where uniforms are prescribed, a ban will apply,"" Bommai explained. He made the remark after Congress' Siddaramaiah raised the issue of Muslim students wearing hijab not being allowed inside classes.",2022-02-16,Shalini Ojha,None,https://static.inshorts.com/inshorts/images/v1/variants/jpg/m/2022/02_feb/16_wed/img_1645006362305_984.jpg?,https://inshorts.com/en/news/ban-on-religious-attire-only-in-colleges-having-uniforms-ktaka-cm-1645008025957,Inshorts,Wednesday
