headlines,text,date,author,read_more,image_url,inshorts_url,original_source,day
Pune activists allege discrepancies in poll papers of Maha CM,"Two Pune-based activists have moved a court to register an offence against Maharashtra Chief Minister Eknath Shinde, alleging discrepancies in his affidavits filed for legislative assembly polls in the past. The discrepancies pertain to the declaration of movable and immovable assets of Shinde, according to the activists. Shinde is a four-time legislator from Kopri Pachpakhadi constituency.",2022-07-15,Indraneel Sen,None,https://static.inshorts.com/inshorts/images/v1/variants/jpg/m/2022/07_jul/15_fri/img_1657893874958_167.jpg?,https://inshorts.com/en/news/pune-activists-allege-discrepancies-in-poll-papers-of-maha-cm-1657899996466,Inshorts,Friday
My govt committed to all-round development of Maha: CM Shinde,"Maharashtra CM Eknath Shinde on Wednesday said he was a ""sevak"" and his government was committed to the all-round development of the state and the welfare of its citizens. Shinde said that the decisions for the people should have been taken two and a half years back, but since that did not happen, 50 MLAs had to take a stand.",2022-07-14,Nakul Ahuja,https://theprint.in/india/i-am-a-sevak-my-govt-committed-to-all-round-development-of-maharashtra-cm-eknath-shinde/1037319/?amp=&utm_campaign=fullarticle&utm_medium=referral&utm_source=inshorts,https://static.inshorts.com/inshorts/images/v1/variants/jpg/m/2022/07_jul/14_thu/img_1657790939811_290.jpg?,https://inshorts.com/en/news/my-govt-committed-to-allround-development-of-maha-cm-shinde-1657797088298,The Print,Thursday
"Not Chinese people, some Chinese hardliners consider me separatist: Dalai Lama","The Dalai Lama on Thursday said not Chinese people but some Chinese ""hardliners"" consider him a separatist. ""Now, more and more Chinese are realising that Dalai Lama is not seeking independence but within China meaningful autonomy and to preserve Tibetan Buddhist culture,"" he said in Jammu. He will make his first trip to Leh in about four years on Friday.",2022-07-14,Sakshi Sharma,https://twitter.com/ANI/status/1547514363233579009?s=20&t=wqCxw8W3T40A6CZ_1z1BEQ&utm_campaign=fullarticle&utm_medium=referral&utm_source=inshorts,https://static.inshorts.com/inshorts/images/v1/variants/jpg/m/2022/07_jul/14_thu/img_1657793489562_865.jpg?,https://inshorts.com/en/news/not-chinese-people-some-chinese-hardliners-consider-me-separatist-dalai-lama-1657799149296,ANI,Thursday
Siddaramaiah demands narco test on PSI scam accused ADGP Paul,"Congress leader Siddaramaiah on Friday demanded a narco test on ADGP Amrit Paul who was arrested in connection with the 2021 Karnataka police sub-inspector (PSI) recruitment scam. ""If Amrit Paul...is subjected to...narco test, then it will be clear who all...politicians are involved,"" Siddaramaiah said. ""There should be no attempt to cover up this case,"" he added.",2022-07-15,Shiwangi,https://www.hindustantimes.com/cities/bengaluru-news/psi-scam-siddaramaiah-demands-narco-test-of-arrested-adgp-paul-101657871568245-amp.html?utm_campaign=fullarticle&utm_medium=referral&utm_source=inshorts,https://static.inshorts.com/inshorts/images/v1/variants/jpg/m/2022/07_jul/15_fri/img_1657876569660_584.jpg?,https://inshorts.com/en/news/siddaramaiah-demands-narco-test-on-psi-scam-accused-adgp-paul-1657880958995,Hindustan Times,Friday
Odisha BJP MLAs protest against Cong leader's remarks on Murmu,"Odisha BJP MLAs held a protest inside the state Legislative Assembly on Thursday against Congress leader Ajoy Kumar's remarks on NDA's Presidential candidate Droupadi Murmu. The BJP also took out a protest rally in Bhubaneswar condemning Ajoy Kumar's statement. Congress leader Ajoy Kumar on Wednesday alleged that Droupadi Murmu represents a ""very evil philosophy of India"".",2022-07-14,Apoorva Shankar,https://www.aninews.in/news/national/politics/odisha-bjp-mlas-hold-protest-against-cong-leader-ajoy-kumars-remarks-on-droupadi-murmu20220714173748/?utm_campaign=fullarticle&utm_medium=referral&utm_source=inshorts,https://static.inshorts.com/inshorts/images/v1/variants/jpg/m/2022/07_jul/14_thu/img_1657807331170_775.jpg?,https://inshorts.com/en/news/odisha-bjp-mlas-protest-against-cong-leaders-remarks-on-murmu-1657816446189,ANI News,Thursday
"We'll break records, everyone will vote for Murmu: Maha CM Shinde","Maharashtra CM Eknath Shinde claimed on Thursday that in the upcoming Presidential polls, all records will be broken as everyone will vote for NDA's candidate, Droupadi Murmu, under PM Narendra Modi's guidance. ""Murmu is a tribal woman. We work for tribals and we support tribal people,"" he said. Murmu had met Shinde and other leaders the same day.",2022-07-15,Medhaa Gupta,https://www.timesnownews.com/india/maharashtra-cm-well-break-all-records-and-everyone-will-vote-for-droupadi-murmu-article-92887550/amp?utm_campaign=fullarticle&utm_medium=referral&utm_source=inshorts,https://static.inshorts.com/inshorts/images/v1/variants/jpg/m/2022/07_jul/15_fri/img_1657857171203_869.jpg?,https://inshorts.com/en/news/well-break-records-everyone-will-vote-for-murmu-maha-cm-shinde-1657859512921,Times Now,Friday
Attacks on Shiv Sena workers will not be tolerated: Uddhav Thackeray,"Shiv Sena chief and former Maharashtra Chief Minister Uddhav Thackeray on Friday said that attacks on party workers would not be tolerated. ""If police cannot bring the culprits to book, Sena workers will do it,"" Uddhav Thackeray said. His comment comes after he met Shiv Sena worker Baban Gaonkar who was attacked by unidentified persons on Thursday night.",2022-07-15,Apoorva Shankar,None,https://static.inshorts.com/inshorts/images/v1/variants/jpg/m/2022/07_jul/15_fri/img_1657887629224_590.jpg?,https://inshorts.com/en/news/attacks-on-shiv-sena-workers-will-not-be-tolerated-uddhav-thackeray-1657892138314,Inshorts,Friday
"BJP running 'Operation Kamal' in Prez polls, bribing people: Sinha","Ahead of Presidential elections, opposition parties’ Presidential candidate Yashwant Sinha has accused the BJP of carrying out 'Operation Kamal' by engaging in horse-trading. Sinha, who has sought a probe into the matter, alleged that the party is offering a ""huge sum of money to non-BJP MLAs"" to back NDA's candidate in polls. Presidential elections will be held on July 18.",2022-07-14,Disha Jana,https://theprint.in/india/bjp-running-operation-kamal-even-in-presidential-polls-money-power-at-play-alleges-yashwant-sinha/1038876/?amp=&utm_campaign=fullarticle&utm_medium=referral&utm_source=inshorts,https://static.inshorts.com/inshorts/images/v1/variants/jpg/m/2022/07_jul/14_thu/img_1657812435455_890.jpg?,https://inshorts.com/en/news/bjp-running-operation-kamal-in-prez-polls-bribing-people-sinha-1657813677737,The Print,Thursday
No concept of 'super CM' in present govt: Maha Dy CM Fadnavis,"Maharashtra Deputy CM Devendra Fadnavis on Friday said that there was no concept of ""super CM"" in the present Eknath Shinde-led government. ""We have only one chief minister and that is Eknath Shinde. We are working under his leadership,"" Fadnavis said. His comment comes after some opposition leaders claimed that though Shinde is the CM, Fadnavis was taking the decisions.",2022-07-15,Apoorva Shankar,http://www.ptinews.com/news/13532933_No--super-CM--in-Maharashtra--says-Fadnavis.html?utm_campaign=fullarticle&utm_medium=referral&utm_source=inshorts,https://static.inshorts.com/inshorts/images/v1/variants/jpg/m/2022/07_jul/15_fri/img_1657900783885_996.jpg?,https://inshorts.com/en/news/no-concept-of-super-cm-in-present-govt-maha-dy-cm-fadnavis-1657904759916,PTI,Friday
"IT Department raids Cong MLA Sanjay Sharma's bungalow, sugar mill","The Income Tax Department is conducting search operations at premises linked to Sanjay Sharma, a Congress MLA from Tendukheda. The MLA is reportedly a liquor and sand baron in Madhya Pradesh. The search action covered 44 premises including Sharma's bungalow in Jabalpur and a sugar mill in Narsinghpur. As per reports, documents related to income tax evasion have been seized.",2022-07-14,Nidhi Sinha,https://aninews.in/news/national/general-news/it-dept-raids-cong-mla-sanjay-sharmas-premises20220714173253/?utm_campaign=fullarticle&utm_medium=referral&utm_source=inshorts,https://static.inshorts.com/inshorts/images/v1/variants/jpg/m/2022/07_jul/14_thu/img_1657814087379_665.jpg?,https://inshorts.com/en/news/it-department-raids-cong-mla-sanjay-sharmas-bungalow-sugar-mill-1657814920457,ANI,Thursday
Murmu will get more votes than expected in Prez polls: Goa CM,"Goa CM Pramod Sawant on Thursday said NDA's Presidential candidate Droupadi Murmu will get more votes than expected as BJP has 'numbers' in the state. ""Apart from 25 MLAs, we have appealed to other MLAs too to vote for her,"" Sawant said. Murmu on Thursday arrived in Goa and sought support from MPs and MLAs for the upcoming Presidential elections.",2022-07-14,Apoorva Shankar,https://www.siasat.com/presidential-poll-draupadi-murmu-will-get-more-votes-than-expected-says-goa-cm-2369407/?utm_campaign=fullarticle&utm_medium=referral&utm_source=inshorts,https://static.inshorts.com/inshorts/images/v1/variants/jpg/m/2022/07_jul/14_thu/img_1657808919539_962.jpg?,https://inshorts.com/en/news/murmu-will-get-more-votes-than-expected-in-prez-polls-goa-cm-1657816669805,The Siasat Daily,Thursday
"There's misgovernance, corruption in Mumbai civic body: Deora","Congress leader Milind Deora said there is ""misgovernance and corruption"" in Brihanmumbai Municipal Corporation and that the municipality's recent delimitation was done to benefit the Shiv Sena. The BMC elections are scheduled for later this year and Deora said the Congress should be ready to take on Shiv Sena. Last year, the number of BMC seats increased to 236.",2022-07-15,Indraneel Sen,https://www.mid-day.com/amp/mumbai/mumbai-news/article/bmc-elections-2022-mumbai-we-know-there-is-misgovernance-and-corruption-in-bmc-says-maharashtra-congress-milind-deora-23236061?utm_campaign=fullarticle&utm_medium=referral&utm_source=inshorts,https://static.inshorts.com/inshorts/images/v1/variants/jpg/m/2022/07_jul/15_fri/img_1657883882336_87.jpg?,https://inshorts.com/en/news/theres-misgovernance-corruption-in-mumbai-civic-body-deora-1657890565632,Mid-day,Friday
SP-ally OP Rajbhar's party to support NDA's Prez candidate Droupadi Murmu,"Om Prakash Rajbhar's Suheldev Bhartiya Samaj Party (SBSP), an ally of the Akhilesh Yadav-led Samajwadi Party (SP), announced on Friday that it will be supporting NDA candidate Droupadi Murmu in the Presidential elections. ""The decision was taken after discussions with party leaders and office bearers,"" Rajbhar said. Notably, Akhilesh Yadav is supporting Yashwant Sinha for Presidential polls.",2022-07-15,Shiwangi,None,https://static.inshorts.com/inshorts/images/v1/variants/jpg/m/2022/07_jul/15_fri/img_1657866358693_23.jpg?,https://inshorts.com/en/news/spally-op-rajbhars-party-to-support-ndas-prez-candidate-droupadi-murmu-1657869131232,Inshorts,Friday
New dictionary for new India: Rahul on 'unparliamentary' words list,"Congress’ Rahul Gandhi reacted to list of words that are banned in Parliament. ""New dictionary for new India,"" Rahul tweeted. ""Unparliamentary: Words used in discussions and debates which correctly describe PM’s handling of government, now banned from being spoken,"" the image Gandhi tweeted, read. ""Example...'Jumlajeevi tanashah shed crocodile tears when his lies...were exposed',"" he added.",2022-07-14,Sakshi Sharma,https://www.hindustantimes.com/india-news/in-rahul-gandhi-s-new-dictionary-jibe-tanashah-shed-crocodile-tears-101657788008930-amp.html?utm_campaign=fullarticle&utm_medium=referral&utm_source=inshorts,https://static.inshorts.com/inshorts/images/v1/variants/jpg/m/2022/07_jul/14_thu/img_1657791932617_208.jpg?,https://inshorts.com/en/news/new-dictionary-for-new-india-rahul-on-unparliamentary-words-list-1657797992395,Hindustan Times,Thursday
Complete dictatorship: O Panneerselvam after AIADMK expels OP Ravindhranath,"Former Tamil Nadu CM O Panneerselvam has termed AIADMK's decision of expelling his son and Theni Lok Sabha MP OP Ravindhranath ""complete dictatorship"". ""In...last General Election 2019, OP Ravindhranath won and that is the only seat where AIADMK won. Removing [him] is a complete dictatorship,"" said O Panneerselvam. His other son, VP Jayapradeep, was also expelled from AIADMK on Thursday.",2022-07-15,Shiwangi,https://aninews.in/news/national/general-news/complete-dictatorship-o-panneerselvam-on-aiadmk-expelling-op-ravindranath20220715042013/?utm_campaign=fullarticle&utm_medium=referral&utm_source=inshorts,https://static.inshorts.com/inshorts/images/v1/variants/jpg/m/2022/07_jul/15_fri/img_1657858615150_672.jpg?,https://inshorts.com/en/news/complete-dictatorship-o-panneerselvam-after-aiadmk-expels-op-ravindhranath-1657862946445,ANI News,Friday
Guru Granth Sahib insulted at Punjab CM Mann's marriage ceremony: SGPC,"The Shiromani Gurdwara Parbandhak Committee (SGPC) has claimed that the vehicle carrying holy book Guru Granth Sahib was stopped for inspection at Punjab CM Bhagwant Mann's wedding ceremony. The committee called the act an ""insult to the honour of the Guru"". ""It was even more hurtful that this incident took place at [CM's] residence,"" SGPC chief Harjinder Singh Dhami said.",2022-07-14,Nidhi Sinha,https://www.timesnownews.com/india/guru-granth-sahib-insulted-at-marriage-ceremony-of-punjab-cm-bhagwant-mann-sgpc-article-92881389/amp?utm_campaign=fullarticle&utm_medium=referral&utm_source=inshorts,https://static.inshorts.com/inshorts/images/v1/variants/jpg/m/2022/07_jul/14_thu/img_1657820599306_818.jpg?,https://inshorts.com/en/news/guru-granth-sahib-insulted-at-punjab-cm-manns-marriage-ceremony-sgpc-1657820971092,Times Now,Thursday
Centre upgrades security of Kumar Vishwas to Y+ category,"The Ministry of Home Affairs has upgraded the security of former Aam Aadmi Party leader Kumar Vishwas from Y to Y+ category, ANI reported. The decision is based on a threat assessment report by Intelligence Bureau. In February, the Centre had granted Y security cover to Vishwas after he accused Delhi CM Arvind Kejriwal of having links with separatist outfits.",2022-07-14,Nidhi Sinha,https://www.timesnownews.com/india/centre-upgrades-kumar-vishwas-security-from-y-category-to-y-article-92876331/amp?utm_campaign=fullarticle&utm_medium=referral&utm_source=inshorts,https://static.inshorts.com/inshorts/images/v1/variants/jpg/m/2022/07_jul/14_thu/img_1657802014017_338.jpg?,https://inshorts.com/en/news/centre-upgrades-security-of-kumar-vishwas-to-y+-category-1657803062483,Times Now,Thursday
Union minister unaware of ground realities on MGNREGA in Bengal: BJP,West Bengal's BJP unit claimed Union Minister Kapil Moreshwar Patil is unaware of the ground reality related to MGNREGA in the state. BJP national vice-president Dilip Ghosh alleged that officers have submitted misleading reports to Patil. This comes after Patil claimed that he doesn't know of any corruption in implementation of the scheme at the panchayat level in West Bengal.,2022-07-15,Shiwangi,None,https://static.inshorts.com/inshorts/images/v1/variants/jpg/m/2022/07_jul/15_fri/img_1657873578695_711.jpg?,https://inshorts.com/en/news/union-minister-unaware-of-ground-realities-on-mgnrega-in-bengal-bjp-1657878424320,Inshorts,Friday
List of words banned in Parliament released,"Lok Sabha Secretariat has released a list of words that will be considered unparliamentary, which includes 'corrupt', 'lie', 'jumlajeevi', 'nikamma', 'hypocrisy' and 'incompetent'. Words like 'anarchist' and 'dictatorial' will also be expunged if used during debates. The list, however, said that some of the words may not appear unparliamentary unless read in conjunction with other expressions.",2022-07-14,Apaar Sharma,https://www.news18.com/amp/news/politics/words-like-ashamed-abused-betrayed-corrupt-to-be-unparliamentary-in-ls-rs-5549545.html?utm_campaign=fullarticle&utm_medium=referral&utm_source=inshorts,https://static.inshorts.com/inshorts/images/v1/variants/jpg/m/2022/07_jul/14_thu/img_1657776751578_825.jpg?,https://inshorts.com/en/news/list-of-words-banned-in-parliament-released-1657779638578,News18,Thursday
Bolein toh bolein kya?: Opposition on list of words banned in Parliament,"Reacting to a list of words that are banned in the Parliament, Shiv Sena's Priyanka Chaturvedi tweeted, ""Reminded of this meme. Agar karein toh karein kya, bolein toh bolein kya?"" TMC's Mahua Moitra tweeted, ""Is 'Truth' unparliamentary?"" Congress leader Jairam Ramesh said, ""All words used by the Opposition to describe the reality of Modi Sarkar now to be considered 'unparliamentary'.""",2022-07-14,Apaar Sharma,None,https://static.inshorts.com/inshorts/images/v1/variants/jpg/m/2022/07_jul/14_thu/img_1657779254344_876.jpg?,https://inshorts.com/en/news/bolein-toh-bolein-kya-opposition-on-list-of-words-banned-in-parliament-1657779858454,Inshorts,Thursday
Next we'll be asked to wear saffron dress: Adhir on 'unparliamentary' words list,"Reacting to the new list of unparliamentary words released by Lok Sabha Secretariat, Congress leader Adhir Ranjan Chowdhury said that Centre is making a ""second republic"" by bringing such rules. ""At present, they (Centre) are saying that certain words can't be used inside Parliament, tomorrow they'll ask to enter premises in a saffron dress,"" the Congress leader said.",2022-07-14,Subhangi Singh,https://twitter.com/ANI/status/1547473342999183360?utm_campaign=fullarticle&utm_medium=referral&utm_source=inshorts,https://static.inshorts.com/inshorts/images/v1/variants/jpg/m/2022/07_jul/14_thu/img_1657784010430_402.jpg?,https://inshorts.com/en/news/next-well-be-asked-to-wear-saffron-dress-adhir-on-unparliamentary-words-list-1657786861770,ANI News,Thursday
Context is important in what you speak in Parliament: Owaisi on list of words banned,"Reacting to a list of words that are now banned in the Parliament, AIMIM chief Asaduddin Owaisi said context is important in what you speak in the Parliament. ""You cannot just term words unparliamentary,"" he added. Lok Sabha Secretariat has released a list of words that will be considered unparliamentary which includes 'corrupt', 'jumlajeevi' and 'lie' among other words.",2022-07-14,Sakshi Sharma,https://twitter.com/ANI/status/1547484249288491008?s=20&t=oTv1IT9pdbTiiqsN9Zy67g&utm_campaign=fullarticle&utm_medium=referral&utm_source=inshorts,https://static.inshorts.com/inshorts/images/v1/variants/jpg/m/2022/07_jul/14_thu/img_1657790696197_289.jpg?,https://inshorts.com/en/news/context-is-important-in-what-you-speak-in-parliament-owaisi-on-list-of-words-banned-1657795688552,ANI,Thursday
What BJP did to tribal rights activist Father Stan Swamy isn’t secret: Ajoy Kumar,"Congress’ Ajoy Kumar said BJP is now thinking about Adivasis but what it did to tribal rights activist Father Stan Swamy is not a secret. ""The whole country knows BJP's Dalit and anti-tribal policies,"" he tweeted. Earlier, Kumar said NDA’s Presidential candidate Droupadi Murmu represents a ""very evil philosophy of India"" and should not be made a ""symbol of Adivasi"".",2022-07-14,Sakshi Sharma,https://www.hindustantimes.com/india-news/what-about-stan-swamy-congress-leader-to-amit-malviya-on-droupadi-murmu-comment-row-101657765764963-amp.html?utm_campaign=fullarticle&utm_medium=referral&utm_source=inshorts,https://static.inshorts.com/inshorts/images/v1/variants/jpg/m/2022/07_jul/14_thu/img_1657772885530_554.jpg?,https://inshorts.com/en/news/what-bjp-did-to-tribal-rights-activist-father-stan-swamy-isnt-secret-ajoy-kumar-1657779274891,Hindustan Times,Thursday
FM has called planets to rescue the economy: P Chidambaram,"Congress leader P Chidambaram said, ""We're not surprised that Finance Minister tweeted pictures of Jupiter, Pluto and Uranus on the day when inflation printed at 7.01% and unemployment printed at 7.8%,"" he tweeted. ""To begin with, she should appoint new CEA: Chief Economic Astrologer,"" he added. ""The FM has called the planets to...rescue of the economy,"" he further added.",2022-07-14,Sakshi Sharma,None,https://static.inshorts.com/inshorts/images/v1/variants/jpg/m/2022/07_jul/14_thu/img_1657780210553_631.jpg?,https://inshorts.com/en/news/fm-has-called-planets-to-rescue-the-economy-p-chidambaram-1657787065111,Inshorts,Thursday
Won't support any law that mandates 2 children: Owaisi,"AIMIM chief Asaduddin Owaisi said that he will not support any law that mandates two children only policy as it would not benefit the country. ""We should not repeat the mistakes of China...India's total fertility rate is declining, by 2030 it will stabilise,"" he added. Earlier, he criticised UP CM Yogi Adityanath over his ""population imbalance"" remark.",2022-07-14,Subhangi Singh,https://twitter.com/ANI/status/1547484243278049286?utm_campaign=fullarticle&utm_medium=referral&utm_source=inshorts,https://static.inshorts.com/inshorts/images/v1/variants/jpg/m/2022/07_jul/14_thu/img_1657786639316_374.jpg?,https://inshorts.com/en/news/wont-support-any-law-that-mandates-2-children-owaisi-1657791353632,Twitter,Thursday
Thackeray forced to back NDA's Presidential candidate: Yashwant Sinha,"Opposition candidate for Presidential polls Yashwant Sinha said that ex-Maharashtra CM and Shiv Sena chief Uddhav Thackeray was ""forced"" to declare that his party would support the NDA’s candidate, Droupadi Murmu. ""I am not only fighting a political party, I am fighting for the government and finally the cat is out of the bag,"" Sinha added.",2022-07-14,Sakshi Sharma,https://www.timesnownews.com/india/uddhav-thackeray-was-forced-to-back-ndas-draupadi-murmu-as-president-says-opposition-candidate-yashwant-sinha-article-92864315/amp?utm_campaign=fullarticle&utm_medium=referral&utm_source=inshorts,https://static.inshorts.com/inshorts/images/v1/variants/jpg/m/2022/07_jul/14_thu/img_1657771324066_13.jpg?,https://inshorts.com/en/news/thackeray-forced-to-back-ndas-presidential-candidate-yashwant-sinha-1657775365843,Times Now,Thursday
Have decided to learn Gorkhali language: Mamata in Darjeeling,"West Bengal CM Mamata Banerjee during her Darjeeling visit said that she has decided to learn Gorkhali language in order to communicate more effectively with the people of the Darjeeling hills. ""One of my nephews is getting married to a girl who is a resident of Kurseong...I have decided to learn Gorkhali from her after the marriage,"" Banerjee said.",2022-07-14,Subhangi Singh,https://www.timesnownews.com/india/decided-to-learn-gorkhali-mamata-banerjee-says-she-wants-to-communicate-better-with-people-of-darjeeling-article-92861979/amp?utm_campaign=fullarticle&utm_medium=referral&utm_source=inshorts,https://static.inshorts.com/inshorts/images/v1/variants/jpg/m/2022/07_jul/14_thu/img_1657768725203_324.jpg?,https://inshorts.com/en/news/have-decided-to-learn-gorkhali-language-mamata-in-darjeeling-1657770213330,Times Now,Thursday
BJP playing dirty politics over upcoming Presidential polls: TMC leader,"TMC's Partha Chatterjee said that the BJP is playing ""dirty politics"" over upcoming Presidential polls. ""The NDA nominee was in Kolkata and didn’t ask for votes of Opposition legislators. But BJP leadership has written letters to our MLAs and MPs, seeking their support,"" Chatterjee added. ""When candidate herself hasn't made any appeal, who are they to write letters?"" he asked.",2022-07-14,Sakshi Sharma,https://www.timesnownews.com/india/presidential-polls-bjp-wrote-to-tmc-mlas-but-droupadi-murmu-did-not-make-any-appeal-says-mamata-banerjees-party-article-92860617/amp?utm_campaign=fullarticle&utm_medium=referral&utm_source=inshorts,https://static.inshorts.com/inshorts/images/v1/variants/jpg/m/2022/07_jul/14_thu/img_1657774319662_850.jpg?,https://inshorts.com/en/news/bjp-playing-dirty-politics-over-upcoming-presidential-polls-tmc-leader-1657775307804,Times Now,Thursday
Congress to hold nationwide protest against ED summons to Sonia Gandhi,"Congress has announced that it will hold nationwide protest on July 21 when Congress interim President Sonia Gandhi is scheduled to appear before the Enforcement Directorate (ED) in the National Herald case. ""[Sonia Gandhi] isn't afraid...she will go to...ED office and face this government,"" said Mallikarjun Kharge. Notably, former Congress President Rahul Gandhi was questioned by ED last month.",2022-07-14,Shiwangi,https://www.siasat.com/national-herald-case-congress-to-protest-nationwide-as-ed-summons-sonia-gandhi-2368906/?utm_campaign=fullarticle&utm_medium=referral&utm_source=inshorts,https://static.inshorts.com/inshorts/images/v1/variants/jpg/m/2022/07_jul/14_thu/img_1657777973375_217.jpg?,https://inshorts.com/en/news/congress-to-hold-nationwide-protest-against-ed-summons-to-sonia-gandhi-1657780379988,The Siasat Daily,Thursday
Congress sees politics in National Emblem: K'taka CM Bommai,"Karnataka CM Basavaraj Bommai on Wednesday criticised Congress over the National Emblem controversy and said the party sees politics in it. ""Its fierceness shows our way of thinking,"" Bommai said. This comes after Congress criticised the BJP over the National Emblem cast atop the new Parliament building and accused the Centre of changing the nature and character of Ashokan lions.",2022-07-13,Apoorva Shankar,http://www.ptinews.com/news/13525845_Congress-sees-politics-in-national-emblem--Karnataka-CM.html?utm_campaign=fullarticle&utm_medium=referral&utm_source=inshorts,https://static.inshorts.com/inshorts/images/v1/variants/jpg/m/2022/07_jul/13_wed/img_1657716122784_326.jpg?,https://inshorts.com/en/news/congress-sees-politics-in-national-emblem-ktaka-cm-bommai-1657730945089,PTI,Wednesday
