headlines,text,date,author,read_more,image_url,inshorts_url,original_source,day
India & Sri Lanka sign agreement for a $1-billion line of credit,"The State Bank of India (SBI) will provide a $1-billion credit facility to Sri Lanka for the procurement of food, medicines and other essential items, the Union Finance Ministry said on Thursday. Finance Minister Nirmala Sitharaman and External Affairs Minister S Jaishankar met Sri Lankan Finance Minister Basil Rajapaksa in Delhi. The ministers discussed wide-ranging issues, the ministry added.",2022-03-17,Deepika Bhatt,https://twitter.com/FinMinIndia/status/1504407560786681862?utm_campaign=fullarticle&utm_medium=referral&utm_source=inshorts,https://static.inshorts.com/inshorts/images/v1/variants/jpg/m/2022/03_mar/17_thu/img_1647536887381_31.jpg?,https://inshorts.com/en/news/india-sri-lanka-sign-agreement-for-a-$1billion-line-of-credit-1647538239809,Twitter,Thursday
Smoke from a huge fire at Walmart warehouse in US visible from space,"A plume of smoke emitted from a huge fire at a Walmart distribution centre in Plainfield, US, was so vast that it could be seen from space on Wednesday afternoon, Bloomberg said. A clip posted on Twitter by National Weather Service gave a satellite's-eye view of the smoke spreading across the surrounding area. Twenty-four fire departments are fighting the fire.",2022-03-17,Pragya Swastik,https://www.bloombergquint.com/onweb/smoke-from-huge-walmart-fire-could-be-seen-from-space?utm_campaign=fullarticle&utm_medium=referral&utm_source=inshorts,https://static.inshorts.com/inshorts/images/v1/variants/jpg/m/2022/03_mar/17_thu/img_1647534409007_187.jpg?,https://inshorts.com/en/news/smoke-from-a-huge-fire-at-walmart-warehouse-in-us-visible-from-space-1647537503645,BloombergQuint,Thursday
Who are India's 10 richest people and what are their net worths as per Hurun?,"Mukesh Ambani is India's richest person and 9th-richest worldwide with $103 billion wealth, as per 2022 Hurun Global Rich List. Adani & family are 2nd-richest in India, followed by HCL Tech's Shiv Nadar & family, Serum Institute's Cyrus Poonawalla and ArcelorMittal's Lakshmi Mittal. DMart's Radhakishan Damani & family are 6th richest in India and SP Hinduja & family 7th richest.",2022-03-16,Pragya Swastik,https://www.hurunindia.net/m3m?utm_campaign=fullarticle&utm_medium=referral&utm_source=inshorts,https://static.inshorts.com/inshorts/images/v1/variants/jpg/m/2022/03_mar/16_wed/img_1647443566118_272.jpg?,https://inshorts.com/en/news/who-are-indias-10-richest-people-and-what-are-their-net-worths-as-per-hurun-1647445233069,Hurun India,Wednesday
"Sensex jumps 1,000 points after US Fed's 1st rate hike in 3 years","Indian benchmark indices gained over 1.5% on Thursday, tracking gains in the global markets, following the US Federal Reserve's first rate hike in over three years. The Sensex jumped over 1,000 points to trade above 57,800, while the broader Nifty 50 jumped more than 280 points to trade at 17,250 levels. HDFC and Kotak Mahindra Bank were among top gainers.",2022-03-17,Kiran Khatri,https://www.bseindia.com/sensex/code/16/?utm_campaign=fullarticle&utm_medium=referral&utm_source=inshorts,https://static.inshorts.com/inshorts/images/v1/variants/jpg/m/2022/03_mar/17_thu/img_1647493315782_864.jpg?,https://inshorts.com/en/news/sensex-jumps-1000-points-after-us-feds-1st-rate-hike-in-3-years-1647493882587,BSE,Thursday
"IDFC FIRST Bank's CEO gifts 5,00,000 shares to family of a deceased colleague","IDFC FIRST Bank's MD and CEO V Vaidyanathan has gifted 5,00,000 shares of the bank to family members of a deceased colleague. The deceased colleague was ""closely known"" to Vaidyanathan and the shares have been gifted to back the family's education and financial security, the bank said. Earlier, Vaidyanathan gifted shares to five people including his driver and househelp.",2022-03-17,Pragya Swastik,https://www.financialexpress.com/market/idfc-first-bank-md-ceo-gifts-5-lakh-shares-to-kin-of-deceased-colleague/2464322/lite/?utm_campaign=fullarticle&utm_medium=referral&utm_source=inshorts,https://static.inshorts.com/inshorts/images/v1/variants/jpg/m/2022/03_mar/17_thu/img_1647526145382_906.jpg?,https://inshorts.com/en/news/idfc-first-banks-ceo-gifts-500000-shares-to-family-of-a-deceased-colleague-1647530176825,Financial Express,Thursday
"Sensex ends 1,047 points higher at 57,864, logs best week in over a year","The Sensex jumped 1,047 points on Thursday to close at 57,864 following gains in global markets, a day after US Federal Reserve's first interest rate hike in over three years. The Nifty 50 jumped 312 points to end at 17,287. HDFC and Reliance Industries were among top gainers. The Sensex and Nifty logged their best week in over a year.",2022-03-17,Kiran Khatri,https://www.moneycontrol.com/news/business/markets/share-market-live-updates-stock-market-today-march-17-latest-news-bse-nse-sensex-nifty-covid-coronavirus-beml-gufic-biosciences-satin-creditcare-network-yasho-industries-indiabulls-housing-finance-8241801.html/amp?utm_campaign=fullarticle&utm_medium=referral&utm_source=inshorts,https://static.inshorts.com/inshorts/images/v1/variants/jpg/m/2022/03_mar/17_thu/img_1647511301209_175.jpg?,https://inshorts.com/en/news/sensex-ends-1047-points-higher-at-57864-logs-best-week-in-over-a-year-1647512132287,Moneycontrol,Thursday
Reliance's drastic action came as a surprise: Future Retail on stores' takeover,"Future Retail (FRL) has said it's committed to taking all actions ""necessary to seek value adjustments and reversal of takeover of stores"" by Reliance Industries (RIL). RIL's ""drastic and unilateral action"" to takeover stores came as a ""surprise"" to FRL, it added. It also complicated the positive scenario which was building up after the CCI order in December, FRL claimed.",2022-03-17,Kiran Khatri,https://www.financialexpress.com/industry/reliance-action-was-unilateral-future-retail-says-stores-takeover-came-as-a-surprise/2463321/lite/?utm_campaign=fullarticle&utm_medium=referral&utm_source=inshorts,https://static.inshorts.com/inshorts/images/v1/variants/jpg/m/2022/03_mar/17_thu/img_1647494586857_630.jpg?,https://inshorts.com/en/news/reliances-drastic-action-came-as-a-surprise-future-retail-on-stores-takeover-1647497768490,Financial Express,Thursday
India has world's 3rd highest number of self-made billionaires: Hurun,"As per the 2022 M3M Hurun Global Rich List, India ranks third in the list of self-made billionaires with 119 such individuals. These individuals have cumulative wealth of $474 billion. China has the most number of self-made billionaires at 1,050, with $3.756 trillion combined wealth, while the US stands second with 523 self-made billionaires, whose combined wealth is $3.554 trillion.",2022-03-17,Kiran Khatri,https://www.businessinsider.in/business/corporates/news/india-at-third-position-after-us-and-china-in-creating-self-made-billionaires/slidelist/90282839.cms?utm_campaign=fullarticle&utm_medium=referral&utm_source=inshorts,https://static.inshorts.com/inshorts/images/v1/variants/jpg/m/2022/03_mar/17_thu/img_1647509516179_208.jpg?,https://inshorts.com/en/news/india-has-worlds-3rd-highest-number-of-selfmade-billionaires-hurun-1647508683690,Business Insider,Thursday
"Investors ₹19 lakh cr richer as Sensex adds over 5,000 points in 8 sessions","The Sensex added more than 5,000 points and the Nifty50 gained over 1,400 points in the last eight sessions in a row, barring the March 15 trading, making investors ₹19 lakh crore richer, Moneycontrol reported on Thursday. On Thursday itself, investors' wealth increased by ₹4 lakh crore. This comes amid positive global cues, easing commodity prices and declining volatility.",2022-03-17,Pragya Swastik,https://www.moneycontrol.com/news/business/markets/investors-turn-richer-by-rs-19-lakh-crore-as-sensex-adds-over-5000-points-in-8-sessions-8243811.html/amp?utm_campaign=fullarticle&utm_medium=referral&utm_source=inshorts,https://static.inshorts.com/inshorts/images/v1/variants/jpg/m/2022/03_mar/17_thu/img_1647510041155_190.jpg?,https://inshorts.com/en/news/investors-₹19-lakh-cr-richer-as-sensex-adds-over-5000-points-in-8-sessions-1647511096253,Moneycontrol,Thursday
China's richest billionaires gain $71 billion as stocks jump most since 2008,"The combined net worth of China's 75 richest billionaires surged by $71 billion on Wednesday as stocks across Hong Kong and China jumped the most since the 2008 financial crisis. Tencent's Pony Ma, NetEase's William Ding and Pinduoduo's Colin Huang, added over $5 billion each to their net worths, as per Bloomberg Billionaires Index.",2022-03-17,Kiran Khatri,https://www.bloombergquint.com/onweb/chinese-tycoons-claw-back-71-billion-from-market-rebound?utm_campaign=fullarticle&utm_medium=referral&utm_source=inshorts,https://static.inshorts.com/inshorts/images/v1/variants/jpg/m/2022/03_mar/17_thu/img_1647496869169_753.jpg?,https://inshorts.com/en/news/chinas-richest-billionaires-gain-$71-billion-as-stocks-jump-most-since-2008-1647498018212,BloombergQuint,Thursday
Consumers could lose invested money if they buy crypto assets: EU,"The European Union's securities, banking and insurance watchdogs in a joint statement warned that consumers risk losing all their money invested in cryptocurrency assets and could fall prey to scams. ""Consumers should be alert to the risks of misleading advertisements, including via social media and influencers,"" the authorities said. They also mentioned energy consumption by some assets.",2022-03-17,Aishwarya Awasthi,https://www.reuters.com/technology/be-ready-lose-all-your-money-crypto-eu-regulators-warn-2022-03-17/?utm_campaign=fullarticle&utm_medium=referral&utm_source=inshorts,https://static.inshorts.com/inshorts/images/v1/variants/jpg/m/2022/03_mar/17_thu/img_1647513243015_528.jpg?,https://inshorts.com/en/news/consumers-could-lose-invested-money-if-they-buy-crypto-assets-eu-1647514481890,Reuters,Thursday
"Reliance, Ola Electric win bids under ₹18,100 cr PLI scheme: Reports","Reliance Industries and Ola Electric will receive incentives under Centre's ₹18,100 crore Production Linked Incentive (PLI) scheme to boost local battery cell production, Reuters reported. Hyundai Motors and Indian jewellery maker Rajesh Exports have also won the bids. Ola Electric and Hyundai will get incentives for 20 Gwh capacity while Reliance and Rajesh Exports have won incentives for 5 Gwh.",2022-03-17,Ashley Paul,https://www.reuters.com/world/india/reliance-ola-electric-others-get-incentives-under-indias-24-bln-battery-scheme-2022-03-17/?utm_campaign=fullarticle&utm_medium=referral&utm_source=inshorts,https://static.inshorts.com/inshorts/images/v1/variants/jpg/m/2022/03_mar/17_thu/img_1647510919250_961.jpg?,https://inshorts.com/en/news/reliance-ola-electric-win-bids-under-₹18100-cr-pli-scheme-reports-1647511825156,Reuters,Thursday
Direct tax collection in FY22 stands at ₹13.63 lakh cr: CBDT chief,"CBDT Chairman JB Mohapatra said direct tax collection for FY22 outmatches revised estimates of ₹12.5 lakh crore after touching ₹13.63 lakh crore. He added that government's cumulative collection through tax deducted at source currently stood at ₹6.79 lakh crore and corporate tax collection stood at ₹7.19 lakh crore. ""The numbers are more than what we expected,"" he said.",2022-03-17,Ashley Paul,https://www.moneycontrol.com/news/business/economy/direct-tax-collection-beats-revised-estimates-stands-at-rs-13-63-lakh-crore-cbdt-chief-8245021.html/amp?utm_campaign=fullarticle&utm_medium=referral&utm_source=inshorts,https://static.inshorts.com/inshorts/images/v1/variants/jpg/m/2022/03_mar/17_thu/img_1647524978659_529.jpg?,https://inshorts.com/en/news/direct-tax-collection-in-fy22-stands-at-₹1363-lakh-cr-cbdt-chief-1647531733643,Moneycontrol,Thursday
"Rajeev Ahuja's term as RBL Bank interim MD, CEO extended for 3 more months","RBI on Thursday extended Rajeev Ahuja's term as RBL Bank interim MD and CEO for three more months with effect from March 25, the bank said. Ahuja was appointed as the interim MD and CEO on December 25 after former chief Vishwavir Ahuja's abrupt exit. In an unusual move, RBI also appointed an Additional Director on the bank's board.",2022-03-17,Ashley Paul,https://www.moneycontrol.com/news/business/banks/rbi-extends-rajeev-ahujas-term-as-rbl-bank-md-ceo-for-three-more-months-8245691.html/amp?utm_campaign=fullarticle&utm_medium=referral&utm_source=inshorts,https://static.inshorts.com/inshorts/images/v1/variants/jpg/m/2022/03_mar/17_thu/img_1647528399178_24.jpg?,https://inshorts.com/en/news/rajeev-ahujas-term-as-rbl-bank-interim-md-ceo-extended-for-3-more-months-1647532141109,Moneycontrol,Thursday
Ex-Fortis Healthcare Promoter Shivinder Singh's interim bail plea rejected by SC,"The Supreme Court on Wednesday rejected former Fortis Healthcare Promoter Shivinder Singh's interim bail plea in a money laundering case, NDTV reported. Singh, who was arrested in December 2019, is accused of misappropriating ₹2,397 crore of Religare Finvest Limited's funds. Taking note of ""serious allegations"" and Singh being a ""flight risk"", SC rejected the interim bail plea.",2022-03-16,Ashley Paul,https://www.moneycontrol.com/news/india/supreme-court-rejects-ex-fortis-healthcare-promoter-shivinder-singhs-interim-bail-plea-8231031.html/amp?utm_campaign=fullarticle&utm_medium=referral&utm_source=inshorts,https://static.inshorts.com/inshorts/images/v1/variants/jpg/m/2022/03_mar/16_wed/img_1647433435935_526.jpg?,https://inshorts.com/en/news/exfortis-healthcare-promoter-shivinder-singhs-interim-bail-plea-rejected-by-sc-1647433879677,Moneycontrol,Wednesday
Moody's slashes India's FY22 GDP growth estimate from 9.5% to 9.1%,"Moody's has slashed India's GDP growth estimate for FY22 from 9.5% to 9.1%. According to the rating agency, the ongoing Russia-Ukraine war is expected to cost India a high fuel and fertiliser import bill in FY22, leading to reduced government spending and a reduction in India's GDP growth. Moody's has projected India's year-end inflation at 6.6% in FY22.",2022-03-17,Ashley Paul,None,https://static.inshorts.com/inshorts/images/v1/variants/jpg/m/2022/03_mar/17_thu/img_1647506692163_240.jpg?,https://inshorts.com/en/news/moodys-slashes-indias-fy22-gdp-growth-estimate-from-95-to-91-1647509599075,Inshorts,Thursday
"Starbucks CEO to step down, Founder Howard Schultz to return as interim CEO","Starbucks CEO Kevin Johnson will step down from his role on April 4 and Founder Howard Schultz will take over as interim CEO, the company announced on Wednesday. ""I feel this is a natural bookend to my 13 years with the company,"" Johnson said. He will continue in an advisory role to the company and its board through September.",2022-03-16,Ashley Paul,https://www.businessinsider.com/starbucks-ceo-kevin-johnson-retire-howard-schultz-interim-ceo-coffee-2022-3?amp=&utm_campaign=fullarticle&utm_medium=referral&utm_source=inshorts,https://static.inshorts.com/inshorts/images/v1/variants/jpg/m/2022/03_mar/16_wed/img_1647436727977_513.jpg?,https://inshorts.com/en/news/starbucks-ceo-to-step-down-founder-howard-schultz-to-return-as-interim-ceo-1647438998182,Business Insider,Wednesday
"Zomato loans $150 mn to Blinkit, buys 16.66% stake in Mukunda Foods for $5 mn",Zomato is loaning $150 million to Blinkit (formerly Grofers) as per its plan of investing $400 million cash in Indian quick commerce over the next two years. The loan's interest rate will be 12% p.a. or higher with a tenor of not more than one year. Zomato is also acquiring a 16.66% stake in Mukunda Foods for $5 million.,2022-03-15,Pragya Swastik,https://www.moneycontrol.com/news/business/startup/zomato-to-give-150-million-debt-to-cash-strapped-blinkit-8235841.html/amp?utm_campaign=fullarticle&utm_medium=referral&utm_source=inshorts,https://static.inshorts.com/inshorts/images/v1/variants/jpg/m/2022/03_mar/15_tue/img_1647353688651_312.jpg?,https://inshorts.com/en/news/zomato-loans-$150-mn-to-blinkit-buys-1666-stake-in-mukunda-foods-for-$5-mn-1647354801525,Moneycontrol,Tuesday
India's urban unemployment rate jumped to 12.6% in Apr-Jun 2021 amid 2nd wave,"India's urban unemployment rate jumped to 12.6% in April-June 2021 from 9.3% in the previous quarter amid COVID-19's second wave, according to data released by the government. The rise in unemployment in the second quarter of 2021 was the first such increase since the jobless rate peaked at 20.8% in April-June 2020, the Ministry of Statistics and Programme Implementation said.",2022-03-15,Pragya Swastik,https://www.moneycontrol.com/news/business/economy/indias-urban-unemployment-rate-jumped-to-12-6-in-april-june-2021-amid-second-wave-8230271.html/amp?utm_campaign=fullarticle&utm_medium=referral&utm_source=inshorts,https://static.inshorts.com/inshorts/images/v1/variants/jpg/m/2022/03_mar/15_tue/img_1647357167009_510.jpg?,https://inshorts.com/en/news/indias-urban-unemployment-rate-jumped-to-126-in-aprjun-2021-amid-2nd-wave-1647357310910,Moneycontrol,Tuesday
India buying discounted crude oil from Russia does not violate US sanctions: US,"India taking up Russia's offer of discounted crude oil would not be a violation of US sanctions, the White House has said. ""Our message to any country continues to be that abide by the sanctions that we have put in place and recommended,"" White House Press Secretary Jen Psaki told reporters at a press briefing on Tuesday.",2022-03-16,Ankush Verma,https://www.aninews.in/news/world/us/india-not-violating-sanctions-but-russian-oil-deal-could-place-new-delhi-on-wrong-side-of-history-us20220316085015/?utm_campaign=fullarticle&utm_medium=referral&utm_source=inshorts,https://static.inshorts.com/inshorts/images/v1/variants/jpg/m/2022/03_mar/16_wed/img_1647403483758_994.jpg?,https://inshorts.com/en/news/india-buying-discounted-crude-oil-from-russia-does-not-violate-us-sanctions-us-1647404267795,ANI,Wednesday
Elon Musk changes his Twitter name to 'Elona' as Putin's ally calls him effeminate,"Tesla CEO Elon Musk changed his Twitter name to 'Elona' after Russian President Vladimir Putin's ally and the Chechen Republic's head Ramzan Kadyrov mocked him as ""effeminate"". Kadyrov said, ""Don't measure your strength against that of Putin's."" ""You'll need to pump up those muscles...to change from the gentle (effeminate) Elona into the brutal Elon you need to be,"" he added.",2022-03-16,Kiran Khatri,https://twitter.com/elonmusk/status/1503828461235982339?utm_campaign=fullarticle&utm_medium=referral&utm_source=inshorts,https://static.inshorts.com/inshorts/images/v1/variants/jpg/m/2022/03_mar/16_wed/img_1647402702919_369.jpg?,https://inshorts.com/en/news/elon-musk-changes-his-twitter-name-to-elona-as-putins-ally-calls-him-effeminate-1647404496376,Twitter,Wednesday
It'll be support for invasion: US on if India buys discounted crude oil from Russia,"On being asked about possibility that India could take up Russian offer of discounted crude oil, White House Press Secretary Jen Psaki said, ""Think where you want to stand when history books are written in this moment in time."" ""Support for Russian leadership is support for invasion that is having a devastating impact,"" she further said.",2022-03-16,Ankush Verma,https://twitter.com/ANI/status/1503919797431857154?utm_campaign=fullarticle&utm_medium=referral&utm_source=inshorts,https://static.inshorts.com/inshorts/images/v1/variants/jpg/m/2022/03_mar/16_wed/img_1647401201369_0.jpg?,https://inshorts.com/en/news/itll-be-support-for-invasion-us-on-if-india-buys-discounted-crude-oil-from-russia-1647403353907,ANI,Wednesday
Tata Communications becomes Formula 1's official broadcast connectivity provider,Formula 1 and Tata Communications on Wednesday announced a multi-year strategic collaboration under which Tata will be F1's official broadcast connectivity provider. Tata Communications will facilitate transfer of over 100 video feeds and 250 audio channels from the racetrack to F1's Media & Technology Centre in the UK. F1 and Tata had ended their eight-year marketing partnership in January 2020.,2022-03-16,Kiran Khatri,https://corp.formula1.com/formula-1-and-tata-communications-announce-multi-year-strategic-collaboration/?utm_campaign=fullarticle&utm_medium=referral&utm_source=inshorts,https://static.inshorts.com/inshorts/images/v1/variants/jpg/m/2022/03_mar/16_wed/img_1647419022122_523.jpg?,https://inshorts.com/en/news/tata-communications-becomes-formula-1s-official-broadcast-connectivity-provider-1647421886449,Formula 1,Wednesday
Chinese stocks jump the most since 2008 after $1.5 tn wiped out in two days,"Stocks across Hong Kong and China witnessed a massive rally after China's state council vowed to keep its stock market stable following a $1.5-trillion wipeout over the past two sessions. The Hang Seng China Enterprises Index jumped 13% on Wednesday, its biggest gain since the global financial crisis of 2008. Chinese technology firms including Alibaba and Tencent gained over 23%.",2022-03-16,Pragya Swastik,https://www.bloombergquint.com/markets/china-tech-stocks-rebound-on-dip-buying-after-historic-rout?utm_campaign=fullarticle&utm_medium=referral&utm_source=inshorts,https://static.inshorts.com/inshorts/images/v1/variants/jpg/m/2022/03_mar/16_wed/img_1647424414843_916.jpg?,https://inshorts.com/en/news/chinese-stocks-jump-the-most-since-2008-after-$15-tn-wiped-out-in-two-days-1647425942134,BloombergQuint,Wednesday
"Russia's space chief, who called Musk 'little devil', invited him home 6 months ago","Russian space agency Roscosmos' chief Dmitry Rogozin, who called Tesla CEO Elon Musk a ""little devil"" after he challenged President Vladimir Putin for a single combat, praised Musk six months ago. Rogozin even invited Musk to his home in Russia in September and said he'd ""already set the teakettle on heat"". Rogozin wanted to discuss ""exploring the universe"" with Musk.",2022-03-16,Kiran Khatri,https://www.businessinsider.in/tech/news/russias-space-chief-was-inviting-elon-musk-to-dinner-and-praising-him-6-months-ago-now-theyre-hurling-insults-and-trolling-each-other/amp_articleshow/90238634.cms?utm_campaign=fullarticle&utm_medium=referral&utm_source=inshorts,https://static.inshorts.com/inshorts/images/v1/variants/jpg/m/2022/03_mar/16_wed/img_1647407386664_577.jpg?,https://inshorts.com/en/news/russias-space-chief-who-called-musk-little-devil-invited-him-home-6-months-ago-1647408229857,Business Insider,Wednesday
"Alibaba, Tencent lose over $1 trillion in market value over a year","Chinese technology giants Alibaba and Tencent have lost more than $1 trillion in combined market value over the last 13 months. The stocks of Chinese tech companies plunged over the past year as the government extended its regulatory crackdown. While food delivery platform Meituan's market value has plunged by $254.6 billion since February 2021, e-commerce platform Pinduoduo lost $217.6 billion.",2022-03-15,Hiral Goyal,https://www.bloombergquint.com/markets/tencent-alibaba-have-erased-1-trillion-in-value-over-last-year?utm_campaign=fullarticle&utm_medium=referral&utm_source=inshorts,https://static.inshorts.com/inshorts/images/v1/variants/jpg/m/2022/03_mar/15_tue/img_1647354837527_993.jpg?,https://inshorts.com/en/news/alibaba-tencent-lose-over-$1-trillion-in-market-value-over-a-year-1647356081710,BloombergQuint,Tuesday
Amazon's demand for $200 mn caused Amazon-Future settlement talks to fail: Report,"The dispute settlement talks between Amazon and India's Future Retail failed over the US company's demand for the return of at least $200 million it had invested in Future, Reuters reported. Future instead offered a stake of an equivalent amount in one of its remaining group companies after Reliance takes over most of its retail assets. Amazon didn't accept that.",2022-03-15,Pragya Swastik,https://www.reuters.com/business/retail-consumer/exclusive-amazon-talks-with-indias-future-broke-down-over-us-firms-demand-200-2022-03-15/?utm_campaign=fullarticle&utm_medium=referral&utm_source=inshorts,https://static.inshorts.com/inshorts/images/v1/variants/jpg/m/2022/03_mar/15_tue/img_1647359821841_98.jpg?,https://inshorts.com/en/news/amazons-demand-for-$200-mn-caused-amazonfuture-settlement-talks-to-fail-report-1647361315623,Reuters,Tuesday
Nykaa CEO Falguni Nayar's net worth now 4 times higher than Paytm CEO's,"India's richest self-made woman and Nykaa CEO Falguni Nayar's net worth is now nearly four times higher than that of Paytm CEO Vijay Shekhar Sharma, as per Forbes data. Sharma's fortune briefly fell below $1 billion on Wednesday, but currently stands at $1.1 billion. Meanwhile, Nayar's net worth stands at $4.9 billion. Both their companies went public in 2021.",2022-03-16,Kiran Khatri,https://www.businessinsider.in/business/news/nykaas-falguni-nayars-net-worth-is-four-times-higher-than-paytms-vijay-shekhar-sharma/amp_articleshow/90264203.cms?utm_campaign=fullarticle&utm_medium=referral&utm_source=inshorts,https://static.inshorts.com/inshorts/images/v1/variants/jpg/m/2022/03_mar/16_wed/img_1647428565853_72.jpg?,https://inshorts.com/en/news/nykaa-ceo-falguni-nayars-net-worth-now-4-times-higher-than-paytm-ceos-1647429679095,Business Insider,Wednesday
