headlines,text,date,author,read_more,image_url,inshorts_url,original_source,day
Doors of Matoshree open for those who want to return: Aaditya to Shinde camp,"Shiv Sena MLA Aaditya Thackeray on Thursday said that real Shiv Sainiks are still with the party led by Uddhav Thackeray. Referring to MLAs who joined Eknath Shinde-led government, he added that the doors of Matoshree are going to remain open for those who want to return. The ones we trusted and offered ministerial posts, backstabbed us, he further said.",2022-07-21,Subhangi Singh,https://www.hindustantimes.com/cities/mumbai-news/stabbed-in-the-back-by-people-we-trusted-says-aaditya-thackeray-on-shinde-camp-101658397195536-amp.html?utm_campaign=fullarticle&utm_medium=referral&utm_source=inshorts,https://static.inshorts.com/inshorts/images/v1/variants/jpg/m/2022/07_jul/21_thu/img_1658398842833_728.jpg?,https://inshorts.com/en/news/doors-of-matoshree-open-for-those-who-want-to-return-aaditya-to-shinde-camp-1658402050627,Hindustan Times,Thursday
Samajwadi Party intimidates Muslims for votes: SBSP chief,"Suheldev Bhartiya Samaj Party (SBSP) chief Om Prakash Rajbhar on Thursday criticised his alliance partner Samajwadi Party over its treatment of Muslims. ""The Samajwadi Party (SP) gets votes of Muslims by intimidating them but when the time comes to give the Muslim community their rights, the party turns its back on them,"" Om Prakash Rajbhar said.",2022-07-21,Apoorva Shankar,http://www.ptinews.com/news/13549732_Samajwadi-Party-intimidates-Muslims-for-votes--Rajbhar.html?utm_campaign=fullarticle&utm_medium=referral&utm_source=inshorts,https://static.inshorts.com/inshorts/images/v1/variants/jpg/m/2022/07_jul/21_thu/img_1658399837184_571.jpg?,https://inshorts.com/en/news/samajwadi-party-intimidates-muslims-for-votes-sbsp-chief-1658406503630,Press Trust of India,Thursday
"Break BJP's prison, bring people's government in 2024: WB CM Mamata","While addressing a rally in Kolkata, West Bengal CM Mamata Banerjee on Thursday urged the people to break BJP's prison and elect a people's government in the 2024 elections. ""What will the people eat when the BJP is implementing GST on everything, even puffed rice and milk powder. How will the poor survive in this country?"" she said.",2022-07-21,Nakul Ahuja,https://theprint.in/india/break-bjps-prison-bring-peoples-government-in-2024-mamata/1048732/?amp=&utm_campaign=fullarticle&utm_medium=referral&utm_source=inshorts,https://static.inshorts.com/inshorts/images/v1/variants/jpg/m/2022/07_jul/21_thu/img_1658405787038_35.jpg?,https://inshorts.com/en/news/break-bjps-prison-bring-peoples-government-in-2024-wb-cm-mamata-1658407671647,The Print,Thursday
Summit is for Mayors: Delhi LG as he denies CM's plea for Singapore visit,"Delhi Lieutenant Governor (LG) VK Saxena has refused to approve CM Arvind Kejriwal's proposal regarding visiting Singapore to attend the World Cities Summit. The LG advised Kejriwal to not attend the summit since it is a conference of Mayors and won't be befitting for a CM to attend it, ANI reported. The summit is set to commence on July 31.",2022-07-21,Nidhi Sinha,https://aninews.in/news/national/politics/delhi-lg-denies-permission-for-kejriwals-singapore-visit20220721170046/?utm_campaign=fullarticle&utm_medium=referral&utm_source=inshorts,https://static.inshorts.com/inshorts/images/v1/variants/jpg/m/2022/07_jul/21_thu/img_1658408829386_304.jpg?,https://inshorts.com/en/news/summit-is-for-mayors-delhi-lg-as-he-denies-cms-plea-for-singapore-visit-1658409856508,ANI,Thursday
Wrong to summon 2 members of same family again & again: Cong leader,"As Congress interim President Sonia Gandhi appeared before ED in connection with the National Herald case on Thursday, party leader Ghulam Nabi Azad said it is wrong to summon two members of the same family over and over again, that too in connection with the same case. The agency earlier questioned Congress leader Rahul Gandhi in connection with the case.",2022-07-21,Sakshi Sharma,https://twitter.com/ANI/status/1550044316479135744?s=20&t=0YQjaEP7QYz5k0gy68FA3g&utm_campaign=fullarticle&utm_medium=referral&utm_source=inshorts,https://static.inshorts.com/inshorts/images/v1/variants/jpg/m/2022/07_jul/21_thu/img_1658396699708_702.jpg?,https://inshorts.com/en/news/wrong-to-summon-2-members-of-same-family-again-again-cong-leader-1658401954306,ANI,Thursday
BJP is blinded by their desire for revenge: Baghel on Sonia's ED questioning,"As Congress interim President Sonia Gandhi appeared before ED on Thursday, Chhattisgarh CM Bhupesh Baghel said the BJP is ""blinded by their desire for revenge"". ""This is the same woman who was married to [former] PM Rajiv Gandhi,"" Baghel added. ""Sonia Gandhi has not been well, of late, and yet the BJP is after her,"" he stated.",2022-07-21,Sakshi Sharma,https://twitter.com/ANI_MP_CG_RJ/status/1550054987866071041?s=20&t=5hlkEDk_p0k-wPdTjwia3g&utm_campaign=fullarticle&utm_medium=referral&utm_source=inshorts,https://static.inshorts.com/inshorts/images/v1/variants/jpg/m/2022/07_jul/21_thu/img_1658399631939_559.jpg?,https://inshorts.com/en/news/bjp-is-blinded-by-their-desire-for-revenge-baghel-on-sonias-ed-questioning-1658402355472,ANI,Thursday
"Shiv Sena leader backing Uddhav Thackeray attacked in Maha, 2 held","Police on Thursday arrested two people in connection with the attack on a worker of the Uddhav Thackeray-led Shiv Sena in Maharashtra, an official said. Harshawardhan Palande, Deputy Chief of the Sena's Kalyan city unit, was attacked by four to five men with sticks and rods on Wednesday, a police official said.",2022-07-21,Nakul Ahuja,https://theprint.in/india/2-held-for-attack-on-thackeray-group-sena-worker-in-thane/1048457/?amp=&utm_campaign=fullarticle&utm_medium=referral&utm_source=inshorts,https://static.inshorts.com/inshorts/images/v1/variants/jpg/m/2022/07_jul/21_thu/img_1658397910414_710.jpg?,https://inshorts.com/en/news/shiv-sena-leader-backing-uddhav-thackeray-attacked-in-maha-2-held-1658402445239,The Print,Thursday
"PM, Shah will have to take many births to understand Gandhi family: Khera","Congress leader Pawan Khera on Thursday said PM Narendra Modi and Union Home Minister Amit Shah will have to ""take many births to understand what Gandhi family and Congress party are"". His statement came ahead of Congress interim President Sonia Gandhi's questioning by ED. ""We'll not hold back, we're not among those who sit at home in fear,"" Khera added.",2022-07-21,Sakshi Sharma,https://www.timesnownews.com/india/pm-narendra-modi-amit-shah-will-have-to-reborn-several-times-to-understand-what-gandhi-family-and-congress-are-pawan-khera-on-sonia-gandhi-questioning-by-enforcement-directorate-national-herald-case-article-93020044/amp?utm_campaign=fullarticle&utm_medium=referral&utm_source=inshorts,https://static.inshorts.com/inshorts/images/v1/variants/jpg/m/2022/07_jul/21_thu/img_1658387413316_830.jpg?,https://inshorts.com/en/news/pm-shah-will-have-to-take-many-births-to-understand-gandhi-family-khera-1658392121741,Times Now,Thursday
300 units of free electricity in Gujarat if AAP wins: Kejriwal,"In the run up to Gujarat Assembly elections, Aam Aadmi Party national convener Arvind Kejriwal has promised free electricity up to 300 units per month if elected. Speaking at a town hall meeting in Surat, Kejriwal said AAP will waive off pending power bills till December 31, 2021. This will be implemented within three months of being elected, he said.",2022-07-21,Anisha Joneja,https://www.hindustantimes.com/india-news/300-units-free-electricity-per-month-if-aap-comes-to-power-in-gujarat-kejriwal-101658397912925-amp.html?utm_campaign=fullarticle&utm_medium=referral&utm_source=inshorts,https://static.inshorts.com/inshorts/images/v1/variants/jpg/m/2022/07_jul/21_thu/img_1658403431394_346.jpg?,https://inshorts.com/en/news/300-units-of-free-electricity-in-gujarat-if-aap-wins-kejriwal-1658406707795,Hindustan Times,Thursday
'Revadi' is called 'prasad' when distributed to public for free: Kejriwal,"AAP chief Arvind Kejriwal responded to BJP's ""revadi culture"" remark and said, ""When 'revadi' is distributed among public for free, then it's called 'prasad'."" ""But when [revadi] is given for free to your own friends, ministers, then it is 'paap' (sin),"" he added. His statement comes after BJP said that ""revadi culture"" may push Gujarat towards Sri Lanka-like crisis.",2022-07-21,Subhangi Singh,https://twitter.com/ANI/status/1550027360724205568?utm_campaign=fullarticle&utm_medium=referral&utm_source=inshorts,https://static.inshorts.com/inshorts/images/v1/variants/jpg/m/2022/07_jul/21_thu/img_1658395337637_452.jpg?,https://inshorts.com/en/news/revadi-is-called-prasad-when-distributed-to-public-for-free-kejriwal-1658399271509,Twitter,Thursday
TMC will win seats outside WB in 2024 LS polls: Abhishek Banerjee,"TMC National General Secretary Abhishek Banerjee on Thursday asserted that the party will continue with its expansion plans and will win seats outside West Bengal in 2024 Lok Sabha elections. He further said that tickets for next year's panchayat elections will be distributed on the basis of ""merit and not recommendations"". Banerjee was addressing workers at the Martyrs' Day rally.",2022-07-21,Shiwangi,https://theprint.in/india/tmc-will-win-seats-outside-bengal-in-2024-ls-polls-abhishek/1048640/?amp=&utm_campaign=fullarticle&utm_medium=referral&utm_source=inshorts,https://static.inshorts.com/inshorts/images/v1/variants/jpg/m/2022/07_jul/21_thu/img_1658395402044_769.jpg?,https://inshorts.com/en/news/tmc-will-win-seats-outside-wb-in-2024-ls-polls-abhishek-banerjee-1658401367161,The Print,Thursday
"If Gandhi family is spotless, why is it anxious?: Anurag Thakur","As Congress interim President Sonia Gandhi appeared before ED, Union Minister Anurag Thakur on Thursday said that it’s the duty of probe agencies to investigate people involved in corruption. ""If the Gandhi family is spotless, why is it anxious? If they have not indulged in corruption then why this ruckus,"" Thakur added.",2022-07-21,Sakshi Sharma,https://twitter.com/ANI/status/1550019198600237056?s=20&t=ghnmi1nmAoHzXI1RADghoA&utm_campaign=fullarticle&utm_medium=referral&utm_source=inshorts,https://static.inshorts.com/inshorts/images/v1/variants/jpg/m/2022/07_jul/21_thu/img_1658392087342_343.jpg?,https://inshorts.com/en/news/if-gandhi-family-is-spotless-why-is-it-anxious-anurag-thakur-1658399019419,ANI,Thursday
Hand over AIADMK headquarter keys to EPS: Madras HC to Tamil Nadu govt,"The Madras High Court on Wednesday asked the Tamil Nadu government to hand over keys of AIADMK headquarters to Interim General Secretary Edappadi K Palaniswami, also known as EPS. The court asked AIADMK cadres not to enter the office for one month to prevent untoward incidents. The office was sealed after a clash between supporters of EPS and O Panneerselvam.",2022-07-20,Deepika Bhatt,https://www.hindustantimes.com/cities/madras-hc-orders-handing-over-of-aiadmk-headquarters-keys-to-team-eps-101658316031329-amp.html?utm_campaign=fullarticle&utm_medium=referral&utm_source=inshorts,https://static.inshorts.com/inshorts/images/v1/variants/jpg/m/2022/07_jul/20_wed/img_1658318581043_165.jpg?,https://inshorts.com/en/news/hand-over-aiadmk-headquarter-keys-to-eps-madras-hc-to-tamil-nadu-govt-1658320236598,Hindustan Times,Wednesday
"UP Minister Dinesh Khatik resigns, says 'was sidelined because I am a Dalit'","Uttar Pradesh Minister of State for Jal Shakti Dinesh Khatik on Wednesday resigned from his post alleging that he was sidelined because he is a Dalit. He sent his resignation letter to Union Home Minister Amit Shah instead of CM Yogi Adityanath. ""My working as a minister of state is... waste for the Dalit community,"" Khatik said in the letter.",2022-07-20,Deepika Bhatt,https://www.hindustantimes.com/cities/lucknow-news/i-quit-up-minister-dinesh-khatik-says-he-was-being-kept-in-the-dark-by-officials-101658305333487-amp.html?utm_campaign=fullarticle&utm_medium=referral&utm_source=inshorts,https://static.inshorts.com/inshorts/images/v1/variants/jpg/m/2022/07_jul/20_wed/img_1658330292457_717.jpg?,https://inshorts.com/en/news/up-minister-dinesh-khatik-resigns-says-was-sidelined-because-i-am-a-dalit-1658331433769,Hindustan Times,Wednesday
Sonia Gandhi appears before ED in National Herald case,"Congress' interim President Sonia Gandhi has reached the Enforcement Directorate (ED) office to appear for questioning in connection with the National Herald case. Priyanka Gandhi Vadra accompanied her mother to the office due to the leader's ill health, according to reports. The agency earlier questioned Congress leader Rahul Gandhi in connection with the case.",2022-07-21,Arshiya Chopra,https://www.news18.com/amp/news/politics/sonia-gandhi-ed-appearance-congress-protest-rahul-priyanka-national-herald-money-laundering-5594341.html?utm_campaign=fullarticle&utm_medium=referral&utm_source=inshorts,https://static.inshorts.com/inshorts/images/v1/variants/jpg/m/2022/07_jul/21_thu/img_1658384979565_172.jpg?,https://inshorts.com/en/news/sonia-gandhi-appears-before-ed-in-national-herald-case-1658385634415,News18,Thursday
"Sachin Pilot, Tharoor detained amid Congress protests over ED's questioning of Sonia","Amid protests by Congress, senior leaders including Sachin Pilot, Shashi Tharoor, Ashok Gehlot, Pawan Khera, Harish Rawat and others were detained by police. ""We're being taken by police to an unknown destination. Two other police buses full of MPs are there,"" Tharoor tweeted. Congress workers are protesting against ED's questioning of Sonia Gandhi in connection with the National Herald case.",2022-07-21,Atul Mishra,https://www.thequint.com/amp/story/news/politics/sonia-gandhi-enforcement-directorate-appearance-national-herald-case-questioning-congress-protests-delhi?utm_campaign=fullarticle&utm_medium=referral&utm_source=inshorts,https://static.inshorts.com/inshorts/images/v1/variants/jpg/m/2022/07_jul/21_thu/img_1658389757857_778.jpg?,https://inshorts.com/en/news/sachin-pilot-tharoor-detained-amid-congress-protests-over-eds-questioning-of-sonia-1658390397575,The Quint,Thursday
Being taken to unknown place: Tharoor after senior Congress leaders detained amid protest,"Congress MP Shashi Tharoor has released a video statement from Delhi Police Bus after senior Congress leaders, including Sachin Pilot, Adhir Ranjan Chowdhury, were detained amid protests against ED's summon to Sonia Gandhi. ""We are being taken by the police to an unknown destination. Two other police buses full of MPs and other party colleagues are there,"" he said.",2022-07-21,Arshiya Chopra,https://www.hindustantimes.com/india-news/shashi-tharoor-sachin-pilot-ashok-gehlot-detained-for-protest-regrettable-101658388149269-amp.html?utm_campaign=fullarticle&utm_medium=referral&utm_source=inshorts,https://static.inshorts.com/inshorts/images/v1/variants/jpg/m/2022/07_jul/21_thu/img_1658389947452_43.jpg?,https://inshorts.com/en/news/being-taken-to-unknown-place-tharoor-after-senior-congress-leaders-detained-amid-protest-1658390754980,Hindustan Times,Thursday
13 Opposition parties issue statement over Centre's 'political vendetta',"As many as 13 Opposition parties attended a meeting on Thursday, chaired by the Congress, to discuss the Centre's ""relentless political vendetta"" through misuse of investigative agencies to target political opponents. This comes ahead of Sonia Gandhi's appearance before ED in Delhi in a money laundering case. ""We will intensify our fight against the anti-people Modi sarkar,"" the Opposition said.",2022-07-21,Atul Mishra,https://www.aninews.in/news/national/general-news/centre-unleashed-political-vendetta-using-probe-agencies-targeting-prominent-leaders-opposition20220721113749/?utm_campaign=fullarticle&utm_medium=referral&utm_source=inshorts,https://static.inshorts.com/inshorts/images/v1/variants/jpg/m/2022/07_jul/21_thu/img_1658384614503_919.jpg?,https://inshorts.com/en/news/13-opposition-parties-issue-statement-over-centres-political-vendetta-1658386597763,ANI,Thursday
Tharoor shares WhatsApp forward on GST on 'Paneer Butter Masala' after hike,"As 'Paneer Butter Masala' trended on social media amid controversy over 5% GST on packaged daily use food items, MP Shashi Tharoor shared a WhatsApp forward saying, ""This one skewers the folly of the GST as few jokes have!"" The Centre has recently imposed 5% GST on daily-use food items, including curd, wheat, pulses, only if they are packed.",2022-07-21,Arshiya Chopra,https://www.hindustantimes.com/india-news/as-paneer-butter-masala-trends-on-twitter-shashi-tharoor-digs-in-101658365592598-amp.html?utm_campaign=fullarticle&utm_medium=referral&utm_source=inshorts,https://static.inshorts.com/inshorts/images/v1/variants/jpg/m/2022/07_jul/21_thu/img_1658374305152_416.jpg?,https://inshorts.com/en/news/tharoor-shares-whatsapp-forward-on-gst-on-paneer-butter-masala-after-hike-1658375546692,Hindustan Times,Thursday
BJP distributes sweets when child is born at someone else's home: Kamal Nath,"Congress leader Kamal Nath alleged that the BJP ""blatantly used police, admin and money"" to win in the Madhya Pradesh (MP) municipal elections. Reacting to BJP's celebration after MP municipal poll results, Nath said, ""BJP lost seven corporations. If they want to celebrate there is no problem. A child is born at someone else's home and BJP starts distributing sweets.""",2022-07-21,Subhangi Singh,https://www.hindustantimes.com/india-news/kamal-nath-takes-dig-at-bjp-celebration-after-mp-civic-polls-a-child-is-born-at-someone-else-s-home-and-101658367289922-amp.html?utm_campaign=fullarticle&utm_medium=referral&utm_source=inshorts,https://static.inshorts.com/inshorts/images/v1/variants/jpg/m/2022/07_jul/21_thu/img_1658376111648_580.jpg?,https://inshorts.com/en/news/bjp-distributes-sweets-when-child-is-born-at-someone-elses-home-kamal-nath-1658377529268,Hindustan Times,Thursday
Cong not letting DK Shivakumar function as KPCC President: K'taka CM,"Karnataka CM Basavaraj Bommai on Wednesday criticised Congress and said the party is not letting DK Shivakumar function as KPCC President. ""Shivakumar has been nursing the dream of becoming the CM...We've been watching what is happening in Congress,"" Bommai said. This comes after DK Shivakumar on Tuesday said Congress coming to power was more important than him becoming the CM.",2022-07-20,Apoorva Shankar,https://aninews.in/news/national/general-news/cong-not-letting-shivakumar-function-as-kpcc-president-cm-bommai20220720190751/?utm_campaign=fullarticle&utm_medium=referral&utm_source=inshorts,https://static.inshorts.com/inshorts/images/v1/variants/jpg/m/2022/07_jul/20_wed/img_1658330304646_535.jpg?,https://inshorts.com/en/news/cong-not-letting-dk-shivakumar-function-as-kpcc-president-ktaka-cm-1658335595520,ANI News,Wednesday
Be fair: AAP MP urges Centre to give representation to Punjab in MSP panel,"AAP MP Vikramjit Singh Sahney on Wednesday urged the Centre to ""be fair"" and include representatives from Punjab in the committee constituted on the minimum support price (MSP) along with the Commission for Agricultural Costs & Prices (CACP). Avoiding a dialogue with representatives of Punjab will not serve the purpose, Sahney said.",2022-07-20,Shiwangi,https://theprint.in/india/be-fair-aap-mp-urges-centre-to-give-adequate-representation-to-punjab-in-msp-committee-cacp/1047368/?amp=&utm_campaign=fullarticle&utm_medium=referral&utm_source=inshorts,https://static.inshorts.com/inshorts/images/v1/variants/jpg/m/2022/07_jul/20_wed/img_1658317432995_822.jpg?,https://inshorts.com/en/news/be-fair-aap-mp-urges-centre-to-give-representation-to-punjab-in-msp-panel-1658320267998,The Print,Wednesday
Is Sonia a super human being?: Pralhad Joshi on Congress' protest,"Union Minister Pralhad Joshi reacted to Congress MPs' protest against questioning of Sonia Gandhi by the Enforcement Directorate and said, ""Everybody is equal before the law or not?"" ""Is the Congress President a super human being? [Congress] thinks they are above the law"", he said in Lok Sabha. The House was adjourned till 11:30 am due to the protest.",2022-07-21,Subhangi Singh,https://twitter.com/ANI/status/1549993629556830208?utm_campaign=fullarticle&utm_medium=referral&utm_source=inshorts,https://static.inshorts.com/inshorts/images/v1/variants/jpg/m/2022/07_jul/21_thu/img_1658384888223_640.jpg?,https://inshorts.com/en/news/is-sonia-a-super-human-being-pralhad-joshi-on-congress-protest-1658390786002,Twitter,Thursday
"When PM Modi was questioned, did we protest?: Prasad on Congress’ protests","BJP’s Ravi Shankar Prasad reacted to Congress’ protests ahead of Congress interim President Sonia Gandhi’s ED questioning on Thursday. “When PM Modi was Gujarat CM, he faced questioning…Did we protest? [PM] Modiji appeared before agencies,” Prasad added. Sonia Gandhi has been summoned by ED in connection with the National Herald case.",2022-07-21,Sakshi Sharma,https://www.hindustantimes.com/india-news/did-we-protest-when-pm-modi-bjp-attacks-cong-over-sonia-gandhi-s-quizzing-101658376409817-amp.html?utm_campaign=fullarticle&utm_medium=referral&utm_source=inshorts,https://static.inshorts.com/inshorts/images/v1/variants/jpg/m/2022/07_jul/21_thu/img_1658385002113_491.jpg?,https://inshorts.com/en/news/when-pm-modi-was-questioned-did-we-protest-prasad-on-congress-protests-1658391167313,Hindustan Times,Thursday
MVA govt didn't implement schemes for minorities properly: Maha SP,"The Maharashtra unit of Samajwadi Party on Wednesday criticised the previous Maha Vikas Aghadi government and said it failed to implement important schemes of the minority ministry properly. ""We've evaluated the performance of...schemes...being run by the state Minority Department,"" SP MLA Rais Shaikh said. ""In nearly 19 of them, the utilisation of funds is less than 50%,"" he added.",2022-07-20,Apoorva Shankar,None,https://static.inshorts.com/inshorts/images/v1/variants/jpg/m/2022/07_jul/20_wed/img_1658327346149_615.jpg?,https://inshorts.com/en/news/mva-govt-didnt-implement-schemes-for-minorities-properly-maha-sp-1658335782708,Inshorts,Wednesday
'Revadi culture' may push Gujarat towards Sri Lanka-like crisis: BJP,"Gujarat BJP chief CR Paatil warned the public to not get misguided by ""revadi culture"" of freebies as it could push the state and country into a Sri Lanka-like crisis. Paatil's statement comes after  AAP's national convener Arvind Kejriwal promised free electricity to people if the party is voted to power in Gujarat after this year's Assembly elections.",2022-07-21,Subhangi Singh,https://www.timesnownews.com/india/revri-culture-may-push-gujarat-towards-sri-lanka-like-crisis-bjp-attacks-aap-in-poll-bound-state-article-93010986?utm_campaign=fullarticle&utm_medium=referral&utm_source=inshorts,https://static.inshorts.com/inshorts/images/v1/variants/jpg/m/2022/07_jul/21_thu/img_1658373265515_178.jpg?,https://inshorts.com/en/news/revadi-culture-may-push-gujarat-towards-sri-lankalike-crisis-bjp-1658375185498,Times Now,Thursday
"PM Modi meets PT Usha after she takes oath in Parliament, shares pic","Prime Minister Narendra Modi met renowned former athlete PT Usha in Parliament after the latter took oath as Rajya Sabha MP on Wednesday. The Prime Minister shared a picture of him standing beside Usha on Twitter. He tweeted, ""Glad to have met PT Usha ji in Parliament."" Usha, 58, has won 18 gold medals for India at several international events.",2022-07-20,Nidhi Sinha,https://www.hindustantimes.com/india-news/glad-to-have-met-narendra-modi-tweets-picture-with-pt-usha-new-rajya-sabha-mp-101658309459071-amp.html?utm_campaign=fullarticle&utm_medium=referral&utm_source=inshorts,https://static.inshorts.com/inshorts/images/v1/variants/jpg/m/2022/07_jul/20_wed/img_1658321167951_183.jpg?,https://inshorts.com/en/news/pm-modi-meets-pt-usha-after-she-takes-oath-in-parliament-shares-pic-1658322049498,Hindustan Times,Wednesday
"Maha CM Eknath Shinde stakes claim over Shiv Sena, sends letter to EC","Maharashtra CM Eknath Shinde on Tuesday night approached the Election Commission of India (ECI), staking claim over the Shiv Sena. CM Shinde on Tuesday said Lok Sabha Speaker Om Birla has recognised rebel Shiv Sena MP Rahul Shewale as the party's floor leader in the Lower House of Parliament. Sanjay Raut on Tuesday called Shinde's faction ""snakes"".",2022-07-20,Nakul Ahuja,None,https://static.inshorts.com/inshorts/images/v1/variants/jpg/m/2022/07_jul/20_wed/img_1658320617031_783.jpg?,https://inshorts.com/en/news/maha-cm-eknath-shinde-stakes-claim-over-shiv-sena-sends-letter-to-ec-1658322591018,Inshorts,Wednesday
Uniting Oppn most crucial thing at the moment: Margaret Alva,"Opposition’s Vice President candidate Margaret Alva said she feels that uniting the Opposition is the most crucial thing at the moment. ""It’s not a question of winning or losing, it’s a question of responding to a challenge before the nation,"" she added. ""There will be various steps which bring them together, I think this is one of those,"" Alva stated.",2022-07-21,Sakshi Sharma,https://www.hindustantimes.com/india-news/uniting-opposition-is-the-most-crucial-thing-at-the-moment-margaret-alva-101658341748854-amp.html?utm_campaign=fullarticle&utm_medium=referral&utm_source=inshorts,https://static.inshorts.com/inshorts/images/v1/variants/jpg/m/2022/07_jul/21_thu/img_1658371840410_397.jpg?,https://inshorts.com/en/news/uniting-oppn-most-crucial-thing-at-the-moment-margaret-alva-1658375595252,Hindustan Times,Thursday
