headlines,text,date,author,read_more,image_url,inshorts_url,original_source,day
Which are the top 10 companies in America as per Fortune 500 list?,"Walmart has topped the 68th edition of the Fortune 500 ranking of America's largest companies, with $572 billion revenue. It is followed by Amazon and Apple, with $469 billion and $365 billion revenue respectively. The list also features CVS Health, UnitedHealth Group and Exxon Mobil. Berkshire Hathaway, Alphabet, McKesson and AmerisourceBergen are the other companies in the top 10.",2022-05-25,Daisy Mowke,https://fortune.com/fortune500/2022/?utm_campaign=fullarticle&utm_medium=referral&utm_source=inshorts,https://static.inshorts.com/inshorts/images/v1/variants/jpg/m/2022/05_may/25_wed/img_1653487893024_951.jpg?,https://inshorts.com/en/news/which-are-the-top-10-companies-in-america-as-per-fortune-500-list-1653490315723,Fortune,Wednesday
British retailer Marks & Spencer to exit Russia after 17 years,"British clothing-to-food retailer Marks and Spencer on Wednesday announced that it will fully exit the Russian market after 17 years. It stopped shipments to Russia in March but earlier stated that complex franchise deals prevented it from withdrawing completely. The company, which has 48 stores there, will face a $39 million hit from its exit, it said.",2022-05-25,Ananya Goyal,https://www.moneycontrol.com/news/business/ukraine-crisis-british-retailer-marks-and-spencer-exits-russia-8574951.html/amp?utm_campaign=fullarticle&utm_medium=referral&utm_source=inshorts,https://static.inshorts.com/inshorts/images/v1/variants/jpg/m/2022/05_may/25_wed/img_1653479869499_586.jpg?,https://inshorts.com/en/news/british-retailer-marks-spencer-to-exit-russia-after-17-years-1653492211104,Moneycontrol,Wednesday
D*** move: Musk on Gates allegedly funding organisations against him,"Tesla CEO Elon Musk in response to an article saying billionaire Bill Gates' foundation funded anti-Musk organisations, said, ""What a d*** move!"" The article claimed that 11 anti-Musk organisations have received funding from a Gates-backed entity. Earlier this month, Gates had said Musk could make Twitter ""worse"" but added that people should have an open mind and ""never underestimate Elon"".",2022-05-25,Aishwarya Awasthi,https://twitter.com/elonmusk/status/1529224801579302912?utm_campaign=fullarticle&utm_medium=referral&utm_source=inshorts,https://static.inshorts.com/inshorts/images/v1/variants/jpg/m/2022/05_may/25_wed/img_1653457544356_585.jpg?,https://inshorts.com/en/news/d-move-musk-on-gates-allegedly-funding-organisations-against-him-1653458683250,Twitter,Wednesday
"Andhra signs deals worth $16 bn at WEF, to generate 38,000 jobs","Andhra Pradesh signed renewables investment pacts worth $16 billion (around ₹1.2 lakh crore) with  three companies, Adani Green Energy, Singapore's GIC sovereign wealth fund-backed Greenko and Aurobindo Realty & Infrastructure, during the WEF at Davos. The pacts involve setting up  hydro, solar and wind power related projects in the state. The investments will create 38,000 jobs, an official said.",2022-05-25,Ananya Goyal,https://www.reuters.com/markets/deals/indias-andhra-state-16-billion-pacts-involving-adani-gic-backed-greenko-2022-05-24/?utm_campaign=fullarticle&utm_medium=referral&utm_source=inshorts,https://static.inshorts.com/inshorts/images/v1/variants/jpg/m/2022/05_may/25_wed/img_1653470850237_6.jpg?,https://inshorts.com/en/news/andhra-signs-deals-worth-$16-bn-at-wef-to-generate-38000-jobs-1653488957350,Reuters,Wednesday
Tesla loses bid to move sexual harassment suit to arbitration in US,"A US judge has rejected Tesla's bid to send a lawsuit alleging widespread sexual harassment at the company's California plant to private arbitration. As per plaintiff Jessica Barraza, workers and supervisors at the plant routinely made lewd comments and gestures to female employees and Tesla failed to address complaints. At least six similar cases are pending in California state court.",2022-05-24,Ananya Goyal,https://www.reuters.com/world/us/tesla-loses-bid-move-sexual-harassment-lawsuit-arbitration-2022-05-24/?utm_campaign=fullarticle&utm_medium=referral&utm_source=inshorts,https://static.inshorts.com/inshorts/images/v1/variants/jpg/m/2022/05_may/24_tue/img_1653411195391_789.jpg?,https://inshorts.com/en/news/tesla-loses-bid-to-move-sexual-harassment-suit-to-arbitration-in-us-1653413632625,Reuters,Tuesday
Amazon opens first physical fashion retail store in Los Angeles,"Amazon on Wednesday announced that it has opened its first brick-and-mortar clothing retail store, called Amazon Style, in US' Los Angeles. As per Amazon, the store will use machine-learning technology to help customers find clothes and personalise recommendations. Customers shopping on the Amazon app will also have the option to try out their selections at the physical store, it added.",2022-05-25,Ananya Goyal,https://www.reuters.com/markets/us/amazon-opens-first-physical-fashion-retail-store-2022-05-25/?utm_campaign=fullarticle&utm_medium=referral&utm_source=inshorts,https://static.inshorts.com/inshorts/images/v1/variants/jpg/m/2022/05_may/25_wed/img_1653489994160_288.jpg?,https://inshorts.com/en/news/amazon-opens-first-physical-fashion-retail-store-in-los-angeles-1653491604774,Reuters,Wednesday
Pay more attention: Ethereum Co-founder on recent crypto crash,"People must pay more attention to what is belying the currency name when they get involved, said Ethereum's Co-founder Gavin Wood with regard to the recent crypto crash which wiped $800 billion off their value. The crypto crash led to Terra's LUNA crypto token crashing nearly 100%. ""The internet has no real concept of legality,"" Wood added.",2022-05-25,Ashley Paul,https://www.reuters.com/markets/us/pay-more-attention-ethereum-co-founder-says-crypto-crash-2022-05-25/?utm_campaign=fullarticle&utm_medium=referral&utm_source=inshorts,https://static.inshorts.com/inshorts/images/v1/variants/jpg/m/2022/05_may/25_wed/img_1653475095250_64.jpg?,https://inshorts.com/en/news/pay-more-attention-ethereum-cofounder-on-recent-crypto-crash-1653477666870,Reuters,Wednesday
Gujarat govt to soon launch India's first carbon trading market,Gujarat government has announced plans for setting up India's first cap-and-trade market for carbon emissions. The market will help industries that are unable to meet their emission targets to trade and purchase surplus targets from other industries which have met their goals. Gujarat government has also been running the world's first Emissions Trading Market for Particulate Pollution since 2019.,2022-05-25,Ashley Paul,https://www.timesnownews.com/exclusive/gujarat-to-launch-indias-first-carbon-trading-market-how-does-this-aid-climate-action-article-91784032/amp?utm_campaign=fullarticle&utm_medium=referral&utm_source=inshorts,https://static.inshorts.com/inshorts/images/v1/variants/jpg/m/2022/05_may/25_wed/img_1653468978059_572.jpg?,https://inshorts.com/en/news/gujarat-govt-to-soon-launch-indias-first-carbon-trading-market-1653471240673,Times Now,Wednesday
Power Ministry seeks 2-yr extension to emissions deadline: Report,"The Power Ministry has sought a two-year extension for the installation of emission-cutting equipment in thermal power plants, Reuters reported. The government initially had set a 2017 deadline but later changed it to varying deadlines for different regions, ending in 2022. Thermal power companies account for some 80% of India's industrial emissions of sulphur- and nitrous-oxides, Reuters said.",2022-05-25,Ananya Goyal,https://www.reuters.com/world/india/india-power-ministry-seeks-2-yr-delay-emission-norms-deadline-2022-05-25/?utm_campaign=fullarticle&utm_medium=referral&utm_source=inshorts,https://static.inshorts.com/inshorts/images/v1/variants/jpg/m/2022/05_may/25_wed/img_1653498430928_788.jpg?,https://inshorts.com/en/news/power-ministry-seeks-2yr-extension-to-emissions-deadline-report-1653500965821,Reuters,Wednesday
Govt on course to privatise two public sector banks: Report,"The government is committed to the privatisation of two public sector banks (PSBs) and will take the steps required in the coming months, PTI reported. As per its sources, Central Bank of India and Indian Overseas Bank are the likely candidates for privatisation. The government had announced its intent to take up the privatisation of two PSBs in Budget 2021-22.",2022-05-25,Ananya Goyal,https://www.financialexpress.com/industry/banking-finance/govt-on-course-on-psu-bank-privatisation-sources/2537906/lite/?utm_campaign=fullarticle&utm_medium=referral&utm_source=inshorts,https://static.inshorts.com/inshorts/images/v1/variants/jpg/m/2022/05_may/25_wed/img_1653499567449_778.jpg?,https://inshorts.com/en/news/govt-on-course-to-privatise-two-public-sector-banks-report-1653501412560,Financial Express,Wednesday
"Would've been nice, but $10 bn was too much: KM Birla on Holcim deal","Aditya Birla Group Chairperson Kumar Mangalam Birla on Wednesday said his company couldn't acquire Holcim's Indian business ""primarily due to pricing issue"". He stated, ""It'd have been nice to have clinched the Holcim deal...[But] $10 billion was too high a price."" Holcim's stake in Ambuja Cements and ACC was eventually taken over by Adani Group in a $10.5 billion deal.",2022-05-25,Ananya Goyal,https://www.moneycontrol.com/news/business/10-billion-was-too-high-a-price-for-holcim-deal-says-kumar-mangalam-birla-8576521.html/amp?utm_campaign=fullarticle&utm_medium=referral&utm_source=inshorts,https://static.inshorts.com/inshorts/images/v1/variants/jpg/m/2022/05_may/25_wed/img_1653493779456_931.jpg?,https://inshorts.com/en/news/wouldve-been-nice-but-$10-bn-was-too-much-km-birla-on-holcim-deal-1653500604839,Moneycontrol,Wednesday
Can alter output target: Tata Steel CEO on 15% export tax on steel,"Tata Steel CEO TV Narendran told Reuters that if the 15% export tax on some steel products remains in place for a long time, the company might have to review its production targets. ""You will only build as much capacity as you need for the domestic market,"" Narendran stated. He added that in the medium-to-long term, India should ""encourage"" exports.",2022-05-24,Ananya Goyal,https://www.reuters.com/markets/commodities/tata-steel-says-india-export-tax-could-alter-output-targets-2022-05-24/?utm_campaign=fullarticle&utm_medium=referral&utm_source=inshorts,https://static.inshorts.com/inshorts/images/v1/variants/jpg/m/2022/05_may/24_tue/img_1653413286779_233.jpg?,https://inshorts.com/en/news/can-alter-output-target-tata-steel-ceo-on-15-export-tax-on-steel-1653414198681,Reuters,Tuesday
Cabinet approves sale of govt's stake in Hindustan Zinc: Report,"The Union Cabinet has approved sale of the Centre's entire residual stake in Hindustan Zinc Limited, Moneycontrol reported citing CNBC Awaaz. The government owns a 29.5% stake in the mining company, while Vedanta Limited holds a 64.92% stake. At current market price, the government's residual stake in Hindustan Zinc is valued at around ₹38,740 crore.",2022-05-25,Ashley Paul,https://www.moneycontrol.com/news/business/cabinet-approves-sale-of-29-5-stake-in-hindustan-zinc-8573901.html/amp?utm_campaign=fullarticle&utm_medium=referral&utm_source=inshorts,https://static.inshorts.com/inshorts/images/v1/variants/jpg/m/2022/05_may/25_wed/img_1653470150115_400.jpg?,https://inshorts.com/en/news/cabinet-approves-sale-of-govts-stake-in-hindustan-zinc-report-1653473729830,Moneycontrol,Wednesday
Advanced economies to be back on track by 2024: IMF's Gopinath,"International Monetary Fund's First Deputy MD Gita Gopinath on Wednesday said advanced economies will be back on track by 2024, but developing economies would be 5% below where they would've been otherwise. ""Prices of commodities including fuel and food are going up around the world,"" Gopinath said. Central banks are trying to tackle this high level of inflation, she added.",2022-05-25,Ashley Paul,https://www.moneycontrol.com/news/business/economy/advanced-economies-to-be-back-on-track-by-2024-gopinath-8574071.html/amp?utm_campaign=fullarticle&utm_medium=referral&utm_source=inshorts,https://static.inshorts.com/inshorts/images/v1/variants/jpg/m/2022/05_may/25_wed/img_1653472275144_783.jpg?,https://inshorts.com/en/news/advanced-economies-to-be-back-on-track-by-2024-imfs-gopinath-1653473981565,Moneycontrol,Wednesday
Shell causing 'extreme harm' to planet: UK consultant as she quits,"Caroline Dennett, a UK-based safety consultant for Shell for 11 years, quit publicly while accusing the company of causing ""extreme harm"" to the planet. ""I can no longer work for a company that ignores all...the risks of climate change,"" Dennett wrote on LinkedIn. She added, ""Contrary to Shell's public expressions around net zero, they're...planning to explore and extract much more.""",2022-05-24,Ananya Goyal,https://www.independent.co.uk/climate-change/news/shell-energy-uk-oil-risk-b2085196.html?utm_campaign=fullarticle&utm_medium=referral&utm_source=inshorts,https://static.inshorts.com/inshorts/images/v1/variants/jpg/m/2022/05_may/24_tue/img_1653408412842_754.jpg?,https://inshorts.com/en/news/shell-causing-extreme-harm-to-planet-uk-consultant-as-she-quits-1653413905566,The Independent,Tuesday
"Indigo's net loss widens to ₹1,681.8 crore in Q4, income rises 29%","India's biggest airline Indigo on Wednesday reported a net loss of ₹1,681.8 crore in the quarter ending March 31, 2022. This year's Q4 loss was 46.6% more than the loss incurred by the airline in the corresponding period a year ago. Meanwhile, its total income for the quarter jumped 29% y-o-y to ₹8,207.5 crore from ₹6,361.8 crore in Q4 FY21.",2022-05-25,Ananya Goyal,https://www.moneycontrol.com/news/business/earnings/indigo-q4-result-net-loss-widens-to-rs-1681-80-crore-as-fuel-expenses-surge-8575001.html/amp?utm_campaign=fullarticle&utm_medium=referral&utm_source=inshorts,https://static.inshorts.com/inshorts/images/v1/variants/jpg/m/2022/05_may/25_wed/img_1653496016074_679.jpg?,https://inshorts.com/en/news/indigos-net-loss-widens-to-₹16818-crore-in-q4-income-rises-29-1653501180733,Moneycontrol,Wednesday
5 NBFCs' registration cancelled due to irregular lending practices,"RBI on Wednesday said it has cancelled the Certificate of Registration (CoR) of five non-banking financial companies (NBFCs) due to irregular lending practices. The CoRs were cancelled as the NBFCs violated RBI's Fair Practices Code. The NBFCs were also not complying with extant regulations pertaining to charging of excessive interest and had resorted to undue harassment of customers, RBI said.",2022-05-25,Ashley Paul,https://theprint.in/economy/rbi-cancels-registration-of-five-nbfcs-due-to-irregular-lending-practices/970830/?amp=&utm_campaign=fullarticle&utm_medium=referral&utm_source=inshorts,https://static.inshorts.com/inshorts/images/v1/variants/jpg/m/2022/05_may/25_wed/img_1653490678756_320.jpg?,https://inshorts.com/en/news/5-nbfcs-registration-cancelled-due-to-irregular-lending-practices-1653492176713,The Print,Wednesday
Snap's shares crash 41% in their biggest-ever intraday decline,"Shares of Snapchat's parent company Snap crashed over 41% on Tuesday, marking their biggest intraday decline ever since the company went public in 2017. The company's share price dipped below its initial public offering (IPO) price to as low as $13.55. Snap's stock crashed after the company cut its revenue and profit forecasts citing rising inflation and Russia-Ukraine war's impact.",2022-05-24,Hiral Goyal,https://www.bqprime.com/business/snap-falls-after-saying-revenue-will-come-in-below-guidance?utm_campaign=fullarticle&utm_medium=referral&utm_source=inshorts,https://static.inshorts.com/inshorts/images/v1/variants/jpg/m/2022/05_may/24_tue/img_1653407875266_277.jpg?,https://inshorts.com/en/news/snaps-shares-crash-41-in-their-biggestever-intraday-decline-1653408933657,BQ Prime,Tuesday
"Govt allows duty free import of crude soyabean, sunflower oils for 2 years","The Central government has allowed duty free import of crude soyabean oil and crude sunflower oil for a period of two years. A quantity of 20 lakh metric tonne of crude soyabean oil and crude sunflower oil each per year will incur a 'NIL' rate of customs duty and agricultural infrastructure and development cess, effective May 25, the government said.",2022-05-24,Hiral Goyal,https://twitter.com/cbic_india/status/1529128204845617153?utm_campaign=fullarticle&utm_medium=referral&utm_source=inshorts,https://static.inshorts.com/inshorts/images/v1/variants/jpg/m/2022/05_may/24_tue/img_1653409153574_180.jpg?,https://inshorts.com/en/news/govt-allows-duty-free-import-of-crude-soyabean-sunflower-oils-for-2-years-1653409303310,Twitter,Tuesday
Mahindra honoured at US college where his father was the 1st Indian graduate,"Businessman Anand Mahindra was honoured with the Dean's Medal at Tufts University's The Fletcher School, 75 years after his father Harish Mahindra became the first-ever Indian graduate of the college. Sharing pictures from the ceremony, Mahindra said, ""In the 75th year of Indian Independence, I was honoured to be the first Indian to address the School's Class Day.""",2022-05-24,Sakshita Khosla,https://www.timesnownews.com/business-economy/companies/anand-mahindra-honoured-by-us-school-where-his-father-was-1st-indian-graduate-article-91770205/amp?utm_campaign=fullarticle&utm_medium=referral&utm_source=inshorts,https://static.inshorts.com/inshorts/images/v1/variants/jpg/m/2022/05_may/24_tue/img_1653404917441_939.jpg?,https://inshorts.com/en/news/mahindra-honoured-at-us-college-where-his-father-was-the-1st-indian-graduate-1653405514142,Times Now,Tuesday
2 IIMs make it to world's top 50 colleges for executive education in FT ranking,"Indian Institute of Management (IIM) Ahmedabad and IIM Bangalore have made it among the top 50 colleges for executive education, occupying the 39th and 45th places in Financial Times (FT) latest ranking. The executive education custom FT ranking also featured the Indian School of Business, Hyderabad (38th rank), apart from IIM Ahmedabad (50) and IIM Bangalore (43).",2022-05-24,Sakshita Khosla,https://www.financialexpress.com/education-2/iim-ahmedabad-back-in-top-50-in-ft-rankings/2535418/lite/?utm_campaign=fullarticle&utm_medium=referral&utm_source=inshorts,https://static.inshorts.com/inshorts/images/v1/variants/jpg/m/2022/05_may/24_tue/img_1653388458164_670.jpg?,https://inshorts.com/en/news/2-iims-make-it-to-worlds-top-50-colleges-for-executive-education-in-ft-ranking-1653389580549,Financial Express,Tuesday
"Snap to slow down hiring, expects to miss quarterly revenue target","Snap CEO Evan Spiegel has told his employees that the company would significantly slow down hiring for the rest of the year and it may miss its revenue goals for the quarter. Spiegel wrote, ""Like many companies, we continue to face rising inflation and interest rates, supply chain shortages and labour disruptions,...the impact of the war in Ukraine, and more.""",2022-05-24,Ridham Gambhir,https://www.reuters.com/article/snap-outlook-idUKKCN2N922D?utm_campaign=fullarticle&utm_medium=referral&utm_source=inshorts,https://static.inshorts.com/inshorts/images/v1/variants/jpg/m/2022/05_may/24_tue/img_1653377524318_229.jpg?,https://inshorts.com/en/news/snap-to-slow-down-hiring-expects-to-miss-quarterly-revenue-target-1653378894386,Reuters,Tuesday
"The richer someone is, the fewer kids they have, I'm an exception: Musk","World's richest man Elon Musk tweeted, ""Contrary to what many think, the richer someone is, the fewer kids they have."" The 50-year-old father of seven children said he's ""a rare exception"", adding that ""most people I know have zero or one kid"". Musk earlier said that the belief that having fewer children is better for the environment is ""total nonsense"".",2022-05-24,Hiral Goyal,https://twitter.com/elonmusk/status/1529100718065569792?utm_campaign=fullarticle&utm_medium=referral&utm_source=inshorts,https://static.inshorts.com/inshorts/images/v1/variants/jpg/m/2022/05_may/24_tue/img_1653402792668_581.jpg?,https://inshorts.com/en/news/the-richer-someone-is-the-fewer-kids-they-have-im-an-exception-musk-1653404251407,Twitter,Tuesday
Russia's biggest mobile operator starts selling used phones amid inflation,"Russia’s biggest mobile operator MTS has started selling discounted and used smartphones amid inflation and Western brands suspending shipments. While Apple has paused all product sales in Russia due to the Ukraine war, sales of Chinese smartphone brands doubled in the first two weeks of March in Russia. ""This is a good opportunity for our company,"" said an MTS official.",2022-05-24,Ridham Gambhir,https://www.reuters.com/business/media-telecom/russias-no-1-mobile-operator-mts-starts-selling-used-discounted-smartphones-2022-05-24/?utm_campaign=fullarticle&utm_medium=referral&utm_source=inshorts,https://static.inshorts.com/inshorts/images/v1/variants/jpg/m/2022/05_may/24_tue/img_1653388787616_409.jpg?,https://inshorts.com/en/news/russias-biggest-mobile-operator-starts-selling-used-phones-amid-inflation-1653390659981,Reuters,Tuesday
$200 billion wiped off social media firms' market value after Snap's profit warning,"Social media companies lost about $200 billion in market value on Tuesday after Snap's shares crashed over 40%. The sector-wide selloff was triggered after Snapchat's parent company said it is expecting to miss quarterly revenue and profit targets and will have to slow hiring. Shares of Meta Platforms, Pinterest, Twitter and Google-parent Alphabet were all down between 7% and 24%.",2022-05-24,Hiral Goyal,https://www.reuters.com/markets/us/snap-incs-profit-warning-sends-ripples-through-social-media-stocks-2022-05-24/?utm_campaign=fullarticle&utm_medium=referral&utm_source=inshorts,https://static.inshorts.com/inshorts/images/v1/variants/jpg/m/2022/05_may/24_tue/img_1653412602464_792.jpg?,https://inshorts.com/en/news/$200-billion-wiped-off-social-media-firms-market-value-after-snaps-profit-warning-1653413042692,Reuters,Tuesday
"Delhivery shares close 10% higher on first day of trading, m-cap hits ₹38,851 cr","Shares of logistics startup Delhivery closed 10.11% higher on their first day of trading on Tuesday. The stock ended at ₹536.25 on the NSE, after listing at a premium of 1.7% over an issue price of ₹487 per share. The Gurugram-based startup, which had raised ₹5,235 crore through its IPO, held a market capitalisation of ₹38,851 crore on Tuesday's close.",2022-05-24,Hiral Goyal,https://www.nseindia.com/get-quotes/equity?symbol=DELHIVERY&utm_campaign=fullarticle&utm_medium=referral&utm_source=inshorts,https://static.inshorts.com/inshorts/images/v1/variants/jpg/m/2022/05_may/24_tue/img_1653388890316_702.jpg?,https://inshorts.com/en/news/delhivery-shares-close-10-higher-on-first-day-of-trading-mcap-hits-₹38851-cr-1653390478466,NSE India,Tuesday
Klarna doesn't exist in a bubble: CEO after firing 10% of startup's workforce,"Klarna CEO Sebastian Siemiatkowski told employees the Swedish fintech startup ""doesn't exist in a bubble"" as he announced plans to fire about 10% of its global workforce. ""When we set our business plans for 2022...it was a very different world,"" he wrote. ""Since then, we've seen a tragic...war in Ukraine unfold...increase in inflation, a highly volatile stock market,"" Siemiatkowski added.",2022-05-24,Hiral Goyal,https://www.klarna.com/us/blog/company-announcement-from-ceo-sebastian/?utm_campaign=fullarticle&utm_medium=referral&utm_source=inshorts,https://static.inshorts.com/inshorts/images/v1/variants/jpg/m/2022/05_may/24_tue/img_1653382110046_107.jpg?,https://inshorts.com/en/news/klarna-doesnt-exist-in-a-bubble-ceo-after-firing-10-of-startups-workforce-1653384040118,Klarna,Tuesday
Delhivery rises 10% after its shares list at 1.68% premium,"Logistics and supply chain startup Delhivery's shares saw a nearly 10% rise in intraday trade on Tuesday after its stock got listed at ₹495.20 apiece, 1.68% over the issue price, on NSE. On BSE, the shares were listed at ₹493 apiece, a premium of 1.2% over its issue price of ₹487. Delhivery had launched its ₹5,235-crore IPO on May 11.",2022-05-24,Aishwarya Awasthi,https://www.moneycontrol.com/news/business/ipo/muted-listing-delhivery-ipo-shares-list-at-rs-495-20-a-1-68-premium-over-issue-price-8562951.html/amp?utm_campaign=fullarticle&utm_medium=referral&utm_source=inshorts,https://static.inshorts.com/inshorts/images/v1/variants/jpg/m/2022/05_may/24_tue/img_1653372894125_756.jpg?,https://inshorts.com/en/news/delhivery-rises-10-after-its-shares-list-at-168-premium-1653375625543,Moneycontrol,Tuesday
"Zomato shares record best day since market debut, close 14% higher","Shares of homegrown food delivery startup Zomato on Tuesday recorded their best day since the stock market debut in July last year. Zomato shares closed 14.72% higher on NSE on Tuesday after soaring 18% during intraday trading. The company's shares gained despite Zomato reporting a net loss of ₹359.7 crore for the fourth quarter, while its revenue surged 75% year-on-year.",2022-05-24,Hiral Goyal,https://www.bqprime.com/business/zomato-share-price-jumps-13-after-q4-results-as-analysts-bet-on-better-unit-economics?utm_campaign=fullarticle&utm_medium=referral&utm_source=inshorts,https://static.inshorts.com/inshorts/images/v1/variants/jpg/m/2022/05_may/24_tue/img_1653396454788_714.jpg?,https://inshorts.com/en/news/zomato-shares-record-best-day-since-market-debut-close-14-higher-1653398135468,BQ Prime,Tuesday
