headlines,text,date,author,read_more,image_url,inshorts_url,original_source,day
Tesla won't make cars in India if we aren't allowed to sell and service first: Musk,"Tesla CEO Elon Musk responded to a Twitter user who asked about Tesla's plans for a manufacturing plant in India and said, ""Tesla will not put a manufacturing plant in any location where we aren't allowed first to sell and service cars."" Earlier, Union Minister Nitin Gadkari said Tesla is welcome to India, make cars for sale and export them.",2022-05-27,Hiral Goyal,https://twitter.com/elonmusk/status/1530218725114228737?utm_campaign=fullarticle&utm_medium=referral&utm_source=inshorts,https://static.inshorts.com/inshorts/images/v1/variants/jpg/m/2022/05_may/27_fri/img_1653668993789_258.jpg?,https://inshorts.com/en/news/tesla-wont-make-cars-in-india-if-we-arent-allowed-to-sell-and-service-first-musk-1653671737191,Twitter,Friday
Google in talks to join India's open e-commerce network ONDC: Report,"Google is in talks with the central government to integrate its shopping services with the country’s Open Network for Digital Commerce (ONDC), as per a report by Reuters. Modelled around the Unified Payments Interface (UPI) project, ONDC will allow buyers and sellers of e-commerce goods like grocery, food delivery and others, to transact regardless of the platform they are registered.",2022-05-27,Ridham Gambhir,https://www.reuters.com/world/india/google-talks-join-indias-open-e-commerce-network-ondc-sources-2022-05-27/?utm_campaign=fullarticle&utm_medium=referral&utm_source=inshorts,https://static.inshorts.com/inshorts/images/v1/variants/jpg/m/2022/05_may/27_fri/img_1653646752585_200.jpg?,https://inshorts.com/en/news/google-in-talks-to-join-indias-open-ecommerce-network-ondc-report-1653648394270,Reuters,Friday
"Anil Agarwal meets Bill Gates, says 'his knowledge about India surprises me'","Vedanta Resources' billionaire Chairman Anil Agarwal met the world's fourth-richest person Bill Gates during World Economic Forum 2022 in Davos. Sharing a picture with the Microsoft Co-founder, Agarwal wrote on LinkedIn, ""He always surprises me with how much he knows about India and his love for Indian food!"" He said the two bonded over their initial struggles as first-generation entrepreneurs.",2022-05-28,Hiral Goyal,https://www.linkedin.com/feed/update/urn:li:activity:6935583523026145280/?utm_campaign=fullarticle&utm_medium=referral&utm_source=inshorts,https://static.inshorts.com/inshorts/images/v1/variants/jpg/m/2022/05_may/28_sat/img_1653727977673_939.jpg?,https://inshorts.com/en/news/anil-agarwal-meets-bill-gates-says-his-knowledge-about-india-surprises-me-1653729662661,LinkedIn,Saturday
I guess I have trust issues with Bill Gates: Elon Musk,"The world's richest person Elon Musk remarked, ""I guess I have some trust issues"" with Bill Gates. A Twitter user wrote that she didn’t trust Gates, to which Musk replied, ""Since Gates still has a multi-billion dollar short position against Tesla while claiming to help with global warming, I guess I’ve some trust issues with him too.""",2022-05-28,Ridham Gambhir,https://twitter.com/elonmusk/status/1530341556443664387?utm_campaign=fullarticle&utm_medium=referral&utm_source=inshorts,https://static.inshorts.com/inshorts/images/v1/variants/jpg/m/2022/05_may/28_sat/img_1653709195795_182.jpg?,https://inshorts.com/en/news/i-guess-i-have-trust-issues-with-bill-gates-elon-musk-1653710467540,Twitter,Saturday
"Nykaa's Q4 net profit falls 49% to ₹8.56 crore, revenue rises to ₹973 crore","Beauty e-commerce startup Nykaa's parent FSN E-Commerce Ventures Ltd reported that the net profit attributable to its shareholders dropped 49% year-on-year to ₹8.56 crore in the quarter ended March. While the company's revenue from operations rose 31% year-on-year to ₹973 crore, its expenses rose to about ₹979 crore from ₹725 crore a year earlier.",2022-05-27,Hiral Goyal,https://www.moneycontrol.com/news/business/earnings/nykaa-reports-49-fall-in-quarterly-net-profit-at-rs-8-56-crore-8593581.html/amp?utm_campaign=fullarticle&utm_medium=referral&utm_source=inshorts,https://static.inshorts.com/inshorts/images/v1/variants/jpg/m/2022/05_may/27_fri/img_1653661883963_889.jpg?,https://inshorts.com/en/news/nykaas-q4-net-profit-falls-49-to-₹856-crore-revenue-rises-to-₹973-crore-1653664852965,Moneycontrol,Friday
RBI includes 'work from anywhere' policy for staff in its agenda for 2022-23,"The RBI in its annual report that was released on Friday stated ""working from anywhere"" under its agenda for 2022-2023. While it had operationalised work from home during COVID-19, the annual report further stated, ""The roadmap for the year would include…To devise a policy on 'working from anywhere' for building a seamless work environment as part of business continuity planning.""",2022-05-27,Ridham Gambhir,https://www.moneycontrol.com/news/business/economy/rbi-annual-report-coming-soon-work-from-anywhere-policy-8592511.html/amp?utm_campaign=fullarticle&utm_medium=referral&utm_source=inshorts,https://static.inshorts.com/inshorts/images/v1/variants/jpg/m/2022/05_may/27_fri/img_1653650158886_293.jpg?,https://inshorts.com/en/news/rbi-includes-work-from-anywhere-policy-for-staff-in-its-agenda-for-202223-1653651832409,Moneycontrol,Friday
Economic recovery is underway in spite of headwinds: RBI in its annual report,"In its annual report released on Friday, the RBI while referring to the Indian economy said that ""a recovery is underway in spite of headwinds"". Highlighting ""structural reforms"", RBI said that the future path of growth will be conditioned by addressing ""supply-side bottlenecks and calibrating monetary and fiscal policy support to aggregate demand and structural reforms"".",2022-05-27,Ridham Gambhir,https://www.moneycontrol.com/news/business/rbi-annual-report-economic-recovery-momentum-to-continue-in-fy23-with-downside-risks-8588591.html/amp?utm_campaign=fullarticle&utm_medium=referral&utm_source=inshorts,https://static.inshorts.com/inshorts/images/v1/variants/jpg/m/2022/05_may/27_fri/img_1653636640296_262.jpg?,https://inshorts.com/en/news/economic-recovery-is-underway-in-spite-of-headwinds-rbi-in-its-annual-report-1653638204373,Moneycontrol,Friday
"Fake ₹500 notes see over 100% jump in FY22, fake ₹2,000 notes rise 54%: RBI","Counterfeit notes detected in the denomination of ₹500 saw an increase of 101.9% during 2021-22 compared to the previous year, as per RBI's annual report. According to the data, ₹500 notes were worst hit, followed by ₹2,000 notes which saw a year-on-year increase of 54.16%. Counterfeit notes detected in denominations of ₹50 and ₹100 declined by 28.7% and 16.7%, respectively.",2022-05-28,Hiral Goyal,https://www.timesnownews.com/business-economy/economy/over-100-increase-in-fake-rs-500-notes-counterfeit-rs-2000-currency-notes-up-over-50-article-91838716/amp?utm_campaign=fullarticle&utm_medium=referral&utm_source=inshorts,https://static.inshorts.com/inshorts/images/v1/variants/jpg/m/2022/05_may/28_sat/img_1653744626909_634.jpg?,https://inshorts.com/en/news/fake-₹500-notes-see-over-100-jump-in-fy22-fake-₹2000-notes-rise-54-rbi-1653747285406,Times Now,Saturday
World's biggest coal miner Coal India to import for first time since 2015: Report,"World's biggest coal miner Coal India will import coal for the first time since 2015 amid shortages, Reuters reported. ""Coal India would import coal for blending on government-to-government...basis and supply...to thermal power plants of state generators and independent power producers,"" a letter by the Power Ministry said. This comes as India faces its worst power cuts in over six years.",2022-05-28,Hiral Goyal,https://www.reuters.com/world/india/coal-india-import-coal-supply-states-document-2022-05-28/?utm_campaign=fullarticle&utm_medium=referral&utm_source=inshorts,https://static.inshorts.com/inshorts/images/v1/variants/jpg/m/2022/05_may/28_sat/img_1653757426232_493.jpg?,https://inshorts.com/en/news/worlds-biggest-coal-miner-coal-india-to-import-for-first-time-since-2015-report-1653758707577,Reuters,Saturday
Indian oil firms' dividend worth $125.5 mn stuck in Russia due to sanctions,"A dividend amounting to $125.49 million belonging to Indian oil companies is stuck in Russia due to Western sanctions over the Ukraine war, said an Oil India official. A consortium comprising Oil India, Indian Oil Corporation and Bharat Petroleum Corporation own 23.9% of Russia's Vankorneft oil project and 29.9% of the Tass-Yuryakh oilfield in east Siberia.",2022-05-28,Ridham Gambhir,https://www.reuters.com/markets/commodities/india-oil-cos-1255-mln-dividend-oil-assets-stuck-russia-2022-05-27/?utm_campaign=fullarticle&utm_medium=referral&utm_source=inshorts,https://static.inshorts.com/inshorts/images/v1/variants/jpg/m/2022/05_may/28_sat/img_1653720563445_303.jpg?,https://inshorts.com/en/news/indian-oil-firms-dividend-worth-$1255-mn-stuck-in-russia-due-to-sanctions-1653721802872,Reuters,Saturday
Russian billionaire named wife as owner of his firms day before EU sanctions: Report,"Russian billionaire businessman Andrey Melnichenko ceded ownership of two of the world's largest coal and fertilisers companies to his wife the day before he was sanctioned by the European Union, as per a report. Notably, the sanctions which included freezing his assets and banning his entry into the EU, didn’t apply to his wife or the couple's children.",2022-05-28,Ridham Gambhir,https://www.moneycontrol.com/news/trends/features/how-a-russian-billionaire-shielded-assets-from-european-sanctions-8597261.html/amp?utm_campaign=fullarticle&utm_medium=referral&utm_source=inshorts,https://static.inshorts.com/inshorts/images/v1/variants/jpg/m/2022/05_may/28_sat/img_1653734907835_262.jpg?,https://inshorts.com/en/news/russian-billionaire-named-wife-as-owner-of-his-firms-day-before-eu-sanctions-report-1653736324664,Moneycontrol,Saturday
Govt to develop framework to check fake reviews on online shopping websites,"The central government on Saturday said that in order to protect consumer interest, it will develop a framework to keep a check on fake reviews posted on e-commerce websites. As per an official statement, the framework will be developed after studying the present mechanism being followed by the e-commerce websites and the best practices available globally.",2022-05-28,Ridham Gambhir,https://www.moneycontrol.com/news/business/centre-to-develop-framework-to-check-fake-reviews-on-e-commerce-websites-8597301.html/amp?utm_campaign=fullarticle&utm_medium=referral&utm_source=inshorts,https://static.inshorts.com/inshorts/images/v1/variants/jpg/m/2022/05_may/28_sat/img_1653726274527_868.jpg?,https://inshorts.com/en/news/govt-to-develop-framework-to-check-fake-reviews-on-online-shopping-websites-1653728865680,Moneycontrol,Saturday
"Share of ₹2,000 notes in circulation falls as RBI prints no new notes for 3rd year","The share of India's highest denomination currency note in circulation is continuing to drop as the RBI has not printed any new ₹2,000 note since 2019-20, according to the central bank's annual report for 2021-22. As of March 31, there were 214 crore notes of ₹2,000 denomination in circulation, compared with 245 crore notes a year ago, the report showed.",2022-05-27,Hiral Goyal,https://theprint.in/economy/number-of-rs-2000-currency-notes-continue-to-decline-accounted-for-just-1-6-pc-of-total-notes-in-circulation-at-march-end/973366/?amp=&utm_campaign=fullarticle&utm_medium=referral&utm_source=inshorts,https://static.inshorts.com/inshorts/images/v1/variants/jpg/m/2022/05_may/27_fri/img_1653651836348_128.jpg?,https://inshorts.com/en/news/share-of-₹2000-notes-in-circulation-falls-as-rbi-prints-no-new-notes-for-3rd-year-1653654287313,The Print,Friday
"United Spirits to sell 32 brands, including Haywards, to Inbrew for ₹820 cr","United Spirits on Saturday announced that its board has approved the sale of 32 brands to Singapore-headquartered Inbrew Beverages for ₹820 crore. The transaction includes brands such as Haywards, Old Tavern, White-Mischief, Honey Bee, Green Label and Romanov. Further, United Spirits and Inbrew have entered into a five-year franchise arrangement for 11 other brands, including Bagpiper, it said.",2022-05-28,Hiral Goyal,https://www.financialexpress.com/industry/united-spirits-signs-sale-franchise-agreements-for-select-brands-with-inbrew/2540572/lite/?utm_campaign=fullarticle&utm_medium=referral&utm_source=inshorts,https://static.inshorts.com/inshorts/images/v1/variants/jpg/m/2022/05_may/28_sat/img_1653739464242_539.jpg?,https://inshorts.com/en/news/united-spirits-to-sell-32-brands-including-haywards-to-inbrew-for-₹820-cr-1653742244662,Financial Express,Saturday
"Musk shares cartoon on freeing Twitter's blue bird from a cage, Twitter users react","Amid the Twitter acquisition deal being put on hold, Tesla CEO Elon Musk shared a cartoon featuring a caricature resembling him freeing Twitter's iconic blue bird from a cage. Meanwhile, Dogecoin Co-creator Billy Markus commented, ""Despite all my rage, I am still just a bird in a cage."" Another Twitter user wrote, ""Twitter is about to get more interesting.""",2022-05-28,Ridham Gambhir,https://twitter.com/elonmusk/status/1530380264966434823?utm_campaign=fullarticle&utm_medium=referral&utm_source=inshorts,https://static.inshorts.com/inshorts/images/v1/variants/jpg/m/2022/05_may/28_sat/img_1653723880652_719.jpg?,https://inshorts.com/en/news/musk-shares-cartoon-on-freeing-twitters-blue-bird-from-a-cage-twitter-users-react-1653724979633,Twitter,Saturday
Axis MF ex-fund manager fired in front-running case sends legal notice to firm,"Viresh Joshi, a former fund manager at Axis Mutual Fund who was fired after being suspended on allegations of front-running, has sent a legal notice to the company against his ""unlawful termination"". Axis AMC, one of India's leading mutual funds, is facing allegations of front-running. It earlier said it has been conducting a suo moto internal investigation since February 2022.",2022-05-27,Hiral Goyal,https://www.timesnownews.com/business-economy/companies/axis-mutual-fund-front-running-case-sacked-fund-manager-sends-legal-notice-to-company-article-91831536/amp?utm_campaign=fullarticle&utm_medium=referral&utm_source=inshorts,https://static.inshorts.com/inshorts/images/v1/variants/jpg/m/2022/05_may/27_fri/img_1653673269383_895.jpg?,https://inshorts.com/en/news/axis-mf-exfund-manager-fired-in-frontrunning-case-sends-legal-notice-to-firm-1653673823632,Times Now,Friday
"Musk calls recession 'good thing', says, 'Money raining on fools for too long'","Responding to a follower who asked him if recession was approaching, Tesla CEO Elon Musk tweeted, ""Yes, but this is actually a good thing."" He added, ""It has been raining money on fools for too long. Some bankruptcies need to happen."" In another tweet, he also said that the recession may last for ""about 12 to 18 months"".",2022-05-27,Ridham Gambhir,https://twitter.com/elonmusk/status/1529983508206190592?utm_campaign=fullarticle&utm_medium=referral&utm_source=inshorts,https://static.inshorts.com/inshorts/images/v1/variants/jpg/m/2022/05_may/27_fri/img_1653635393863_795.jpg?,https://inshorts.com/en/news/musk-calls-recession-good-thing-says-money-raining-on-fools-for-too-long-1653636803283,Twitter,Friday
Adani Wilmar best-performing Asia IPO among firms that raised over $100 mn in 2022,"Asia's richest man Gautam Adani's Adani Wilmar is the best-performing stock among 121 Asian companies that listed on the stock exchanges after raising over $100 million this year. Shares of Adani Wilmar have almost tripled since their market debut. Notably, almost two-thirds of Asia's new stock listings are trading in the red amid rising interest rates and the Russia-Ukraine war.",2022-05-27,Hiral Goyal,https://www.bqprime.com/markets/billionaire-adani-s-food-venture-is-best-performing-asia-ipo?utm_campaign=fullarticle&utm_medium=referral&utm_source=inshorts,https://static.inshorts.com/inshorts/images/v1/variants/jpg/m/2022/05_may/27_fri/img_1653641124145_882.jpg?,https://inshorts.com/en/news/adani-wilmar-bestperforming-asia-ipo-among-firms-that-raised-over-$100-mn-in-2022-1653642404457,BQ Prime,Friday
Asia's richest man's Adani Enterprises to buy 50% stake in General Aeronautics,"Asia's richest man Gautam Adani's Adani Enterprises on Friday announced that it has signed a definitive agreement to acquire 50% stake in General Aeronautics Private Limited. The Bengaluru-based company provides robotic drones and drone-based solutions for crop protection. The company didn't disclose the financial details of the deal. The deal is expected to close by July 31, 2022.",2022-05-27,Hiral Goyal,https://www.moneycontrol.com/news/business/adani-enterprises-to-acquire-50-stake-in-general-aeronautics-8591541.html/amp?utm_campaign=fullarticle&utm_medium=referral&utm_source=inshorts,https://static.inshorts.com/inshorts/images/v1/variants/jpg/m/2022/05_may/27_fri/img_1653649951064_79.jpg?,https://inshorts.com/en/news/asias-richest-mans-adani-enterprises-to-buy-50-stake-in-general-aeronautics-1653650154761,Moneycontrol,Friday
Will give away most of my wealth; kids to get the family house: Moderna CEO,"Moderna CEO Stéphane Bancel told Bloomberg in an interview that he plans to donate the bulk of his family wealth. The 49-year-old billionaire said, ""[My kids] will get the family house, you know. But the rest we're going to give away."" Bancel holds a 1.36% stake in Moderna and has an estimated net worth of $4.1 billion, as per Bloomberg.",2022-05-27,Hiral Goyal,https://www.moneycontrol.com/news/business/moderna-ceo-bancel-says-hell-give-most-of-his-money-away-8586081.html/amp?utm_campaign=fullarticle&utm_medium=referral&utm_source=inshorts,https://static.inshorts.com/inshorts/images/v1/variants/jpg/m/2022/05_may/27_fri/img_1653642970187_700.jpg?,https://inshorts.com/en/news/will-give-away-most-of-my-wealth-kids-to-get-the-family-house-moderna-ceo-1653645287624,Moneycontrol,Friday
"'Fun and Tasty', 'The Same One' among possible new names for McDonald's in Russia","McDonald's in Russia has registered possible new brand names such as ‘Fun and Tasty’, 'The Same One', 'Just Like That' and ‘Open Checkout’ for the firm taking over its restaurants in the country. McDonald's, which owns 84% of its restaurants in Russia, is selling its nearly 850 stores in the country to a local licensee, Alexander Govor.",2022-05-28,Ridham Gambhir,https://www.reuters.com/business/retail-consumer/fun-tasty-among-possible-names-mcdonalds-russian-successor-2022-05-27/?utm_campaign=fullarticle&utm_medium=referral&utm_source=inshorts,https://static.inshorts.com/inshorts/images/v1/variants/jpg/m/2022/05_may/28_sat/img_1653711020673_434.jpg?,https://inshorts.com/en/news/fun-and-tasty-the-same-one-among-possible-new-names-for-mcdonalds-in-russia-1653713654277,Reuters,Saturday
"Drone industry to reach ₹15,000 cr turnover by 2026: Scindia","Addressing the 'Bharat Drone Mahotsav 2022' event, Union Minister for Civil Aviation Jyotiraditya Scindia said, ""It is estimated that the drone industry will reach ₹15,000 crore turnover by the year 2026."" Currently, there are 270 drone startups in India, Scindia said during the event. 'Bharat Drone Mahotsav 2022' is a two-day event (May 27-28) being held in Delhi's Pragati Maidan.",2022-05-27,Subhangi Singh,https://twitter.com/ANI/status/1530061491122016256?utm_campaign=fullarticle&utm_medium=referral&utm_source=inshorts,https://static.inshorts.com/inshorts/images/v1/variants/jpg/m/2022/05_may/27_fri/img_1653634825343_347.jpg?,https://inshorts.com/en/news/drone-industry-to-reach-₹15000-cr-turnover-by-2026-scindia-1653636997738,Twitter,Friday
Broadcom to acquire VMware for $61 billion in one of the largest tech deals,Broadcom Inc. agreed to buy cloud-computing company VMware Inc. for about $61 billion in cash and stock in one of the largest technology deals of all time. VMware shareholders will elect to receive either $142.50 in cash or 0.2520 shares of Broadcom common stock for each VMware share. Broadcom will also assume $8 billion of VMware's net debt.,2022-05-26,Daisy Mowke,https://www.reuters.com/markets/us/chipmaker-broadcom-buy-vmware-61-bln-deal-2022-05-26/?utm_campaign=fullarticle&utm_medium=referral&utm_source=inshorts,https://static.inshorts.com/inshorts/images/v1/variants/jpg/m/2022/05_may/26_thu/img_1653571612851_180.jpg?,https://inshorts.com/en/news/broadcom-to-acquire-vmware-for-$61-billion-in-one-of-the-largest-tech-deals-1653573851229,Reuters,Thursday
India's interests no different from EU's: India on importing Russian oil in ruble,"On being asked whether India would pay in ruble for Russian oil at the World Economic Forum in Davos, Union Minister Piyush Goyal said every country has to look after its national interest. He added that India's interests are no different from the European Union's. He said any suggestion that India was contributing to the Ukraine situation doesn't stand scrutiny.",2022-05-26,Apaar Sharma,https://theprint.in/world/india-looks-after-its-interests-just-like-europe-piyush-goyal-on-russia-imports-amid-ukraine-conflict/971203/?amp=&utm_campaign=fullarticle&utm_medium=referral&utm_source=inshorts,https://static.inshorts.com/inshorts/images/v1/variants/jpg/m/2022/05_may/26_thu/img_1653540333338_189.jpg?,https://inshorts.com/en/news/indias-interests-no-different-from-eus-india-on-importing-russian-oil-in-ruble-1653542623794,The Print,Thursday
"I'm a fan of Jack, wish he stayed on the board: Musk after Dorsey exits Twitter board","After former Twitter CEO Jack Dorsey stepped down from the company's board, Tesla CEO Elon Musk tweeted, ""I'm a fan of Jack."" Musk added, ""Wish he would stay on the board, but I understand that he needs to move on."" Dorsey had quit as Twitter CEO in November last year after handing over the post to Indian-origin Parag Agrawal.",2022-05-27,Ridham Gambhir,https://twitter.com/elonmusk/status/1529875823184035841?utm_campaign=fullarticle&utm_medium=referral&utm_source=inshorts,https://static.inshorts.com/inshorts/images/v1/variants/jpg/m/2022/05_may/27_fri/img_1653619214684_218.jpg?,https://inshorts.com/en/news/im-a-fan-of-jack-wish-he-stayed-on-the-board-musk-after-dorsey-exits-twitter-board-1653620985467,Twitter,Friday
Tesla planning to build 24-hr diner & a drive-in theatre in LA: Report,"Tesla is reportedly planning to build a 24-hour diner with a drive-in movie theatre and a supercharger station in Los Angeles. As per a report, on May 19, Tesla filed the necessary documents for this. The site will have 28 supercharger stalls and two movie screens that can accommodate over 200 people while food will reportedly be delivered to cars.",2022-05-27,Ridham Gambhir,https://news.abplive.com/offbeat/elon-musk-is-planning-a-24x7-futuristic-tesla-diner-for-hollywood-report-1533990/amp?utm_campaign=fullarticle&utm_medium=referral&utm_source=inshorts,https://static.inshorts.com/inshorts/images/v1/variants/jpg/m/2022/05_may/27_fri/img_1653624577782_278.jpg?,https://inshorts.com/en/news/tesla-planning-to-build-24hr-diner-a-drivein-theatre-in-la-report-1653625788997,ABP Live,Friday
25-yr-old college dropout named youngest self-made billionaire by Forbes,"Alexandr Wang, 25, has been named the world's youngest self-made billionaire by Forbes. Wang dropped out of MIT at the age of 19 to co-found a software company, Scale AI. His company helps in deploying artificial intelligence and generates an estimated $100 million in revenue at $7.3 billion valuation. Wang's estimated 15% stake in the company is worth $1 billion.",2022-05-27,Ridham Gambhir,https://www.moneycontrol.com/news/trends/meet-worlds-youngest-self-made-billionaire-alexandr-wang-who-dropped-out-of-college-at-19-8582261.html/amp?utm_campaign=fullarticle&utm_medium=referral&utm_source=inshorts,https://static.inshorts.com/inshorts/images/v1/variants/jpg/m/2022/05_may/27_fri/img_1653627405192_525.jpg?,https://inshorts.com/en/news/25yrold-college-dropout-named-youngest-selfmade-billionaire-by-forbes-1653629021946,Moneycontrol,Friday
Ex-Twitter official accuses Dorsey of 'backstabbing' Twitter board by helping Musk,"An ex-Twitter board member has accused former CEO Jack Dorsey of ""backstabbing"" his company’s board by helping Tesla CEO Elon Musk acquire it. Jason Goldman said that after it was agreed to bring Musk on as a director, Dorsey ""shared his personal view that Twitter would be able to better focus on execution as a private company"".",2022-05-27,Ridham Gambhir,https://www.moneycontrol.com/news/trends/jack-dorsey-accused-of-backstabbing-twitter-board-by-helping-elon-musk-8584831.html/amp?utm_campaign=fullarticle&utm_medium=referral&utm_source=inshorts,https://static.inshorts.com/inshorts/images/v1/variants/jpg/m/2022/05_may/27_fri/img_1653633607172_920.jpg?,https://inshorts.com/en/news/extwitter-official-accuses-dorsey-of-backstabbing-twitter-board-by-helping-musk-1653635085994,Moneycontrol,Friday
Twitter investors sue Musk for 'manipulating' firm's stock price via his tweets,"Twitter investors have sued Tesla CEO Elon Musk, accusing him of ""market manipulation"" and for a decline in Twitter's stock price. They claimed Musk saved himself $156 million by not revealing that he had purchased more than 5% of Twitter by March 14. Musk's criticism of Twitter via his tweets also led to the company's share price drop, they added.",2022-05-27,Ridham Gambhir,https://www.reuters.com/markets/deals/musk-sued-by-twitter-investors-delayed-disclosure-stake-2022-05-26/?utm_campaign=fullarticle&utm_medium=referral&utm_source=inshorts,https://static.inshorts.com/inshorts/images/v1/variants/jpg/m/2022/05_may/27_fri/img_1653621658492_73.jpg?,https://inshorts.com/en/news/twitter-investors-sue-musk-for-manipulating-firms-stock-price-via-his-tweets-1653623461711,Reuters,Friday
