headlines,text,date,author,read_more,image_url,inshorts_url,original_source,day
All practices in compliance with law: Zomato after CCI orders probe,"Zomato issued a statement after the Competition Commission of India ordered an investigation into the conduct of Swiggy and Zomato. It said while CCI has prima facie didn't find concerns with respect to their independence on levy of commissions or alleged bundling of services, it'll work to assist them and explain why their services are in compliance with the law.",2022-04-05,Ridham Gambhir,https://www.moneycontrol.com/news/business/zomato-says-it-will-explain-to-cci-why-its-practices-comply-with-the-competition-law-8319391.html/amp?utm_campaign=fullarticle&utm_medium=referral&utm_source=inshorts,https://static.inshorts.com/inshorts/images/v1/variants/jpg/m/2022/04_apr/5_tue/img_1649155011424_120.jpg?,https://inshorts.com/en/news/all-practices-in-compliance-with-law-zomato-after-cci-orders-probe-1649156256045,Moneycontrol,Tuesday
"I've never traded stocks, I don't even have a brokerage account: Zoho CEO","Zoho's billionaire CEO Sridhar Vembu told Moneycontrol, ""I have never actually traded. In fact, I don't even have a brokerage account."" Stockbroking startup Zerodha's CEO Nithin Kamath, who was also a part of the conversation, was asked if he would make a pitch to add Vembu on Zerodha. ""I don't think Sridhar has to invest in the markets,"" Kamath replied.",2022-04-04,Hiral Goyal,https://www.moneycontrol.com/news/trends/zohos-sridhar-vembu-reveals-he-doesnt-have-a-brokerage-account-zerodha-ceo-nithin-kamath-responds-8316831.html/amp?utm_campaign=fullarticle&utm_medium=referral&utm_source=inshorts,https://static.inshorts.com/inshorts/images/v1/variants/jpg/m/2022/04_apr/4_mon/img_1649091487241_608.jpg?,https://inshorts.com/en/news/ive-never-traded-stocks-i-dont-even-have-a-brokerage-account-zoho-ceo-1649092577365,Moneycontrol,Monday
Zomato shares decline after CCI orders probe,Shares of Zomato fell up to 5% on Tuesday after the Competition Commission of India (CCI) ordered an investigation into the conduct of Zomato and Swiggy. Zomato said it will assist the CCI in their investigation into the preferential listing of restaurant partners and pricing parity across platforms. Zomato shares later pared losses and were trading 2.61% lower on NSE.,2022-04-05,Hiral Goyal,https://www.bloombergquint.com/markets/share-market-live-sgx-nifty-gains-vedanta-ril-bajaj-finance-tcs-mindtree-zomato-in-focus?utm_campaign=fullarticle&utm_medium=referral&utm_source=inshorts,https://static.inshorts.com/inshorts/images/v1/variants/jpg/m/2022/04_apr/5_tue/img_1649148707523_202.jpg?,https://inshorts.com/en/news/zomato-shares-decline-after-cci-orders-probe-1649150849507,BloombergQuint,Tuesday
How much are petrol and diesel prices expected to further rise according to experts?,"Experts have noted that retail prices of petrol and diesel need to be hiked by ₹0.52-0.60 for every $1/barrel rise in the price of crude oil for oil marketing companies. The price of Brent crude has risen by about $28.4/barrel since November 4 to $108.9/barrel, indicating that fuel prices could see further hikes of ₹5.5-7.8/litre each on petrol and diesel.",2022-04-05,Ankush Verma,None,https://static.inshorts.com/inshorts/images/v1/variants/jpg/m/2022/04_apr/5_tue/img_1649151076942_347.jpg?,https://inshorts.com/en/news/how-much-are-petrol-and-diesel-prices-expected-to-further-rise-according-to-experts-1649153008027,Inshorts,Tuesday
"Boss in UK pays 60 employees over ₹74,000 each to help them pay bills","A boss in the UK paid 60 of his workers £750 (over ₹74,000) each to help them pay their bills amid rising living costs in the country. The 51-year-old MD of Emerys Timber and Builders Merchants said he wanted to ""share back the success of the business"". UK energy regulator Ofgem has announced a hike in the energy price cap.",2022-04-05,Ridham Gambhir,https://www.mirror.co.uk/money/hero-boss-gives-each-worker-26629927.amp?utm_campaign=fullarticle&utm_medium=referral&utm_source=inshorts,https://static.inshorts.com/inshorts/images/v1/variants/jpg/m/2022/04_apr/5_tue/img_1649149294648_264.jpg?,https://inshorts.com/en/news/boss-in-uk-pays-60-employees-over-₹74000-each-to-help-them-pay-bills-1649150515888,Mirror,Tuesday
Investors get ₹4.5 lakh crore richer as Sensex rallies over HDFC merger,"Investors turned richer by over ₹4.5 lakh crore on Monday as Sensex ended 1,335 points higher at 60,612, primarily led by the merger announcement of HDFC and HDFC Bank. Data showed that investor wealth, measured by the combined market capitalisation of BSE-listed companies, rose to around ₹272.46 lakh crore. Investors of HDFC group companies gained over 1 lakh crore.",2022-04-04,Kiran Khatri,https://news.abplive.com/business/mutual-funds/investor-wealth-soars-rs-4-5-lakh-crore-as-markets-rally-over-hdfc-twins-merger-1523557/amp?utm_campaign=fullarticle&utm_medium=referral&utm_source=inshorts,https://static.inshorts.com/inshorts/images/v1/variants/jpg/m/2022/04_apr/4_mon/img_1649091989202_308.jpg?,https://inshorts.com/en/news/investors-get-₹45-lakh-crore-richer-as-sensex-rallies-over-hdfc-merger-1649092885091,ABP Live,Monday
Elephants can dance as well: HDFC Bank's CEO on merger with HDFC,"HDFC Bank's CEO Sashidhar Jagdishan, who will lead the merged entity of HDFC Bank and HDFC, said, ""Elephants can dance as well."" When asked about the next milestone, Jagdishan said, ""We don't work for any milestones."" He added, ""Even if I'm not there...this engine created by the founding fathers...it's such a fantastic platform that it will grow on its own.""",2022-04-05,Pragya Swastik,https://www.bloombergquint.com/business/hdfc-hdfc-bank-merger-elephants-can-dance-as-well-says-ceo-sashidhar-jagdishan?utm_campaign=fullarticle&utm_medium=referral&utm_source=inshorts,https://static.inshorts.com/inshorts/images/v1/variants/jpg/m/2022/04_apr/5_tue/img_1649155689206_648.jpg?,https://inshorts.com/en/news/elephants-can-dance-as-well-hdfc-banks-ceo-on-merger-with-hdfc-1649157414852,BloombergQuint,Tuesday
"FIIs & FPIs may come and go, retail investors take care of markets: FM","Finance Minister Nirmala Sitharaman on Monday said that retail investors have brought a shock-absorbing capacity into the Indian markets. ""FIIs and FPIs may come and go but today the Indian retail investors have proven that any shock that may come in is now taken care of,"" she added. Sitharaman further informed Lok Sabha that the inflow of FDI remains unabated.",2022-04-04,Hiral Goyal,None,https://static.inshorts.com/inshorts/images/v1/variants/jpg/m/2022/04_apr/4_mon/img_1649082574614_1.jpg?,https://inshorts.com/en/news/fiis-fpis-may-come-and-go-retail-investors-take-care-of-markets-fm-1649084286018,Inshorts,Monday
Crypto payments worth ₹2.2 cr made in 11 drug trafficking cases: Govt,"Narcotics Control Bureau and Central Board of Indirect Taxes and Customs have unearthed crypto payments worth ₹2.2 crore in 11 drug trafficking cases, Minister of State for Finance Pankaj Chaudhary said. Government is taking steps to check such usage, he added. Liaisoning with technical experts and coordination with foreign drug law enforcement agencies is being done regularly, Chaudhary said.",2022-04-04,Ashley Paul,https://www.financialexpress.com/digital-currency/ncb-cbic-unearth-rs-2-2-cr-payment-in-cryptocurrency-in-11-drug-trafficking-cases/2481273/lite/?utm_campaign=fullarticle&utm_medium=referral&utm_source=inshorts,https://static.inshorts.com/inshorts/images/v1/variants/jpg/m/2022/04_apr/4_mon/img_1649076251870_975.jpg?,https://inshorts.com/en/news/crypto-payments-worth-₹22-cr-made-in-11-drug-trafficking-cases-govt-1649082963951,Financial Express,Monday
Musk is sending strong signal to Twitter CEO Agrawal: Cathie Wood,"ARK Invest's Cathie Wood said that Tesla CEO Elon Musk is ""sending a strong signal"" to the new Twitter CEO Parag Agrawal, after Musk's 9.2% Twitter stake was revealed. She added Musk is making a statement about censorship and that Musk doesn't believe in it. Wood also discussed that the news could also be ""setting up for another leadership change"".",2022-04-05,Aishwarya Awasthi,https://www.moneycontrol.com/news/world/cathie-wood-sees-potential-for-twitter-shakeup-after-elon-musk-takes-stake-8317641.html/amp?utm_campaign=fullarticle&utm_medium=referral&utm_source=inshorts,https://static.inshorts.com/inshorts/images/v1/variants/jpg/m/2022/04_apr/5_tue/img_1649136854246_903.jpg?,https://inshorts.com/en/news/musk-is-sending-strong-signal-to-twitter-ceo-agrawal-cathie-wood-1649138695014,Moneycontrol,Tuesday
Paytm Payments Bank yet to appoint firm for IT audit: Govt,"Minister of State for Finance Bhagwat Karad said Paytm Payments Bank hasn't yet appointed a firm to conduct an audit of its IT systems. On March 11, RBI barred the bank from onboarding new customers and ordered it to appoint an audit firm. Order followed a report that the bank allegedly leaked data to Chinese entities, Bloomberg reported citing sources.",2022-04-04,Ashley Paul,https://www.moneycontrol.com/news/business/banks/paytm-payments-bank-yet-to-appoint-firm-for-it-audit-government-tells-lok-sabha-8314431.html/amp?utm_campaign=fullarticle&utm_medium=referral&utm_source=inshorts,https://static.inshorts.com/inshorts/images/v1/variants/jpg/m/2022/04_apr/4_mon/img_1649081550641_416.jpg?,https://inshorts.com/en/news/paytm-payments-bank-yet-to-appoint-firm-for-it-audit-govt-1649084541602,Moneycontrol,Monday
"Amazon, Future Retail agree in Supreme Court to appear before SIAC","Amazon and Future Retail (FRL) expressed their agreement before the Supreme Court on Monday to appear before the Singapore International Arbitration Centre (SIAC) over FRL's deal with Reliance Retail. Amazon and FRL are involved in legal fight over FRL's ₹24,713-crore deal with Reliance. The Supreme Court told the companies that it will request the arbitration tribunal to expedite the proceedings.",2022-04-04,Hiral Goyal,https://theprint.in/india/amazon-future-agrees-in-sc-to-appear-before-arbitration-tribunal-siac/902217/?amp=&utm_campaign=fullarticle&utm_medium=referral&utm_source=inshorts,https://static.inshorts.com/inshorts/images/v1/variants/jpg/m/2022/04_apr/4_mon/img_1649092538323_100.jpg?,https://inshorts.com/en/news/amazon-future-retail-agree-in-supreme-court-to-appear-before-siac-1649093588965,The Print,Monday
"IndiGo suspends few pilots, they reportedly planned protest over pay cuts","Some IndiGo pilots were suspended for planning a mass leave on Tuesday to protest against pay cuts, reports said. IndiGo pilots' salaries were cut by as much as 30% during the COVID-19 pandemic's peak. ""We confirm that a handful of IndiGo pilots have been suspended...for indulging in activities that are in contravention to the terms of their employment,"" IndiGo said.",2022-04-04,Ashley Paul,None,https://static.inshorts.com/inshorts/images/v1/variants/jpg/m/2022/04_apr/4_mon/img_1649091822687_133.jpg?,https://inshorts.com/en/news/indigo-suspends-few-pilots-they-reportedly-planned-protest-over-pay-cuts-1649093848663,Inshorts,Monday
Petrol prices reach ₹110.25/litre in B'luru as fuel rates hiked again,"Fuel prices were hiked again across the country for the 13th time in 15 days on Tuesday. Following the latest price revision, the price of petrol has reached ₹110.25 per litre in Bengaluru, while that of diesel has reached ₹94.01 per litre. Meanwhile, Karnataka Electricity Regulatory Commission has hiked electricity tariffs by five paise per unit across the state.",2022-04-05,Dharini Mudgal,None,https://static.inshorts.com/inshorts/images/v1/variants/jpg/m/2022/04_apr/5_tue/img_1649154644752_540.jpg?,https://inshorts.com/en/news/petrol-prices-reach-₹11025litre-in-bluru-as-fuel-rates-hiked-again-1649158591457,Inshorts,Tuesday
Will protect interest of Supertech twin towers' homebuyers: SC,"The Supreme Court on Monday said it will protect the interest of homebuyers of Supertech's 40-storey twin towers in its Emerald Court project. The Supreme Court noted submissions of senior advocate S Ganesh, appearing for Supertech's ex-management, that of the 711 homebuyers, claims of 652 homebuyers had been settled. The remaining homebuyers need to be refunded ₹14.96 crore in total.",2022-04-04,Ashley Paul,https://www.hindustantimes.com/real-estate/supertechs-twin-tower-homebuyers-interest-will-be-protected-says-sc-101649078792216-amp.html?utm_campaign=fullarticle&utm_medium=referral&utm_source=inshorts,https://static.inshorts.com/inshorts/images/v1/variants/jpg/m/2022/04_apr/4_mon/img_1649083764597_951.jpg?,https://inshorts.com/en/news/will-protect-interest-of-supertech-twin-towers-homebuyers-sc-1649091384790,Hindustan Times,Monday
We must have a common culture post-merger: HDFC Chairman,"HDFC and HDFC Bank ""will have to have a common culture"" after the merger, HDFC Chairman Deepak Parekh said on Tuesday. ""Now, bank will have to deal in housing loans which is very emotional, personal...So we have to be very careful with all our customers,"" he added. As per the announcement, HDFC will acquire a 41% stake in HDFC Bank.",2022-04-05,Ashley Paul,https://www.moneycontrol.com/news/business/companies/deepak-parekh-exclusive-interview-hdfc-and-hdfc-bank-need-to-have-a-common-culture-8319091.html/amp?utm_campaign=fullarticle&utm_medium=referral&utm_source=inshorts,https://static.inshorts.com/inshorts/images/v1/variants/jpg/m/2022/04_apr/5_tue/img_1649149780547_233.jpg?,https://inshorts.com/en/news/we-must-have-a-common-culture-postmerger-hdfc-chairman-1649151020045,Moneycontrol,Tuesday
India's trade deficit rises by 87.5% to $192 billion in 2021-22,"India's trade deficit rose by 87.5% from $102.63 billion in 2020-21 to $192.41 billion in 2021-22, government data showed on Monday. While total exports in FY22 rose to a record high of $417.81 billion, imports too soared 54.71% year-on-year to $610.22 billion on the back of rising global fuel and commodity prices. Merchandise imports in FY21 stood at $394.44 billion.",2022-04-04,Ashley Paul,https://www.financialexpress.com/economy/indias-trade-deficit-rises-88-in-fy22-govt-data/2481438/lite/?utm_campaign=fullarticle&utm_medium=referral&utm_source=inshorts,https://static.inshorts.com/inshorts/images/v1/variants/jpg/m/2022/04_apr/4_mon/img_1649080420726_444.jpg?,https://inshorts.com/en/news/indias-trade-deficit-rises-by-875-to-$192-billion-in-202122-1649089664038,Financial Express,Monday
Banks force you to travel to the home branch for everything: Jupiter,"People face a lot of trouble due to the rules of some banks, said Jupiter, a 100%* digital banking app, adding that people have to take leaves from work or they end up wasting their weekend just doing bank work. Tired of such routines, Jupiter promises to be a banking partner for millennials and offers a 100%* digital banking experience.",2022-04-04,Roshan Gupta,https://inshorts.com/safe_redirect?url=https%3A%2F%2Fjptr.onelink.me%2FTOMp%2F7wt0txw3&inshorts_open_externally=true,https://static.inshorts.com/inshorts/images/v1/variants/jpg/m/2022/04_apr/4_mon/img_1649037992200_559.jpg?,https://inshorts.com/en/news/banks-force-you-to-travel-to-the-home-branch-for-everything-jupiter-1649048417768,Jupiter,Monday
"CNG price hiked by ₹2.5 per kg in Delhi, to now cost ₹64.11 per kg","The Indraprastha Gas Limited (IGL) has hiked the price of Compressed Natural Gas (CNG) in Delhi by ₹2.5 per kg from Monday. CNG will now cost ₹64.11 per kg in the national capital. ""In view of the CNG price hike, we are not in favour of switching on the cab's air conditioner for passengers,"" a city-based cab driver told ANI.",2022-04-04,Shreyasi Banerjee,https://www.timesnownews.com/business-economy/economy/cng-price-hike-igl-increases-price-by-rs-2-5-per-kg-in-delhi-check-latest-rate-article-90634330/amp?utm_campaign=fullarticle&utm_medium=referral&utm_source=inshorts,https://static.inshorts.com/inshorts/images/v1/variants/jpg/m/2022/04_apr/4_mon/img_1649052656305_607.jpg?,https://inshorts.com/en/news/cng-price-hiked-by-₹25-per-kg-in-delhi-to-now-cost-₹6411-per-kg-1649055057837,Times Now,Monday
HDFC board approves merger of company with HDFC Bank,"The board of Housing Development Finance Corporation (HDFC) has approved the merger of the firm with HDFC Bank. Following the merger, HDFC Bank will be 100% owned by public shareholders and existing shareholders of HDFC Limited will own 41% of HDFC Bank. ""[It]...shall enable HDFC Bank to build its housing loan portfolio and enhance its existing customer base,"" HDFC said.",2022-04-04,Anmol Sharma,https://www.bseindia.com/xml-data/corpfiling/AttachLive/0b17984a-38cb-4b65-9f6c-c14fc0e7fae2.pdf?utm_campaign=fullarticle&utm_medium=referral&utm_source=inshorts,https://static.inshorts.com/inshorts/images/v1/variants/jpg/m/2022/04_apr/4_mon/img_1649045183276_820.jpg?,https://inshorts.com/en/news/hdfc-board-approves-merger-of-company-with-hdfc-bank-1649046040336,BSE,Monday
Elon Musk discloses 9.2% stake in Twitter,"World's richest person and Tesla CEO Elon Musk has disclosed a passive stake of 9.2% in Twitter, Bloomberg reported citing a US Securities and Exchange Commission filing. Following the news, shares of the social media platform jumped more than 25% in pre-market trading in the US. Musk's stake is worth around $2.89 billion, based on Twitter's closing price on Friday.",2022-04-04,Kiran Khatri,https://twitter.com/moneycontrolcom/status/1510925821028241408?utm_campaign=fullarticle&utm_medium=referral&utm_source=inshorts,https://static.inshorts.com/inshorts/images/v1/variants/jpg/m/2022/04_apr/4_mon/img_1649068482622_944.jpg?,https://inshorts.com/en/news/elon-musk-discloses-92-stake-in-twitter-1649069152040,Moneycontrol,Monday
"India's exports touch record high of $417.8 bn in FY22, govt calls it 'historic'","Union Commerce Minister Piyush Goyal on Sunday announced that India's exports touched a record high of $417.8 billion in FY22, and called the milestone ""historic"". ""It's the first time that the country's yearly exports have reached this figure and the exports were 5% above the set target,"" Goyal said. Goods worth $40 billion were exported in March 2022 alone.",2022-04-03,Pragya Swastik,https://twitter.com/PiyushGoyal/status/1510566597961740291?s=20&t=PoR_UUBY1WAPCV3L3BV8Xw&utm_campaign=fullarticle&utm_medium=referral&utm_source=inshorts,https://static.inshorts.com/inshorts/images/v1/variants/jpg/m/2022/04_apr/3_sun/img_1648986523184_97.jpg?,https://inshorts.com/en/news/indias-exports-touch-record-high-of-$4178-bn-in-fy22-govt-calls-it-historic-1648988434456,Twitter,Sunday
"Petrol, diesel prices hiked for 12th time in 14 days","Petrol and diesel prices have been hiked for the 12th time in 14 days. Petrol in Delhi now costs ₹103.81/litre after being increased by 40 paise/litre, while diesel price in the national capital has gone up to ₹95.07/litre from ₹94.67/litre. In Mumbai, petrol cost has jumped to ₹118.83/litre from ₹118.41/litre, and diesel price has been increased to ₹103.07/litre from ₹102.64/litre.",2022-04-04,Anmol Sharma,None,https://static.inshorts.com/inshorts/images/v1/variants/jpg/m/2022/04_apr/4_mon/img_1649041193390_765.jpg?,https://inshorts.com/en/news/petrol-diesel-prices-hiked-for-12th-time-in-14-days-1649042516687,Inshorts,Monday
"HDFC Bank-HDFC merger may create India's 2nd-largest company, beating TCS","HDFC and HDFC Bank saw their combined market capitalisation surpass that of India's second-most valued company, TCS, on Monday. Following the announcement that HDFC will merge itself with HDFC Bank, both stocks surged over 9% each during intraday trade. At closing, HDFC Bank's market value stood at ₹9.18 lakh crore, while HDFC's market cap was at ₹4.84 lakh crore.",2022-04-04,Kiran Khatri,https://www.businessinsider.in/business/corporates/news/hdfc-bank-hdfc-together-the-second-largest-company-in-india-beating-tcs/amp_articleshow/90635725.cms?utm_campaign=fullarticle&utm_medium=referral&utm_source=inshorts,https://static.inshorts.com/inshorts/images/v1/variants/jpg/m/2022/04_apr/4_mon/img_1649062851228_674.jpg?,https://inshorts.com/en/news/hdfc-bankhdfc-merger-may-create-indias-2ndlargest-company-beating-tcs-1649064145746,Business Insider,Monday
Elon Musk becomes Twitter's largest shareholder with 9.2% stake,"World's richest person Elon Musk has become the largest shareholder of Twitter after he disclosed that he owns a 9.2% passive stake in the platform. It's more than quadruple the 2.25% stake held by Twitter Co-founder and former CEO Jack Dorsey. Notably, Musk conducted a Twitter poll last month asking users whether Twitter adheres to the principle of free speech.",2022-04-04,Hiral Goyal,https://www.bloombergquint.com/business/musk-takes-9-2-stake-in-twitter-after-questioning-platform?utm_campaign=fullarticle&utm_medium=referral&utm_source=inshorts,https://static.inshorts.com/inshorts/images/v1/variants/jpg/m/2022/04_apr/4_mon/img_1649071920515_57.jpg?,https://inshorts.com/en/news/elon-musk-becomes-twitters-largest-shareholder-with-92-stake-1649074012123,BloombergQuint,Monday
"30-yr-old crypto billionaire drives Corolla, sleeps on bean bag & has 10 roommates","Sam Bankman-Fried, the 30-year-old CEO of the world's third-largest crypto exchange FTX, ""lives like a college student"", sleeps on a bean bag and drives a Toyota Corolla, Bloomberg reported. ""When he's not at the office, he crashes at an apartment with 10 roommates, though it's a penthouse,"" Bloomberg added. Sam, worth over $20 billion, is currently living in the Bahamas.",2022-04-04,Pragya Swastik,https://www.bloombergquint.com/markets/sam-bankman-fried-ftx-s-crypto-billionaire-who-wants-to-give-his-fortune-away?utm_campaign=fullarticle&utm_medium=referral&utm_source=inshorts,https://static.inshorts.com/inshorts/images/v1/variants/jpg/m/2022/04_apr/4_mon/img_1649062460049_189.jpg?,https://inshorts.com/en/news/30yrold-crypto-billionaire-drives-corolla-sleeps-on-bean-bag-has-10-roommates-1649063863072,BloombergQuint,Monday
I'll keep only 1% of my earnings: FTX's 30-yr-old crypto billionaire worth $20 bn,"Sam Bankman-Fried, the 30-year-old CEO of the world's third-largest crypto exchange FTX, told Bloomberg that he'll ""keep enough money to maintain a comfortable life: 1% of his earnings or, at minimum, $100,000 a year."" Bloomberg added, ""Other than that, he plans to give it all away—every dollar, or Bitcoin."" Sam Bankman-Fried has a net worth of over $20 billion.",2022-04-04,Pragya Swastik,https://www.bloombergquint.com/markets/sam-bankman-fried-ftx-s-crypto-billionaire-who-wants-to-give-his-fortune-away?utm_campaign=fullarticle&utm_medium=referral&utm_source=inshorts,https://static.inshorts.com/inshorts/images/v1/variants/jpg/m/2022/04_apr/4_mon/img_1649061003051_858.jpg?,https://inshorts.com/en/news/ill-keep-only-1-of-my-earnings-ftxs-30yrold-crypto-billionaire-worth-$20-bn-1649063962424,BloombergQuint,Monday
$71 billion wiped out of market cap of Singapore's Grab and Sea in 3 months,"Singapore's two largest new-economy companies have lost a combined $71 billion from their market capitalisation this year. While shares of ride-hailing company Grab have more than halved in the last three months, technology giant Sea's stock price has plunged by 46%. Sea-owned Shopee recently shut down India operations, whereas its Free Fire game was banned by the Indian government.",2022-04-04,Hiral Goyal,https://www.bloombergquint.com/global-economics/a-71-billion-plunge-casts-doubt-on-singapore-s-new-economy-aura?utm_campaign=fullarticle&utm_medium=referral&utm_source=inshorts,https://static.inshorts.com/inshorts/images/v1/variants/jpg/m/2022/04_apr/4_mon/img_1649070537406_829.jpg?,https://inshorts.com/en/news/$71-billion-wiped-out-of-market-cap-of-singapores-grab-and-sea-in-3-months-1649071001710,BloombergQuint,Monday
"Bezos shares pic of Amazon's office from early days, says 'Big things start small'","The world's second-richest man Jeff Bezos on Sunday took to Instagram to share a picture of his office from Amazon's early days, and wrote, ""Big things start small."" The office had 'amazon.com' spray-painted on a banner and a table built out of a wooden door. He also shared a video of his company Blue Origin's fourth spaceflight with astronauts aboard.",2022-04-03,Pragya Swastik,https://www.instagram.com/p/Cb5Kmp0rWgF/?utm_campaign=fullarticle&utm_medium=referral&utm_source=inshorts,https://static.inshorts.com/inshorts/images/v1/variants/jpg/m/2022/04_apr/3_sun/img_1649004213268_907.jpg?,https://inshorts.com/en/news/bezos-shares-pic-of-amazon-office-from-early-days-says-big-things-start-small-1649005893276,Instagram,Sunday
Rahul shares chart comparing cost of full tank of fuel in vehicles in 2014 & now,"Congress leader Rahul Gandhi has shared a chart comparing the cost of a full tank of fuel in different vehicles in 2014 and now. According to him, it costed ₹714 for a full tank of fuel in a bike, compared to ₹1,038 now. It costed ₹2,856 for a full tank of fuel in car in 2014, compared to ₹4,152 now.",2022-04-04,Apaar Sharma,https://twitter.com/RahulGandhi/status/1510855184896782336?utm_campaign=fullarticle&utm_medium=referral&utm_source=inshorts,https://static.inshorts.com/inshorts/images/v1/variants/jpg/m/2022/04_apr/4_mon/img_1649060688152_936.jpg?,https://inshorts.com/en/news/rahul-shares-chart-comparing-cost-of-full-tank-of-fuel-in-vehicles-in-2014-now-1649062598469,Twitter,Monday
