headlines,text,date,author,read_more,image_url,inshorts_url,original_source,day
Meta employees 'lovingly' call me 'The Eye of Sauron': Mark Zuckerberg,"During an appearance on The Tim Ferriss Show, Meta CEO Mark Zuckerberg said, ""Some of the folks I work with at the company, they say this lovingly, but I think that they sometimes refer to my attention as the Eye of Sauron."" Zuckerberg was referring to the Lord of the Rings villain usually depicted as a flaming eye.",2022-04-06,Ankush Verma,https://www.moneycontrol.com/news/trends/mark-zuckerberg-reveals-nickname-given-by-meta-employees-its-the-eye-of-sauron-8324531.html/amp?utm_campaign=fullarticle&utm_medium=referral&utm_source=inshorts,https://static.inshorts.com/inshorts/images/v1/variants/jpg/m/2022/04_apr/6_wed/img_1649253035204_822.jpg?,https://inshorts.com/en/news/meta-employees-lovingly-call-me-the-eye-of-sauron-mark-zuckerberg-1649254710956,Moneycontrol,Wednesday
"Edtech unicorn Unacademy lays off 1,000 employees: Report","Bengaluru-based edtech unicorn Unacademy has laid off around 1,000 employees in the past few weeks as part of a cost-cutting exercise, ET reported citing sources. An Unacademy spokesperson said, ""A small subset of employee, contractor and educator roles were re-evaluated due to role redundancy and performance."" Unacademy was last valued at $3.4 billion in a funding round in August 2021.",2022-04-07,Kiran Khatri,https://www.timesnownews.com/business-economy/companies/mass-layoffs-at-unacademy-1000-employees-sacked-in-cost-cutting-exercise-article-90705207/amp?utm_campaign=fullarticle&utm_medium=referral&utm_source=inshorts,https://static.inshorts.com/inshorts/images/v1/variants/jpg/m/2022/04_apr/7_thu/img_1649328611815_807.jpg?,https://inshorts.com/en/news/edtech-unicorn-unacademy-lays-off-1000-employees-report-1649330248300,Times Now,Thursday
Lemon prices touch ₹400 per kg in Rajasthan's Jaipur,"Lemon prices have increased in several parts of the country amid soaring temperatures and touched ₹400 per kilogram in Rajasthan's Jaipur on Wednesday. On Tuesday, lemons were selling for ₹340 per kilogram in Jaipur. Traders at local mandis said vegetable prices soar during the summers, but an increase in the prices of fuel is triggering the price rise of produce.",2022-04-07,Pragya Swastik,https://www.businessinsider.in/india/news/price-of-lemons-rises-with-temperature-in-jaipur-reaches-400-per-kg-in-last-24-hours/amp_articleshow/90686436.cms?utm_campaign=fullarticle&utm_medium=referral&utm_source=inshorts,https://static.inshorts.com/inshorts/images/v1/variants/jpg/m/2022/04_apr/7_thu/img_1649336590278_374.jpg?,https://inshorts.com/en/news/lemon-prices-touch-₹400-per-kg-in-rajasthans-jaipur-1649337783950,Business Insider India,Thursday
In which states do India's richest real estate developers live as per Hurun?,"According to GROHE Hurun India Real Estate Rich List 2021, Maharashtra is the preferred state for India's richest developers with 37 individuals residing there. Macrotech Developers' Mangal Prabhat Lodha & family are the richest developers in the state. Maharashtra is followed by Delhi (23), Karnataka (20), Telangana (6) and Gujarat (4). DLF's Rajiv Singh is India's richest real estate developer.",2022-04-06,Kiran Khatri,https://www.hurunindia.net/grohe-hurun-india-real-estate-rich-list?utm_campaign=fullarticle&utm_medium=referral&utm_source=inshorts,https://static.inshorts.com/inshorts/images/v1/variants/jpg/m/2022/04_apr/6_wed/img_1649242780091_135.jpg?,https://inshorts.com/en/news/in-which-states-do-indias-richest-real-estate-developers-live-as-per-hurun-1649244017408,Hurun,Wednesday
Anand Mahindra shares video showing 360 degree view from the top of Mt Everest,"Mahindra Group Chairman Anand Mahindra took to social media to share a video showing 360 degree view from the top of Mt Everest. ""Sometimes, when you have to make hard decisions, it helps to imagine you're on top of Everest with an unobstructed view of the world. Becomes easier to see the 'big picture',"" he wrote.",2022-04-06,Daisy Mowke,None,https://static.inshorts.com/inshorts/images/v1/variants/jpg/m/2022/04_apr/6_wed/img_1649239568505_841.jpg?,https://inshorts.com/en/news/anand-mahindra-shares-video-showing-360-degree-view-from-the-top-of-mt-everest-1649240600607,Inshorts,Wednesday
Russian women film themselves cutting Chanel bags as brand stops selling to them,"Several wealthy Russian women and influencers have been filming themselves cutting their Chanel bags with a pair of scissors after the brand pulled out of Russia and stopped selling to Russians abroad. ""I am against Russophobia...If owning Chanel means selling my Motherland, then I don't need Chanel,"" TV presenter and actress Marina Ermoshkina said, cutting her bag.",2022-04-07,Kiran Khatri,https://www.mirror.co.uk/news/world-news/fuming-russian-socialites-cut-up-26648217.amp?utm_campaign=fullarticle&utm_medium=referral&utm_source=inshorts,https://static.inshorts.com/inshorts/images/v1/variants/jpg/m/2022/04_apr/7_thu/img_1649311599972_186.jpg?,https://inshorts.com/en/news/russian-women-film-themselves-cutting-chanel-bags-as-brand-stops-selling-to-them-1649315586945,Mirror,Thursday
Russia's ruble surges to the level it was before Putin invaded Ukraine,"Russia's ruble has surged back to the levels where it was before President Vladimir Putin invaded Ukraine, trading at 74.2625 per dollar in early Moscow trade on Thursday. This comes as foreign countries continue to buy Russian oil and natural gas, supporting the ruble. International sanctions had earlier sunk the ruble to a record low of 121.5 rubles per dollar.",2022-04-07,Pragya Swastik,https://www.bloombergquint.com/politics/mocked-as-rubble-by-biden-russia-s-ruble-comes-roaring-back?utm_campaign=fullarticle&utm_medium=referral&utm_source=inshorts,https://static.inshorts.com/inshorts/images/v1/variants/jpg/m/2022/04_apr/7_thu/img_1649333478369_102.jpg?,https://inshorts.com/en/news/russias-ruble-surges-to-the-level-it-was-before-putin-invaded-ukraine-1649337137443,BloombergQuint,Thursday
Which countries have the most number of billionaires as per Forbes?,"According to Forbes' World's Billionaires 2022 list, the US has the most number of billionaires at 735. This is followed by 539 in China, a drop from 626 last year. India is ranked third with 166 billionaires, followed by 134 in Germany, 83 in Russia, 67 in Hong Kong, 64 in Canada, 62 in Brazil and 52 in Italy.",2022-04-06,Arshiya Chopra,https://twitter.com/htTweets/status/1511639851703091200?utm_campaign=fullarticle&utm_medium=referral&utm_source=inshorts,https://static.inshorts.com/inshorts/images/v1/variants/jpg/m/2022/04_apr/6_wed/img_1649241960191_824.jpg?,https://inshorts.com/en/news/which-countries-have-the-most-number-of-billionaires-as-per-forbes-1649243269076,Twitter,Wednesday
May face impairment losses of up to $5 bn due to Russia exit: Shell,"Oil and natural gas giant Shell is writing off $4 billion to $5 billion in assets after it pulled its operations in Russia. On March 8, Shell announced that it would exit the Russian oil and natural gas sector and close all its service stations in response to the Russia-Ukraine war. ""These charges are expected to be identified,"" Shell said.",2022-04-07,Ashley Paul,https://www.financialexpress.com/market/commodities/shell-says-russia-exit-has-already-cost-5-billion/2484768/lite/?utm_campaign=fullarticle&utm_medium=referral&utm_source=inshorts,https://static.inshorts.com/inshorts/images/v1/variants/jpg/m/2022/04_apr/7_thu/img_1649330405060_758.jpg?,https://inshorts.com/en/news/may-face-impairment-losses-of-up-to-$5-bn-due-to-russia-exit-shell-1649333969793,Financial Express,Thursday
India trying to stabilise economic transactions with Russia: Govt,"External Affairs Minister S Jaishankar on Wednesday said India is trying to stabilise economic transactions with Russia, a day after India condemned killings of civilians in Ukraine. Jaishankar added that India has chosen the ""side of peace"" in the Russia-Ukraine war. Russia is India's main supplier of defence hardware but the overall annual trade between the two countries is small.",2022-04-06,Ashley Paul,https://www.reuters.com/world/india/india-says-trying-stabilise-economic-transactions-with-russia-2022-04-06/?utm_campaign=fullarticle&utm_medium=referral&utm_source=inshorts,https://static.inshorts.com/inshorts/images/v1/variants/jpg/m/2022/04_apr/6_wed/img_1649247006561_763.jpg?,https://inshorts.com/en/news/india-trying-to-stabilise-economic-transactions-with-russia-govt-1649250810799,Reuters,Wednesday
"Musk denies selling Twitter shares, says 'initial number was incorrect'","World's richest person Elon Musk has refuted reports claiming he had reduced his stake in Twitter from 9.2% to 9.1%. ""No sale took place. Initial share number filed was incorrect,"" he said in response to a claim that he had sold 371,900 Twitter shares. A filing on Tuesday showed that the Tesla CEO had taken a 9.1% stake in Twitter.",2022-04-07,Aishwarya Awasthi,https://www.bloombergquint.com/onweb/elon-musk-refutes-reports-that-he-had-sold-twitter-shares?utm_campaign=fullarticle&utm_medium=referral&utm_source=inshorts,https://static.inshorts.com/inshorts/images/v1/variants/jpg/m/2022/04_apr/7_thu/img_1649329403801_249.jpg?,https://inshorts.com/en/news/musk-denies-selling-twitter-shares-says-initial-number-was-incorrect-1649331249132,BloombergQuint,Thursday
Warren Buffett's Berkshire reveals 11.4% stake in HP worth $4.2 bn,"Billionaire Warren Buffett-led Berkshire Hathaway has disclosed its purchase of nearly 121 million shares of HP, giving it a roughly 11.4% stake worth about $4.2 billion. HP shares jumped nearly 10% to $38.38 in after-hours trading after Berkshire disclosed the stake in SEC filings. In March, Berkshire agreed to buy insurance company Alleghany for $11.6 billion in cash.",2022-04-07,Aishwarya Awasthi,https://www.reuters.com/business/buffetts-berkshire-hathaway-takes-stake-worth-42-bln-hp-2022-04-07/?utm_campaign=fullarticle&utm_medium=referral&utm_source=inshorts,https://static.inshorts.com/inshorts/images/v1/variants/jpg/m/2022/04_apr/7_thu/img_1649303663809_195.jpg?,https://inshorts.com/en/news/warren-buffetts-berkshire-reveals-114-stake-in-hp-worth-$42-bn-1649306111194,Reuters,Thursday
"SC orders resumption of arbitration over ₹24,713-cr Future-Reliance deal","The Supreme Court has ordered Singapore International Arbitration Centre (SIAC) to resume its arbitral proceedings in ₹24,713-crore Future Retail's merger deal with Reliance. Both Future Group and Amazon have consented to the resumption of arbitral proceedings before the SIAC. Earlier, the Delhi High Court had stayed arbitration proceedings between the two parties in January.",2022-04-06,Aishwarya Awasthi,None,https://static.inshorts.com/inshorts/images/v1/variants/jpg/m/2022/04_apr/6_wed/img_1649242696582_658.jpg?,https://inshorts.com/en/news/sc-orders-resumption-of-arbitration-over-₹24713cr-futurereliance-deal-1649244382495,Inshorts,Wednesday
Flipkart planning US listing in 2023 at $60-70 bn valuation: Report,"Flipkart has pushed its IPO valuation target to around $60-70 billion, and is now planning a US listing in 2023 instead of 2022, Reuters reported citing sources. Some sources reportedly said that the ongoing conflict between Russia and Ukraine played a part in Flipkart delaying its plans. Others said Flipkart's internal plan to boost valuations further caused the delay.",2022-04-07,Aishwarya Awasthi,https://www.reuters.com/business/retail-consumer/walmarts-flipkart-raises-ipo-valuation-target-60-70-bln-eyes-2023-listing-2022-04-07/?utm_campaign=fullarticle&utm_medium=referral&utm_source=inshorts,https://static.inshorts.com/inshorts/images/v1/variants/jpg/m/2022/04_apr/7_thu/img_1649319134620_86.jpg?,https://inshorts.com/en/news/flipkart-planning-us-listing-in-2023-at-$6070-bn-valuation-report-1649320372343,Reuters,Thursday
"Maruti Suzuki to recall 19,731 EECO cars to rectify wheel size marking","India's largest car manufacturer Maruti Suzuki on Wednesday said it'll voluntarily recall 19,731 units of its EECO model to inspect and rectify incorrect marking of wheel size. The incorrect marking has been found in units manufactured between July 19, 2021 and October 5, 2021. ""The issue has no implication on performance, safety or environment,"" the carmaker said in a statement.",2022-04-06,Ashley Paul,https://www.freepressjournal.in/amp/business/maruti-suzuki-to-recall-19731-eeco-cars-for-incorrect-rim-marking?utm_campaign=fullarticle&utm_medium=referral&utm_source=inshorts,https://static.inshorts.com/inshorts/images/v1/variants/jpg/m/2022/04_apr/6_wed/img_1649256820647_42.jpg?,https://inshorts.com/en/news/maruti-suzuki-to-recall-19731-eeco-cars-to-rectify-wheel-size-marking-1649260994917,Free Press Journal,Wednesday
Karnataka CM to inaugurate 'SARAS' fair in Bengaluru tomorrow,"Karnataka CM Basavaraj Bommai will inaugurate 'Sanjeevini SARAS-2022', a national fair of Self-Help Group women on Friday in Bengaluru, State Minister CN Ashwathnarayan said. About 700 women entrepreneurs from across the country will participate in the fair to showcase their skills and sell the products, which include handlooms, handicrafts, etc. About 310 stalls will be on display at the fair.",2022-04-07,Dharini Mudgal,https://theprint.in/india/karnataka-cm-bommai-to-inaugurate-sanjeevini-saras-2022-on-friday/905925/?amp=&utm_campaign=fullarticle&utm_medium=referral&utm_source=inshorts,https://static.inshorts.com/inshorts/images/v1/variants/jpg/m/2022/04_apr/7_thu/img_1649327638550_491.jpg?,https://inshorts.com/en/news/karnataka-cm-to-inaugurate-saras-fair-in-bengaluru-tomorrow-1649328528980,The Print,Thursday
"Coca-Cola to set up 2nd plant worth ₹1,000 cr in Telangana","Hindustan Coca-Cola Beverages on Thursday signed a partnership with the Telangana government and announced a fresh investment of ₹1,000 crore for setting up their second factory in the state. Coca-Cola will initially invest ₹600 crore in the new facility and add another ₹400 crore over the next five years, reports said. The facility will manufacture packaged beverages, juices and more.",2022-04-07,Nakul Ahuja,None,https://static.inshorts.com/inshorts/images/v1/variants/jpg/m/2022/04_apr/7_thu/img_1649332146145_398.jpg?,https://inshorts.com/en/news/cocacola-to-set-up-2nd-plant-worth-₹1000-cr-in-telangana-1649333640255,Inshorts,Thursday
Greater Noida increases land rates up to 25% in residential category,"The Greater Noida Industrial Development Authority (GNIDA) has increased the land allotment rates up to 25% which is between ₹5,000-₹7,000 per square metre for residential plots for FY 2022-23. The new rates per square metre of land will be ₹39,000 for category A, ₹36,000 for category B, ₹34,000 for category C and ₹29,000 for category D, the GNIDA said.",2022-04-07,Subhangi Singh,https://www.hindustantimes.com/cities/noida-news/greater-noida-increases-land-rates-upto-25-in-residential-category-101649270797171-amp.html?utm_campaign=fullarticle&utm_medium=referral&utm_source=inshorts,https://static.inshorts.com/inshorts/images/v1/variants/jpg/m/2022/04_apr/7_thu/img_1649312036934_762.jpg?,https://inshorts.com/en/news/greater-noida-increases-land-rates-up-to-25-in-residential-category-1649315372172,Hindustan Times,Thursday
"CCI probes SBI, Axis & IDBI Bank on suspected fee cartel: Reports","Competition Commission of India (CCI) is investigating the trustee units of State Bank of India, Axis Bank and IDBI Bank for suspected collusion of fees, Reuters reported. Last year, Trustees Association of India (TAI) ""substantially"" increased the fee for assisting companies raising debt, thereby hurting competition, CCI stated in an order. TAI has challenged the probe and called it ""illegal"".",2022-04-06,Ashley Paul,https://www.reuters.com/world/india/exclusive-india-probes-debt-trustee-units-sbi-axis-idbi-suspected-fee-cartel-2022-04-06/?utm_campaign=fullarticle&utm_medium=referral&utm_source=inshorts,https://static.inshorts.com/inshorts/images/v1/variants/jpg/m/2022/04_apr/6_wed/img_1649244469008_998.jpg?,https://inshorts.com/en/news/cci-probes-sbi-axis-idbi-bank-on-suspected-fee-cartel-reports-1649247859453,Reuters,Wednesday
"BankBazaar plans IPO in 2023; seeks to hire 1,500 employees","Online financial services marketplace BankBazaar plans to list an IPO in 2023, the company said on Thursday. After reporting revenue growth in FY22, the Sequoia India and Amazon-backed firm also plans to recruit over 1,500 employees across departments this year aiming to expand its product offerings. BankBazaar reported annualised revenue run rate of ₹156 crore, the company added.",2022-04-07,Ashley Paul,https://www.financialexpress.com/industry/banking-finance/bankbazaar-ipo-plans-mulls-listing-in-2023-seeks-to-hire-1500-employees-to-expand-product-offerings/2484875/lite/?utm_campaign=fullarticle&utm_medium=referral&utm_source=inshorts,https://static.inshorts.com/inshorts/images/v1/variants/jpg/m/2022/04_apr/7_thu/img_1649337490526_550.jpg?,https://inshorts.com/en/news/bankbazaar-plans-ipo-in-2023-seeks-to-hire-1500-employees-1649341189866,Financial Express,Thursday
"ADB expects India's FY23 GDP to grow at 7.5%, inflation at 5.8%","Asian Development Bank (ADB) has pegged India's GDP growth projection for FY23 at 7.5%. ADB added that India's economic growth in the coming years will be supported by increased public investment in infrastructure and a pickup in private investment. Inflation in India is likely to increase to 5.8% in FY23 amid rising oil prices, ADB said.",2022-04-06,Ashley Paul,https://www.latestly.com/agency-news/business-news-adb-pegs-indias-economic-growth-at-7-5-per-cent-for-2022-23-3558868.html/amp?utm_campaign=fullarticle&utm_medium=referral&utm_source=inshorts,https://static.inshorts.com/inshorts/images/v1/variants/jpg/m/2022/04_apr/6_wed/img_1649239575293_166.jpg?,https://inshorts.com/en/news/adb-expects-indias-fy23-gdp-to-grow-at-75-inflation-at-58-1649242925491,LatestLY,Wednesday
Exploring all options to procure affordable crude oil: Govt,"Centre is exploring all viable options to procure crude oil at affordable rates, the Finance Ministry said. Rise in imports in March because of an increase in oil prices ""doesn't portend well for the economy in the year ahead"", the Ministry added. If fuel was available at a discount, India would buy it, Finance Minister Nirmala Sitharaman had said earlier.",2022-04-07,Ashley Paul,https://www.moneycontrol.com/news/business/economy/govt-exploring-all-options-to-procure-crude-oil-at-affordable-rates-says-finmin-8330161.html/amp?utm_campaign=fullarticle&utm_medium=referral&utm_source=inshorts,https://static.inshorts.com/inshorts/images/v1/variants/jpg/m/2022/04_apr/7_thu/img_1649335203529_622.jpg?,https://inshorts.com/en/news/exploring-all-options-to-procure-affordable-crude-oil-govt-1649338534823,Moneycontrol,Thursday
ATS group firm goes into insolvency; may affect homebuyers of Gurugram project,"Insolvency proceedings have been initiated against ATS group firm Anand Divine Developers after ICICI Prudential Venture filed a petition for non-payment of dues worth ₹25 crore. Over 443 homebuyers of the ATS Triumph project in Gurugram's Sector 104 will likely be impacted. PSP Legal's partner Piyush Singh, who is representing the project's buyers, said homebuyers must file claims immediately.",2022-04-06,Ashley Paul,https://www.moneycontrol.com/news/business/real-estate/ats-group-company-goes-into-insolvency-over-400-homebuyers-face-uncertainty-8324581.html/amp?utm_campaign=fullarticle&utm_medium=referral&utm_source=inshorts,https://static.inshorts.com/inshorts/images/v1/variants/jpg/m/2022/04_apr/6_wed/img_1649246479848_408.jpg?,https://inshorts.com/en/news/ats-group-firm-goes-into-insolvency-may-affect-homebuyers-of-gurugram-project-1649250489424,Moneycontrol,Wednesday
"Petrol, diesel prices hiked for 14th time in 16 days","Petrol and diesel prices have been hiked for the 14th time in 16 days. Petrol in Delhi now costs ₹105.41/litre after being increased by 80 paise/litre, while diesel price in the national capital has gone up to ₹96.67/litre from ₹95.87/litre. In Mumbai, petrol cost has jumped to ₹120.51/litre from ₹119.67/litre, and diesel price has been increased to ₹104.77/litre from ₹103.92/litre.",2022-04-06,Anmol Sharma,https://www.hindustantimes.com/business/petrol-price-today-diesel-price-today-april-6-2022-fuel-price-hike-of-rs-10-per-litre-101649207607060-amp.html?utm_campaign=fullarticle&utm_medium=referral&utm_source=inshorts,https://static.inshorts.com/inshorts/images/v1/variants/jpg/m/2022/03_mar/25_fri/img_1648176092231_814.jpg?,https://inshorts.com/en/news/petrol-diesel-prices-hiked-for-14th-time-in-16-days-1649217935558,Hindustan Times,Wednesday
Who are the top 10 shareholders of Twitter?,"The world's richest person Elon Musk is the largest shareholder of Twitter, owning a 9.2% stake in the platform. Vanguard Group is the second-largest shareholder, with an 8.4% stake, followed by Morgan Stanley Investment Management (8.1%), BlackRock (4.6%) and SSgA Funds Management (4.5%), according to FactSet. Aristotle Capital holds a 2.5% stake and Co-founder Jack Dorsey holds a 2.3% stake.",2022-04-05,Pragya Swastik,https://www.reuters.com/technology/musk-discloses-92-stake-twitter-2022-04-04/?utm_campaign=fullarticle&utm_medium=referral&utm_source=inshorts,https://static.inshorts.com/inshorts/images/v1/variants/jpg/m/2022/04_apr/5_tue/img_1649167513741_641.jpg?,https://inshorts.com/en/news/who-are-the-top-10-shareholders-of-twitter-1649168609917,Reuters,Tuesday
Elon Musk to join Twitter's board of directors,"Twitter is appointing the world's richest person Elon Musk to its board of directors after he disclosed a passive stake of 9.2% in the company. ""He's both a passionate believer and intense critic of the service which is exactly what we need on Twitter, and in the boardroom,"" Twitter CEO Parag Agrawal tweeted. Musk is now Twitter's largest shareholder.",2022-04-05,Hiral Goyal,https://twitter.com/paraga/status/1511320953598357505?utm_campaign=fullarticle&utm_medium=referral&utm_source=inshorts,https://static.inshorts.com/inshorts/images/v1/variants/jpg/m/2022/04_apr/5_tue/img_1649163503145_90.jpg?,https://inshorts.com/en/news/elon-musk-to-join-twitters-board-of-directors-1649163636182,Twitter,Tuesday
Who are India's richest real estate developers & what are their net worths?,"DLF's Rajiv Singh is India's richest developer with a wealth of ₹61,220 crore, according to GROHE Hurun India Real Estate Rich List 2021. He has overtaken Macrotech Developers' Mangal Prabhat Lodha & family, who now rank 2nd, with ₹52,970 crore wealth. K Raheja's Chandru Raheja & family ranked 3rd with ₹26,290 crore. Embassy Office Parks' Jitendra Virwani ranked 4th.",2022-04-06,Kiran Khatri,https://www.hurunindia.net/grohe-hurun-india-real-estate-rich-list?utm_campaign=fullarticle&utm_medium=referral&utm_source=inshorts,https://static.inshorts.com/inshorts/images/v1/variants/jpg/m/2022/04_apr/6_wed/img_1649239769385_854.jpg?,https://inshorts.com/en/news/who-are-indias-richest-real-estate-developers-what-are-their-net-worths-1649240104744,Hurun India,Wednesday
Who are India's 10 richest people according to Forbes' latest rich list?,"Mukesh Ambani is India's richest person with $90.7 billion wealth as of March 11, Forbes' latest rich list released on Tuesday stated. Gautam Adani is second-richest in India with $90 billion wealth, followed by HCL Tech's Shiv Nadar ($28.7 billion) and Cyrus Poonawalla ($24.3 billion). DMart's Radhakishan Damani is fifth-richest in India with $20 billion wealth and Lakshmi Mittal sixth-richest.",2022-04-05,Pragya Swastik,https://www.moneycontrol.com/news/photos/india/forbes-india-rich-list-2022-top-10-richie-rich-indians-8320461.html/amp?utm_campaign=fullarticle&utm_medium=referral&utm_source=inshorts,https://static.inshorts.com/inshorts/images/v1/variants/jpg/m/2022/04_apr/5_tue/img_1649174204999_876.jpg?,https://inshorts.com/en/news/who-are-indias-10-richest-people-according-to-forbes-latest-rich-list-1649175647375,Moneycontrol,Tuesday
EU bans Russian coal imports worth €4 bn per yr in 5th sanctions package amid war,"The European Union on Tuesday said it would ban the import of coal from Russia that's worth €4 billion per year, in its fifth sanctions package over the Ukraine war. It also imposed a full transaction ban on four key Russian banks, including Russia's second-largest bank VTB. Russian and Russia-operated vessels have also been banned from accessing EU ports.",2022-04-05,Sakshita Khosla,https://twitter.com/ANI/status/1511327755287236610?utm_campaign=fullarticle&utm_medium=referral&utm_source=inshorts,https://static.inshorts.com/inshorts/images/v1/variants/jpg/m/2022/04_apr/5_tue/img_1649167048479_976.jpg?,https://inshorts.com/en/news/eu-bans-russian-coal-imports-worth-€4-bn-per-yr-in-5th-sanctions-package-amid-war-1649168078953,Twitter,Tuesday
I'm really happy Elon is joining the Twitter board: Co-founder Jack Dorsey,"Twitter Co-founder Jack Dorsey on Tuesday tweeted, ""I'm really happy Elon Musk is joining the Twitter board!"" Dorsey added, ""He cares deeply about our world and Twitter's role in it. Parag Agrawal (Twitter's CEO) and Elon both lead with their hearts, and they will be an incredible team."" Musk is Twitter's largest shareholder with a 9.2% stake.",2022-04-05,Pragya Swastik,https://twitter.com/jack/status/1511329369473564677?s=20&t=SDd5WfjEV28uJE_Npc3ryQ&utm_campaign=fullarticle&utm_medium=referral&utm_source=inshorts,https://static.inshorts.com/inshorts/images/v1/variants/jpg/m/2022/04_apr/5_tue/img_1649164707620_178.jpg?,https://inshorts.com/en/news/im-really-happy-elon-is-joining-the-twitter-board-cofounder-jack-dorsey-1649165023335,Twitter,Tuesday
