headlines,text,date,author,read_more,image_url,inshorts_url,original_source,day
Fundamentals remain robust: Paytm as BSE seeks clarity on stock price fall,"A day after BSE sought clarification from Paytm parent One97 Communications over a sharp plunge in its stock price, the company said its ""business fundamentals remain robust"" as demonstrated in previous earnings. ""There is no information...which...may have a bearing
on the price/volume behaviour in the scrip of the company,"" it added. Paytm's shares fell to a record low on Tuesday.",2022-03-23,Kiran Khatri,https://www.timesnownews.com/business-economy/companies/paytm-says-business-fundamentals-robust-as-bse-seeks-clarity-on-stock-price-fall-article-90388153/amp?utm_campaign=fullarticle&utm_medium=referral&utm_source=inshorts,https://static.inshorts.com/inshorts/images/v1/variants/jpg/m/2022/03_mar/23_wed/img_1648011534785_355.jpg?,https://inshorts.com/en/news/fundamentals-remain-robust-paytm-as-bse-seeks-clarity-on-stock-price-fall-1648012770647,Times Now,Wednesday
"Hero MotoCorp MD Pawan Munjal's office, residence raided by I-T dept: Reports","The Income Tax (I-T) department on Wednesday conducted searches at Hero MotoCorp Chairman and MD Pawan Munjal's office and residence, according to reports. The raids were reportedly being conducted at over two dozen premises linked to India's largest two-wheeler maker. The premises included those of several senior officials of the company in Delhi, Gurugram and other cities, reports said.",2022-03-23,Kiran Khatri,https://twitter.com/ETNOWlive/status/1506498038252060677?utm_campaign=fullarticle&utm_medium=referral&utm_source=inshorts,https://static.inshorts.com/inshorts/images/v1/variants/jpg/m/2022/03_mar/23_wed/img_1648013632620_989.jpg?,https://inshorts.com/en/news/hero-motocorp-md-pawan-munjals-office-residence-raided-by-it-dept-reports-1648014304521,Twitter,Wednesday
BSE seeks clarification from Paytm's parent company over fall in share price,"The BSE has sought a clarification from Paytm's parent company One 97 Communications Ltd over a fall in its share price. It said the clarification is sought to ensure that investors ""have latest relevant information about the company and to inform the market"". While the issue price of Paytm shares was ₹2,150, the price dropped to ₹543.90 in Tuesday's trade.",2022-03-22,Ridham Gambhir,https://www.moneycontrol.com/news/business/markets/bse-seeks-clarification-from-paytm-parent-after-shares-dip-to-all-time-low-8262161.html/amp?utm_campaign=fullarticle&utm_medium=referral&utm_source=inshorts,https://static.inshorts.com/inshorts/images/v1/variants/jpg/m/2022/03_mar/22_tue/img_1647963352812_710.jpg?,https://inshorts.com/en/news/bse-seeks-clarification-from-paytms-parent-company-over-fall-in-share-price-1647964206334,Moneycontrol,Tuesday
Crypto mining cost not to be allowed as deduction under Income Tax Act: Govt,"The infrastructure cost incurred in the mining of cryptocurrencies or any Virtual Digital Assets (VDA) won't be allowed as a deduction under the Income Tax Act, MoS for Finance Pankaj Chaudhary said. He said the government will come out with a definition of VDA with a view to levy 30% tax on income from the transfer of such assets.",2022-03-21,Pragya Swastik,https://www.moneycontrol.com/news/business/cryptocurrency/crypto-mining-cost-not-to-be-allowed-as-deduction-under-i-t-act-finance-ministryin-8256741.html/amp?utm_campaign=fullarticle&utm_medium=referral&utm_source=inshorts,https://static.inshorts.com/inshorts/images/v1/variants/jpg/m/2022/03_mar/21_mon/img_1647877016007_476.jpg?,https://inshorts.com/en/news/crypto-mining-cost-not-to-be-allowed-as-deduction-under-income-tax-act-govt-1647879126856,Moneycontrol,Monday
"I-T dept raids Hiranandani Group at 24 places in Mumbai, B'luru & Chennai","The Income Tax department on Tuesday conducted raids on several premises linked to Hiranandani Group over suspected tax evasion. The raids were underway at around 24 locations in Mumbai, Chennai and Bengaluru, including residences of some top officials, department officials said. The group, founded by Niranjan and Surendra Hiranandani in 1978, is one of India's largest real estate companies.",2022-03-22,Kiran Khatri,https://www.freepressjournal.in/amp/mumbai/i-t-dept-conducting-searches-at-hiranandani-group-in-mumbai-chennai-bangalore?utm_campaign=fullarticle&utm_medium=referral&utm_source=inshorts,https://static.inshorts.com/inshorts/images/v1/variants/jpg/m/2022/03_mar/22_tue/img_1647930804238_833.jpg?,https://inshorts.com/en/news/it-dept-raids-hiranandani-group-at-24-places-in-mumbai-bluru-chennai-1647932338243,Free Press Journal,Tuesday
Ambani's Jio World Centre in Mumbai gets armed CISF cover: Report,"The Union government has sanctioned armed security cover of over 200 CISF personnel to guard the Jio World Centre opened by Reliance Industries in Mumbai, PTI reported. The business and entertainment centre, spread across 18.5 acres in Bandra Kurla Complex, will receive counter-terrorist cover. Mukesh Ambani and Nita Ambani are protectees of the CRPF VIP security wing.",2022-03-22,Pragya Swastik,None,https://static.inshorts.com/inshorts/images/v1/variants/jpg/m/2022/03_mar/22_tue/img_1647946201112_957.jpg?,https://inshorts.com/en/news/ambanis-jio-world-centre-in-mumbai-gets-armed-cisf-cover-report-1647947736134,Inshorts,Tuesday
His dignity is humbling: Mahindra on 125-yr-old Padma Shri awardee Swami Sivananda,"Businessman Anand Mahindra shared a video of UP-based yoga guru Swami Sivananda receiving the Padma Shri award and wrote, ""The power of yoga. A life spanning 125 years of dedication."" ""The grace and dignity of...Sivananda is both humbling & inspiring. Proud to belong to the country of yoga's origin,"" he tweeted. Sivananda knelt before PM Narendra Modi at the ceremony.",2022-03-22,Kiran Khatri,https://twitter.com/anandmahindra/status/1505899611713507328?utm_campaign=fullarticle&utm_medium=referral&utm_source=inshorts,https://static.inshorts.com/inshorts/images/v1/variants/jpg/m/2022/03_mar/22_tue/img_1647924826299_518.jpg?,https://inshorts.com/en/news/his-dignity-is-humbling-mahindra-on-125yrold-padma-shri-awardee-swami-sivananda-1647926530662,Twitter,Tuesday
"HUL in talks to buy majority stake in MDH at ₹10,000 crore-₹15,000 crore valuation: Report","FMCG major Hindustan Unilever Ltd is in discussions to buy a majority stake in MDH Spices, Livemint reported on Tuesday. MDH could be valued between ₹10,000 crore and ₹15,000 crore, the report added. MDH Spices is said to have been in discussions with other conglomerates too after the demise of Founder Mahashay Dharampal Gulati, who passed away in December 2020.",2022-03-22,Pragya Swastik,https://www.moneycontrol.com/news/business/hindustan-unilever-in-talks-to-buy-majority-stake-in-mdh-spices-report-8258611.html/amp?utm_campaign=fullarticle&utm_medium=referral&utm_source=inshorts,https://static.inshorts.com/inshorts/images/v1/variants/jpg/m/2022/03_mar/22_tue/img_1647939871361_879.jpg?,https://inshorts.com/en/news/hul-in-talks-to-buy-majority-stake-in-mdh-at-₹10000-crore₹15000-crore-valuation-report-1647941002400,Moneycontrol,Tuesday
Burger King UK accuses McDonald's of copying its food item; shares meme,"Burger King UK has accused McDonald's of copying one of its food items as the latter recently shared new additions to its menu. Burger King accused McDonald's of copying its Chilli Cheese Bites and shared a meme on Facebook, which read, ""Can I copy your homework?"" Burger King claims it has been serving the item for the last 15 years.",2022-03-22,Pragya Swastik,https://www.independent.co.uk/life-style/christmas/food-drink/burger-king-mcdonald-s-chilli-cheese-bites-b2040769.html?utm_campaign=fullarticle&utm_medium=referral&utm_source=inshorts,https://static.inshorts.com/inshorts/images/v1/variants/jpg/m/2022/03_mar/22_tue/img_1647952616048_34.jpg?,https://inshorts.com/en/news/burger-king-uk-accuses-mcdonalds-of-copying-its-food-item-shares-meme-1647954943426,The Independent,Tuesday
Spent sleepless nights over ₹16 lakh down payment: Anil Agarwal on buying his 1st firm,"Vedanta's billionaire Chairman Anil Agarwal on Monday shared how he acquired a bankrupt company named Shamsher Sterling Cable Company in May 1976. ""I had no experience on how to buy a company, but I went ahead anyway,"" he wrote. Agarwal revealed that he ""spent many sleepless nights thinking"" about the down payment but managed to gather ₹16 lakh through loans.",2022-03-22,Kiran Khatri,https://www.moneycontrol.com/news/trends/how-vedanta-ceo-anil-agarwal-cobbled-up-rs-16-lakh-to-acquire-his-first-company-8258631.html/amp?utm_campaign=fullarticle&utm_medium=referral&utm_source=inshorts,https://static.inshorts.com/inshorts/images/v1/variants/jpg/m/2022/03_mar/22_tue/img_1647920956507_176.jpg?,https://inshorts.com/en/news/spent-sleepless-nights-over-₹16-lakh-down-payment-anil-agarwal-on-buying-his-1st-firm-1647922563176,Moneycontrol,Tuesday
"Sensodyne asked to discontinue misleading ads, fined ₹10 lakh","The Central Consumer Protection Authority has imposed a ₹10 lakh fine on Sensodyne while ordering it to discontinue certain misleading advertisements within seven days. Ads that claimed Sensodyne as 'Recommended by dentists worldwide' and 'World's No.1 sensitivity toothpaste' have been ordered to be stopped. Earlier, Sensodyne was asked to stop ads that showed endorsement by foreign dentists.",2022-03-22,Ridham Gambhir,https://www.aninews.in/news/business/consumer-body-slaps-rs-10-lakh-penalty-on-sensodynes-misleading-advertisements20220322173619/?utm_campaign=fullarticle&utm_medium=referral&utm_source=inshorts,https://static.inshorts.com/inshorts/images/v1/variants/jpg/m/2022/03_mar/22_tue/img_1647950483855_134.jpg?,https://inshorts.com/en/news/sensodyne-asked-to-discontinue-misleading-ads-fined-₹10-lakh-1647952729237,ANI,Tuesday
Indian billionaire Ravi Pillai buys helicopter costing ₹100 crore,"Dubai-based Indian billionaire Ravi Pillai, the Chairman of industrial development conglomerate RP Group, has bought an Airbus H145 helicopter costing ₹100 crore. The helicopter was delivered by Airbus in Kovalam and took its inaugural flight from Kovalam to The Raviz Ashtamudi. The helicopter is capable of landing and takeoff from even high altitudes of 20,000 feet above sea level.",2022-03-22,Pragya Swastik,https://www.moneycontrol.com/news/business/b-ravi-pillai-becomes-the-first-indian-to-own-an-airbus-luxury-helicopter-worth-rs-100-crore-8262031.html/amp?utm_campaign=fullarticle&utm_medium=referral&utm_source=inshorts,https://static.inshorts.com/inshorts/images/v1/variants/jpg/m/2022/03_mar/22_tue/img_1647959939883_52.jpg?,https://inshorts.com/en/news/indian-billionaire-ravi-pillai-buys-helicopter-costing-₹100-crore-1647962571655,Moneycontrol,Tuesday
Growth impact of Ukraine crisis should be marginal for India: RBI Governor,"The Reserve Bank of India (RBI) Governor, Shaktikanta Das, on Monday said the growth impact of the Russia-Ukraine crisis should be marginal for India. He further said he does not see a situation in India where inflation remains above the 2% to 6% band for extended period. Das was addressing industrialists at the National Council Meeting of the CII.",2022-03-21,Hiral Goyal,https://www.bloombergquint.com/business/indian-bank-bad-loans-at-all-time-low-says-rbi-governor-shaktikanta-das?utm_campaign=fullarticle&utm_medium=referral&utm_source=inshorts,https://static.inshorts.com/inshorts/images/v1/variants/jpg/m/2022/03_mar/21_mon/img_1647878604904_427.jpg?,https://inshorts.com/en/news/growth-impact-of-ukraine-crisis-should-be-marginal-for-india-rbi-governor-1647880007303,BloombergQuint,Monday
US lawmakers raise concerns around Musk's business in China: WSJ,"Some US lawmakers have raised concerns over Elon Musk-owned SpaceX's ties in China, questioning if Beijing could exploit the ties to gain access to classified information through its foreign suppliers, the WSJ reported. Utah's Representative Chris Stewart reportedly said, ""I am a fan of Elon Musk...but anyone would be concerned if there are financial entanglements with China.""",2022-03-22,Aishwarya Awasthi,https://www.businessinsider.in/tech/news/elon-musks-business-links-to-china-spark-concern-among-lawmakers-2-months-after-tesla-opened-its-first-showroom-in-controversial-region/amp_articleshow/90339984.cms?utm_campaign=fullarticle&utm_medium=referral&utm_source=inshorts,https://static.inshorts.com/inshorts/images/v1/variants/jpg/m/2022/03_mar/22_tue/img_1647946666209_608.jpg?,https://inshorts.com/en/news/us-lawmakers-raise-concerns-around-musks-business-in-china-wsj-1647947810182,Business Insider India,Tuesday
Jack Ma-led Alibaba increases share buyback size to record $25 bn,"Billionaire Jack Ma-led Alibaba has increased its share buyback programme to $25 billion, the largest ever repurchase plan by the e-commerce firm. In August, Alibaba had increased the programme from $10 billion to $15 billion. The firm's board has approved the programme, which will run through March 2024. Alibaba's shares rose 4.8% in Hong Kong following the news.",2022-03-22,Aishwarya Awasthi,https://www.reuters.com/business/retail-consumer/alibaba-increases-share-buyback-25-billion-15-billion-2022-03-22/?utm_campaign=fullarticle&utm_medium=referral&utm_source=inshorts,https://static.inshorts.com/inshorts/images/v1/variants/jpg/m/2022/03_mar/22_tue/img_1647933603653_44.jpg?,https://inshorts.com/en/news/jack-maled-alibaba-increases-share-buyback-size-to-record-$25-bn-1647936867173,Reuters,Tuesday
Indian economy better placed to deal with challenges: RBI Governor,"Governor of the Reserve Bank of India, Shaktikanta Das on Monday said that the Indian economy is ""comfortably placed to deal with any challenges with regard to financing the Current Account Deficit (CAD)"". He also said that the RBI will continue to ensure liquidity to support the economy, which is facing some troubles following the Russian invasion of Ukraine.",2022-03-21,Nakul Ahuja,None,https://static.inshorts.com/inshorts/images/v1/variants/jpg/m/2022/03_mar/21_mon/img_1647876323187_923.jpg?,https://inshorts.com/en/news/indian-economy-better-placed-to-deal-with-challenges-rbi-governor-1647881205337,Inshorts,Monday
Delhi NCR developers plan to halt construction as raw material costs soar,"Developers in Delhi NCR are planning to stop purchase of raw materials and construction activity due to rising raw material costs, according to industry body CREDAI NCR. ""After COVID-19, the current crisis is a dual blow on real estate developers,"" said CREDAI NCR President Pankaj Bajaj. CREDAI members in Maharashtra are also planning to stop work for the same reason.",2022-03-22,Ashley Paul,https://www.financialexpress.com/money/developers-in-delhi-ncr-to-halt-construction-as-raw-materials-costs-soar/2468359/lite/?utm_campaign=fullarticle&utm_medium=referral&utm_source=inshorts,https://static.inshorts.com/inshorts/images/v1/variants/jpg/m/2022/03_mar/22_tue/img_1647962198976_900.jpg?,https://inshorts.com/en/news/delhi-ncr-developers-plan-to-halt-construction-as-raw-material-costs-soar-1647966200816,Financial Express,Tuesday
Govt's PLI scheme not leading us towards closed economy: NITI Aayog VC,"Centre's Production Linked Incentive (PLI) scheme for Aatmanirbhar India is not leading us towards a closed economy, NITI Aayog Vice Chairman Rajiv Kumar said. He added that India remains deeply committed to greater integration with global flows and the regional network. Inviting investments from Japan, he said, ""Japanese companies are very well placed to [help us] achieve [these goals].""",2022-03-22,Ashley Paul,https://www.financialexpress.com/economy/atmanirbhar-mission-not-leading-india-towards-closed-economy-says-niti-aayog-vc-rajiv-kumar/2468041/lite/?utm_campaign=fullarticle&utm_medium=referral&utm_source=inshorts,https://static.inshorts.com/inshorts/images/v1/variants/jpg/m/2022/03_mar/22_tue/img_1647952066296_298.jpg?,https://inshorts.com/en/news/govts-pli-scheme-not-leading-us-towards-closed-economy-niti-aayog-vc-1647956385052,Financial Express,Tuesday
Cost of EVs to be at par with petrol-run vehicles in 2 years: Gadkari,"Road Transport Minister Nitin Gadkari said cost of electric vehicles (EVs) will be at par with cost of petrol-run vehicles in two years. Emphasising on the need to shift to a cost-effective indigenous fuel, Gadkari said rapid strides in technology and green fuel will reduce EV costs. Cost of driving EVs will be about 1/10th of petrol vehicles, he added.",2022-03-22,Ashley Paul,https://www.moneycontrol.com/news/technology/auto/cost-of-evs-to-be-at-par-with-petrol-run-vehicles-in-2-years-nitin-gadkari-8261211.html/amp?utm_campaign=fullarticle&utm_medium=referral&utm_source=inshorts,https://static.inshorts.com/inshorts/images/v1/variants/jpg/m/2022/03_mar/22_tue/img_1647954199724_274.jpg?,https://inshorts.com/en/news/cost-of-evs-to-be-at-par-with-petrolrun-vehicles-in-2-years-gadkari-1647960193062,Moneycontrol,Tuesday
Campus Activewear gets SEBI's nod for IPO launch,Footwear brand Campus Activewear has received market regulator SEBI's approval for an IPO launch. Promoters Hari Krishan Agarwal and Nikhil Aggarwal will cumulatively sell 1.4 crore shares of the 5.1 crore shares that will be offered for sale by promoters and investors. The money raised will go to the shareholders and the company will not receive any of the funds.,2022-03-22,Ashley Paul,https://www.moneycontrol.com/news/business/ipo/3-more-companies-get-sebi-nod-to-launch-ipos-8259551.html/amp?utm_campaign=fullarticle&utm_medium=referral&utm_source=inshorts,https://static.inshorts.com/inshorts/images/v1/variants/jpg/m/2022/03_mar/22_tue/img_1647942171341_545.jpg?,https://inshorts.com/en/news/campus-activewear-gets-sebis-nod-for-ipo-launch-1647947056257,Moneycontrol,Tuesday
"Suzuki to invest ₹10,440 cr to make electric vehicles, batteries in Gujarat","Japan's Suzuki Motor Corporation has announced plans to invest around ₹10,440 crore to locally manufacture electric vehicles (BEV) and BEV batteries in Gujarat. The memorandum of understanding was signed at India-Japan Economic Forum in the presence of PM Narendra Modi and Japanese PM Fumio Kishida. ""We'll continue active investment in India to realise Atmanirbhar Bharat,"" Suzuki's President said.",2022-03-20,Hiral Goyal,https://www.moneycontrol.com/news/business/companies/japans-suzuki-motor-to-invest-rs-10440-crore-for-electric-vehicle-production-in-india-8251981.html/amp?utm_campaign=fullarticle&utm_medium=referral&utm_source=inshorts,https://static.inshorts.com/inshorts/images/v1/variants/jpg/m/2022/03_mar/20_sun/img_1647771628092_723.jpg?,https://inshorts.com/en/news/suzuki-to-invest-₹10440-cr-to-make-electric-vehicles-batteries-in-gujarat-1647775788426,Moneycontrol,Sunday
₹224 cr undisclosed income found during raids on Maharashtra-based unicorn,"The Income Tax department found an undisclosed income of about ₹224 crore after it raided a unicorn startup based in Pune and Thane in Maharashtra. While the firm is engaged in wholesale and retail of construction materials, the Central Board of Direct Taxes said that its annual turnover exceeded ₹6,000 crore. Unaccounted cash worth ₹1 crore has also been seized.",2022-03-20,Ridham Gambhir,https://www.moneycontrol.com/news/business/i-t-dept-detects-rs-224-cr-black-income-after-raids-on-maharashtra-based-start-up-group-8252351.html/amp?utm_campaign=fullarticle&utm_medium=referral&utm_source=inshorts,https://static.inshorts.com/inshorts/images/v1/variants/jpg/m/2022/03_mar/20_sun/img_1647766461804_249.jpg?,https://inshorts.com/en/news/₹224-cr-undisclosed-income-found-during-raids-on-maharashtrabased-unicorn-1647767448369,Moneycontrol,Sunday
Reliance Retail acquires 89% stake in women's innerwear brand Clovia,"Reliance Retail Ventures Limited (RRVL) has acquired an 89% equity stake in Purple Panda Fashions Private Limited, which owns and operates Clovia, a brand for women's innerwear and loungewear. Reliance made an investment of ₹950 crore through a combination of secondary stake purchase and primary investment. Clovia was launched in 2013 by Pankaj Vermani, Neha Kant and Suman Chowdhury.",2022-03-20,Ridham Gambhir,https://www.moneycontrol.com/news/business/reliance-retail-acquires-89-percent-stake-in-purple-panda-fashions-8253161.html/amp?utm_campaign=fullarticle&utm_medium=referral&utm_source=inshorts,https://static.inshorts.com/inshorts/images/v1/variants/jpg/m/2022/03_mar/20_sun/img_1647788749426_676.jpg?,https://inshorts.com/en/news/reliance-retail-acquires-89-stake-in-womens-innerwear-brand-clovia-1647789634559,Moneycontrol,Sunday
Govt working on classification of cryptos under GST law: Report,"The government is reportedly working on the classification of cryptocurrencies as goods or services under the GST law. ""There's a clarity needed in regard to levy of GST on cryptocurrencies and whether it has to be levied on the entire value,"" an official told PTI. Currently, the government levies 18% GST on the services provided by the crypto exchanges.",2022-03-20,Hiral Goyal,https://www.financialexpress.com/digital-currency/govt-working-on-classification-of-cryptocurrency-under-gst-law/2465765/lite/?utm_campaign=fullarticle&utm_medium=referral&utm_source=inshorts,https://static.inshorts.com/inshorts/images/v1/variants/jpg/m/2022/03_mar/20_sun/img_1647767629843_382.jpg?,https://inshorts.com/en/news/govt-working-on-classification-of-cryptos-under-gst-law-report-1647769693876,Financial Express,Sunday
Apple ex-employee charged with defrauding company out of $10 mn in US,"Dhirendra Prasad, a former Apple employee, has been charged with defrauding the tech giant out of more than $10 million in the US. The 52-year-old worked for 10 years as a buyer in Apple's Global Service Supply Chain department. According to the federal prosecutors, Prasad exploited his position to defraud Apple by allegedly taking kickbacks, stealing equipment and laundering money.",2022-03-20,Hiral Goyal,https://apnews.com/article/technology-business-crime-money-laundering-san-jose-be8ac17c1761ff2c0f21b6d79c26f545?utm_campaign=fullarticle&utm_medium=referral&utm_source=inshorts,https://static.inshorts.com/inshorts/images/v1/variants/jpg/m/2022/03_mar/20_sun/img_1647775033492_236.jpg?,https://inshorts.com/en/news/apple-exemployee-charged-with-defrauding-company-out-of-$10-mn-in-us-1647776778612,The Associated Press,Sunday
Loss in one crypto can't be set off against income in another one: Govt,"Loss from the transfer of a virtual digital asset (VDA) will not be allowed to set off against income arising from transfer of another VDA, the Minister of State for Finance, Pankaj Chaudhary, told the Lok Sabha on Monday. He also clarified that infrastructure costs incurred in crypto mining won't be treated as cost of acquisition, but as capital expenditure.",2022-03-21,Hiral Goyal,https://www.moneycontrol.com/news/business/crypto-tax-government-clarifies-that-losses-cannot-be-set-off-between-trades-of-different-tokens-8256411.html/amp?utm_campaign=fullarticle&utm_medium=referral&utm_source=inshorts,https://static.inshorts.com/inshorts/images/v1/variants/jpg/m/2022/03_mar/21_mon/img_1647862636135_50.jpg?,https://inshorts.com/en/news/loss-in-one-crypto-cant-be-set-off-against-income-in-another-one-govt-1647864191907,Moneycontrol,Monday
Cooperating with authorities: Infra.Market after ₹224 cr undisclosed income detected,Infra.Market Founder Souvik Sengupta on Sunday said that they are cooperating with the authorities to provide them with the necessary information to solve the issues they have in relation to the recent searches. The Income Tax department has found an undisclosed income of ₹224 crore from the Maharashtra-based unicorn startup group and has seized unaccounted cash worth ₹1 crore.,2022-03-20,Ridham Gambhir,https://www.moneycontrol.com/news/business/startup/infra-market-says-cooperating-with-authorities-after-income-tax-dept-detects-undisclosed-income-of-rs-224-cr-8252921.html/amp?utm_campaign=fullarticle&utm_medium=referral&utm_source=inshorts,https://static.inshorts.com/inshorts/images/v1/variants/jpg/m/2022/03_mar/20_sun/img_1647777753610_666.jpg?,https://inshorts.com/en/news/cooperating-with-authorities-inframarket-after-₹224-cr-undisclosed-income-detected-1647779804870,Moneycontrol,Sunday
No fears of 'stagflation' in India: RBI Governor Shaktikanta Das,"RBI Governor Shaktikanta Das said, ""With regard to the prospect of stagflation, whether it is a risk for India, in our assessment I think such prospects don't exist."" He added, ""India is far away from such a grim prospect."" 'Stagflation' is when there's slow economic growth and relatively high unemployment, which is at the same time accompanied by rising prices.",2022-03-21,Pragya Swastik,https://twitter.com/bloombergquint/status/1505877449837780998?utm_campaign=fullarticle&utm_medium=referral&utm_source=inshorts,https://static.inshorts.com/inshorts/images/v1/variants/jpg/m/2022/03_mar/21_mon/img_1647870310120_4.jpg?,https://inshorts.com/en/news/no-fears-of-stagflation-in-india-rbi-governor-shaktikanta-das-1647871931807,Twitter,Monday
