headlines,text,date,author,read_more,image_url,inshorts_url,original_source,day
"India buys 45,000 tonnes of Russian sunflower oil at record high price: Report","India has contracted 45,000 tonnes of Russian sunflower oil at a record high price for shipments in April, Reuters reported on Tuesday citing industry officials. The move comes as oil prices in the local market surged after supplies from Ukraine stopped because of the war. Refiners bought crude sunflower oil at a record price of $2,150 a tonne, dealers said.",2022-03-29,Pragya Swastik,https://www.reuters.com/business/retail-consumer/india-buys-russian-sunoil-record-high-price-ukraine-supplies-halt-2022-03-29/?utm_campaign=fullarticle&utm_medium=referral&utm_source=inshorts,https://static.inshorts.com/inshorts/images/v1/variants/jpg/m/2022/03_mar/29_tue/img_1648546392068_771.jpg?,https://inshorts.com/en/news/india-buys-45000-tonnes-of-russian-sunflower-oil-at-record-high-price-report-1648548792098,Reuters,Tuesday
"Petrol, diesel prices hiked for 7th time in 8 days","Petrol and diesel prices have been hiked for the seventh time in eight days. Petrol in Delhi now costs ₹100.21/litre after being increased by 80 paise/litre, while diesel price in the national capital has gone up to ₹91.47/litre from ₹90.77/litre. In Mumbai, petrol cost has jumped to ₹115.04/litre from ₹114.19/litre, and diesel price has been increased to ₹99.25/litre from ₹98.50/litre.",2022-03-29,Anmol Sharma,https://www.thequint.com/amp/story/news/india/fuel-hikes-for-the-7th-time?utm_campaign=fullarticle&utm_medium=referral&utm_source=inshorts,https://static.inshorts.com/inshorts/images/v1/variants/jpg/m/2022/03_mar/29_tue/img_1648522051845_937.jpg?,https://inshorts.com/en/news/petrol-diesel-prices-hiked-for-7th-time-in-8-days-1648523300336,The Quint,Tuesday
India-born Raj Subramaniam named new FedEx CEO as Founder steps down after 50 yrs,"FedEx has named India-born Raj Subramaniam as its new CEO as the company's Founder Frederich W Smith will step down after around five decades, effective June 1, 2022. Subramaniam is currently President and Chief Operating Officer. He will be promoted to President and CEO, while 77-year-old Smith will become Executive Chairman. ""Fred is a...legend of the business world,"" Subramaniam said.",2022-03-29,Kiran Khatri,https://www.timesnownews.com/business-economy/companies/fedex-founder-steps-down-as-ceo-after-50-years-indian-born-raj-subramaniam-takes-over-article-90505875/amp?utm_campaign=fullarticle&utm_medium=referral&utm_source=inshorts,https://static.inshorts.com/inshorts/images/v1/variants/jpg/m/2022/03_mar/29_tue/img_1648523474772_161.jpg?,https://inshorts.com/en/news/indiaborn-raj-subramaniam-named-new-fedex-ceo-as-founder-steps-down-after-50-yrs-1648524186860,Times Now,Tuesday
"Who is Namit Malhotra, CEO of VFX company that won 'Dune' an Oscar?","Union I&B Minister Anurag Thakur congratulated UK-based Namit Malhotra, the CEO of DNEG visual effects company behind the movie 'Dune', which won the Best Visual Effects Oscar on Monday. Malhotra's DNEG also worked on the movie 'No Time to Die', which was nominated for Oscars. Malhotra's grandfather has worked as a cinematographer, and his father as a producer, in Bollywood.",2022-03-28,Pragya Swastik,None,https://static.inshorts.com/inshorts/images/v1/variants/jpg/m/2022/03_mar/28_mon/img_1648461717930_875.jpg?,https://inshorts.com/en/news/who-is-namit-malhotra-ceo-of-vfx-company-that-won-dune-an-oscar-1648462427366,Inshorts,Monday
No plan to buy crude oil from Russia in Indian rupees: Govt,"Rameswar Teli, the Minister of State in the Petroleum Ministry, said, ""Oil public sector undertakings neither have any contract nor is any such proposal under consideration from Russia or any other country for the purchase of crude oil in Indian rupees."" He clarified this in Parliament on Monday. This comes amid Indian companies buying Russian oil following deep discounts.",2022-03-28,Pragya Swastik,https://www.moneycontrol.com/news/business/india-not-considering-buying-crude-from-russia-in-rupees-8285521.html/amp?utm_campaign=fullarticle&utm_medium=referral&utm_source=inshorts,https://static.inshorts.com/inshorts/images/v1/variants/jpg/m/2022/03_mar/28_mon/img_1648465830758_938.jpg?,https://inshorts.com/en/news/no-plan-to-buy-crude-oil-from-russia-in-indian-rupees-govt-1648466498491,Moneycontrol,Monday
"I'm practically under house arrest, have to eat at home: Sanctioned Russian oligarch","London-based Russian oligarch Mikhail Fridman said he's ""practically under house arrest"" and has to eat at home because all his cards and bank accounts are blocked due to sanctions. ""Authorities in Great Britain...assign me a certain amount so I can take taxis and buy food,"" he told a newspaper. Fridman has a fortune of over $10 billion, as per Bloomberg.",2022-03-29,Kiran Khatri,https://www.businessinsider.in/politics/world/news/sanctioned-russian-oligarch-mikhail-fridman-says-he-is-practically-under-house-arrest-and-has-to-eat-at-home-as-his-credit-cards-have-been-blocked/amp_articleshow/90509748.cms?utm_campaign=fullarticle&utm_medium=referral&utm_source=inshorts,https://static.inshorts.com/inshorts/images/v1/variants/jpg/m/2022/03_mar/29_tue/img_1648544146525_569.jpg?,https://inshorts.com/en/news/im-practically-under-house-arrest-have-to-eat-at-home-sanctioned-russian-oligarch-1648545951781,Business Insider,Tuesday
"20,000 bankers sleeping in offices to beat COVID-19 lockdown in Shanghai","Over 20,000 bankers, traders and other workers are sleeping in their office towers in Shanghai's Lujiazui district to keep China's financial hub working through the COVID-19 lockdown. Brokerages, asset managers and financial exchanges in Lujiazui summoned key workers to offices ahead of Monday's lockdown. Arrangements were made for sleeping bags and basic supplies for workers' overnight stays.",2022-03-29,Pragya Swastik,https://www.reuters.com/world/china/chinas-wall-street-bankers-traders-sleep-offices-beat-shanghai-covid-lockdown-2022-03-29/?utm_campaign=fullarticle&utm_medium=referral&utm_source=inshorts,https://static.inshorts.com/inshorts/images/v1/variants/jpg/m/2022/03_mar/29_tue/img_1648545332629_733.jpg?,https://inshorts.com/en/news/20000-bankers-sleeping-in-offices-to-beat-covid19-lockdown-in-shanghai-1648548648006,Reuters,Tuesday
"After Heineken, Carlsberg says it will exit Russia","Danish brewer Carlsberg has announced that it has ""taken the difficult and immediate decision"" to exit the Russian market, following Russia's invasion of Ukraine. Carlsberg will incur a substantial non-cash impairment charge and will have no presence in Russia after full disposal of its business, the company said. Earlier, Dutch brewer Heineken said it will exit its business in Russia.",2022-03-28,Hiral Goyal,https://www.reuters.com/business/retail-consumer/carlsberg-says-it-will-exit-russian-market-2022-03-28/?utm_campaign=fullarticle&utm_medium=referral&utm_source=inshorts,https://static.inshorts.com/inshorts/images/v1/variants/jpg/m/2022/03_mar/28_mon/img_1648471687191_756.jpg?,https://inshorts.com/en/news/after-heineken-carlsberg-says-it-will-exit-russia-1648473425670,Reuters,Monday
Heineken to exit Russia at a cost of $438 million,"Dutch brewing major Heineken is exiting its business in Russia at an expected cost of $438 million, following Russia's invasion of Ukraine. Previously, the beer maker had said that it would only halt new investment and exports to the country. ""Heineken's ownership of the business in Russia is no longer sustainable nor viable in the current environment,"" the company said.",2022-03-28,Pragya Swastik,https://www.reuters.com/business/heineken-exit-its-russian-operations-2022-03-28/?utm_campaign=fullarticle&utm_medium=referral&utm_source=inshorts,https://static.inshorts.com/inshorts/images/v1/variants/jpg/m/2022/03_mar/28_mon/img_1648462948632_105.jpg?,https://inshorts.com/en/news/heineken-to-exit-russia-at-a-cost-of-$438-million-1648465956267,Reuters,Monday
₹95.86 crore recovered from 11 crypto exchanges for GST evasion: Govt,"The government has recovered ₹95.86 crore, including interest and penalty charges, from 11 cryptocurrency exchanges for evading Goods and Services Tax (GST), Minister of State for Finance Pankaj Chaudhary said. He told the Lok Sabha that the exchanges were investigated for evading ₹81.54 crore in taxes. The biggest evasion was detected at WazirX, followed by CoinDCX and CoinSwitch Kuber.",2022-03-28,Hiral Goyal,https://www.moneycontrol.com/news/business/cryptocurrency/centre-reveals-action-against-11-crypto-exchanges-for-tax-evasion-rs-95-86-crore-recovered-8284251.html/amp?utm_campaign=fullarticle&utm_medium=referral&utm_source=inshorts,https://static.inshorts.com/inshorts/images/v1/variants/jpg/m/2022/03_mar/28_mon/img_1648458690339_272.jpg?,https://inshorts.com/en/news/₹9586-crore-recovered-from-11-crypto-exchanges-for-gst-evasion-govt-1648459548549,Moneycontrol,Monday
Singapore's e-commerce platform Shopee to shut down India operations,"Shopee, the e-commerce arm of Singapore-headquartered Sea Ltd, on Monday announced it's closing down India operations citing ""global market uncertainties"". The development comes over a month after the Indian government banned Sea's Garena Free Fire gaming app. ""[We'll work] to support local seller and buyer communities and our local team to make the process as smooth as possible,"" Shopee said.",2022-03-28,Hiral Goyal,https://www.reuters.com/business/retail-consumer/exclusive-seas-e-commerce-arm-shopee-shut-down-india-operations-statement-2022-03-28/?utm_campaign=fullarticle&utm_medium=referral&utm_source=inshorts,https://static.inshorts.com/inshorts/images/v1/variants/jpg/m/2022/03_mar/28_mon/img_1648456025880_591.jpg?,https://inshorts.com/en/news/singapores-ecommerce-platform-shopee-to-shut-down-india-operations-1648456968435,Reuters,Monday
"I supposedly have COVID-19 again, but almost no symptoms: Musk","World’s richest person and Tesla CEO Elon Musk on Monday tweeted that he might have contracted COVID-19 again. Musk tweeted, ""COVID-19 is the virus of Theseus. How many gene changes before it’s not COVID-19 anymore? I supposedly have it again (sigh), but almost no symptoms."" Earlier in November 2020, Musk revealed that he had a moderate case of COVID-19.",2022-03-28,Ridham Gambhir,https://twitter.com/elonmusk/status/1508356357967122434?utm_campaign=fullarticle&utm_medium=referral&utm_source=inshorts,https://static.inshorts.com/inshorts/images/v1/variants/jpg/m/2022/03_mar/28_mon/img_1648455592580_221.jpg?,https://inshorts.com/en/news/i-supposedly-have-covid19-again-but-almost-no-symptoms-musk-1648456691568,Twitter,Monday
Stop forcing people to pay for news: Musk to Bezos-owned Washington Post,"World's richest person Elon Musk has accused the Washington Post of editorialising his comments for a story. ""Here's what I actually said: 'If you're so concerned about democracy, stop forcing people to pay for (allegedly) important news! Your boss (Jeff) Bezos can certainly afford it',"" Musk wrote on Twitter. Amazon's billionaire Founder Bezos bought the Washington Post in 2013.",2022-03-28,Hiral Goyal,https://twitter.com/elonmusk/status/1508347227252543503?utm_campaign=fullarticle&utm_medium=referral&utm_source=inshorts,https://static.inshorts.com/inshorts/images/v1/variants/jpg/m/2022/03_mar/28_mon/img_1648479381421_742.jpg?,https://inshorts.com/en/news/stop-forcing-people-to-pay-for-news-musk-to-bezosowned-washington-post-1648482874958,Twitter,Monday
7 Indian-origin persons charged for insider trading worth million dollars in US,"Seven Indian-origin persons have been charged by US federal authorities with insider trading in a scheme through which they allegedly made over $1 million in illegal profits. Three of them were software engineers at California-based Twilio. They knowingly tipped off four family members and friends to trade in Twilio's options ahead of its 2020 earnings announcement, according to the complaint.",2022-03-29,Kiran Khatri,https://www.freepressjournal.in/amp/business/seven-indian-origin-persons-charged-in-1-mn-insider-trading-scheme?utm_campaign=fullarticle&utm_medium=referral&utm_source=inshorts,https://static.inshorts.com/inshorts/images/v1/variants/jpg/m/2022/03_mar/29_tue/img_1648532143579_248.jpg?,https://inshorts.com/en/news/7-indianorigin-persons-charged-for-insider-trading-worth-million-dollars-in-us-1648534656035,Free Press Journal,Tuesday
"Tesla adds $84 billion to its value in 1 day, more than Ford's entire market cap","Tesla shares added $84 billion to their market value on Monday, more than Ford's entire market capitalisation. The stock surged after the electric car maker said it is planning a second stock split in about two years. Tesla's current market value stands at $1.13 trillion. When Tesla split its stock in August 2020, its share price rose 743% that year.",2022-03-29,Kiran Khatri,https://www.moneycontrol.com/news/world/tesla-adds-84-billion-to-valuation-on-stock-split-signal-8288891.html/amp?utm_campaign=fullarticle&utm_medium=referral&utm_source=inshorts,https://static.inshorts.com/inshorts/images/v1/variants/jpg/m/2022/03_mar/29_tue/img_1648527721851_681.jpg?,https://inshorts.com/en/news/tesla-adds-$84-billion-to-its-value-in-1-day-more-than-fords-entire-market-cap-1648530908142,Moneycontrol,Tuesday
"Hero MotoCorp made ₹1,000 crore bogus expenses, I-T dept reportedly finds","The I-T department, in a recent search operation at Hero MotoCorp-linked premises, reportedly found that the company made over ₹1000 crore in bogus expenses. It also found that Chairman and MD Pawan Munjal used black money to pay over ₹100 crore in cash to buy a farmhouse in Delhi, ANI reported citing sources. The company's shares fell over 7%.",2022-03-29,Kiran Khatri,https://www.timesnownews.com/business-economy/companies/hero-motocorp-raised-rs-1000-crore-bogus-expenses-md-used-black-money-to-purchase-farmhouse-i-t-department-article-90515490/amp?utm_campaign=fullarticle&utm_medium=referral&utm_source=inshorts,https://static.inshorts.com/inshorts/images/v1/variants/jpg/m/2022/03_mar/29_tue/img_1648549043331_321.jpg?,https://inshorts.com/en/news/hero-motocorp-made-₹1000-crore-bogus-expenses-it-dept-reportedly-finds-1648549490728,Times Now,Tuesday
"Bank transactions worth ₹18,000 crore hit by Bharat Bandh: Industry body","The All India Bank Employees Association said that the two-day Bharat Bandh against the Central government's policies affecting workers has halted banking transactions worth at least ₹18,000 crore. In the southern grid functioning in Chennai, six lakh cheques couldn't be cleared, AIBEA's General Secretary CH Venkatachalam said. ""We regret the inconvenience caused to the banking public,"" he added.",2022-03-29,Kiran Khatri,https://www.moneycontrol.com/news/business/economy/bharat-bandh-bank-unions-say-transactions-worth-at-least-rs-18000-crore-impacted-8289131.html/amp?utm_campaign=fullarticle&utm_medium=referral&utm_source=inshorts,https://static.inshorts.com/inshorts/images/v1/variants/jpg/m/2022/03_mar/29_tue/img_1648539094921_506.jpg?,https://inshorts.com/en/news/bank-transactions-worth-₹18000-crore-hit-by-bharat-bandh-industry-body-1648541911918,Moneycontrol,Tuesday
Russia's Gazprom seeks gas payments in euros from GAIL amid sanctions: Report,"Russian government-controlled energy firm Gazprom has asked India’s GAIL to pay for gas imports in euros instead of dollars, said two sources. This comes amid Russia facing various sanctions from European countries and the United States over its invasion of Ukraine. ""GAIL doesn't see any problem in settling payment in euros,"" said one of the sources.",2022-03-28,Ridham Gambhir,https://www.reuters.com/business/energy/exclusive-russias-gazprom-seeks-gas-payments-euros-indias-gail-sources-2022-03-25/?utm_campaign=fullarticle&utm_medium=referral&utm_source=inshorts,https://static.inshorts.com/inshorts/images/v1/variants/jpg/m/2022/03_mar/28_mon/img_1648450671843_114.jpg?,https://inshorts.com/en/news/russias-gazprom-seeks-gas-payments-in-euros-from-gail-amid-sanctions-report-1648451843493,Reuters,Monday
"Women's feet smell 5 times worse than men's, claims P&G ad; firm issues apology","US consumer goods firm Procter & Gamble has apologised for a WeChat infographic that had the text: ""Women's feet smell five times worse than men's. If you don't believe it, smell it."" P&G removed the advertisement, which was meant to promote fragrant body care products, after backlash in China. ""P&G always advocates equal, tolerant and respectful values,"" the company said.",2022-03-29,Kiran Khatri,https://www.businessinsider.in/thelife/news/pg-apologizes-after-sparking-outrage-with-social-media-post-claiming-womens-feet-smell-5-times-worse-than-mens/amp_articleshow/90516460.cms?utm_campaign=fullarticle&utm_medium=referral&utm_source=inshorts,https://static.inshorts.com/inshorts/images/v1/variants/jpg/m/2022/03_mar/29_tue/img_1648550744863_32.jpg?,https://inshorts.com/en/news/womens-feet-smell-5-times-worse-than-mens-claims-pg-ad-firm-issues-apology-1648552466473,Business Insider,Tuesday
"Who is Raj Subramaniam, the IITian named FedEx's new CEO?","Raj Subramaniam, who will be promoted as FedEx's CEO in June, is originally from Kerala's Thiruvananthapuram and currently lives in Memphis, Tennessee. The 56-year-old has a bachelor's degree in chemical engineering from IIT Bombay and an MBA from The University of Texas at Austin. Subramaniam joined FedEx in 1991 and is currently the firm's President and Chief Operating Officer.",2022-03-29,Kiran Khatri,https://www.moneycontrol.com/news/trends/current-affairs-trends/raj-subramaniam-to-be-new-fedex-ceo-5-things-to-know-about-the-newest-indian-origin-boss-8289011.html/amp?utm_campaign=fullarticle&utm_medium=referral&utm_source=inshorts,https://static.inshorts.com/inshorts/images/v1/variants/jpg/m/2022/03_mar/29_tue/img_1648534107694_95.jpg?,https://inshorts.com/en/news/who-is-raj-subramaniam-the-iitian-named-fedexs-new-ceo-1648535002682,Moneycontrol,Tuesday
Credit Suisse hasn't pursued new Russian clients since Feb: Reports,"Credit Suisse has stopped pursuing new clients in Russia since the invasion of Ukraine on February 24, Reuters reported. Roughly 4% of the assets the bank manages belong to Russian clients, CEO Thomas Gottstein had said earlier. The bank has been striving to reduce its business contacts with Russia and helping clients limit their exposure to the country.",2022-03-28,Ashley Paul,https://www.reuters.com/business/finance/credit-suisse-has-stopped-pursuing-new-client-business-russia-2022-03-28/?utm_campaign=fullarticle&utm_medium=referral&utm_source=inshorts,https://static.inshorts.com/inshorts/images/v1/variants/jpg/m/2022/03_mar/28_mon/img_1648478580978_227.jpg?,https://inshorts.com/en/news/credit-suisse-hasnt-pursued-new-russian-clients-since-feb-reports-1648483941946,Reuters,Monday
"37,000 feature phones users joined UPI service since March 8: Govt","Union Minister of State for Finance Bhagwat Kishanrao Karad, in a written reply to Lok Sabha, said over 37,000 users have used digital payment services meant for feature phones, totalling 21,833 successful transactions since its launch on March 8. The UPI123 Pay service is meant for feature phones, which can be used by people without the internet.",2022-03-29,Aishwarya Awasthi,https://www.moneycontrol.com/news/technology/more-than-37000-feature-phone-users-joined-upi-service-since-its-launch-on-march-8-karad-8287521.html/amp?utm_campaign=fullarticle&utm_medium=referral&utm_source=inshorts,https://static.inshorts.com/inshorts/images/v1/variants/jpg/m/2022/03_mar/29_tue/img_1648541288705_473.jpg?,https://inshorts.com/en/news/37000-feature-phones-users-joined-upi-service-since-march-8-govt-1648543883258,Moneycontrol,Tuesday
"SMEs raised ₹932 crore via IPOs in FY22, 3.8 times more than FY21","A total of 67 small and medium enterprises (SMEs) raised ₹932 crore via IPOs in FY22, 3.8 times higher than the amount raised by SMEs in FY21, according to Prime Database. In FY21, 28 SMEs raised ₹244 crore via IPOs. The largest SME IPO in FY22 was of Gujarat-based Aashka Hospitals for ₹96 crore in September 2021.",2022-03-28,Ashley Paul,https://www.financialexpress.com/industry/sme/msme-fin-smes-raised-over-rs-900-crore-through-ipos-in-fy22-up-nearly-4x-from-previous-year/2473929/lite/?utm_campaign=fullarticle&utm_medium=referral&utm_source=inshorts,https://static.inshorts.com/inshorts/images/v1/variants/jpg/m/2022/03_mar/28_mon/img_1648465198041_160.jpg?,https://inshorts.com/en/news/smes-raised-₹932-crore-via-ipos-in-fy22-38-times-more-than-fy21-1648468377767,Financial Express,Monday
Supertech homebuyers and creditors can file claims until April 8,"Homebuyers and creditors that have invested in Supertech can submit their claims in the realty firm's insolvency case till April 8, Supertech's insolvency resolution professional said. Homebuyers need to submit documents like builder-buyer agreement and statement of accounts. By submitting their claims, homebuyers and creditors will become a part of the company's Committee of Creditors (COC).",2022-03-29,Ashley Paul,https://www.moneycontrol.com/news/business/real-estate/supertech-insolvency-case-homebuyers-and-financial-creditors-should-file-claims-by-april-8-8288931.html/amp?utm_campaign=fullarticle&utm_medium=referral&utm_source=inshorts,https://static.inshorts.com/inshorts/images/v1/variants/jpg/m/2022/03_mar/29_tue/img_1648545103599_603.jpg?,https://inshorts.com/en/news/supertech-homebuyers-and-creditors-can-file-claims-until-april-8-1648547593397,Moneycontrol,Tuesday
Govt's total liabilities in Q3 rise 2.15% QoQ to ₹128.4 lakh cr,"The government's total liabilities rose 2.15% QoQ from ₹125.71 lakh crore in Q2 FY22 to ₹128.41 lakh crore in Q3. Data released by the Finance Ministry said public debt accounted for 91.6% of total outstanding liabilities in Q3, up from 91.15% in Q2. Commercial banks' share in the government's securities stood at 35.4% in Q3, down from 37.82% in Q2.",2022-03-28,Ashley Paul,https://www.financialexpress.com/economy/govts-total-liabilities-rise-2-pc-to-rs-128-41-lakh-cr-in-dec-quarter/2474004/lite/?utm_campaign=fullarticle&utm_medium=referral&utm_source=inshorts,https://static.inshorts.com/inshorts/images/v1/variants/jpg/m/2022/03_mar/28_mon/img_1648465909859_460.jpg?,https://inshorts.com/en/news/govts-total-liabilities-in-q3-rise-215-qoq-to-₹1284-lakh-cr-1648469292626,Financial Express,Monday
"ONGC Videsh sells Russia's Sokol oil to BPCL, HPCL: Reports","Oil and Natural Gas Corporation (ONGC) Videsh has sold at least one cargo of Russian Sokol oil to Bharat Petroleum Corporation Limited (BPCL) and Hindustan Petroleum Corporation Limited (HPCL), Reuters reported. This comes after the ONGC's overseas investment arm failed to draw interest in a tender earlier this month. ONGC Videsh has a stake in Russia's Sakhalin-1 project.",2022-03-29,Ashley Paul,https://www.moneycontrol.com/news/business/ongc-sells-russias-sokol-oil-to-bpcl-hpcl-report-8287391.html/amp?utm_campaign=fullarticle&utm_medium=referral&utm_source=inshorts,https://static.inshorts.com/inshorts/images/v1/variants/jpg/m/2022/03_mar/28_mon/img_1648484068117_423.jpg?,https://inshorts.com/en/news/ongc-videsh-sells-russias-sokol-oil-to-bpcl-hpcl-reports-1648495080933,Moneycontrol,Tuesday
SEBI directs Ruchi Soya to allow FPO investors to withdraw bids,"Market regulator SEBI has directed Ruchi Soya Industries to allow investors who participated in its ₹4,300 crore follow-on public offering (FPO) to withdraw their bids from March 28-30. SEBI's directive came after ""unsolicited SMSs advertising the issue"" were sent to Patanjali users. The procedure to withdraw bids shall be informed to the investors via an advertisement, SEBI's order stated.",2022-03-28,Ashley Paul,https://www.moneycontrol.com/news/business/sebi-orders-three-day-window-for-investors-in-ruchi-soya-fpo-to-withdraw-applications-8287341.html/amp?utm_campaign=fullarticle&utm_medium=referral&utm_source=inshorts,https://static.inshorts.com/inshorts/images/v1/variants/jpg/m/2022/03_mar/28_mon/img_1648481064553_776.jpg?,https://inshorts.com/en/news/sebi-directs-ruchi-soya-to-allow-fpo-investors-to-withdraw-bids-1648486330911,Moneycontrol,Monday
What are the major announcements made in Delhi Budget 2022-23?,"Presenting Delhi Budget 2022-23 of ₹75,800 crore, Deputy CM Manish Sisodia said the government aims to generate 20 lakh more jobs in five years. Calling it 'Rozgar Budget', he added ₹800 crore will be allocated for creating jobs. The government will start 'Delhi Food Truck Policy' under which food trucks will operate from 8 pm to 2 am, Sisodia stated.",2022-03-26,Atul Mishra,None,https://static.inshorts.com/inshorts/images/v1/variants/jpg/m/2022/03_mar/26_sat/img_1648278361345_533.jpg?,https://inshorts.com/en/news/what-are-the-major-announcements-made-in-delhi-budget-202223-1648280058266,Inshorts,Saturday
Which services are likely to be hit due to Bharat Bandh on March 28 & 29?,"A joint forum of central trade unions, with support from All India Bank Employees Association, has called for Bharat Bandh on March 28 and 29 against the Central government's policies affecting workers. Workers from roadways, transport, electricity, railways, coal, steel, oil, telecom, insurance and postal sectors are likely to join the strike. SBI said its banking services may get affected.",2022-03-27,Pragya Swastik,None,https://static.inshorts.com/inshorts/images/v1/variants/jpg/m/2022/03_mar/27_sun/img_1648373454750_935.jpg?,https://inshorts.com/en/news/which-services-are-likely-to-be-hit-due-to-bharat-bandh-on-march-28-29-1648376159765,Inshorts,Sunday
