headlines,text,date,author,read_more,image_url,inshorts_url,original_source,day
"Supertech declared insolvent, move may impact 25,000 homebuyers","Real estate developer Supertech, which has several ongoing projects in Noida, Gurugram and Ghaziabad, has gone into insolvency, Moneycontrol reported. On Friday, the National Company Law Tribunal ordered initiation of insolvency proceedings based on a petition filed by Union Bank of India for non-payment of dues. The order may impact over 25,000 buyers who were awaiting possession of their homes.",2022-03-25,Kiran Khatri,https://www.moneycontrol.com/news/business/real-estate/supertech-goes-into-insolvency-8274131.html/amp?utm_campaign=fullarticle&utm_medium=referral&utm_source=inshorts,https://static.inshorts.com/inshorts/images/v1/variants/jpg/m/2022/03_mar/25_fri/img_1648194974859_59.jpg?,https://inshorts.com/en/news/supertech-goes-into-insolvency-move-may-impact-25000-homebuyers-1648196740738,Moneycontrol,Friday
"Mother of 3 makes jewellery out of breast milk, expects ₹15 crore turnover by 2023","London-based Safiyya Riyadh, a mother of three, and her husband Adam Riyadh run Magenta Flowers, which has expanded its business into breast milk jewellery. They convert milk into precious gems that can be worn as pendants and rings and expect a turnover of ₹15 crore by 2023. ""It provides a sentimental connection between mothers and their babies,"" Safiyya said.",2022-03-25,Kiran Khatri,https://www.timesnownews.com/viral/mother-of-three-uses-breast-milk-to-make-jewellery-expects-turnover-of-rs-15-crore-by-2023-article-90428655/amp?utm_campaign=fullarticle&utm_medium=referral&utm_source=inshorts,https://static.inshorts.com/inshorts/images/v1/variants/jpg/m/2022/03_mar/25_fri/img_1648191502885_365.jpg?,https://inshorts.com/en/news/mother-of-3-makes-jewellery-out-of-breast-milk-expects-₹15-crore-turnover-by-2023-1648192845858,Times Now,Friday
I've nothing to do with it: UK FM on wife's stake in Infosys that operates in Russia,"UK Finance Minister Rishi Sunak recently faced questions about his wife Akshata Murthy's stake in Infosys, which has a Russian presence. ""I'm an elected politician and I'm here to talk...about what I'm responsible for. My wife isn't,"" he responded. When asked if Infosys is taking action against Putin's aggression, he said: ""I've...no idea...I've nothing to do with that company.""",2022-03-25,Kiran Khatri,https://www.mirror.co.uk/news/politics/rishi-sunaks-wife-490million-stake-26551479.amp?utm_campaign=fullarticle&utm_medium=referral&utm_source=inshorts,https://static.inshorts.com/inshorts/images/v1/variants/jpg/m/2022/03_mar/25_fri/img_1648181303046_913.jpg?,https://inshorts.com/en/news/ive-nothing-to-do-with-it-uk-fm-on-wifes-stake-in-infosys-that-operates-in-russia-1648182173656,Mirror,Friday
No active ties with local firms: Infosys as Rishi Sunak questioned over Russia link,"Infosys has responded after company Co-founder Narayana Murthy's son-in-law and UK Finance Minister, Rishi Sunak, was questioned on TV about Infosys' presence in Russia. The Indian IT major said it ""advocates for peace"" between Russia and Ukraine. It added, ""Infosys has a small team of employees based out of Russia...We don't have any active business relationships with local Russian enterprises.""",2022-03-26,Kiran Khatri,https://www.freepressjournal.in/amp/business/rishi-sunak-says-of-infosys-presence-in-russia-i-have-nothing-to-do-with-that-company?utm_campaign=fullarticle&utm_medium=referral&utm_source=inshorts,https://static.inshorts.com/inshorts/images/v1/variants/jpg/m/2022/03_mar/26_sat/img_1648267916946_521.jpg?,https://inshorts.com/en/news/no-active-ties-with-local-firms-infosys-as-rishi-sunak-questioned-over-russia-link-1648268657730,Free Press Journal,Saturday
"I'm struggling to pay bills, don't know how to survive: Sanctioned Russian oligarch","Russian oligarch Petr Aven said he's struggling to pay bills after he was sanctioned by the European Union and the UK following Russia's invasion of Ukraine. ""We don't understand how to survive...Our business is completely destroyed,"" Aven, whose wealth is estimated at $5.6 billion, told Financial Times. ""Will I be allowed to have a cleaner, or a driver?"" he added.",2022-03-25,Hiral Goyal,https://www.businessinsider.in/politics/world/news/a-sanctioned-russian-oligarch-says-hes-struggling-to-pay-bills-and-isnt-sure-he-can-employ-a-cleaner-or-driver/amp_articleshow/90445381.cms?utm_campaign=fullarticle&utm_medium=referral&utm_source=inshorts,https://static.inshorts.com/inshorts/images/v1/variants/jpg/m/2022/03_mar/25_fri/img_1648220884352_142.jpg?,https://inshorts.com/en/news/im-struggling-to-pay-bills-dont-know-how-to-survive-sanctioned-russian-oligarch-1648224278501,Business Insider India,Friday
Does Twitter adhere to principle of free speech: Musk asks users in Twitter poll,"World's richest person Elon Musk posted a Twitter poll asking users to vote if Twitter adheres to the principle of free speech. ""Free speech is essential to a functioning democracy. Do you believe Twitter rigorously adheres to this principle?"" Musk wrote, giving yes and no as options. ""The consequences of this poll will be important. Please vote carefully,"" he warned.",2022-03-25,Kiran Khatri,https://www.moneycontrol.com/news/trends/elon-musk-twitter-poll-gets-social-media-talking-about-consequences-8275021.html/amp?utm_campaign=fullarticle&utm_medium=referral&utm_source=inshorts,https://static.inshorts.com/inshorts/images/v1/variants/jpg/m/2022/03_mar/25_fri/img_1648205760117_481.jpg?,https://inshorts.com/en/news/does-twitter-adhere-to-principle-of-free-speech-musk-asks-users-in-twitter-poll-1648207288295,Moneycontrol,Friday
"ICICI Bank users face glitches on net banking, mobile app; bank says 'working on it'","Several users of ICICI Bank took to Twitter on Friday to complain that they were facing glitches while using their net banking services and mobile app. ""We're working to get things back to normal as quick as possible and will update you here,"" ICICI Direct said in a tweet. ""This is not acceptable during market hours,"" a Twitter user wrote.",2022-03-25,Kiran Khatri,https://www.moneycontrol.com/news/business/twitter-flooded-with-grievance-posts-as-customers-face-glitches-on-icici-net-banking-8275131.html/amp?utm_campaign=fullarticle&utm_medium=referral&utm_source=inshorts,https://static.inshorts.com/inshorts/images/v1/variants/jpg/m/2022/03_mar/25_fri/img_1648202798518_250.jpg?,https://inshorts.com/en/news/icici-bank-users-face-glitches-on-net-banking-mobile-app-bank-says-working-on-it-1648203903488,Moneycontrol,Friday
Apple pays another round of bonuses of ₹1.5 crore to some staff: Report,"Apple has reportedly been paying a small number of engineers another round of bonuses in stock units ranging from $100,000 (₹76 lakh) to $200,000 (₹1.52 crore). The bonuses are designed to keep employees from leaving by vesting over several years, Bloomberg reported. The iPhone maker previously gave out stock-based bonuses of up to $180,000 in December.",2022-03-26,Kiran Khatri,https://www.bloombergquint.com/business/apple-pays-another-round-of-rare-200-000-bonuses-to-some-staff?utm_campaign=fullarticle&utm_medium=referral&utm_source=inshorts,https://static.inshorts.com/inshorts/images/v1/variants/jpg/m/2022/03_mar/26_sat/img_1648266701956_981.jpg?,https://inshorts.com/en/news/apple-pays-another-round-of-bonuses-of-₹15-crore-to-some-staff-report-1648268349055,BloombergQuint,Saturday
"Ambani, 60 other tycoons invited to Yogi's swearing-in as UP CM: Report","Mukesh Ambani and 60 other business tycoons have been invited to watch Yogi Adityanath take oath as UP's CM for a second time, PTI reported on Thursday. Leading industrialists have been invited as they have a role in boosting the state's economy, former UP BJP chief Laxmikant Bajpai told ANI. Yogi will be sworn in as UP's CM on Friday.",2022-03-24,Pragya Swastik,https://www.hindustantimes.com/india-news/yogi-adityanath-swearing-in-reliance-industries-mukesh-ambani-invited-report-101648127861570-amp.html?utm_campaign=fullarticle&utm_medium=referral&utm_source=inshorts,https://static.inshorts.com/inshorts/images/v1/variants/jpg/m/2022/03_mar/24_thu/img_1648139703656_383.jpg?,https://inshorts.com/en/news/ambani-60-other-tycoons-invited-to-yogis-swearingin-as-up-cm-report-1648141837637,Hindustan Times,Thursday
"Era of globalisation is over, we must prepare for a new era: Zoho CEO","Zoho CEO Sridhar Vembu, in response to a US author saying globalisation is over and suggesting the US should raise tariffs, said globalisation's era is ""over"" and that ""we must prepare for a new era"". ""It was killed by...US dollar being an infinitely expanding reserve currency, which led to...US surrendering its industrial base, accompanied by...massive increase in inequality,"" Vembu added.",2022-03-25,Aishwarya Awasthi,https://twitter.com/svembu/status/1506985961850236929?utm_campaign=fullarticle&utm_medium=referral&utm_source=inshorts,https://static.inshorts.com/inshorts/images/v1/variants/jpg/m/2022/03_mar/25_fri/img_1648205168957_745.jpg?,https://inshorts.com/en/news/era-of-globalisation-is-over-we-must-prepare-for-a-new-era-zoho-ceo-1648206346847,Twitter,Friday
Will consider if 'Nimbooz' is lemonade or fruit juice based drink: Supreme Court,"The Supreme Court recently agreed to consider whether the product 'Nimbooz' can be classified under item 'lemonade' or as 'fruit pulp or fruit juice based drinks' for the purposes of determining the excise duty on the drink. This comes after an appeal from the company, Aradhana Foods, that demanded the drink be called 'lemonade' instead of its current categorisation.",2022-03-24,Arshiya Chopra,https://www.thequint.com/amp/story/neon/social-buzz/sc-discusses-whether-nimbooz-is-lemonade-or-fruit-juice-based-drink?utm_campaign=fullarticle&utm_medium=referral&utm_source=inshorts,https://static.inshorts.com/inshorts/images/v1/variants/jpg/m/2022/03_mar/24_thu/img_1648137273127_248.jpg?,https://inshorts.com/en/news/will-consider-if-nimbooz-is-lemonade-or-fruit-juice-based-drink-supreme-court-1648137741396,The Quint,Thursday
"India to send 40,000 tonnes of diesel to crisis-hit Sri Lanka: Report","India has agreed to urgently provide a consignment of diesel to Sri Lanka as it faces a shortage amid an economic crisis. Indian Oil Corporation will reportedly send 40,000 tonnes of diesel to Sri Lanka soon. This is in addition to the seven monthly shipments of petrol and diesel being sent to Sri Lanka under a $500-million line of credit.",2022-03-25,Kiran Khatri,https://auto.hindustantimes.com/auto/news/india-comes-to-aid-of-crisis-hit-sri-lanka-will-send-40-000-tonnes-of-diesel/amp-41648180772857.html?utm_campaign=fullarticle&utm_medium=referral&utm_source=inshorts,https://static.inshorts.com/inshorts/images/v1/variants/jpg/m/2022/03_mar/25_fri/img_1648187189041_443.jpg?,https://inshorts.com/en/news/india-to-send-40000-tonnes-of-diesel-to-crisishit-sri-lanka-report-1648189350397,Hindustan Times,Friday
"Petrol, diesel get costlier by ₹2.40 per litre in 4 days","Petrol and diesel have become costlier by around ₹2.40 per litre in just four days as state-run oil companies raised their rates by 80 paise a litre for the third time since March 22 on Friday. In Delhi, petrol prices have jumped by 2.5% since March 22 to ₹97.81 per litre. Fuel rates were unchanged from November 4, 2021-March 21.",2022-03-25,Kiran Khatri,https://www.hindustantimes.com/business/petrol-and-diesel-prices-jump-by-2-40-a-litre-in-four-days-101648183999916-amp.html?utm_campaign=fullarticle&utm_medium=referral&utm_source=inshorts,https://static.inshorts.com/inshorts/images/v1/variants/jpg/m/2022/03_mar/25_fri/img_1648192106724_731.jpg?,https://inshorts.com/en/news/petrol-diesel-get-costlier-by-₹240-per-litre-in-4-days-1648193037908,Hindustan Times,Friday
"Finance Bill, 2022 passed in Lok Sabha","The Lok Sabha on Friday passed the Finance Bill, 2022, completing the Budgetary exercise for the financial year 2022-23. The Bill was approved by Lower House after accepting 39 official amendments moved by Finance Minister Nirmala Sitharaman. The Bill proposed introduction of a new section to tax virtual digital assets (VDAs) and retrospective disallowance of deduction for surcharge or cess.",2022-03-25,Hiral Goyal,https://www.financialexpress.com/economy/lok-sabha-passes-finance-bill-completes-budgetary-exercise-for-fy23/2471946/lite/?utm_campaign=fullarticle&utm_medium=referral&utm_source=inshorts,https://static.inshorts.com/inshorts/images/v1/variants/jpg/m/2022/03_mar/25_fri/img_1648208907955_715.jpg?,https://inshorts.com/en/news/finance-bill-2022-passed-in-lok-sabha-1648210689112,Financial Express,Friday
"Future Enterprises defaults on ₹94 crore payment to banks, shares fall 5%","Future Enterprises has missed the due date of March 23, 2022, to pay ₹93.99 crore to Punjab National Bank and Canara Bank under the one-time restructuring (OTR) plan. Shares of Kishore Biyani-led company fell nearly 5% on Friday after the announcement. Future Enterprises informed the stock exchanges that it had a review period of 30 days to make the payment.",2022-03-25,Hiral Goyal,https://www.freepressjournal.in/amp/business/future-enterprises-defaults-on-rs-9399-cr-payment-to-pnb-canara-bank?utm_campaign=fullarticle&utm_medium=referral&utm_source=inshorts,https://static.inshorts.com/inshorts/images/v1/variants/jpg/m/2022/03_mar/25_fri/img_1648200001090_166.jpg?,https://inshorts.com/en/news/future-enterprises-defaults-on-₹94-crore-payment-to-banks-shares-fall-5-1648201186591,Free Press Journal,Friday
Air India may buy 30 large jets worth $10 billion: Rolls-Royce executive,"Tata Group-owned Air India is looking to buy as many as 30 widebody aircraft worth $10 billion, said the Senior Vice President of Customers for Rolls-Royce Holdings in Asia Pacific. ""I think they are looking at something up to 30 aircraft, could be as big as that, which is a big order. A really big order,"" Chris Davie told Bloomberg.",2022-03-25,Hiral Goyal,https://www.bloombergquint.com/business/air-india-may-buy-large-jets-worth-10-billion-enginemaker-says?utm_campaign=fullarticle&utm_medium=referral&utm_source=inshorts,https://static.inshorts.com/inshorts/images/v1/variants/jpg/m/2022/03_mar/25_fri/img_1648225526209_884.jpg?,https://inshorts.com/en/news/air-india-may-buy-30-large-jets-worth-$10-billion-rollsroyce-executive-1648226836747,BloombergQuint,Friday
Emami acquires Dermicool powder brand from Reckitt for ₹432 crore,"Emami on Friday announced that it has acquired the popular prickly heat powder brand Dermicool from FMCG major Reckitt Benckiser Group for a total consideration of ₹432 crore. The acquisition is funded through internal accruals and is subject to customary closing conditions, the company said. According to Emami, Dermicool commands 20% market share in the prickly heat powder category.",2022-03-25,Hiral Goyal,https://www.moneycontrol.com/news/business/companies/emami-acquires-dermicool-from-reckitt-for-rs-432-crore-8275991.html/amp?utm_campaign=fullarticle&utm_medium=referral&utm_source=inshorts,https://static.inshorts.com/inshorts/images/v1/variants/jpg/m/2022/03_mar/25_fri/img_1648212724522_650.jpg?,https://inshorts.com/en/news/emami-acquires-powder-brand-dermicool-from-reckitt-for-₹432-crore-1648213121026,Moneycontrol,Friday
Why was realty developer Supertech declared bankrupt by NCLT?,"India's bankruptcy court NCLT ordered insolvency proceedings against real estate firm Supertech over non-payment of around ₹432 crore in dues. The default involves a loan given by Union Bank of India to Eco Village II project at Uttar Pradesh's Greater Noida, which was being developed for ₹1,106 crore. The bank moved NCLT in 2019 after Supertech failed to repay it.",2022-03-26,Kiran Khatri,https://theprint.in/economy/nclt-orders-insolvency-proceedings-against-supertech-ltd-over-rs-432-crore-default/888665/?amp=&utm_campaign=fullarticle&utm_medium=referral&utm_source=inshorts,https://static.inshorts.com/inshorts/images/v1/variants/jpg/m/2022/03_mar/26_sat/img_1648264626508_311.jpg?,https://inshorts.com/en/news/why-was-realty-developer-supertech-declared-bankrupt-by-nclt-1648265040331,The Print,Saturday
Axis Bank fined ₹5 lakh by SEBI for violating merchant banking norms,The Securities and Exchange Board of India (SEBI) has imposed a ₹5 lakh fine on Axis Bank for violating merchant banking regulations. SEBI had conducted an examination into Debt Capital Market operations of Axis Bank between 2016-2019. It found that Axis Bank had acted as a merchant banker for 22 entities and acquired securities in nine issues without informing SEBI.,2022-03-25,Hiral Goyal,https://www.financialexpress.com/industry/banking-finance/sebi-imposes-rs-5-lakh-fine-on-axis-bank/2471257/lite/?utm_campaign=fullarticle&utm_medium=referral&utm_source=inshorts,https://static.inshorts.com/inshorts/images/v1/variants/jpg/m/2022/03_mar/25_fri/img_1648201476647_533.jpg?,https://inshorts.com/en/news/axis-bank-fined-₹5-lakh-by-sebi-for-violating-merchant-banking-norms-1648202691189,Financial Express,Friday
"IOC, BPCL, HPCL lost ₹17,000 cr in revenue in March due to fuel rate freeze: Moody's","Indian Oil Corporation, BPCL and HPCL have together lost around ₹17,000 crore in revenue in March by keeping fuel rates unchanged despite a sharp rise in global oil prices, Moody's Investors Service said. Indian retailers raised petrol prices on March 22, for the first time since November 4. Crude oil prices were averaging around $111 per barrel in early March.",2022-03-25,Kiran Khatri,https://www.moneycontrol.com/news/business/ioc-bpcl-hpcl-lost-2-25-billion-in-revenue-due-to-fuel-price-freeze-moodys-8270751.html/amp?utm_campaign=fullarticle&utm_medium=referral&utm_source=inshorts,https://static.inshorts.com/inshorts/images/v1/variants/jpg/m/2022/03_mar/25_fri/img_1648184416940_977.jpg?,https://inshorts.com/en/news/ioc-bpcl-hpcl-lost-₹17000-cr-in-revenue-in-march-due-to-fuel-rate-freeze-moodys-1648185774891,Moneycontrol,Friday
53rd Indian Handicrafts & Gifts Fair to be held in Gr Noida from Mar 30,"The 53rd Indian Handicrafts and Gifts Fair will be held at India Expo Centre and Mart in Greater Noida from March 30-April 3. Reportedly, over 2,500 handicraft exhibitors from across the country will participate in the fair. EPCH Chairman Raj Kumar Malhotra said the exhibitors will showcase over 2,000 new products across 14 product categories like houseware, furniture, decoratives, etc.",2022-03-25,Dharini Mudgal,https://www.hindustantimes.com/cities/noida-news/53rd-indian-handicrafts-and-gifts-fair-to-be-held-in-greater-noida-from-march-30-101648148186293-amp.html?utm_campaign=fullarticle&utm_medium=referral&utm_source=inshorts,https://static.inshorts.com/inshorts/images/v1/variants/jpg/m/2022/03_mar/25_fri/img_1648200103128_571.jpg?,https://inshorts.com/en/news/53rd-indian-handicrafts-gifts-fair-to-be-held-in-gr-noida-from-mar-30-1648203780085,Hindustan Times,Friday
UN cuts India's GDP growth forecast for FY22 from 6.7% to 4.6%,"India's projected GDP growth for FY22 has been downgraded from 6.7% to 4.6%, a United Nations Conference on Trade and Development (UNCTAD) report said. Citing the Ukraine war for the cut in forecast, it added that India is expected to face reflexes from trade sanctions, food inflation and financial instability. It also said Russia will experience deep recession this year.",2022-03-24,Ashley Paul,https://www.moneycontrol.com/news/business/economy/indias-2022-gdp-growth-downgraded-to-4-6-due-to-ongoing-war-in-ukraine-un-report-8271481.html/amp?utm_campaign=fullarticle&utm_medium=referral&utm_source=inshorts,https://static.inshorts.com/inshorts/images/v1/variants/jpg/m/2022/03_mar/24_thu/img_1648138712677_115.jpg?,https://inshorts.com/en/news/un-cuts-indias-gdp-growth-forecast-for-fy22-from-67-to-46-1648142234370,Moneycontrol,Thursday
Delhi court dismisses ex-NSE official Anand Subramanian's bail plea,"A Delhi Court on Thursday dismissed former National Stock Exchange (NSE) Group Operating Officer Anand Subramanian's bail plea. Subramanian is accused of being the 'Himalayan yogi' in the co-location scam case including former NSE CEO Chitra Ramkrishna. ""There are strong chances that [Subramanian] may influence the relevant witnesses or tamper with the evidence,"" the court said.",2022-03-24,Ashley Paul,https://www.financialexpress.com/india-news/nse-co-location-scam-delhi-court-dismisses-bail-plea-by-former-goo-anand-subramanian/2470741/lite/?utm_campaign=fullarticle&utm_medium=referral&utm_source=inshorts,https://static.inshorts.com/inshorts/images/v1/variants/jpg/m/2022/03_mar/24_thu/img_1648123497866_813.jpg?,https://inshorts.com/en/news/delhi-court-dismisses-exnse-official-anand-subramanians-bail-plea-1648130929786,Financial Express,Thursday
IGL hikes price of CNG and PNG by ₹1 per unit in Delhi-NCR,"Indraprastha Gas Limited (IGL) has hiked the price of compressed natural gas (CNG) and domestic piped natural gas (PNG) in Delhi-NCR by ₹1/unit. The new prices will come into effect from today. CNG now costs ₹59.01/kg in Delhi, ₹61.58/kg in Noida and ₹67.37/kg in Gurugram. PNG costs ₹36.61/standard cubic meter (SCM) in Delhi, ₹35.86/SCM in Noida and ₹34.81/SCM in Gurugram.",2022-03-24,Apaar Sharma,https://twitter.com/ANI/status/1506830339775537159?utm_campaign=fullarticle&utm_medium=referral&utm_source=inshorts,https://static.inshorts.com/inshorts/images/v1/variants/jpg/m/2022/03_mar/24_thu/img_1648095827095_733.jpg?,https://inshorts.com/en/news/igl-hikes-price-of-cng-and-png-by-₹1-per-unit-in-delhincr-1648097022795,ANI,Thursday
"India's exports hit $400 billion for 1st time ever, PM Modi calls it 'key milestone'","Prime Minister Narendra Modi on Wednesday said that India has achieved an ambitious target of $400 billion worth of goods exports for the first time ever, nine days ahead of schedule. ""I congratulate our farmers, weavers, MSMEs, manufacturers, exporters for this success,"" he tweeted. ""This is a key milestone in our Aatmanirbhar Bharat journey,"" the PM added.",2022-03-23,Kiran Khatri,https://twitter.com/narendramodi/status/1506474220209184769?ref_src=twsrc%5Egoogle%7Ctwcamp%5Eserp%7Ctwgr%5Etweet&utm_campaign=fullarticle&utm_medium=referral&utm_source=inshorts,https://static.inshorts.com/inshorts/images/v1/variants/jpg/m/2022/03_mar/23_wed/img_1648014743505_460.jpg?,https://inshorts.com/en/news/indias-exports-hit-$400-billion-for-1st-time-ever-pm-modi-calls-it-key-milestone-1648016144641,Twitter,Wednesday
"Goldman Sachs CEO, who's also a DJ, to perform at Lollapalooza music festival","Goldman Sachs' 60-year-old CEO David Solomon, who's also a DJ, is set to perform at Chicago's Lollapalooza music festival in July. Besides Solomon, artists like Dua Lipa, Machine Gun Kelly, Doja Cat, and bands like Green Day and Metallica are set to perform at the music festival. Previously, Solomon also did a cameo on the Showtime series 'Billions'.",2022-03-23,Pragya Swastik,https://www.bloombergquint.com/onweb/goldman-ceo-solomon-gets-his-big-break-with-lollapalooza-slot?utm_campaign=fullarticle&utm_medium=referral&utm_source=inshorts,https://static.inshorts.com/inshorts/images/v1/variants/jpg/m/2022/03_mar/23_wed/img_1648032577152_648.jpg?,https://inshorts.com/en/news/goldman-sachs-ceo-whos-also-a-dj-to-perform-at-lollapalooza-music-festival-1648034269298,BloombergQuint,Wednesday
I want one: Mahindra as man builds wooden treadmill that works without power,"Businessman Anand Mahindra shared the video of a man who built a wooden treadmill that works without power and wrote on Twitter, ""I want one."" ""In a world of...energy-hungry devices...the hours of dedicated efforts in hand-making this device makes it a work of art, not just a treadmill,"" he added. Telangana's IT Minister KT Rama Rao also lauded his work.",2022-03-24,Kiran Khatri,https://www.moneycontrol.com/news/trends/current-affairs-trends/anand-mahindra-kt-rama-rao-laud-wooden-treadmill-that-needs-no-electricity-8269751.html/amp?utm_campaign=fullarticle&utm_medium=referral&utm_source=inshorts,https://static.inshorts.com/inshorts/images/v1/variants/jpg/m/2022/03_mar/24_thu/img_1648118364185_434.jpg?,https://inshorts.com/en/news/i-want-one-mahindra-as-man-builds-wooden-treadmill-that-works-without-power-1648120621009,Moneycontrol,Thursday
Indian Oil Corporation buys another 3 million barrels of Russian Urals oil: Report,"Indian Oil Corporation (IOC) has reportedly bought 3 million barrels of Russian Urals oil and 2 million barrels of West African oil through a tender for May loading. It purchased the Urals crude from Geneva-based trader Vitol on delivered basis at a ""discount"", Reuters reported citing sources. Earlier this month, IOC bought similar volumes of Urals from Vitol.",2022-03-24,Kiran Khatri,https://www.reuters.com/world/india/indian-oil-buys-3-mln-barrels-urals-may-loading-trade-sources-2022-03-23/?utm_campaign=fullarticle&utm_medium=referral&utm_source=inshorts,https://static.inshorts.com/inshorts/images/v1/variants/jpg/m/2022/03_mar/24_thu/img_1648099745379_74.jpg?,https://inshorts.com/en/news/indian-oil-corporation-buys-another-3-million-barrels-of-russian-urals-oil-report-1648102574946,Reuters,Thursday
