headlines,text,date,author,read_more,image_url,inshorts_url,original_source,day
Cong helping Rohingya Muslims settle in Uttarakhand: Amit Shah,"Union Home Minister Amit Shah on Saturday said that Congress has started appeasement politics by helping Rohingya Muslims settle in Uttarakhand. If BJP is voted back to power, it will expel Rohingya Muslims from the state, Shah added. Congress workers are also helping Rohingya Muslims get ration and identity cards, he further said.",2022-02-12,Shailesh,https://theprint.in/politics/congress-has-started-appeasement-politics-helping-rohingya-muslims-settle-on-mountains-of-uttarakhand-amit-shah/828814/?amp=&utm_campaign=fullarticle&utm_medium=referral&utm_source=inshorts,https://static.inshorts.com/inshorts/images/v1/variants/jpg/m/2022/02_feb/12_sat/img_1644669906049_824.jpg?,https://inshorts.com/en/news/cong-helping-rohingya-muslims-settle-in-uttarakhand-amit-shah-1644672010640,ThePrint,Saturday
Congress not even ready to consider India a nation: PM Modi,"Addressing a rally in poll-bound Uttarakhand, PM Narendra Modi on Saturday said that the Congress party was not even ready to consider India a nation. PM Modi said, ""India is one, this country is one...Congress says there is no nation...Congress is not even ready to consider India a nation."" ""BJP will secure the 'Devatava' [divinity] of Devbhoomi Uttarakhand,"" he added.",2022-02-12,Dharini Mudgal,https://www.timesnownews.com/amp/india/article/uttarakhand-election-2022-congress-not-even-ready-to-consider-india-a-nation-says-pm-modi-during-poll-rally/858179?utm_campaign=fullarticle&utm_medium=referral&utm_source=inshorts,https://static.inshorts.com/inshorts/images/v1/variants/jpg/m/2022/02_feb/12_sat/img_1644665936264_685.jpg?,https://inshorts.com/en/news/congress-not-even-ready-to-consider-india-a-nation-pm-modi-1644672289171,timesnownews.com,Saturday
Cong leaders put humanity to shame: Nadda over 1984 anti-Sikh riots,"BJP chief JP Nadda on Saturday blamed the Congress party for the 1984 anti-Sikh riots in Delhi, saying that Congress leaders put humanity to shame. ""During...anti-Sikh riots...Congress leaders used to say when a big tree falls, the earth shakes,"" Nadda said. ""They brought such...situation where Sikh brothers and sisters were killed and now they're asking for your votes,"" he added.",2022-02-12,Dharini Mudgal,https://aninews.in/news/national/politics/no-one-else-has-done-the-kind-of-work-pm-modi-did-for-sikhs-says-jp-nadda-slams-congress-for-1984-anti-sikh-riots20220212185343/?utm_campaign=fullarticle&utm_medium=referral&utm_source=inshorts,https://static.inshorts.com/inshorts/images/v1/variants/jpg/m/2022/02_feb/12_sat/img_1644675246302_376.jpg?,https://inshorts.com/en/news/cong-leaders-put-humanity-to-shame-nadda-over-1984-antisikh-riots-1644676512184,ANI News,Saturday
Congress candidate Salim Khan joins SP ahead of 2nd phase of UP polls,"Ahead of the second phase of the Assembly elections in Uttar Pradesh, Congress' candidate from Amroha (Sadar seat), Salim Khan, joined the Samajwadi Party. He joined the party in the presence of SP chief Akhilesh Yadav. Reportedly, a few days ago, Khan had publicly stated that ""people must vote for SP to keep the ruling BJP out in the elections"".",2022-02-11,Dharini Mudgal,https://www.timesnownews.com/amp/india/article/up-election-2022-setback-for-congress-as-party-s-amroha-candidate-joins-samajwadi-party-ahead-of-polls/857960?utm_campaign=fullarticle&utm_medium=referral&utm_source=inshorts,https://static.inshorts.com/inshorts/images/v1/variants/jpg/m/2022/02_feb/11_fri/img_1644590700913_342.jpg?,https://inshorts.com/en/news/congress-candidate-salim-khan-joins-sp-ahead-of-2nd-phase-of-up-polls-1644595435547,timesnownews.com,Friday
Jinnah's soul has entered into Congress: Assam CM amid hijab row,"Amid the hijab controversy in Karnataka, BJP leader and Assam CM Himanta Biswa Sarma on Friday said that ""political Islam"" is sponsored by Congress as Jinnah's soul has entered into the party. He said, ""Congress wants...Muslims to remain backward and hence is promoting madrassas and hijab."" ""[PM Narendra Modi]...talking about making India...world leader...others are talking about hijab,"" he added.",2022-02-11,Dharini Mudgal,https://www.freepressjournal.in/amp/india/jinnahs-soul-has-entered-into-congress-assam-cm-himanta-biswa-sarma-amid-karnataka-hijab-row?utm_campaign=fullarticle&utm_medium=referral&utm_source=inshorts,https://static.inshorts.com/inshorts/images/v1/variants/jpg/m/2022/02_feb/11_fri/img_1644594209118_90.jpg?,https://inshorts.com/en/news/jinnahs-soul-has-entered-into-congress-assam-cm-amid-hijab-row-1644596877590,Free Press Journal,Friday
Dynasts are sleepless after first round of voting in UP polls: PM,"PM Narendra Modi on Saturday said that political dynasts are sleepless after the first round of voting in UP Assembly polls. For such leaders, the mantra of democracy is ""government of the family, by the family and for the family"", he added. UP residents have realised that only the BJP government has antidote for rioters and mafias, he further said.",2022-02-12,Shailesh,https://theprint.in/india/dynasts-are-sleepless-after-first-round-of-voting-pm-modi-at-rally-in-up/828902/?amp=&utm_campaign=fullarticle&utm_medium=referral&utm_source=inshorts,https://static.inshorts.com/inshorts/images/v1/variants/jpg/m/2022/02_feb/12_sat/img_1644671920586_78.jpg?,https://inshorts.com/en/news/dynasts-are-sleepless-after-first-round-of-voting-in-up-polls-pm-1644675388521,ThePrint,Saturday
BJD leader allegedly threatens voters in Odisha; SEC issued notice,"Odisha's State Election Commission (SEC) on Friday issued a show-cause notice to BJD leader Pramila Malik for allegedly threatening voters. Malik had reportedly threatened to stop providing benefits from various schemes if people don't vote for her party during the upcoming panchayat elections. ""I did not violate the model code of conduct by seeking votes for my party,"" Malik said.",2022-02-12,Medhaa Gupta,https://theprint.in/india/odisha-govt-chief-whip-threatens-voters-to-stop-benefits-of-schemes-show-caused/828448/?amp=&utm_campaign=fullarticle&utm_medium=referral&utm_source=inshorts,https://static.inshorts.com/inshorts/images/v1/variants/jpg/m/2022/02_feb/12_sat/img_1644647014254_26.jpg?,https://inshorts.com/en/news/bjd-leader-allegedly-threatens-voters-in-odisha-sec-issued-notice-1644649126676,ThePrint,Saturday
"Schools for classes up to 10th to reopen from Monday, colleges later: K'taka CM","Karnataka CM Basavaraj S Bommai said on Thursday that schools for classes up to Standard 10 can reopen from Monday while a decision on reopening schools for Standard 11-12 as well as degree colleges will be taken later. On Tuesday, Bommai had ordered schools and colleges to close for three days amid the controversy over banning hijab in colleges.",2022-02-10,Shalini Ojha,https://twitter.com/ANI/status/1491777831877365764?utm_campaign=fullarticle&utm_medium=referral&utm_source=inshorts,https://static.inshorts.com/inshorts/images/v1/variants/jpg/m/2022/02_feb/10_thu/img_1644503384828_293.jpg?,https://inshorts.com/en/news/schools-for-classes-up-to-10th-to-reopen-from-monday-colleges-later-ktaka-cm-1644504523465,Twitter,Thursday
"EC revises Manipur election dates, to be held on Feb 28 and Mar 5","The Election Commission on Thursday revised the dates for Assembly election in Manipur, saying it will be conducted on February 28 and March 5. It was earlier scheduled for February 27 and March 3. Notably, the tenure of the Manipur Legislative Assembly, which consists of 60 members, is scheduled to end on March 19, 2022.",2022-02-10,Shalini Ojha,https://twitter.com/PTI_News/status/1491766198580572162?utm_campaign=fullarticle&utm_medium=referral&utm_source=inshorts,https://static.inshorts.com/inshorts/images/v1/variants/jpg/m/2022/02_feb/10_thu/img_1644500525957_656.jpg?,https://inshorts.com/en/news/ec-revises-manipur-election-dates-to-be-held-on-feb-28-and-mar-5-1644501473522,Twitter,Thursday
Omar responds after Yogi's 'UP may become Kashmir if voters make mistake' remark,"After UP CM Yogi Adityanath's ""UP may become Kashmir if voters make a mistake"" remark, former J&K CM Omar Abdullah tweeted, ""J&K has less poverty, better human development indices, less crime & generally better standards of living than UP."" ""What we lack is good governance over the last 3-4 years but that is a temporary phenomenon,"" Omar wrote.",2022-02-11,Ankush Verma,https://www.thequint.com/amp/story/uttar-pradesh-elections/if-up-becomes-like-kerala-cm-vijayan-responds-to-yogi-adityanaths-barb?utm_campaign=fullarticle&utm_medium=referral&utm_source=inshorts,https://static.inshorts.com/inshorts/images/v1/variants/jpg/m/2022/02_feb/11_fri/img_1644561776926_783.jpg?,https://inshorts.com/en/news/omar-responds-after-yogis-up-may-become-kashmir-if-voters-make-mistake-remark-1644563562760,TheQuint,Friday
"Details of Sonia's bungalow's unpaid rent surface, BJP leader starts fund","After an RTI reply revealed that ₹4,610 rent of Congress interim chief Sonia Gandhi's bungalow in Delhi hasn't been paid since 2020, BJP leader Tajinder Pal Singh Bagga started a fund for her on Twitter. ""She can't do scams now but political differences aside, I want to help her as a human being,"" he tweeted. He said he deposited ₹10.",2022-02-10,Shalini Ojha,https://www.freepressjournal.in/amp/india/bjp-leader-tajinder-pal-singh-bagga-launches-sonia-gandhi-relief-fund-after-rti-reply-reveals-rent-of-congress-headquarters-not-paid?utm_campaign=fullarticle&utm_medium=referral&utm_source=inshorts,https://static.inshorts.com/inshorts/images/v1/variants/jpg/m/2022/02_feb/10_thu/img_1644506275606_829.jpg?,https://inshorts.com/en/news/details-of-sonias-bungalows-unpaid-rent-surface-bjp-leader-starts-fund-1644510131073,Free Press Journal,Thursday
My name is Jyotiraditya Scindia: Minister on being called 'maharaj',"Civil Aviation Minister Jyotiraditya Scindia on Thursday took exception to being referred to as 'maharaj' by Congress' Adhir Ranjan Chowdhury. He said, ""I want to inform him that my name is Jyotiraditya Scindia."" While asking a question on airport projects in West Bengal, Chowdhury said, ""The matter is that one 'maharaj' is a minister, another 'maharaj' Air India...privatisation is happening.""",2022-02-10,Shalini Ojha,https://repository.inshorts.com/articles/en/PTI/1d220818-921f-467f-bd7d-23173ccf4d07?utm_campaign=fullarticle&utm_medium=referral&utm_source=inshorts,https://static.inshorts.com/inshorts/images/v1/variants/jpg/m/2022/02_feb/10_thu/img_1644512034747_996.jpg?,https://inshorts.com/en/news/my-name-is-jyotiraditya-scindia-minister-on-being-called-maharaj-1644515063280,PTI,Thursday
"Ambani, Adani should be worshipped as they create jobs: BJP MP","During a parliamentary debate over unemployment, BJP MP and former Union Minister KJ Alphons said, ""Be it Reliance, be it Ambani, be it Adani, be it anybody, they must be worshipped. Yes, because they provide jobs."" He added that every industrialist who creates money in India creates jobs and they need to be respected.",2022-02-11,Arshiya Chopra,None,https://static.inshorts.com/inshorts/images/v1/variants/jpg/m/2022/02_feb/11_fri/img_1644570441302_419.jpg?,https://inshorts.com/en/news/ambani-adani-should-be-worshipped-as-they-create-jobs-bjp-mp-1644571754491,Inshorts,Friday
Want me to address that poverty?: FM on Rahul's old 'poverty a state of mind' remark,"Finance Minister Nirmala Sitharaman on Friday took a dig at Rahul Gandhi's 2013 remark calling poverty ""just a state of mind"". Speaking in the Rajya Sabha, she said, ""Is this the poverty that you wanted me to address, the poverty of mind?"" She said this in response to the Opposition's allegation that the poor were left out of the Budget.",2022-02-11,Sakshita Khosla,None,https://static.inshorts.com/inshorts/images/v1/variants/jpg/m/2022/02_feb/11_fri/img_1644578754582_858.jpg?,https://inshorts.com/en/news/want-me-to-address-that-poverty-fm-on-rahuls-old-poverty-a-state-of-mind-remark-1644579914415,Inshorts,Friday
"₹4,600 rent of Sonia Gandhi's bungalow unpaid since 2020, reveals RTI reply","The rent of several properties occupied by Congress leaders, including the official bungalow of Congress interim President Sonia Gandhi, has not been paid, according to an RTI reply. There's a pending rent of ₹4,610 for her residence on 10 Janpath Road that hasn't been paid since September 2020. It also stated that pending rent against Congress' headquarters is ₹12,69,902.",2022-02-10,Arshiya Chopra,https://www.aninews.in/news/national/general-news/rti-reply-reveals-rent-of-cong-headquarters-sonia-gandhis-residence-not-paid20220210135836/?utm_campaign=fullarticle&utm_medium=referral&utm_source=inshorts,https://static.inshorts.com/inshorts/images/v1/variants/jpg/m/2022/02_feb/10_thu/img_1644499663252_584.jpg?,https://inshorts.com/en/news/₹4600-rent-of-sonia-gandhis-bungalow-unpaid-since-2020-reveals-rti-reply-1644500785526,ANI News,Thursday
Punjab CM's nephew sent to 14-day judicial custody in illegal sand-mining case,"Punjab Chief Minister Charanjit S Channi's nephew Bhupinder Singh Honey was on Friday sent to 14-day judicial custody in an illegal sand-mining case. The Enforcement Directorate (ED) had arrested Honey under money laundering charges in the case on February 3 in Jalandhar. The ED had on January 18 conducted raids at several locations in Punjab, including Honey's residence.",2022-02-11,Shreyasi Banerjee,https://www.hindustantimes.com/cities/chandigarh-news/punjab-cm-channi-s-nephew-sent-to-14-day-judicial-custody-in-illegal-mining-case-101644570565467-amp.html?utm_campaign=fullarticle&utm_medium=referral&utm_source=inshorts,https://static.inshorts.com/inshorts/images/v1/variants/jpg/m/2022/02_feb/11_fri/img_1644571490538_130.jpg?,https://inshorts.com/en/news/punjab-cms-nephew-sent-to-14day-judicial-custody-in-illegal-sandmining-case-1644575434041,Hindustan Times,Friday
CBI names Bengal CM Mamata's poll agent in 5 post-poll violence cases,"TMC leader SK Supian, who was West Bengal Chief Minister Mamata Banerjee's election agent at the Nandigram Assembly poll in Purba Medinipur in April last year, has been named by the Central Bureau of Investigation (CBI) in five cases related to post-poll violence, officials said. Supian has alleged that the charges are concocted and masterminded by BJP leader Suvendu Adhikari.",2022-02-11,Shreyasi Banerjee,https://www.hindustantimes.com/cities/kolkata-news/mamata-banerjee-s-election-agent-named-in-5-post-poll-violence-cases-by-cbi-101644523598217-amp.html?utm_campaign=fullarticle&utm_medium=referral&utm_source=inshorts,https://static.inshorts.com/inshorts/images/v1/variants/jpg/m/2022/02_feb/11_fri/img_1644560604312_241.jpg?,https://inshorts.com/en/news/cbi-names-bengal-cm-mamatas-poll-agent-in-5-postpoll-violence-cases-1644563010602,Hindustan Times,Friday
"Mayawati is helping BJP due to fear of ED, CBI: SP MLA","Alleging BJP of using enforcement agencies to threaten BSP supremo Mayawati, Samajwadi Party MLA Manoj Kumar Paras said that Mayawati was helping BJP out of fear in the Uttar Pradesh election. ""I am not against BSP. I am not against Behenji (Mayawati). She is my leader as well, but today, the BJP has clutches on her,"" Paras added.",2022-02-11,Subhangi Singh,https://news.abplive.com/elections/mayawati-is-helping-bjp-in-up-election-due-to-fear-of-ed-cbi-says-sp-heavyweight-mla-from-nagina-1512195/amp?utm_campaign=fullarticle&utm_medium=referral&utm_source=inshorts,https://static.inshorts.com/inshorts/images/v1/variants/jpg/m/2022/02_feb/11_fri/img_1644552044028_630.jpg?,https://inshorts.com/en/news/mayawati-is-helping-bjp-due-to-fear-of-ed-cbi-sp-mla-1644556024961,abplive.com,Friday
"For BJP, Goa means Governance, Opportunities, Aspirations: PM Modi","While addressing a gathering in Goa's Mapusa ahead of Assembly polls, PM Narendra Modi said, ""For us, Goa mean Governance, Opportunities and Aspirations."" ""From this land of Goa, phrases like 'Congress-Mukt Bharat' unexpectedly came out of my mouth. Today these phrases have become the resolution of many citizens of the country,"" PM Modi further added.",2022-02-10,Nakul Ahuja,https://twitter.com/ANI/status/1491776423786606594?utm_campaign=fullarticle&utm_medium=referral&utm_source=inshorts,https://static.inshorts.com/inshorts/images/v1/variants/jpg/m/2022/02_feb/10_thu/img_1644507073212_53.jpg?,https://inshorts.com/en/news/for-bjp-goa-means-governance-opportunities-aspirations-pm-modi-1644513234432,loading,Thursday
"SP, BSP, Cong live for their families, encouraged dynasties: Yogi","Uttar Pradesh CM Yogi Adityanath on Friday said the SP, BSP and Congress only ""live for their families"" and ""encouraged dynasties"". ""If we (BJP) talk about nationalism, they talk about casteism...I talk about 'ganna' (sugarcane), they talk about Jinnah,"" Adityanath said. The BJP leader promised smartphones and tablets to two crore youth if voted back to power.",2022-02-11,Ramanpreet Singh Virdi,https://aninews.in/news/national/politics/sp-bsp-congress-live-for-their-families-they-encouraged-dynasties-cm-yogi20220211131823/?utm_campaign=fullarticle&utm_medium=referral&utm_source=inshorts,https://static.inshorts.com/inshorts/images/v1/variants/jpg/m/2022/02_feb/11_fri/img_1644569834077_942.jpg?,https://inshorts.com/en/news/sp-bsp-cong-live-for-their-families-encouraged-dynasties-yogi-1644581682630,ANI News,Friday
Kerala's education will do wonders for UP: Tharoor after Yogi's remark,"Responding to UP CM Yogi Adityanath's remark, senior Congress leader Shashi Tharoor said that Kashmir's beauty, Bengal's culture and Kerala's education would do wonders for UP. ''UP is wonderful: pity about its Govt,'' Tharoor tweeted. Earlier, Adityanath said in a video message that the state could turn into a ''Kashmir, Kerala or Bengal'' if BJP does not return to power.",2022-02-11,Subhangi Singh,https://www.financialexpress.com/india-news/shashi-tharoor-responds-to-yogi-adityanath-kashmirs-beauty-bengals-culture-keralas-education-will-do-wonders-for-up/2430243/lite/?utm_campaign=fullarticle&utm_medium=referral&utm_source=inshorts,https://static.inshorts.com/inshorts/images/v1/variants/jpg/m/2022/02_feb/11_fri/img_1644566791031_610.jpg?,https://inshorts.com/en/news/keralas-education-will-do-wonders-for-up-tharoor-after-yogis-remark-1644578307854,The Financial Express,Friday
BJP only party with courage to show their report card: JP Nadda,"BJP National President JP Nadda on Thursday said no political party other than BJP has the courage to show a report card of the work they have undertaken. Calling BJP a party of ideology that is committed to development, Nadda said, ""All the remaining parties are dynastic parties."" He added, ""Congress has neither remained National, nor has it remained Indian.""",2022-02-10,Ashley Paul,https://aninews.in/news/national/politics/up-polls-only-bjp-courageous-enough-to-showcase-report-card-of-their-work-other-dynastic-parties-work-for-self-interest-says-jp-nadda20220210170615/?utm_campaign=fullarticle&utm_medium=referral&utm_source=inshorts,https://static.inshorts.com/inshorts/images/v1/variants/jpg/m/2022/02_feb/10_thu/img_1644495440936_238.jpg?,https://inshorts.com/en/news/bjp-only-party-with-courage-to-show-their-report-card-jp-nadda-1644502084969,ANI News,Thursday
Goa could have been freed 'within hours' in 1947 if Nehru wanted: PM Modi,"Claiming that Jawaharlal Nehru delayed liberation in Goa in 1947, PM Narendra Modi said, ''What could have been done in a few hours, the Congress delayed for 15 years.'' Criticising Congress, PM Modi said, ''The people of Goa continued to fight for their freedom, satyagrahis braved bullets and continued to tolerate atrocities but the Congress government did not help them.''",2022-02-11,Subhangi Singh,https://www.hindustantimes.com/india-news/nehru-left-goa-s-freedom-fighters-to-die-delayed-liberation-says-pm-modi-101644521016419-amp.html?utm_campaign=fullarticle&utm_medium=referral&utm_source=inshorts,https://static.inshorts.com/inshorts/images/v1/variants/jpg/m/2022/02_feb/11_fri/img_1644548260279_978.jpg?,https://inshorts.com/en/news/goa-could-have-been-freed-within-hours-in-1947-if-nehru-wanted-pm-modi-1644556551918,Hindustan Times,Friday
We'll give Goans land rights within 6 months of forming govt: Kejriwal,"Aam Aadmi Party's (AAP) Arvind Kejriwal said on Thursday that AAP will grant land rights to residents of Goa within six months of forming government. Kejriwal, who was speaking at gathering in Goa's Poriem, said the party will also provide free education and electricity. ""Due to these facilities every household will get benefit of ₹2 lakh per year,"" he added.",2022-02-10,Disha Jana,https://twitter.com/ANI/status/1491771924095320070?utm_campaign=fullarticle&utm_medium=referral&utm_source=inshorts,https://static.inshorts.com/inshorts/images/v1/variants/jpg/m/2022/02_feb/10_thu/img_1644504594550_363.jpg?,https://inshorts.com/en/news/well-give-goans-land-rights-within-6-months-of-forming-govt-kejriwal-1644508400210,Twitter,Thursday
"Cong believes in 'divide everyone, loot together': PM in U'khand","Prime Minister Narendra Modi on Friday alleged that Congress believes in the principle of 'divide everyone, loot together'. ""In the earlier governments, the border villages, tehsils and districts of Uttarakhand were ignored,"" he claimed at a rally in Almora. ""For these border areas, we have made a 'Vibrant Village' scheme,"" he added.",2022-02-11,Ramanpreet Singh Virdi,https://aninews.in/news/national/general-news/uttarakhand-polls-congress-policy-is-divide-and-loot-pm-modi20220211134923/?utm_campaign=fullarticle&utm_medium=referral&utm_source=inshorts,https://static.inshorts.com/inshorts/images/v1/variants/jpg/m/2022/02_feb/11_fri/img_1644571597479_572.jpg?,https://inshorts.com/en/news/cong-believes-in-divide-everyone-loot-together-pm-in-ukhand-1644582046092,ANI News,Friday
Congress has become a party of crabs: MP CM ahead of U'khand polls,"While addressing an election rally in Dwarahat ahead of the Uttarakhand Assembly polls, Madhya Pradesh Chief Minister Shivraj Singh Chouhan said that Congress is becoming a ""party of crabs"". ""Congress leaders are fighting among themselves, they cannot develop Uttarakhand. Congress is Kumbhakaran who used to sleep for six months and after waking up eat everything,"" he added.",2022-02-10,Nakul Ahuja,https://aninews.in/news/national/politics/congress-has-become-party-of-crabs-leaders-fight-among-themselves-shivraj-singh-chouhan20220210185317/?utm_campaign=fullarticle&utm_medium=referral&utm_source=inshorts,https://static.inshorts.com/inshorts/images/v1/variants/jpg/m/2022/02_feb/10_thu/img_1644502340463_245.jpg?,https://inshorts.com/en/news/congress-has-become-a-party-of-crabs-mp-cm-ahead-of-ukhand-polls-1644512925012,ANI News,Thursday
UP Police says Congress' door-to-door campaign looked like roadshow; case registered,"The UP Police registered a case after a ""roadshow-like situation"" emerged during Congress leader Rizwan Qureshi's door-to-door campaign in Moradabad. ""Rizwan had taken permission for a door-to-door campaign but it was seen that a roadshow-like situation had emerged with people atop of the car with him,"" said SP Akhilesh Bhadoria. Priyanka Gandhi Vadra was also part of the campaign.",2022-02-11,Subhangi Singh,https://www.freepressjournal.in/amp/india/up-elections-2022-police-say-congress-door-to-door-campaign-in-moradabad-looked-like-roadshow-case-registered?utm_campaign=fullarticle&utm_medium=referral&utm_source=inshorts,https://static.inshorts.com/inshorts/images/v1/variants/jpg/m/2022/02_feb/11_fri/img_1644550814146_620.jpg?,https://inshorts.com/en/news/up-police-says-congress-doortodoor-campaign-looked-like-roadshow-case-registered-1644555352173,Free Press Journal,Friday
"India is secular, we should behave accordingly: Pawar on hijab issue","Reacting to controversy over hijab in Karnataka, Maharashtra Deputy CM and Nationalist Congress Party (NCP) leader Ajit Pawar said that India is a secular country and people should behave accordingly.  ""It’s unfortunate...some people are trying to gain political mileage out of [this],"" he added. Pawar's comments come after NCP's demonstration in Pune in support of hijab for female Muslim students.",2022-02-10,Disha Jana,https://twitter.com/ANI/status/1491720533888552963?utm_campaign=fullarticle&utm_medium=referral&utm_source=inshorts,https://static.inshorts.com/inshorts/images/v1/variants/jpg/m/2022/02_feb/10_thu/img_1644501029873_55.jpg?,https://inshorts.com/en/news/india-is-secular-we-should-behave-accordingly-pawar-on-hijab-issue-1644504551139,Twitter,Thursday
Won't run away with 'jhola' leaving family behind: Akhilesh Yadav,Samajwadi Party (SP) supremo Akhilesh Yadav reacted to BJP's 'dynastic politics' remark and said that he is proud to have a family and will not run away with a 'jhola' (bag) leaving them behind. Yadav's remarks come days after Prime Minister Narendra Modi said in the Rajya Sabha that the biggest threat to democracy is dynastic politics.,2022-02-10,Disha Jana,https://www.timesnownews.com/amp/india/article/wont-run-away-with-jhola-leaving-family-behind-akhilesh-yadav-attacks-yogi-adityanath-over-dynasty-jibe/857658?utm_campaign=fullarticle&utm_medium=referral&utm_source=inshorts,https://static.inshorts.com/inshorts/images/v1/variants/jpg/m/2022/02_feb/10_thu/img_1644504865634_150.jpg?,https://inshorts.com/en/news/wont-run-away-with-jhola-leaving-family-behind-akhilesh-yadav-1644511775159,Times Now,Thursday
