headlines,text,date,author,read_more,image_url,inshorts_url,original_source,day
Will end corruption in Punjab govt jobs if voted to power: Kejriwal,"AAP National Convenor Arvind Kejriwal on Saturday said his party will end corruption in government jobs if voted to power in Punjab. ""Young people are forced to leave Punjab and go abroad. These people are compelled to sell off their lands for just ₹20-25 lakh,"" he said in a video message. ""We will not let this happen,"" Kejriwal added.",2022-02-05,Ramanpreet Singh Virdi,https://aninews.in/news/national/general-news/punjab-polls-if-voted-to-power-aap-will-end-corruption-in-govt-jobs-says-kejriwal20220205130049/?utm_campaign=fullarticle&utm_medium=referral&utm_source=inshorts,https://static.inshorts.com/inshorts/images/v1/variants/jpg/m/2022/02_feb/5_sat/img_1644051126740_433.jpg?,https://inshorts.com/en/news/will-end-corruption-in-punjab-govt-jobs-if-voted-to-power-kejriwal-1644083434298,ANI News,Saturday
Centre making policy of 'Beti Hatao': Ex-Karnataka CM on hijab row,"Speaking about hijab row in Karnataka, Janata Dal (Secular) leader and former Chief Minister of state, HD Kumaraswamy, said it seems the Central government has set out to make policy of 'Beti Hatao' instead of 'Beti Padhao'. ""In schools and colleges where they were already wearing the hijab, let them continue to be allowed to wear the hijab,"" he added.",2022-02-06,Ria Kapoor,None,https://static.inshorts.com/inshorts/images/v1/variants/jpg/m/2022/02_feb/6_sun/img_1644117097888_818.jpg?,https://inshorts.com/en/news/centre-making-policy-of-beti-hatao-exkarnataka-cm-on-hijab-row-1644118793980,Inshorts,Sunday
"Modi ji is not a PM, but a king who listens to no one: Rahul Gandhi","Congress' Rahul Gandhi has said that India doesn't have a PM but a king who believes the public should remain quiet when he takes decisions. Gandhi said, ""[Narendra Modi ji is not a PM], but a king...he just takes decisions and listens to no one."" ""[He] ignored farmers for almost a year, because a king doesn't talk...to labourers,"" Gandhi added.",2022-02-05,Dharini Mudgal,https://www.timesnownews.com/amp/india/article/pm-modi-is-a-king-who-believes-public-should-stay-quiet-when-he-takes-decisions-rahul-gandhi/856163?utm_campaign=fullarticle&utm_medium=referral&utm_source=inshorts,https://static.inshorts.com/inshorts/images/v1/variants/jpg/m/2022/02_feb/5_sat/img_1644063019365_148.jpg?,https://inshorts.com/en/news/modi-ji-is-not-a-pm-but-a-king-who-listens-to-no-one-rahul-gandhi-1644064241588,timesnownews.com,Saturday
40 candidates from Congress-Goa Forward Party take pledge of loyalty,"All 40 candidates from the Congress-Goa Forward Party alliance on Friday took a pledge of loyalty to stay united and loyal in presence of Rahul Gandhi, the Congress party's Goa unit tweeted. ""They pledge to never support or participate in any activity that would sell Goa's identity,"" it added. Goa Assembly polls are scheduled to be held on February 14.",2022-02-05,Atul Mishra,https://www.thequint.com/amp/story/elections/congress-goa-candidates-take-anti-defection-oath-in-rahul-gandhis-presence?utm_campaign=fullarticle&utm_medium=referral&utm_source=inshorts,https://static.inshorts.com/inshorts/images/v1/variants/jpg/m/2022/02_feb/5_sat/img_1644030392437_319.jpg?,https://inshorts.com/en/news/40-candidates-from-congressgoa-forward-party-take-pledge-of-loyalty-1644032901640,The Quint,Saturday
Be positively present in Rajya Sabha on Feb 8: BJP to its members,"The Bharatiya Janata Party has issued a three-line whip to all its Rajya Sabha MPs asking them to be ""positively present"" in the House on February 8. ""All BJP members in Rajya Sabha are hereby informed that some very important business will be taken up for discussion and passing in the Rajya Sabha on Tuesday,'' the notice said.",2022-02-05,Subhangi Singh,https://www.freepressjournal.in/amp/india/bjp-issues-three-line-whip-to-its-rajya-sabha-mps-to-be-present-in-the-house-on-feb-8-and-support-govts-stand?utm_campaign=fullarticle&utm_medium=referral&utm_source=inshorts,https://static.inshorts.com/inshorts/images/v1/variants/jpg/m/2022/02_feb/5_sat/img_1644056937865_114.jpg?,https://inshorts.com/en/news/be-positively-present-in-rajya-sabha-on-feb-8-bjp-to-its-members-1644058544328,Free Press Journal,Saturday
More Owaisis will be born if one is killed: AIMIM chief on car attack,"All India Majlis-e-Ittehadul Muslimeen (AIMIM) chief Asaduddin Owaisi, while talking about attack on his car in Uttar Pradesh, said ""More Owaisis will be born if one is killed."" ""Those who fired bullets (on my vehicle) were ones who killed Gandhi...I talk about stake (of Muslims), so shot was fired,"" Owaisi added. Meanwhile, police have arrested two people who fired shots.",2022-02-06,Ria Kapoor,https://www.hindustantimes.com/india-news/more-owaisis-will-be-born-if-one-is-killed-says-aimim-chief-slams-law-and-order-in-up-101644078803873-amp.html?utm_campaign=fullarticle&utm_medium=referral&utm_source=inshorts,https://static.inshorts.com/inshorts/images/v1/variants/jpg/m/2022/02_feb/6_sun/img_1644122636433_956.jpg?,https://inshorts.com/en/news/more-owaisis-will-be-born-if-one-is-killed-aimim-chief-on-car-attack-1644126320941,Hindustan Times,Sunday
BJP leader allegedly manhandled by Sena workers at PMC premises,"BJP leader Kirit Somaiya claimed on Saturday that he was manhandled by Shiv Sena workers at Pune Municipal Corporation's (PMC) premises. Somaiya, who was visiting PMC to file a complaint alleging financial irregularities related to COVID-19 jumbo hospitals, reportedly fell down the stairs. He also posted photos on Twitter of being discharged from a hospital a day later.",2022-02-06,Medhaa Gupta,None,https://static.inshorts.com/inshorts/images/v1/variants/jpg/m/2022/02_feb/6_sun/img_1644125651931_66.jpg?,https://inshorts.com/en/news/bjp-leader-allegedly-manhandled-by-sena-workers-at-pmc-premises-1644128393940,Inshorts,Sunday
PM Modi’s Goa rally cancelled owing to Lata Mangeshkar's demise,"The virtual rally in Goa that Prime Minister Narendra Modi was scheduled to address on Sunday has been cancelled in view of Lata Mangeshkar's demise, said CM Pramod Sawant. ""Small scale constituency-level programmes will be held after honouring Lata Mangeshkar,"" he added. Notably, BJP was scheduled to unveil its poll manifesto, which has now been postponed.",2022-02-06,Saurabh Sinha,https://www.aninews.in/news/national/politics/pm-modis-virtual-rally-in-goa-cancelled-in-wake-of-lata-mangeshkars-demise20220206122616/?utm_campaign=fullarticle&utm_medium=referral&utm_source=inshorts,https://static.inshorts.com/inshorts/images/v1/variants/jpg/m/2022/02_feb/6_sun/img_1644134843578_864.jpg?,https://inshorts.com/en/news/pm-modis-goa-rally-cancelled-owing-to-lata-mangeshkars-demise-1644147765834,ANI,Sunday
Owaisi asks UP CM to conduct 'proper' probe into attack on his car,"AIMIM chief Asaduddin Owaisi has asked Uttar Pradesh CM Yogi Adityanath to conduct a ""proper"" investigation into the incident in which shots were fired at his car. ""[The state government] invoked NSA over a cricket match. Give justice in this case too,"" he added. He further said that if this radicalisation continues, ""it can be converted to terrorism and communalism"".",2022-02-05,Medhaa Gupta,https://www.timesnownews.com/amp/india/article/uttar-pradesh-election-2022-owaisi-asks-adityanath-for-proper-probe-into-attack-on-his-car-demands-justice/856118?utm_campaign=fullarticle&utm_medium=referral&utm_source=inshorts,https://static.inshorts.com/inshorts/images/v1/variants/jpg/m/2022/02_feb/5_sat/img_1644058021866_159.jpg?,https://inshorts.com/en/news/owaisi-asks-up-cm-to-conduct-proper-probe-into-attack-on-his-car-1644059129872,Times Now,Saturday
Make in India should be termed 'farce': Adhir Ranjan Chowdhury,"Targeting the Central government, Congress leader Adhir Ranjan Chowdhury said that Make in India should be termed ""farce"" as the trade deficit between India and China is widening. If Make in India is successful, why we are relying on China, he asked. He further alleged that imports from China are at an all-time high under the Modi government.",2022-02-05,Subhangi Singh,https://www.timesnownews.com/amp/india/article/after-rahul-gandhi-adhir-ranjan-chowdhury-questions-make-in-india-says-it-should-be-termed-as-farce/856042?utm_campaign=fullarticle&utm_medium=referral&utm_source=inshorts,https://static.inshorts.com/inshorts/images/v1/variants/jpg/m/2022/02_feb/5_sat/img_1644055705198_48.jpg?,https://inshorts.com/en/news/make-in-india-should-be-termed-farce-adhir-ranjan-chowdhury-1644059935537,Times Now,Saturday
AIMIM stages protest in Hyderabad against attack on Owaisi's convoy,Members of the AIMIM along with a large number of people staged a protest in Hyderabad after party president and MP Asaduddin Owaisi's vehicle was shot at in Uttar Pradesh. The protest was held near Hyderabad's iconic Charminar. The police had made heavy security arrangements at the Mecca Masjid adjacent to the Charminar to keep the situation in control.,2022-02-05,Ramanpreet Singh Virdi,https://www.aninews.in/news/national/general-news/hyderabad-aimim-supporters-protest-over-firing-on-owaisis-convoy20220204212946/?utm_campaign=fullarticle&utm_medium=referral&utm_source=inshorts,https://static.inshorts.com/inshorts/images/v1/variants/jpg/m/2022/02_feb/5_sat/img_1644058556225_857.jpg?,https://inshorts.com/en/news/aimim-stages-protest-in-hyderabad-against-attack-on-owaisis-convoy-1644068739260,ANI News,Saturday
"Rahul a political tourist, comes to Goa before polls: BJP leader","BJP leader CT Ravi on Friday criticised Congress leader Rahul Gandhi, calling him a ""political tourist"" and saying that he ""comes to Goa only before the elections"". Ravi made the remarks while conducting a door-to-door campaign in Calangute ahead of the state Assembly elections. He also claimed that the BJP ""doesn't sign agreements with China"" unlike Congress.",2022-02-05,Medhaa Gupta,https://www.aninews.in/news/national/general-news/rahul-gandhi-is-tourist-politician-comes-to-goa-only-before-elections-bjp-leader-ct-ravi20220205064315/?utm_campaign=fullarticle&utm_medium=referral&utm_source=inshorts,https://static.inshorts.com/inshorts/images/v1/variants/jpg/m/2022/02_feb/5_sat/img_1644035671503_802.jpg?,https://inshorts.com/en/news/rahul-a-political-tourist-comes-to-goa-before-polls-bjp-leader-1644038588770,ANI News,Saturday
Priyanka gives Cong manifesto to BJP supporters during her rally in UP,"A video has surfaced showing Congress' Priyanka Gandhi smiling and shaking hands with BJP supporters, who were raising PM Narendra Modi's and UP CM Yogi Adityanath's slogans during her roadshow in Aligarh. Gandhi was also seen giving Congress' youth manifesto, 'Bharti Vidhan' to the BJP's supporters. ""Ye padh lo...[Read this]"", she said while giving the manifesto to a BJP supporter.",2022-02-05,Dharini Mudgal,https://twitter.com/ANINewsUP/status/1489947167808954374?ref_src=twsrc%5Etfw%7Ctwcamp%5Etweetembed%7Ctwterm%5E1489947167808954374%7Ctwgr%5E%7Ctwcon%5Es1_&utm_campaign=fullarticle&utm_medium=referral&ref_url=https%3A%2F%2Fwww.ndtv.com%2Findia-news%2Fwatch-priyanka-gandhi-stops-roadshow-to-hand-manifesto-to-bjp-workers-2751195&utm_source=inshorts,https://static.inshorts.com/inshorts/images/v1/variants/jpg/m/2022/02_feb/5_sat/img_1644076165167_888.jpg?,https://inshorts.com/en/news/priyanka-gives-cong-manifesto-to-bjp-supporters-during-her-rally-in-up-1644077648288,Twitter,Saturday
Those reporting that Tejashwi will be RJD chief are fools: Lalu,"RJD chief Lalu Prasad Yadav on Friday denied reports of his son Tejashwi Yadav becoming the party's national president. ""Those who run such news reports are fools. We will get to know whatever happens,"" Lalu Yadav said. His elder son Tej Pratap Yadav had also refuted speculation of Tejashwi taking over as party chief.",2022-02-05,Ramanpreet Singh Virdi,https://news.abplive.com/news/india/rjd-chief-lalu-prasad-yadav-react-on-tejashwi-yadav-will-be-made-national-president-of-party-1511052/amp?utm_campaign=fullarticle&utm_medium=referral&utm_source=inshorts,https://static.inshorts.com/inshorts/images/v1/variants/jpg/m/2022/02_feb/5_sat/img_1644056327910_19.jpg?,https://inshorts.com/en/news/those-reporting-that-tejashwi-will-be-rjd-chief-are-fools-lalu-1644084194989,abplive.com,Saturday
Rahul Gandhi makes 4 promises to people of U'khand ahead of polls,"Congress leader Rahul Gandhi made four promises to the people of poll-bound Uttarakhand. ""We'll give employment to four lakh people. We'll give LPG cylinders for less than ₹500 each. We will also implement the 'Nyay' scheme here, in which five lakh families will be given ₹40,000 a year. Besides, we will provide medical facilities at your doorstep,"" Gandhi said.",2022-02-05,Dharini Mudgal,https://news.abplive.com/elections/employment-cheaper-lpg-nyay-more-rahul-gandhi-s-4-major-poll-promises-ahead-of-uttarakhand-election-1511092/amp?utm_campaign=fullarticle&utm_medium=referral&utm_source=inshorts,https://static.inshorts.com/inshorts/images/v1/variants/jpg/m/2022/02_feb/5_sat/img_1644081217240_300.jpg?,https://inshorts.com/en/news/rahul-gandhi-makes-4-promises-to-people-of-ukhand-ahead-of-polls-1644082488475,abplive.com,Saturday
"SP doing appeasement politics, only BJP can develop UP: Rajnath","Defence Minister Rajnath Singh on Saturday said the Samajwadi Party (SP) was doing the ""politics of appeasement"" and ""only the BJP can do development"" in Uttar Pradesh. ""Politics should not be based on caste or creed. SP is doing religion and caste-based politics,"" he claimed. The minister campaigned in the Baldev constituency ahead of Assembly elections in the state.",2022-02-05,Ramanpreet Singh Virdi,https://aninews.in/news/national/politics/sp-doing-politics-of-appeasement-only-bjp-can-do-development-in-up-rajnath-singh20220205140720/?utm_campaign=fullarticle&utm_medium=referral&utm_source=inshorts,https://static.inshorts.com/inshorts/images/v1/variants/jpg/m/2022/02_feb/5_sat/img_1644055242816_341.jpg?,https://inshorts.com/en/news/sp-doing-appeasement-politics-only-bjp-can-develop-up-rajnath-1644081756258,ANI News,Saturday
ED arrests Punjab CM Charanjit Channi's nephew in illegal sand-mining case,"Punjab Chief Minister Charanjit Singh Channi's nephew, Bhupinder Singh, has been arrested by the Enforcement Directorate (ED) in an illegal sand-mining case. Last month, the investigation agency seized ₹10 crore in cash along with gold and other valuables during raids, which were carried out at the premises of Bhupinder Singh and his business partners.",2022-02-04,Ankush Verma,https://www.hindustantimes.com/cities/chandigarh-news/ed-arrests-punjab-cm-channi-s-nephew-in-illegal-sand-mining-case-101643943676860-amp.html?utm_campaign=fullarticle&utm_medium=referral&utm_source=inshorts,https://static.inshorts.com/inshorts/images/v1/variants/jpg/m/2022/02_feb/4_fri/img_1643944187938_720.jpg?,https://inshorts.com/en/news/ed-arrests-punjab-cm-charanjit-channis-nephew-in-illegal-sandmining-case-1643945041085,Hindustan Times,Friday
"'Did you write Rahul Gandhi's speech?' Twitter user asks Vir Das, he replies","A Twitter user asked comedian Vir Das if he wrote Rahul Gandhi's recent Parliament speech, adding, ""If you [did], kindly change your script."" Das replied, ""No I didn't (write it). The idea of two nations and many versions have been around for a lot longer than two of us. The only thing that stays the same, is your predictable reactions.""",2022-02-04,Sakshita Khosla,https://twitter.com/thevirdas/status/1489637480387293187?utm_campaign=fullarticle&utm_medium=referral&utm_source=inshorts,https://static.inshorts.com/inshorts/images/v1/variants/jpg/m/2022/02_feb/4_fri/img_1643993873108_74.jpg?,https://inshorts.com/en/news/did-you-write-rahul-gandhis-speech-twitter-user-asks-vir-das-he-replies-1643994640976,Twitter,Friday
"Priyanka & Akhilesh come face-to-face during UP campaign, video surfaces",Congress General Secretary Priyanka Gandhi Vadra and SP chief Akhilesh Yadav came face-to-face in Bulandshahr while they were leading their respective campaigns for UP polls. Yadav was accompanied by his ally RLD chief Jayant Chaudhary. A video shows the leaders waving and greeting each other with smiles. Akhilesh also shared the image from their meeting.,2022-02-03,Shalini Ojha,https://twitter.com/ANINewsUP/status/1489229392169832451?utm_campaign=fullarticle&utm_medium=referral&utm_source=inshorts,https://static.inshorts.com/inshorts/images/v1/variants/jpg/m/2022/02_feb/3_thu/img_1643902203842_480.jpg?,https://inshorts.com/en/news/priyanka-akhilesh-come-facetoface-during-up-campaign-video-surfaces-1643904228560,Twitter,Thursday
No objection to law doing its work: CM Channi on nephew's arrest,"Punjab CM Charanjit Singh Channi said on Friday that he has no objection to law doing its work. He made the statement after his nephew Bhupinder Singh Honey was arrested by the Enforcement Directorate (ED) in an illegal sand mining case. However, Congress General Secretary Priyanka Gandhi Vadra criticised the arrest, saying the Centre is misusing agencies to threaten people.",2022-02-04,Shalini Ojha,None,https://static.inshorts.com/inshorts/images/v1/variants/jpg/m/2022/02_feb/4_fri/img_1643971043290_265.jpg?,https://inshorts.com/en/news/no-objection-to-law-doing-its-work-cm-channi-on-nephews-arrest-1643972123535,Inshorts,Friday
"Congress to give ₹6,000 monthly to poorest Goa citizens: Rahul Gandhi","Former Congress chief Rahul Gandhi announced on Friday that if his party wins Goa polls it will give ₹6,000 per month to the poorest citizens of the state. ""A new 'Nyay Scheme' will be launched,"" he said. Criticising BJP on tourism, COVID-19 and unemployment, he claimed the fight is between BJP and Congress. ""Don't waste your vote,"" he added.",2022-02-04,Shalini Ojha,https://twitter.com/ANI/status/1489578783573438464?utm_campaign=fullarticle&utm_medium=referral&utm_source=inshorts,https://static.inshorts.com/inshorts/images/v1/variants/jpg/m/2022/02_feb/4_fri/img_1643980284681_799.jpg?,https://inshorts.com/en/news/congress-to-give-₹6000-monthly-to-poorest-goa-citizens-rahul-gandhi-1643981121037,Twitter,Friday
UP CM Adityanath declares assets worth ₹1.5 cr in election affidavit,"UP CM Yogi Adityanath declared assets worth over ₹1.54 crore in his election affidavit. Reportedly, he said he owns a Samsung mobile phone worth ₹12,000, a revolver worth ₹1,00,000 and a rifle worth ₹80,000. He added he owns no agricultural or non-agricultural property and no vehicle is registered under his name. He didn't mention any pending criminal case against him.",2022-02-04,Shalini Ojha,https://www.timesnownews.com/amp/india/article/up-election-cm-yogi-declares-assets-worth-over-rs-1-5-crore-in-poll-affidavit-no-pending-criminal-cases/855885?utm_campaign=fullarticle&utm_medium=referral&utm_source=inshorts,https://static.inshorts.com/inshorts/images/v1/variants/jpg/m/2022/02_feb/4_fri/img_1643974374223_947.jpg?,https://inshorts.com/en/news/adityanath-declares-assets-worth-rs-15-cr-in-election-affidavit-1643977972588,timesnownews.com,Friday
People at top want weak CM: Cong's Sidhu ahead of Punjab polls,"Congress Punjab chief Navjot Singh Sidhu on Thursday claimed the high command wants a ""weak CM"" in Punjab who can ""dance to their tunes"". ""If a new Punjab has to be made, it's in hands of CM,"" he said. His supporters cheered for him saying, ""Humara CM kaisa ho? Navjot Sidhu jaisa ho."" Congress could announce CM face on Sunday.",2022-02-04,Shalini Ojha,https://www.financialexpress.com/india-news/people-on-top-want-a-weak-chief-minister-in-punjab-who-can-dance-to-their-tunes-navjot-singh-sidhu/2425723/lite/?utm_campaign=fullarticle&utm_medium=referral&utm_source=inshorts,https://static.inshorts.com/inshorts/images/v1/variants/jpg/m/2022/02_feb/4_fri/img_1643968998455_577.jpg?,https://inshorts.com/en/news/people-at-top-want-weak-cm-congs-sidhu-ahead-of-punjab-polls-1643972550253,Financial Express,Friday
Bridge on Pangong lake being built on land illegally occupied by China: Govt,"MoS (External Affairs) V Muraleedharan said in the Parliament that India has taken note of the bridge being constructed by China on Pangong lake. ""This bridge is being constructed in areas that have continued to be under the illegal occupation of China since 1962,"" he said. He added the government expects other nations to respect India's sovereignty and territorial integrity.",2022-02-04,Shalini Ojha,https://www.timesnownews.com/amp/india/article/chinese-bridge-on-pangong-tso-is-on-illegally-occupied-land-says-government/855983?utm_campaign=fullarticle&utm_medium=referral&utm_source=inshorts,https://static.inshorts.com/inshorts/images/v1/variants/jpg/m/2022/02_feb/4_fri/img_1643991308398_96.jpg?,https://inshorts.com/en/news/bridge-on-pangong-lake-build-on-land-illegally-occupied-by-china-govt-1643994564988,timesnownews.com,Friday
"1 caught for firing at Owaisi's car, search on for another: UP Police","SP Hapur Deepak Bhuker on Thursday said that one person was apprehended for allegedly firing gunshots at AIMIM chief Asaduddin Owaisi's car when he was leaving for Delhi after a poll-related event. The accused is being questioned and a search has been launched for his accomplice, Bhuker added. Owaisi asked Election Commission to order an independent inquiry into the incident.",2022-02-03,Shalini Ojha,https://twitter.com/ANI/status/1489231173826056194?utm_campaign=fullarticle&utm_medium=referral&utm_source=inshorts,https://static.inshorts.com/inshorts/images/v1/variants/jpg/m/2022/02_feb/3_thu/img_1643896570426_466.jpg?,https://inshorts.com/en/news/1-caught-for-firing-at-owaisis-car-search-on-for-another-up-police-1643899399543,Twitter,Thursday
Wonders done in 111 days: Kejriwal on Punjab CM's nephew's arrest,"After the ED arrested Punjab CM's nephew, AAP Convenor Arvind Kejriwal on Friday said CM Charanjit Singh Channi had ""managed to do wonders in 111 days"". ""People take four to five years to indulge in such corruption. It is unfortunate. People are watching,"" Kejriwal said. Channi's nephew Bhupinder Singh Honey has been arrested in a money laundering case.",2022-02-04,Ramanpreet Singh Virdi,https://aninews.in/news/national/general-news/channi-did-wonders-within-111-days-kejriwal-after-ed-arrests-channis-nephew20220204145625/?utm_campaign=fullarticle&utm_medium=referral&utm_source=inshorts,https://static.inshorts.com/inshorts/images/v1/variants/jpg/m/2022/02_feb/4_fri/img_1643968415443_121.jpg?,https://inshorts.com/en/news/wonders-done-in-111-days-kejriwal-on-punjab-cms-nephews-arrest-1643996777526,ANI News,Friday
"PM Modi did not create single PSU, privatised 23: Cong MP","Congress' Rajya Sabha MP Ripun Bora on Thursday said PM Narendra Modi did not create a single public sector undertaking (PSU) but privatised 23 of them. Speaking on the Motion of Thanks to the President's Address in Rajya Sabha, he compared PM Modi with previous PMs and said Rajiv Gandhi and Atal Bihari Vajpayee created 16 and 17 PSUs respectively.",2022-02-03,Ashley Paul,https://aninews.in/news/national/politics/pm-modi-didnt-create-single-psu-privatised-23-congress-in-rs20220203153151/?utm_campaign=fullarticle&utm_medium=referral&utm_source=inshorts,https://static.inshorts.com/inshorts/images/v1/variants/jpg/m/2022/02_feb/3_thu/img_1643885234268_685.jpg?,https://inshorts.com/en/news/pm-modi-did-not-create-single-psu-privatised-23-cong-mp-1643898599595,ANI,Thursday
"Under Yogi's leadership, BJP will secure 300 plus seats in UP: Shah","Uttar Pradesh Chief Minister Yogi Adiyanath's leadership will lead BJP to win over 300 seats in the state's Assembly elections, Union Home Minister Amit Shah said on Friday. ""In 2014, 2017 and 2019 polls,...people...chose...development under...leadership of PM Modi and gave...absolute majority. Today with CM Yogi filing nomination, BJP is marching ahead with the resolve of '300 paar',"" he added.",2022-02-04,Swati Dubey,https://www.aninews.in/news/national/politics/bjp-will-secure-over-300-seats-in-up-under-yogis-leadership-says-amit-shah20220204125739/?utm_campaign=fullarticle&utm_medium=referral&utm_source=inshorts,https://static.inshorts.com/inshorts/images/v1/variants/jpg/m/2022/02_feb/4_fri/img_1643961224108_158.jpg?,https://inshorts.com/en/news/under-yogis-leadership-bjp-will-secure-300-plus-seats-in-up-shah-1643963608456,ANI News,Friday
"Kejriwal is an imposter, ‘Chhota Modi’: Congress' Surjewala in Goa","All India Congress Committee general secretary Randeep Singh Surjewala on Thursday called AAP National Convenor Arvind Kejriwal an 'imposter' and 'Chhota Modi'. ""Kejriwal finally represents what RSS or BJP represents. He is in Goa and Uttarakhand to give cover fire to the BJP which is losing ground,"" Surjewala said in Panaji.",2022-02-04,Ramanpreet Singh Virdi,None,https://static.inshorts.com/inshorts/images/v1/variants/jpg/m/2022/02_feb/4_fri/img_1643972546799_140.jpg?,https://inshorts.com/en/news/kejriwal-is-an-imposter-chhota-modi-congress-surjewala-in-goa-1643984069184,Inshorts,Friday
